1	Fausto presbytero insulano Eucherius episcopus. 
2	Hierusolimitanae urbis situm atque ipsius Iudaeae, ut mihi uel relatione cognitus erat uel lectione conpertus, breuiter amplexus sum breui et ipsum praefatione indicans, quia opusculo non diffuso nequaquam esse diffusam praefationem decet. Vale in Christo, decus et praesidium meum. 
3	Hierusalem ab Aelio Adriano Aelia uocitatur, nam post subuersionem Titi conditoris Aelii nomen cum opere suscepit. Natura loci edita adeuntibus eam qualibet ex parte haut dubie ascendendum erit, diutino quippe, sed molli tractu adsurgit. Situs ipse urbis paene in orbem circumactus est non paruo murorum ambitu, quo etiam montem Sion quondam uicinum iam intra se recipit, qui a meridie positus pro arce urbi supereminet. Maior ciuitatis pars infra montem iacet in planitie humilioris collis sita. 
4	Mons Sion latere uno, quod aquilonem respicit, clericorum religiosorumque habitationibus sequestratur, cuius in uertice A + U), In ne dni nri ihu xpi. Incipit opusculum sancti Eucherii episcopi de situ hierosolimae uel iudae E Epistola Eucherii episcopi ad FauBtum presbyterum V titulus deest P 1 Faustino EV 2 urbis hierosolimę E hierusolymitanae urbis V 3 uel om. PV agnitus PV compertus EV brebiter E 4 brebi et ipsum E breuique ipsum V breui id ipsum P pfacione V 5 defusione quamquam P 6 decus et praesidium meum om. E 7 helio E hadriano V helia E uoci... ur E 8 aeliae P helii E 9 aedita P adeuntibus] adeuntibi P aiunt V eam] eum E om. V aut dubiae P 10 molliter tracto P assurgit Y 11 urbes P pene hinc in E urbem P est om. PV parbo E 12 syon, ,,;c semper V 13 quia a E oppositus E arche E archae P urbis EP 14 ciuitates P infra] suptu E planiciem PV planitiae E 15 umilioris E 16 quo E aquilone excipit P 17 religiosoremque P frequentatur P uerticem P planitiem monachorum cellulae obtinuerunt ecclesiam circumdantes, quae illic fertur ab apostolis fundata pro loci resurrectionis dominicae reuerentia, eo quod ibi promisso quondam per Dominum paracleto repleti sunt spiritu. 
5	Celebriores tres sunt portarum exitus, unus ab occasu, alter ab oriente, tertius a septentrione ingressis a septentrionali parte urbem. 
6	Primum de locis sanctis pro conditione platearum deuertendum est ad basilicam, quae Martyrium appellatur, a Constantino magno cultu nuper extructam. Dehinc cohaerentia ab occasu loca uisuntur Golgotha atque Anastasis; sed Anastasis in loco est resurrectionis, Golgotha uero medius inter Anastasim ac Martyrium locus est dominicae passionis, in quo etiam rupis apparet illa, quae quondam ipsam adfixo Domino crucem pertulit. Atque haec tamen extra montem Sion posita cernuntur, quo se ad aquilonem deficiens loci tumor porrexit. 
7	Templum uero in inferiore parte urbis in uicinia muri ab oriente locatum magnificeque extructum quondam miraculum fuit, ex quo parietis unius in ruinis quaedam pinna superest reliquis a fundamentis usque distructis. Paucae illic cisternae in usum 1 planiciem P monacorum E cellolae P optinuerunt EV obtenuerunt P circundantes V 2 quae] que P quia V ut fertur PV ab om. E fundata in ramra E loci surrexit refatatus E 3 ob quod V ibi om. PY promissum quondam PV quondam promisso E 4 deum E paraclito E paraclyto V repleti cum correctura E 5 caelebriores P 6 septentrione ingressis a om. PV io septentrionale P septetnali, corr. 1. m. V 7 urbis PF 8 de] e E diuertendum EV 9 uaselicam E martirum E martyrum P 10 nuper om. PY coherentia P 11 loca om. V golgota P atque] et E anasthasiB bis E 12 locn est dmce res. E anastasin P anastasis E 13 martirum E 14 aparet E illa om. PV condam E ipsa E apsam V adfiia E afixo P affixo V domini E domino corpore PV 15 adque E positae PV cernnuntar E 16 difficiena P porregit P porrigit V 17 inferiori EV in uicinia] inuina E 18 instructum E conda E 19 ex co E parietes P ruinas PV 20 a fundamenta P ad fundamenta V destructis V usus E aquarum ostenduntur in ea parte ciuitatis, quae ad septentrionem tenditur. 
8	Vicina templo Bethsaida piscina gemino apparet insignis lacu, quorum alter hibernis plerumque impletur imbribus, alter rubris est discolor aquis. 
9	Ab ea fronte montis Sion, quae praerupta rupe orientalem plagam spectat, intra muros atque ad radices collis fons Siloa prorumpit, qui alternante aquarum accessu in meridiem fiuit. Iuxta murum Hierusalem uel templi ab oriente Geennon occurrit, quae uallis Iosaphat uocatur, a septentrione in austrum porrecta, per quam Cedron torrens, si quando pluuiarum aquas recipit, decurrit. 
10	Circumiecta Hierusolimitanae urbis aspera ac montuosa cernuntur, quae etiam montem Oliueti mille a se discretum passibus in orientem prospectat. Duae in eo ecclesiae celeberrimae habentur, una in eo fundata loco, in quo Dominus ad discipulos habuisse sermonem, alia in illo loco, de quo in caelum ascendisse traditur. 
11	Sex milibus ab Hierusolima Bethlem in meridiano latere secedit, quae humili muro et absque turribus angustissimo spatio circumdatur, ubi praesepe Domini exornatum insuper argento atque auro fulgenti cella ambitur. 1 ciuitates que P 2 ostenditur E in uicinia templi ostenditur V 3 templi P betsaida P Bethesda Tobler piscina om. V apparit ut signis P 4 coram E 5 rubri et aquis decolor E 6 rupta EP 7 exspectat PV infra V adque ad radices E atque in radicibus P atque radicibus V silua P 8 alternantia E 9 muroa iheruh salem E geenon E quae om. V 10 nullis P uocatur om. PV septentrionali E austum V porrectum E 11 Cedron om. V turrene P plubiaram E recepit P 13 hierosolimitane urbi E ac] et PF 14 olibeti E oliuiti P 15 dne E aecclesiae V caeleberrime P 16 abentur E eodem PV quod P 17 discipulos suos PV habuisse dicitur PV alio E altera PV illo om. PV loco om. E in caelum] caelum PV in celo E 19 hierosolyma E bethleem ab hierusolima P bethleem ab hierosolimam V 20 umiii E 21 spacio P presepi P exornatu P exornato V 22 adque E 
12	Hiericho uero ab Hierusolima in orientem aestiuum decem et octo milibus excurrit. Iordanis quoque ab eadem caeli parte ludaeae terrae praetenditur, quarto et uicesimo lapide ab Aelia separatus, qui primum mare Tiberiadis intersecans atque ex hoc mergens largis deinde ac placide fluentibus aquis in mare mortuum conditur, quod mare Hierusolimam uiginti circiter milibus respicit. 
13	Chebron ciuitas quondam gigantum lapide ferme uicesimo et secundo ab Hierusalem infra meridianam plagam distat. 
14	Mare magnum nusquam uicinius quam circa Ioppen oppidum possidet, quod quadraginta ab ea in occasum aestiuum milibus abest. 
15	Longitudo uerum terrae Iudaeae a Dan usque Bersabee praetenditur ab aquilonali plaga in meridiem producta. Dan quippe uicus exiguus est in exterioribus Iudaeae, quae septentrionalem partem contuentur, in quarto a Paneade miliario Tyrum pergentibus, de quo Iordanis erumpens a loco nomen sortitus est. Ior uero Ebraei fluuium appellant. Ceterum Bersabee, ut supra diximus, ad austrum uergens uicus est maximus uicesimo a Chebron miliario. 
16	Igitur longitudo siue etiam latitudo Iudaeae quanta sit, 1 hietico E hierosolima EV hierusolimam P oriente aestiuo V estibum E XCII P 2 iordannis E iordanes P 3 inde terrae E iudeae terrae PV IIII. et XV. PV 4 helia E elia V seperatus P separatur EV primo E tuberiadis P tyberiadis V insecans PV adque E 5 placidis P V 6 Hierosolyma EV XX. P 7 millibus V 8 cebron EP cibitas E condam E gygantum V ferme] uero E firme P XX et II PV 10 magnum] rubrum V nusquam om. E uicinus E circa] iuxta PV ioppem V 11 pos- sedit PY XL P ęstibum E 13 uerum om. PV Iudaeae om. V ad iudae E israhel P usque bersabę E 14 protenditur PV aquilonis E aquilonale P in] ai PV 15 quippe] quoque V indae P inde V que P 16 partem] plagam V IIII P contuetur V a om. P panide in rasura V 17 tirum E turum P iordanes P erumpens] erom P, om. V a om. V nomine E 18 hebrei PV ebrei E flubium E 19 uersabe E bersabe V 20 XX PV ac ebron E milibus V 21 longitudo siue etiam om. E iudae EP sanctus quoque Hieronymus determinauit in quadam epistola ad Dardanum, de qua nos huic operi, quae necessaria uidebantur, excerpsimus, in qua aduersum Iudaeos de terra repromissionis disserens etiam haec addidit: 
17	"Respondeant mihi, qui hanc terram, quae nunc nobis Christi passione et resurrectione terra repromissionis effecta est, possessam putant a populo Iudaeorum, postquam reuersus est ex Aegypto, quantum possederit; utique a Dan usque ad Bersabe, quae uix centum sexaginta milium spatio in longum tenditur. Neque enim Dauid et Salomonem potentissimos reges exceptis his, quos post uictoriam in amicitiam receperunt, plus tenuisse scriptura testatur. Et hoc dico, ut taceam quinque Palaestinae ciuitates Gazam, Ascalon, Geth, Accaron, Azotum, Idumaeos quoque a meridiana plaga uix XXV ab Hierusolima milibus separatos, Arabes et Agarenos, quos nunc Sarracenos uocant, in uicinia urbis Hierusalem. Pudet dicere latitudinem terrae repromissionis, ne ethnicis occasionem blasphemandi dedisse uideamur. A Ioppe usque ad uiculum nostrum Bethlem XLVI milia sunt; cui succedit uastissima solitudo plena ferocium barbarorum." 
18	Item paulo post: "Quod si obieceris terram repromissionis dici, quae in Numerorum uolumine continetur, a meridie 1 Hieron. ep. ad Dardanum CXXIX, Migne Patrol. lat. 22 p. 1104 12 cf. 2. Reg. 17, 11 22 cf. Num. 34, 4 1 hieronimua EP determinabit E epistolam E 2 ex quo P opere que P 3 in qua in qua P iudeae terram E 4 addedit. Haec P 5 quae] qui P 7 iudeorum E est om. P est reuersus E reuersus est Hier. 8 egipto E aegyptum P ad om. Hier . 9 bereabee P quae] qui E CXL P spatium P in longum spatio Hier, 10 enim oin. P 11 regis P uicturiam P amicitia E amiticiam P 12 dicto P 13 palestine E palestinas P ascalonem P 14 accharon E idumea E idomeus P 15 hierosolima E separata est E seperatur P 16 sarracinos P uicina P 17 ne et inimicis P occansionem P 18 blasfemandi E 19 bethleem P XL et C P milibus E 20 plenas P 21 quod sibi quis (om. E) obiecerit EP quod si obieceris Hier . repromissiones P 22 que P in om. E meridiae P XXXVIIII IUn. Hlerosol, 9 maris salinarum per Sina et Cadesbarne usque ad torrentem Aegypti, qui iuxta Rinocoruram mari magno influit, et ad occidentem ipsum mare, quod Palaestinae, Phoenici, Syriae Coelen Ciliciaeque praetenditur, ab aquilone Taurum montem et Zephyrium usque Emath, quae appellatur Epiphania Syriae, ad orientem uero per Antiochiam et lacum Ceneret, quae nunc Tiberias appellatur, et Iordanem, qui mari influit salinarum, quod nunc mortuum dicitur, trans Iordanem autem duarum semis tribuum possessionem, Ruben et Gad et dimidiae tribus Manasse: et ego fatebor haec tibi repromissa, non tradita." 
19	Item postea addidit: "Et mihi in euangelio promittuntur regna caelorum, quae instrumentum uetus omnino non nominat; sed si non fecero, quae praecepta sunt, nequaquam erit culpa in promittente, sed in me, qui promissum accipere non merui. Lege librum Iosue et ludicum, et quantis possessionum angustiis sis coartatus intelleges". Haec Hieronymus, uir in omni scripturarum scientia omnium eruditissimus. 
20	Sed etiam et Iosephus nobilis historicus Iudaeorum situm 18 Hegeaipp. III c. 6, p. 181—184, 70 ed. Iul. Caesar 1 mare P synam P, Sin coni. Relandius, Senna Mignt coll. Num. 34, 4 usque om. P torrentem om. P 2 egipti E qui om. P nicoruram E rinocuroram P mare P ad postea additum E 3 palestini E palestinae P phenices E foenis P sirię cele E coelis eyriae P 4 cilięque E ciliciae omisso que P pertenditur P aquilonem P tauro P 5 zipherium E zypherus P emmath E que P e epipania E ephyfania P siriae E 6 antiociam E anthiocbiam P cinereth P que P 7 tyberiadis P in mare fluit P 8 quod nunc-duarum om. P 9 et semis P possessione E gath E dimedio P 10 tribu E et haec fatebor ego fatebor ego repromissa tibi P 12 addit E addedit P regni P 13 non om. E 14 perflcero E 15 promissa E 16 librum om. E et iudicum om. P possessionibus E possessiones P 17 intellege E intellegis P hieronimus EP 18 scientiam EP heruditissimus E 19 ea post etiam E; et scripsi, om. P sthoricus E storicus P iudeorum E totius eius regionis refert, qui utriusque Galilaeae ac Samariae terminos relatione distinguit aut uarias, quae Galilaeae, Syriae et Phoenicae adhaerent disterminantque eam, gentes: a solis occasu Ptolomais territorii sui finibus et mons Carmelus, qui erat ante Galilaeis, nunc uero Tyriorum finibus adsociatus, cui conectitur Gabaa ciuitas, quae quondam Iudaeis causa grauis exitii fuit; ab oriente Hippene et Gadara suis finibus restant. Eadem autem et Gaulanitidi regioni et regno Agrippae confinia praescripta ueteri aeuo fuere. A meridiano latere Scythopolis et Samaria suis utraque excipiunt regionibus nec ultra fluenta Iordanis patiuntur extendi. Septentrionalia eius a dextro latere Tyrus claudit omnisque regio Tyriorum, cuius obiectu Galilaeae spatia definiuntur. Ipsae autem inter se hoc distinguuntur modo, ut quae inferior Galilaea dicitur, ab urbe Tiberiade usque ad urbem, cui nomen Zabulon, supra maritima Ptolomaidis extenta longitudine diffundatur. 
21	Latitudo autem eius a uico Chaloth, qui est in campo maximo, usque ad Bersabe haud dubie deducitur. Unde etiam superiori 1 eias om. P regiones P quia E quae P, qui scripsi utrique galileae P galilae aesamariae E, scripsi: Galilaeae ac Samariae ac Samariae terminos relatione distinguet aut uarias quae Galiliae (sic E) om. P 2 siria E 3 phenicea E phenice P adderent E adheret P disterminansque E determinauitque P disterminantque scripsi coll. Heg. III c. 6,1 gentesom. P a solis om. E 4 optolomais E tholomaidis P territoris E territurii P 5 qui erat—Tyrioram finibus om. P galileis E tiriorum E adsocietas P 6 connectitur P conertitur E cibitas E que condam EP 7 grabis exitus E ab or. autem ut uidetur E ippene E ioppen P, apud Heg . ioppen C, hyppenae uulgo 8 resecant. Eadem Heg. uulg . resecante idem autem Heg. C eandem P a galinitidi P ea gaulanitidi E et gaulanitidi Heg. uulg . et gaulonitidi C regionem P 9 agrippe EP ueteribus fuere P neterie uo fure E 10 scitopolis E scitopoli P excipiuntur P Heg . 11 paciuntur P septentrionali E 12 dextero P tirorum E 13 galilae E galileae P diuiniuntur E ipsa E ipse P 14 utq; E utique P galilae E gallilea P 15 tyberiade P ad om. E nomen est Zabulon E; est om. P Heg . 16 optolomaidis E tholomaidis P diffunditur E 17 exaloth E xalth P chaloth Heg. C, saloth Heg. uulg . 18 uessabe E bersabee P uan dubiae E educitur P superiore P superiori E, Heg. uulgo superioris Heg. C 9* Galilaeae aperitur exordium, quoad uici Bacatae fines attingat; ipso autem uico etiam Tyriae terrae fines determinantur. Longitudinis quoque eius initium uicus est t Thoalla, finis Thoalla Iordani finitimus. Hinc intellegi datur, quantum se porrigant spatia Galilaeae superioris, cuius initium Iordanis est, uel eius confinia. Hac igitur suae magnitudinis aestimatione utraque Galilaea distinguitur. 
22	Terra autem pinguis, herbosa, diuerso culturae genere nitens, distincta arboribus, ut quemuis adliciat ad sui gratiam et fugitantem laborum ad studia culturae inuitet atque excitet Denique nulla hic uel exigua terrae portio uacat, frequentatur plerisque inhabitantibus. Crebrae urbes, uici frequentes, multitudo hominum innumerabilis, ut exiguus uicus in suo tractu habeat XV milia inhabitantium. 
23	Item paulo post: "Samaritana quoque regio, inquit, inter Iudaeam ac Galilaeam media iacet, incipiens a uico, cui nomen est Helias, deficiens in terra Acrabatthenorum, natura consimili nec ullo differens a Iudaea. Utraque enim montuosa atque campestris est pro locorum diuersitate, neque tota campis 1 galilg E gallileae P peritar exordio E quod ab bacate E quod a uico bachatae P quod ad uici batathae Heg. C quo ad uici bathatae Heg. uulgo quoad nici Bacatae em. Iul. Caesar fines om. P attingit E 2 tirie de terre fines determinatur E tyriae finis terrae determinatur P tyriae terrae fines determinantur Heg . 3 ttalla E thoalla P thalla Heg. uulgo; Meroth corr. Iul. Caesar coll. Ioseph b. Iud. III, 3, 1 fines EP finis est Heg . rotalla E thoalla P Thella Iul. Caesar cum Iosepho 4 iordanes E iordanis P hinc om. P intelligi E porregant P 5 ispatia galilae E spacia gallileae P superiores P 7 galilea P 8 erbosa E diuersu P 9 distincta arboribus om. E quamuis P adliceat E alliciat P 10 et fagitantem] exfugit autem E effngit autem P et fugitantem Heg . laboris Heg. C labores Heg. uulgo adquo E 11 uagat P frequenter P 12 plurimis inabitantibus E urbis P 13 innumerabiles P in suo abeat E in sua habeat P tractu addidi ex Heg . 15 inquid P 16 iudeam EP ac] ad E atque P galileam E gallileam P 17 aeleaB Heg. C elias Heg. uulgo diffiniens P arabet thenorum E acrabathtenorum P acrabattenorum Heg. C acrabathenorum Heg. uulgo 18 ulla P iudea EP adque EP diffunditur neque in locis omnibus montium rupibus scinditur, sed utriusque qualitatis habet gratiam. Ad exercitium culturae solubilis terra et mollior eoque frumentis utilis et prope circa fertilitatem soli nulli secunda, maturitate certe fructuum prior omnibus; nam cum adhuc alibi serantur frumenta, istic metuntur. \'Species quoque atque ipsa frumenti natura haud usquam praestantior habetur. Aqua dulcis, decora ad speciem, suauis quoque ad potum, ut secundum elementorum gratiam aestimauerint Iudaei eam promissam patribus terram fluentem mel et lac, cum spoponderit illis resurrectionis praerogatiuam, et utrumque quidem diuina pietas contulerat, si seruassent fidem; sed infidelibus animis utrumque ereptum, hic iugo captiuitatis, illic uinculo peccati. Nemorosa regio et ideo diues pecoris, abundans lactis, denique nusquam sic lacte distenta pecus ubera gerit. Poma siluestria uel insitiua super omnium regionum copias. Referta autem utraque uel Samaria uel Iudaea hominum multitudine, ut mihi uideantur hinc illud interpretati Iudaei, quod scriptum est: Quia nulla erit in his sterilis et infecunda, cum hoc lex de meritorum fecunditate praescripserit et uirtutum fertilitate. 
24	Principium Samariae de Arabiae finibus a uico, cui nomen 18 Exod. 23, 26 1 neque in locis-scinditur om. E 2 utrisque P abet E 3 terrae mollior P terra, mollior Heg. C terra et mollior Heg, uulgo eo quod P 4 solis E 5 metetur E 6 adque E haud] aut E 7 abeatur E 8 suauiaque Heg. C Buauis ona . quoque uel que Heg. uulgo aelimentorum P 9 estirnauerint iudei E 10 mel et lac E, Heg . C; lac et mel P, Heg. uulgo illi E resurrectiones P prerogatiba E prerogatiuam P 11 et om. P et harumque quidem E contulerit EP contulerat Heg . 12 animus P ereptam E repertum P ereptum Heg . hinc E 13 peccati perdiderunt P et ideo diuee-lactie om. P 14 habundans E usquam P sic] illic P lac et E 15 geret E insitiba E 16 cupias regionum P reuerta est autem E iudea EP 17 multitudinem P uideatur E hic illut E illud hic P hinc illut Heg. C interpraetare P 18 iudei E eii P 19 sterelis P hec E lex om. P 21 arabie P bico E Iordanis, finis ab aquilone porrigitur uico Bortheo, latitudo autem Iudaeae a fluuio Iordane usque Ioppen. Incipit enim a fontibus Iordanis et a monte Libano et usque ad Tiberiadis lacum dilatatur. A uico quoque Arfa initium longitudinis eius, quae usque uicum extenditur Iuliadem, in quo Iudaeorum pariter ac Tyriorum communis habitatio. 
25	In medio autem Iudaeae ciuitas Hierusolima quasi umbilicus regionis totius, ut prudentibus placuit, nuncupatur, abundans regio mediterraneis copiis nec fraudata maritimis, quia praetendit usque Ptolomaidem et totum illud mare praetexit littoribus suis. Multae urbes, sed inter omnes Hierusolima eminet, ita ut quasi caput in suo corpore non obumbret sua membra, sed regat atque eis tuitioni sit et pulchritudini." 
26	Hactenus Iosephus, quem idcirco relationi huic inserendum putaui, ut ueritatem studiose inquirentibus maiorem Iudaeus relator de Iudaeae situ fidem faceret. 1 iordannis P iordanni Heg. C iordani Heg. uulgo Iorda coni. Iul. Caesar fines E ab aquilone—latitudo om. P boree hoch (?) E bortheo Heg. C, borceo Heg. uulgo et Iul. Caesar coli, Iosepho 2 indae EP fiuuiolo iordanis E fluuio Iordanne P usque ad P iopen E enim] autem P 3 frontibus P et a monte] et om. P lybano usque tyberiadis P 4 quoquo P area E longitudines P 5 usque iuliadem extenditur E usque ad Heg . iudeorum ac pariter tirorum E 6 commonis P abitatio E 7 iudae E om. P cibitas Hierosolyma E umbiculus P 8 habundans E 9 nec frui diutnmaritimis E protendit P pretenditur E 10 tholomaidem P obtolomaidem et tum illut E praetexit. littoribus illius E praetexit litoribus suis P Heg . 11 hierosolima E 12 umbret P 13 atque ita ita P ei EP eis Heg . pulcritudini E pulchritudine P 14 actenus P ioseppus E ,.relatione P 15 studiosae inquerentibus P iudeus E iudaeos P 16 iudae E iudeae P explicit situs hierosolime uel iudae E explicit de situ terrae repromissionis epistola P explicit epistola de situ terrae repromissionis eucherii episcopi ad faustinum pr\' mensulauQ Y 
