1	 Maccab. II 6 et 7 Rex fuit Antiochus Syriae ditissimus olim, 
2	in cuius regno mater natique fuerunt 
3	septem, ut fama refert, de sancta gente creati. 
4	quos cura adsidue generis meminisse iubebat 
5	et legi seruire datae: sic namque uolentes 
6	de populo meliore dei sua iura tenebant. 
7	rex auidus mutare iidem, mutare timorem 
8	iustorum uoluit. populo ut misceret iniquo. 
9	praemia promittit matri. nromittit et auri, 
10	et quidquid posset toto conquirere regno, 
11	si modo mutaret mores sensusque priores, 
12	cogeret et natos alios sibi fingere mores. 
13	illa negat tacitumque premit sub corde dolorem. 
14	hanc postquam nulla potuit conpellere praeda, 
15	temptauit primum tormentis uincere saeuis; 
16	pertulit illa graues gemitus et tristia regis 
17	uerbera non timuit. uictum ut se uidit at ille: 
18	.,Heu. quid agam," dixit, "uincis quod femina regem? 
19	non tamen effugies: plus est, quod dura dolebis. 
20	20 in natos saeuibo tuos; licet inproba perstes, 
21	hac certe ratione meum sanabo dolorem. " 
22	sustulit illa manus caelumque adspexit in altum; 
23	emisit gemitus et talia uerba locuta est: 
24	Tu licet et gazas tradas et regna. tyranne, 
25	non capimur regum donis, nec munera sanctis 
26	eripient promissa dei. spes certior illa est. 
27	quae uitam nobis promittit tempore longo: 
28	hanc sequor, hanc didici, non lubrica tangere dona; 
29	sumere diuitias facile est et perdere uitam. 
30	sed licet et flammas post uerbera saeua mineris, 
31	nil mutare potes, quod primis coepimus annis. 
32	uirtute id cum lege data mihi uincere certum est. 
33	quid nunc, saeue, iubes ? natis quid, dure, minaris? 
34	hoc solo poteris matrem turbare dolore. 
35	est mihi namque deus spes; est mihi cura meorum, 
36	per quam spero equidem te nullum uincere posse. 
37	caeli, quaeso. faue numen, quia iusta rogamus." 
38	rex furit Antiochus, turbatus corda tumultu 
39	concutit et saeuos testatur lumine uultus, 
40	miraturque diu, possit quod femina tantum. 
41	Pare, age, miles!" ait; "regi quoque pare, minister; 
42	uos famuli parete mihi! date digna furenti 
43	femineo tormenta malo; seruire furentem 
44	femina me cogit: quod plus est, femina uincit 
45	regis iussa sui! sed non inpune locuta est: 
46	membratim perdam septem quot perfida natos 
47	intra se retinet: quorum qui primus habetur, 
48	hic primus pereat; perdas sic ordine cunctos, 
49	cratibus inpositos subiectis urere flammis 
50	cernat ut ipsa suos mater nunc aspera natos. 
51	poena autem manet haec; celeres decet esse ministros." 
52	Interea fecunda parens iam crine soluto 
53	stabat et, hortanti similis, iam pectore nudo 
54	ubera protendens, natorum alimenta suorum, 
55	non confusa aperit, natumque ut uidit ad ignem 
56	constantique gradu fortem procedere, dixit: 
57	Tu mea progenies, tu primus respice matrem. 
58	tu certe meus es: nunc nostri, nate, memento! 
59	te primum peperi, tu nunc imitare parentem: 
60	sume meos mores et regem uince tacendo. 
61	tu poteris durare diu, si tempora uinces:, 
62	perfida ne superet sanctos uiolentia regis, 
63	utere consilio matris, nec damna timebis. 
64	fortior esto aere saxoque potentior ipso; 
65	ingredere ut iuuenis, patienter uince dolores." 
66	Ille modo ad matrem uultus, modo tollit in altum, 
67	dumque tacet tacitusque rogat, quem debet, et orat, 
68	non sensit rapidos subiectis cratibus ignes. 
69	corpus inane fluit; mater gauisa dolore est. 
70	et dixit: "Vici : uineam sic saepius, oro; 
71	duret natorum uirtus incognita regi, 
72	sed iam nota deo, populi qui pectora nouit." 
73	Finierat primi partus fecunda dolorem, 
74	sed remanente metu pro pluribus anxia mater; 
75	dissimulatque tamen, ne regem gaudia tangant. 
76	rex stupet Antiochus nec credit posse sequentes 
77	poenae tale genus simili peruincere sensu. 
78	coepta iubet peragi; mater non territa mansit; 
79	sed tamen ut uidit pallentem adsistere natum. 
80	haec secum uoluens aliqua iam parte leuatur: 
81	"Ecce secunda mihi partus producitur aetas: 
82	quam similis fratris formae! si pectore duras 
83	et sequeris primi partus uestigia nostri. 
84	esse meus poteris; poteris reparare salutem, 
85	quam iam frater habet, matris praecepta secutus. 
86	pone metus, regisque minas contemne furentes 
87	regnaque, quis cursim labentia tempora dantur. 
88	non poterit post ista tibi rex iste nocere ; 
89	sed poteris post haec tu regi, nate, nocere. 
90	temporis ecce leuis conscendere cogeris ignes! 
91	uirtutis locus est: languentem pone timorem: 
92	esto memor nostri generis, si sensus inhaeret. 
93	hic qui sceptra tenet, regno qui saeuit, in isto 
94	tempus inane agitat regno, uitaque carebit 
95	damnatusque nocens\' aeternos sentiet ignes: 
96	tu securus eris, turba comitante piorum. 
97	adspice nate meos uultus et suspice caelum 
98	auctoremque deum, per quem tibi uita paratur. 
99	fac melius, fratrisque tui uestigia calca: 
100	non quod iste iubet, sed quod deus imperat, audio " 
101	sicut. erat monitus matrem caelumque uidere, 
102	constitit atque hilari uultu contemnere regem 
103	coepit et, ut ridens, ardentes inruit ignes 
104	conlapsusque iacens anima superante quieuit. 
105	mater ut hoc uidit, rigido sic ore locuta est: 
106	"Felix parte aliqua sum: iamiam non potes omnes. 
107	saeue tyranne, meos cruciando uincere natos. 
108	te grauior mox poena manet, crudelis, inique; 
109	quam patiere breui; deus haec namque omnia cernit." 
110	iam duo securi contempto rege manebant, 
111	spes melior iam matris erat: iam tertius instat 
112	ecce locus poenae: si poena est uincere regem, 
113	et seruire deo: laus est. non poena furentis. 
114	tertius adtrahitur iuuenis frendente tyranno, 
115	qui nondum satiatus erat; furor intus et ira 
116	saeuibant pariter. quod fortia pectora fratrum 
117	uiderat inpauide regis superasse furorem. 
118	constitit ante pedes iuuenis florentibus annis, 
119	egregius forma, dignus qui regna teneret, 
120	dignior Antiocho. et sic meliora secutus 
121	regna. uolente deo. mater cui talia fatur: 
122	"Accipe. nate. tuae securus dicta parentis; 
123	accipe, ne segnis perdas uirtutis honores. 
124	sunt tibi iam fratres pietatis sede manentes. 
125	iam meliore loco. quam regna labentia regis. 
126	quorum si proprios attingis pectore sensus, 
127	uictor apud populos regem superasse fereris. 
128	sicut fama tuos iam misit in omnia fratres. 
129	his accede, precor; sunt haec aptissima dona 
130	contempsisse nefas et iura relinquere regis 
131	indomiti, quem nulla manet post ista uoluptas." 
132	at iuuenis tacito mittebat murmure uoces; 
133	oranti similis palmas tendebat in altum 
134	subnixoque genu matris pendebat in ore, 
135	qua licet adspectu corpus cui turba premebat. 
136	qui simul admonitus cratem conscendit, in igne 
137	intrepidus certaque fide sua membra locauit. ~ 
138	conciderunt flammae tepida remanente fauilla 
139	corpusque inlaesum tellus adaperta recepit, 
140	sancta quoque ad superos anima inuiolata recessit. 
141	at mater dubitans, gemitus an gaudia sumat, 
142	haesitat et querulo sic est sermone locuta: 
143	"Quid nunc, dire, paras? iussis parebimus omnes. 
144	sed numera partus, custos ne subtrahat ullum! 
145	ac, licet ipse uelis, non sum passura, tyranne, 
146	ut non isto omnes pereant certamine nati. 
147	temporis ista tui, mutes licet, horrida poena est 
148	duraque damnatis eadem sententia natis. 
149	si grauiora putas, si sunt grauiora, minare ! 
150	quodque meos cernis uultus, horrore teneris? 
151	gaudemus pariter, quotiens decernis in istos." 
152	Ardet at ipse magis rabida rex concitus ira 
153	temptarique putat, ne, sicut cetera fratrum 
154	turba, ferat poenas, matremque hoc quaerere sentit. 
155	durat in exitium, quartumque addicere natum 
156	poenae mox uoluit; lassati namque ministri 
157	nec regis furias, nec regem ferre ualebant. 
158	pro pudor! erubuit uultus ostendere matri 
159	natus et attonita mente confundere coepit. 
160	hunc postquam stantem submisso lumine uidit, 
161	talibus adgreditur dictis monitura timentem: 
162	"Quartus es a primo partus mihi, quartus et infans. 
163	quae nunc uerba tibi, quae possum dicere, nate, 
164	hoc nisi. quod solum durata potentia tecum 
165	sit simul et uirtus sanctaeque et originis auctor? 
166	illi debemus, regi quodcumque negamus; 
167	ille dedit nobis Abraham cum semine sancto, 
168	per quem nobilitas, per quem genus omne probatur, 
169	quod manet in domino sanctum; quia nascitur Isac 
170	tunc, cum iam nullum natum sperare senectus 
171	sponte sua poterat, sterilis quia Sarra manebat. 
172	illa tamen peperit, generisque propagine coepta 
173	ex insperato remanent tibi, Sarra, nepotes, 
174	Esau et patria deductus origine Iacob. 
175	quos scimus partu geminos peperisse Rebeccam. 
176	hinc sumus, hinc morimur; genus hoc tibi, nate, petendum est. 
177	tu tibi pande uiam genitori[que] ac cede priorum, 
178	quorum progenies totum dispersa per orbem 
179	inuidiam patitur, dominum quia sola potentem 
180	mente colit, mixta nec turbae accedit iniquae. 
181	quid tibi cum tristi uultu? quid lumina terra 
182	fixa tenes? caelum potius caelique parentem 
183	conspice! ne dubita, mater tibi prospera monstrat. 
184	quidquid inest, patienter adi; comitare ualenter 
185	turbam, nate, meam numerumque hortare sequentem." 
186	sic dilecta parens, luctus et gaudia miscens, - 
187	finierat claros monitus: tum luminis orbes 
188	ipse leuat matremque oculis intendere coepit. 
189	nil iam triste gerens habitu uultuque fatetur 
190	se timuisse nihil nisi tristia uulnera matris 
191	per partus diuisa suos. sicque ipse tenentum 
192	elapsus manibus cursu contendit in ignes. 
193	mira loquar: non flamma comas, non contigit ora; 
194	corpus ut exanimum flammas superarat et ignes, 
195	ore patente, tamen tacito, qua spiritus iret, 
196	unde acceptus erat, pariter cum sanguine fugit. 
197	hoc ipso gauisa parens, quod, qui modo tristi 
198	constiterat uultu, fretus mox pectore toto 
199	paruerit monitis et regis tempserit iras. 
200	sic est orsa tamen, cum rex dubitaret in illos, 
201	qui superant, gemitusque darent pia turba ministris, 
202	regem execrantes, tacito sermone querentes: 
203	Protrahe; quid dubitas? nulli iam parcere debes. 
204	nec potes, ut cupias: decretum rumpere noli. 
205	appello regem, totum qui temperat orbem, 
206	cui mare, cui caelum, caeli cui sidera parent, 
207	quod, nisi producis, timor est. iam segniter haeres, 
208	iam sentis, quae regna petat, quae gloria nobis 
209	parte in utraque manet, si iam tu parcere nolis. 
210	nam quoscumque tuo iussisti excedere regno 
211	saeuitia comitante, tuum uicere furorem,. 
212	nempe tuum, laetique manent in sede piorum. 
213	forsitan hoc mortem credas, furiose tyranne ? 
214	uita est longa magis regnoque potentior isto. 
215	quod regis et cuius extrema in parte moraris. 
216	hos quoque si metuis, superant aetate minores. 
217	contemptaque simul uici tua regna, superbe: 
218	sed perage imperium nec partus diuide nostros: 
219	hos quoque da flammis et uiribus utere regni. 
220	mortalis tamen es, nec in aeuum regna tenebis!" 
221	Concipit Antiochus furias, saeuusque tyrannus 
222	aestuat et gemitus inter sua pectora uoluit. 
223	consentit cum mente dolor tristisque grauatos 
224	attollit uultus et talia uerba profatur: \' 
225	,,Haec tua libertas et dura potentia linguae 
226	atque hic, quem tumida portas ceruice rigorem. 
227	sentiet, irati regis quid tempora possint. 
228	si nondum es satiata malis et fingere temptas 
229	laetitiam luctusque tuos in gaudia uertis: 
230	non mutabo necem; gaude, laetare, triumpha. 
231	dummodo sic uincas, ut sis suprema tuorum — 
232	sic furiosa animis natorum funere gaudet? 
233	hos quoque do flammis; hoc nec mutare potestas 
234	ulla potest; decreta manent — laetare superstes. 
235	natis orba tuis. et ne mea iussa morentur, 
236	ordo suos pergat cursus. producite natum. 
237	ne uani pereant ignes dubiusue uideri 
238	rex possit. certe timor est mihi femina nullus. " 
239	Praecipuus de gente tua produceris, ore 
240	et specie mirande puer, cui pectore uirtus 
241	firma manet. iamque hunc poteras uel uincere regem. 
242	ad quem sic placido mater sermone locuta est: 
243	"Si dare conplexus matri tibi, nate, liceret, 
244	confiteor, soli post uulnera, nate, dedissem; 
245	sed me dura uetat tristisque potentia regis. 
246	deneget amplexus, dum sit uox libera nobis 
247	et liceat meminisse dei legemque tenere, 
248	non a rege datam, sed quam deus arbiter orbis 
249	tradidit et mundi rector, Mosesque petitam 
250	accepit populoque dedit. cui maxima laus est 
251	nosse deum, meritum cui nos debemus honorem. 
252	tu modo ne dubites monitis parere parentis. 
253	sit uigor et uirtus, penitusque in pectore toto 
254	mens maneat iam plena deo: sit fortior aetas, 
255	quam regem sperare fuit superare iubentem. 
256	o quanta est uirtus, quanta est fiducia forti! 
257	sed iam ne dubites medias peruincere flammas: 
258	uictor eris, mihi crede puer, uictorque redibis. 
259	ossibus et ualidis miscebunt corpora nerui, 
260	seruatas animas iterum in noua uiscera reddent. 
261	sed ne forte tamen rapidus te terreat ignis, 
262	fratrum sume animos aeternumque inuoca numen." 
263	iussa facit tacitusque deum testatur et orat 
264	murmure, quo poterat. puerum non impedit aetas, 
265	non timuit cratem expositam, matrique uolenti 
266	paruit et dicto citius super inruit ignes. 
267	cesserunt flammae, cessit dolor omnis et una 
268	corpus et ignis erat: corpus superauerat ignem, 
269	spiritus ante tamen placidas superauerat auras. 
270	laeta dolet tacite mater, pressoque dolore 
271	tristitiam luctusque suos in gaudia uertit. 
272	Interea trepidat et curas corde uolutat, 
273	non de praeteritis, sed de puerilibus annis: 
274	qui superant, ne forte negent; ne forte timorem 
275	concipiant animo. regique accendere malint. 
276	quo minor est aetas, maior metus; anxia secum 
277	ducit heu curas: et iam spes ac timor una 
278	luctantur matrisque piae per uiscera currunt. 
279	spes tamen est maior, natum ut procedere uidit, 
280	et procul exultans: "Video, quid possit in isto 
281	spes conferre mihi: uultus agnoscere nostros 
282	debet et hic, fratrum numero parere suorum. 
283	forsitan hunc solum puerilia pectora tangant 
284	indigneque ferat, quod sic uelut hostia detur. 
285	adloquar et paucis conabor dicere uerbis. 
286	sit memor ut, potius generis, quam temporis huius. 
287	"Si te nobilitas, generis si tangit origo. 
288	respice, nate. tuos, Israhel quoque respice, nate. 
289	noli annos numerare tuos, puer; incipe forti 
290	pectore ferre deum. tradent hoc saecula saeclis, 
291	quod tua det fortis aetas exempla futuris 
292	temporibus. da, nate, precor, quodque amplius hoc est: 
293	cogita, quae fugias et quam meliora petantur. 
294	non te sollicitet stolidi fallacia regis 
295	295 sed crescant istaec nunc in contraria." uictor 
296	spiritus extinxit flammas; sic deinde uocatum, 
297	quod dederat, corpus tellus adaperta recepit, 
298	sanctaque, quae superest, anima inuiolata recessit. 
299	Quamuis lassa parens perque et sua uulnera uictrix 
300	procidit in faciem pariter manibusque supinis 
301	has habuit uoces et talia uerba locuta est: 
302	"Qui tenes imperium caeli terraeque marisque, 
303	sidera qui caelo, qui das animalia terris. 
304	aequoribus pisces, auibus qui temperas auras: 
305	ad te, magne, meae mentis fiducia surgit, 
306	qui chaos inmensum, caeca caligine mixtum, 
307	diuidis in partes et das noctemque diemque, 
308	lunamque ac solem, uario quos tempore semper 
309	nocte dieque iubes lumen praebere per orbem. 
310	post haec das hominem, cuius de semine mundi 
311	conpletur mortale genus, cui lingua loquescit 
312	dissona per gentes; sapor est tamen omnibus unus. 
313	sed quid mutarit meritumque hominumque loquellas, 
314	longa referre mora est: coeptis insistere certum est. 
315	te mare diuisum uirga tenuisse fatemur, 
316	dum pede per siccum populus transcenderet aequor, 
317	Aegypti fugiens mortes regemque Pharaon, 
318	qui sibi sanctorum numerum seruire iubebat. 
319	quem tua maiestas Mose duce transtulit amne 
320	seruatumque tua tutum uirtute diremit. 
321	terra dabat fructus, quos te cogente ferebat, 
322	et sitis ad requiem quaesita est lympha latebris." 
323	umor erat nullus: cuncti clamore querentes 
324	poscebant Mosen, daret ut sitientibus undas. 
325	ad quos ille breui sic est sermone locutus: 
326	"Credite posse deum, quidquid petieritis illum. 
327	qui potis est uirga hac amnem defundere saxo. 
328	ut ueniant fontes tota regione negati." 
329	percussitque simul: dicto uelocius omni 
330	emisit saxum fontes dulcedine prima. 
331	confiteor, totus cum sit tibi debitor orbis. 
332	tu, quidquid possunt gentes, potes omnia solus, 
333	et quod non capiunt gentes, capis omnia solus. 
334	tu mortale genus curis onerasque leuasque: 
335	te precor attonita mente confirma timentem. 
336	ne desit fratrum numero meus infimus infans 
337	ignarusque sui; quem iam procul ecce teneri 
338	conspicio turba circumueniente frequenti. 
339	hunc propter solum lacrimas mihi commouet aetas; 
340	unus enim superest, de quo mihi maxima cura est. 
341	ne tener ignoret, qua sit de gente creatus. 
342	hunc ego si possem secreto adprendere solum, 
343	blandirer, patriumque genus patriamque docerem: 
344	si quaecumque tamen potero, solacia mittam. 
345	"Parue puer, tenerisque tuis mihi carior annis — 
346	carior es regno, uita quoque carior ipsa - 
347	tu potes in totum uictricem reddere matrem. 
348	tu, finis partus finisque future malorum, 
349	si te cura mei tangit, si matris honorem 
350	mente pia retines; quamuis sis carus et infans, 
351	hoc magis aure auida dictis adtende parentis. 
352	primum disce, puer, quid sis post ista futurus. 
353	si patiens fueris; quod te milii, care, futurum 
354	facta docent. fratrum sanctorum in parte manebis 
355	et requie securus eris, dum saecula cursus 
356	saeua suos peragunt. finito tempore longo 
357	hanc lucem repetens aeternaque regna uidebis. 
358	non maculata malis, sed erit concordia sanctis; 
359	nec morti locus ullus erit, nec bella citatis 
360	committentur equis, sed pax aeterna manebit. 
361	matri crede tuae, quae te cupit esse salutis. 
362	heu mihi, cur tristi uultu mea dicta repellis? 
363	quid refugis? miserere mei, miserere tuique! 
364	si liceat. prior ire uelim: uetat ecce ! sed ibo 
365	tunc, cum uictorem te uidero, nate, malorum. 
366	quid sperare iubes? solus mea dicta moraris, 
367	solus adhuc etiam reuocas mihi, nate, dolorem. 
368	adnuis. an damnas et me fratresque genusque?, 
369	quod ne forte uelis, oro te et deprecor. audi! 
370	his ego te paruum nutriui, nate, papillis, 
371	his precor, et lacrimas te propter, nate, profundo, 
372	ne remanere uelis: remanebis solus et orbus; 
373	non tibi iam frater est ullus. solacia uitae 
374	quis dabit? heu solus matrem confundere temptas 
375	375 et genus et patriam, si talia dicta recusas. 
376	o quanto melius uitam seruabis in aeuum. 
377	si facis ante deum, quidquid fecere priores! 
378	audenter depone metus, depone timorem, 
379	concipe mente deum; uires dabit ille uiriles." 
380	haec dum mater agit, puer ad praecepta parentis 
381	respicit, et solum ut se uidet esse relictum, 
382	sustulit in caelum uultus palmasque supinas, 
383	et sic uoce petens aeternum numen adorat: 
384	quem secum sensu pariter nutuque rogabat. 
385	uinceret ut regem, saeuos ut uinceret ignes. 
386	atque ita non segnis, nec pro puerilibus annis 
387	prosilit intrepidus, medios delapsus in ignes, 
388	et pugnat uictor, donec remearet in altum 
389	spiritus et fratrum peteret secreta priorum. 
390	Dum puer ista gerit, soluerunt gaudia matrem: 
391	iamque ut erat lassata malis, iam uoce negata 
392	spirat ouans; interque manus conlapsa suorum 
393	_ concidit exanimis resolutaque membra quierunt. 
394	sic ipsa et nati sanctorum in parte recepta est. 
