1.1.1	Celsior astrigerum Titan conscenderat axem, 
1.1.2	Lampade cum plena totus in orbe paret. 
1.1.3	Flammiger ardenti sorbebat flumina Cancro, 
1.1.4	Cum segetem messor falce domat propriam. 
1.1.5	 Siccatur dum fonte bibens, dum mundus anhelat, 
1.1.6	Iussus in excursum Gallica lustra sequi, 
1.1.7	Torrida non timui quae uincunt arua Syenen. 
1.1.8	Puluis flamma sitis dos fuit obsequio. 
1.1.9	Quid iubar et ualidos renouas mihi, Musa, uapores? 
1.1.10	Plus erit algentes me superasse uias. 
1.1.11	Quicquid plana calent, quicquid sublimia rigent 
1.1.12	Frigoribus, passum dic sine lege peli. 
1.1.13	Bellum naturae quod discors fecerat annus, 
1.1.14	Aestatem atque hiemem detulit una dies. 
1.1.15	 Indutum nebulis canas superare pruinas 
1.1.16	Edocuit uates feruidus imperio. 
1.1.17	Presserat aestiuo corpus sub fasce lacerna, 
1.1.18	Vestitus tenui tegmine nudus eram. 
1.1.19	.cum fugit ex oculis constanti tempore tempus, 
1.1.20	Lampada nam Phoebi dux fuit ad glaciem,\'. 
1.1.21	Optanti brumam de uoto contigit horror 
1.1.22	Quaesitusque calor nil dedit indicii. 
1.1.23	Matronas taceo scopulos atque inuia dictas, 
1.1.24	In foribus blandas, cetera difficiles. 
1.1.25	 Inlexit miseros facies depicta uiantes, 
1.1.26	Calcatae diras mox peperere neces. 
1.1.27	Nominibus propriis nil fallit sacra uetustas, 
1.1.28	Tot leti formas sic uocitare uolens. 
1.1.29	Scrupea descissis pendebat semita plantis 
1.1.30	Nec uisu facilis, credite, callis erat. 
1.1.31	Quid labyrintheos, priscorum fama, recessus 
1.1.32	Inuoluis linguis, quos timeat relegens? 
1.1.33	Illic artificis laudandus constitit error, 
1.1.34	Cum torsit rectum Daedalus ingenio. 
1.1.35	 Hic natura homines per summum portat Olympi, 
1.1.36	Quo liquidum tranans ire columba ualet. 
1.1.37	Parcite, Pierides, pelagus fluuiale silendo, 
1.1.38	Ne reparet sermo fore bona quod pepulit. 
1.1.39	Duria nam, Sessis torrens uel Stura uel Orgus 
1.1.40	Marmoris Ionii saeuitiam superant. 
1.1.41	Dulcia cum uariis succedunt laeta periclis, 
1.1.42	Effectus rerum cor solidare solet. 
1.1.43	Nil mihi cum dubiis, prosunt obliuia tristi: 
1.1.44	Ebria lethaeo pectora fonte fero. 
1.1.45	45 Limina sanctorum praestat lustrasse trementem, 
1.1.46	Martyribus lacrimas exhibuisse meas. 
1.1.47	Ecce Saturninus, Crispinus, Daria, Maurus, 
1.1.48	Eusebius, Quintus gaudia magna parant. 
1.1.49	Octaui, meritis da, Aduentor, redde, Solutor, 
1.1.50	Candida ne pullis uita cadat maculis. 
1.1.51	Hostiles laqueos scindat mens conscia recti: 
1.1.52	Hoc semper placeat: quod decet, hoc liceat. 
1.2.1	Gaudia transcendunt uires, uox laeta superbit: 
1.2.2	Ingenii maciem prospera non metuunt. 
1.2.3	Dulcia temporibus famulantur fila secundis: 
1.2.4	Quod felix meruit, nobile carmen erit. 
1.2.5	 Vox iusti quaestor, legum substantia, nobis 
1.2.6	Ceu Phoebus mittet tympana plectra lyram. 
1.2.7	Docta Camenarum coeat pia turba sororum, 
1.2.8	Offerat arguto pollice quod loquitur. 
1.2.9	Turgida fatidici uix possint pectora uatis 
1.2.10	10 Virtutum species enumerare tuas. 
1.2.11	Tu decus Italiae, spes tu fidissima recti, 
1.2.12	Fax, tuba causarum, purpura nostra, uale. 
1.2.13	Luminibus locuples solem te Roma uocauit 
1.2.14	Celsa, Quirinali suscipiens gremio. 
1.2.15	 Eloquio lyncem, tu subdis uoce leonem. 
1.2.16	Melle tuo serpens gutturis arma premit. 
1.2.17	Fetibus orbatae ferrent tibi munera tigres, 
1.2.18	Quae dolor et feritas sure pauente daret. 
1.2.19	Te pene demessum ceu florem dextera fati 
1.2.20	Dum lacerat, Christus perculit exitium. 
1.2.21	Reddita se melius nunc uincit uita beati; 
1.2.22	Actibus adseritur quod uenit a superis. 
1.2.23	His. fretus non legatos neque uerba precantum 
1.2.24	Callida fucatis artibus elicui. 
1.2.25	 Ipse ego, mendicae transmittens uerba Thaliae, 
1.2.26	Donum more dei te precor ut tribuas. 
1.2.27	Hortulus exigua sociatus parte retardat 
1.2.28	Spem solidam, fieri ne merear dominus. 
1.2.29	Hanc mihi largiri non spernas, lumen honorum: 
1.2.30	Sic uoti compos saecula nostra colas, 
1.2.31	Sic te regnantis sublimet celsa potestas, 
1.2.32	Sic currant meritis aurea facta tuis. 
1.2.33	Amphion Dirceus tetigit quod pectine uixit: 
1.2.34	Nulla mori rerum tunc animata potest. 
1.2.35	 Commoda de Musis numquam fluxere tot annis, 
1.2.36	Affectu pretii quas mihi concilia., 
1.3.1	Exprimit in spicam tellus iam feta papillas, 
1.3.2	Lacte maritatis turgida cespitibus. 
1.3.3	Stringitur in prolem sparsus per gramina sucus, 
1.3.4	De guttis faciens progeniem solidam. 
1.3.5	 Vestitus gemmis protendit brachia palmes, 
1.3.6	De gremio ligni pampinus ecce uiret. 
1.3.7	Iussa per augmentum nunc siluam perdere uitis 
1.3.8	Frugibus ut crescat, uulnera conciliant. 
1.3.9	Euocat inquirit gaudens infantia mundi. 
1.3.10	Nutricem, tepidi quam dedit aura poli. 
1.3.11	Ludit per faciem camporum rustica pubes, 
1.3.12	Respiciens duri dulce laboris onus. 
1.3.13	Annus reptat ouans tractus per murmura ueris, 
1.3.14	Farcta locuturis mella ferens labiis. 
1.3.15	 Cum rebus noster balbutit carmina sensus, 
1.3.16	Aurea principiis dextera portet opem. 
1.3.17	Blandior ad falcem messor perducit aristas, 
1.3.18	Si rastris segetem pectere continuet. 
1.3.19	Nunc stirpem Proculi, dans uernum, suscipe, doctor, 
1.3.20	Ne feruor teneros decoquat in studiis. 
1.3.21	Seruentur leges: ceu census littera currat. 
1.3.22	Horum Pindareus flumina uicit auus, 
1.3.23	Docta Camenali cecinit qui carmina plectro, 
1.3.24	Cuius Apollinei nil tacuere chori. 
1.3.25	 Phoebus in auxilio repetat mox fortior ilium, 
1.3.26	Artis nobilitas, Marsya si ueniat. 
1.4.1	Annus sole nouo teneras dum format aristas, 
1.4.2	Natura in thalamis orbe tepente sedet. 
1.4.3	Pingitur et uario mundus discrimine florum: 
1.4.4	Vna soli facies: gratia, cultus, amor. 
1.4.5	 Arbuta uitali coalescunt uda uapore, 
1.4.6	Ignea concretus semina sucus alit 
1.4.7	Erigitur genio tellus tumefacta marito, 
1.4.8	Turgida lasciuis silua uiret spoliis. 
1.4.9	Lactans cespitibus in nodum truditur herba, 
1.4.10	Vitea gemmatos brachia dant digitos. 
1.4.11	In rerum uultu lex iungit pronuba taedas: 
1.4.12	Aura poli ut sponsum germina cuncta facit. 
1.4.13	Ergo pari uoto lux caelum flumina Nereus 
1.4.14	Montes prata ferae gaudia concipiunt. 
1.4.15	 De te quod uernat sortitur, Maxime, mundus, 
1.4.16	Et naturalem dos tua comit opem, 
1.4.17	cui sanguis census genius mens uota superstant, 
1.4.18	Musarum primo fulta supercilio. 
1.4.19	Saecula te fidei monumentum nostra dederunt, 
1.4.20	Corporis et cordis uirginitate parem. 
1.4.21	Vincentem meritis sponsam dat candida uita, 
1.4.22	Quae cum te superat, sic tibi palma uenit. 
1.4.23	Huic niueis consors adridet flamma labellis, 
1.4.24	Alba uerecundas spargit in ora notas. 
1.4.25	 Adsit, oro, fons loquelae mente uoce pectine 
1.4.26	Ars natura Musa Phoebus qua tumet facundia. 
1.4.27	Vile nil decet sonare in Maximorum laudibus. 
1.4.28	Conterunt plebeia celsum saepe dicta uerticem. 
1.4.29	Orbe captiuo Venus alma fusis 
1.4.30	Dotibus florum per amoena ludens, 
1.4.31	Dum facit uernum pretio et micantis 
1.4.32	Sidere formae, 
1.4.33	Spreuit aurati decus omne pepli, 
1.4.34	Aduenae pompam noluit metalli: 
1.4.35	Ditior cultu stetit effugato 
1.4.36	Sparsa capillos: 
1.4.37	Nobilis si quod bibit arte uirus 
1.4.38	Lana, mentito potior colore: 
1.4.39	Sic et algentis pelagi lapillos 
1.4.40	40 Nuda superstat. 
1.4.41	Fulserant raro sub hiante filo 
1.4.42	Pectoris gemmae in roseis papillis. 
1.4.43	Inuidum membris negitando amictum\' 
1.4.44	Altera lux est. 
1.4.45	45 Proditum risit sine nube corpus, 
1.4.46	Carcere inrupto nituit serenum 
1.4.47	Quodque seruabat male tuta uestis, 
1.4.48	Panditur arte. 
1.4.49	Aliger laxo remeabat arcu, 
1.4.50	50 Marcidam damnans otiis pharetram, 
1.4.51	Sanguine in nullo madefacta lentus 
1.4.52	Spicula gestans. 
1.4.53	Tunc sic alloquitur matrem fluitantibus armis: 
1.4.54	"Perdidimus, genetrix, uirtutis praemia nostrae. 
1.4.55	55 Iam nusquam Cytherea sonat, ridetur Amorum 
1.4.56	Fabula, nec proles nascenti sufficit aeuo. 
1.4.57	Frigida consumens multorum possidet artus 
1.4.58	Virginitas: feruore nouo sublimia carnem 
1.4.59	Vota domant: mundus tenui uix nomine constat. 
1.4.60	60 Primaeui tremulos, fractos imitantur ephebi: 
1.4.61	Rara per inmensos saeclorum, respice, campos 
1.4.62	Coniugii messis: per flores sola uetustas 
1.4.63	Exerit albentes ieiuna et pallida canos. 
1.4.64	Vna fides rerum nulla dulcedine flecti 
1.4.65	65, Et si quid teneros potuit transducere mores 
1.4.66	Praeceptis calcare malis: seruatur ubique 
1.4.67	lustitium culpa est thalamos nominasse pudico. 
1.4.68	Tu remissa iaces et tanti nescia iuris 
1.4.69	Nuda per effusos respectas membra capillos. 
1.4.70	70 Surge, age, et obstantem properanter discute somnum,. 
1.4.71	Nec te, quod turpe est, captiuum numen habere 
1.4.72	Iura pudicitiae uel lex malesuada putetur." 
1.4.73	Talibus arsissent dictis et uiscera ponti. 
1.4.74	Colligit in nodum passos lux aurea crines 
1.4.75	75 Et naturalem concludens ueste decorem,- 
1.4.76	Mutauit formam. tunc quicquid fulget iaspis, 
1.4.77	Quae uiret in pretio pasturae ficta smaragdus 
1.4.78	Et latet in concis melior custode ueneno, 
1.4.79	Alba uenit, niueum sumptura es corpore lumen. 
1.4.80	80 Palla per adcinctos decrescit splendida lumbos \' 
1.4.81	Et zona teneras conpressit dura papillas. 
1.4.82	Adfatur natum: "quem, spes mea, figere temptas? 
1.4.83	Quem sequimur? quoue ire iubes? post otia maior 
1.4.84	Flamma decet: discant populi tunc crescere diuam, 
1.4.85	85 Cum neglecta iacet. superos nil perdere somno 
1.4.86	Ostendant geminis reparata incendia curis. 
1.4.87	Maximus ecce, uides, generis spes unica summi, 
1.4.88	Dulcibus inludit per longa obliuia taedis. 
1.4.89	Sectatur matrem, quae caelo purior ipso est 
1.4.90	Femina, quam scimus mulierem uincere mente. 
1.4.91	Hic domuit puerum, mores sortitus auorum: 
1.4.92	Quod pudet, heu longo nobis nescitus in aeuo est. 
1.4.93	Huius ad abstrusas ueniat mea lampada fibras: 
1.4.94	Suspiret cupiat discurrat ferueat oret." 
1.4.95	 Haec ait: et subolem fotu conplexa benigno 
1.4.96	Mollia mellitis artauit ad oscula labris. 
1.4.97	Ille uolat celeri tranans per nubila uento, 
1.4.98	Omnia lasciuo socians elementa furore. 
1.4.99	Vt stetit et iuuenem formae conspexit in ostro, 
1.4.100	"Tune Dionaeum tumefactus despicis?" inquit. 
1.4.101	"Huc, Venerem culture, ueni: qui tardius arsit 
1.4.102	In multum calet ille rogus, celeresque fauillas 
1.4.103	Restituet quaecumque pyrae subducitur arbor." 
1.4.104	Deprompsit iaculum, quo diuos fixerat omnes. 
1.4.105	 Tunc pulcher teretem flexuram pertulit arcus: 
1.4.106	Spicula diuerso traxerunt brachia calle. 
1.4.107	Pennigeri uulnus praesentit dextera tactu, 
1.4.108	Moxque ferit, laeto factum clamore salutans: 
1.4.109	"Ille ego (quid trepidas?) semper contemptus adhaesi 
1.4.110	Visceribus, fugitiue, tuis. hac uictima matri 
1.4.111	Litamus, multis quam tu non suspicis annis." 
1.4.112	Ecce iterum magno rimatus stemmate cretam, 
1.4.113	Quam thalamis iungat, cernit sublime puellae 
1.4.114	Sidus et adtonitus ad matrem lumina flexit, 
1.4.115	Germanam credens: conlaudat nobile furtum. 
1.4.116	Sed teneram leniore ferit puer ille sagitta, 
1.4.117	Inque uirum totos exhausit fortior ictus. 
1.4.118	Post haec digrediens permulcet pectora dictis. 
1.4.119	"Nostra tuas, iuuenis, confortent uulnera uires. 
1.4.120	 Nam quicumque mea est percussus cuspide crescit. 
1.4.121	Haec faciunt multos, si credis, bella nepotes. 
1.4.122	Sis felix semperque feras mea munera tecum." 
1.4.123	Nunc me Pierio fauore iutum 
1.4.124	In laeta, proceras, locate fronte. 
1.4.125	 Sustentont gracilem per omne carmen 
1.4.126	Qui doctum faciunt benignitate. 
1.4.127	Quod nunc ingenium premunt pruinae, 
1.4.128	Distendat refouens tepore uernum. 
1.5.1	Ingenii cultor, fons oris, copia linguae 
1.5.2	Vmor Castalius ueniat, quo Thracius Orpheus 
1.5.3	Naufraga diffuso succendit pectora fluxu. 
1.5.4	Adsit et arentis coniungat cordis hiatus. 
1.5.5	 Eridani dicturus aquas nisi flumine largo 
1.5.6	Sicca Pegasaeo perfundam membra liquore, 
1.5.7	Torrida ieiuno uix stillant uerba relatu. 
1.5.8	Vndarum cumulos at narrem, suggere, limpha. 
1.5.9	Quam bene pandit aquas cui blandus murmurat amnis! 
1.5.10	Anni tempus erat, quo uernat mitibus uuis 
1.5.11	Palmes et autumni dotes proponit in orbe, 
1.5.12	Imbribus externis madida cum ueste Lyaeus 
1.5.13	Distendit tunicas uuarum carcere musti. 
1.5.14	Vberibus pluuiis (ri)parum lege subacta 
1.5.15	Tunc sibi forte Padus captiuos texerat agros, 
1.5.16	Canebant spumis et turgida dorsa minaci. 
1.5.17	Currebant stantes per fluctus culmina uillae. 
1.5.18	Seruauit raptum pelagus tunc littore tectum, 
1.5.19	Et mutans terras mansit fortuna casarum. 
1.5.20	 Respiceres siluas stationem perdere iussas 
1.5.21	Ad flammas propera(re) Pado ducente uoraces. 
1.5.22	Tunc ego feruenti germanae tractus amore, 
1.5.23	Cui natum Parcae demessum pollice diro 
1.5.24	Sustulerant uiduamque domum constante marito 
1.5.25	Reddebant, turbis peperit quae semper Auerni, 
1.5.26	Hanc ut solarer, uel uitam prodere legi. 
1.5.27	Regnator Ligurum fluuiorum maximus ille 
1.5.28	Sub iuga transmissus gemuit sub pondere cumbae, 
1.5.29	Intumuit rursusque minas flatusque remisit, 
1.5.30	Quique polos uicit soli mihi cedere iussus. 
1.5.31	Sic pietas elementa domat, sic cuncta cohercet 
1.5.32	Cuius grata deo tenuit miseratio mentem. 
1.5.33	Ecce iterum madidis contectus nubibus aether 
1.5.34	Hausit aquas, quibus omne ruens submergeret aruum. 
1.5.35	Non caeli faciem conspexit naufraga tellus 
1.5.36	Et stellis uiduae micuerunt dira tenebrae. 
1.5.37	Errauit piscis sed non captiuus in aedes 
1.5.38	Et populus fluuii per mensas lambuit escam. 
1.5.39	Euomuit pelagus hominum penetrale profundum, 
1.5.40	Vmida pulueribus clauserunt aequora campos. 
1.5.41	Perfunctus primis recidiua pericula uidi. 
1.5.42	Ille triumphator tiro ad certamina Nerei 
1.5.43	Frigida per liquidas gestabam pectora limphas 
1.5.44	Et siccis oculis respexi marmoris iras: 
1.5.45	45 Cum subito absorptum uidit uetus accola pontum, 
1.5.46	Risit et abiecti restantia signa pauoris. 
1.5.47	Ditia permixto fulgebant arua metallo, 
1.5.48	Eridanus claris radiabat comptus arenis. 
1.5.49	Nauita me laetus suscepit protinus alno, 
1.5.50	Sarcina cui felix dudum concesserat omen. 
1.5.51	Indoctus clauum rexit de pondere tutus 
1.5.52	Et me festiuis Christo duce pertulit oris. 
1.6.1	1 Post canas hiemes, gelidi post damna profundi 
1.6.2	Tranquillum quotiens nauita carpit iter, 
1.6.3	Maeret et infidi desperat prospera ponti 
1.6.4	Quamque uidet faciem non putat esse salis. 
1.6.5	 Sibilat aura leuis, ualidas timet ille procellas 
1.6.6	Fluctibus et blandas aestimat esse minas. 
1.6.7	Lintea si crispant Zephyri pendentia malo 
1.6.8	Et dulci ludit spiritus obsequio, 
1.6.9	Confusam uentis naturam perdere leges 
1.6.10	Iurat et antiquum credit adesse chaos. 
1.6.11	Gaudia sic tollunt placidis discrimina rebus: 
1.6.12	Nulla fides laetis integra nec dubiis. 
1.6.13	Non aliter uariis tenuit quos Roma periclis 
1.6.14	Litoris optati reddidit ad gremium. 
1.6.15	 Permulcent pelagi numen uenerabile cantu, 
1.6.16	Anchora quod proprium mordet obunca solum. 
1.6.17	Flamina sed lassis tenerum factura soporem 
1.6.18	Perturbant mentem militis aequorei. 
1.6.19	Arma ratis subigit, remos et lintea uibrat: 
1.6.20	Sic mens naufragium suspicionis habet. 
1.6.21	Adueniat siccis qui pressit caerula plantis, 
1.6.22	(Nam portus fessis ille salutis erit) 
1.6.23	Qui latices uinxit fundens in pocula saxum, 
1.6.24	Qui lapides soluit, qui solidauit aquas, 
1.6.25	Quem genetrix fudit saeclis sine semine feta, 
1.6.26	Ad matrem iungens uirginitatis onus, 
1.6.27	Qui mortem propriae superauit munere mortis, 
1.6.28	Dans uitam mundo, funere quam peperit: 
1.6.29	Ille per excelsum uideat me dexter Olympum. 
1.6.30	 Tunc patriam teneam. tunc stationis opem. 
1.6.31	Nubila laxati uerrant licet aequora uenti, 
1.6.32	Rimosam puppim nil nocitura petunt. 
1.6.33	Dulcia conpositis quatiam tunc tympana chordis, 
1.6.34	Floribus et pingam carmina nostra nouis. 
1.6.35	 Vt fatear, doctis constat bene dicere laetum: 
1.6.36	Tristia nil capiunt pectora uersiloqui. 
1.6.37	Sed redeat uernum, cesset iam bruma timoris. 
1.6.38	Stringite quae nectant frondea serta comas: 
1.6.39	Cantem quae solitus, dum plebem pasceret ore, 
1.6.40	Ambrosius uates carmina pulcra loqui. 
1.7.1	Fluminis in medio succendis uiscera, Fauste, 
1.7.2	Cuius alit magnam carminis unda sitim. 
1.7.3	Quis ferat ardorem laticum flammasque fluentis 
1.7.4	Cognatas sicco sorbeat ore potans? 
1.7.5	 Fonte uaporiferum pariunt tua uerba calorem: 
1.7.6	Aestuet unde iecur, pocula prospiciunt. 
1.7.7	Ingenii quisquis festinus tendit ad amnem, 
1.7.8	Non putet ambiguum: sic bibit, ut sitiat. 
1.7.9	Nobilis occultum condiuit limpha saporem, 
1.7.10	Conputet et damnum, ei minus inde feram. 
1.7.11	Lubrica Cecropio confidens lingua coturno 
1.7.12	Nil iactet priscos nobilitate seni. 
1.7.13	In ueterum morem pangit noua carmina Faustus, 
1.7.14	Qui per membra suum desecat arte melos. 
1.7.15	 Doctus ad incudem uerba infabricata referre, 
1.7.16	Quosque facit uersus terque quaterque probat. 
1.7.17	Aetas cana refert digitis animasse Myronem 
1.7.18	Quod fingebat opus uiuificante manu. 
1.7.19	Tu uerbis faciem tribuis, modulamine membra. 
1.7.20	Quod natura deo, hoc tibi dant studia. 
1.7.21	In uetulum dexter si uertas plectra cadauer, 
1.7.22	Primaeuum facias aedificante lyra. 
1.7.23	Si flores simules gelidi per plaustra Bootis, 
1.7.24	Mox Helicem uernis sibilat aura modis. 
1.7.25	 Ninguida lustra rosas, fundant tibi frigora mustum, 
1.7.26	Feruenti Pallas sidere dona ferat: 
1.7.27	Piscis in aetherio quem portas uertice tranet: 
1.7.28	Si iubeas uersu, marmora ceruus amat. 
1.7.29	Faucibus e mediis inpasto uiscera praedam 
1.7.30	Ore potens tollas, quam tenet ore leo. 
1.7.31	Iam scio Castalii quo me traxistis amores: 
1.7.32	Accedunt culpis munera uestra meis. 
1.7.33	Sutilis ad tumidas rapitur mea cumba procellas, 
1.7.34	Hibernos passura notos, quam nauita pauper 
1.7.35	Rimosam tenui fingens de cortice puppim 
1.7.36	Conposuit nomenque dedit tine laude phaseli. 
1.7.37	Illa nec Aegeum pelagus nec littora Phryxi 
1.7.38	Nec quaecumque ualet. trux aequora uerrere fundo 
1.7.39	Aeolus agnouit, placidos sed gurgitis alti 
1.7.40	 Praelegit bene cauta sinus, ubi seruiat Auster, 
1.7.41	Non ubi regna petat, quotiens ibi remige lento 
1.7.42	Sibilat in tremula discurrens aura carina. 
1.7.43	Lintea nam summis dum crispant nexa cerucis, 
1.7.44	Quae portant mortes praestant mihi flamina somnos, 
1.7.45	45 Huc uertam puppim, certis mea carbasa uentis 
1.7.46	Commendans, cursus artis opisque meae. 
1.7.47	Flecte uiam uelis clauumque ad littora, Phoebe: 
1.7.48	Anchora proscissum mordeat unca solum. 
1.7.49	Musa, dictorum caput optimorum, 
1.7.50	50 Herbidam fingens hederis coronam, 
1.7.51	Quam per exactos muneras poetas, 
1.7.52	Necte capillos. 
1.7.53	Sulcat inmensum pelagus carina, 
1.7.54	Nescit ad clauum manus apta ferri, 
1.7.55	55 Quo uocat dextrum regimen per undas 
1.7.56	Artis amicus. , 
1.7.57	Pergis ad Faustum, trutinam loquelae, 
1.7.58	Ore qui uastum ualet ut profundum, 
1.7.59	Luce quem mundus ueneratur ipsa 
1.7.60	Dexteriorem. 
1.7.61	Aurium libram tenet in Camenis: 
1.7.62	Illius ferrum secat omne uulnus, 
1.7.63	Quodquod internis latet in medullis 
1.7.64	Carminis aegri. 
1.7.65	65 Si meos uellet modicos thyrambos 
1.7.66	Mente, qua cunctum moderatur orbem, 
1.7.67	Inter infantum triuiale murmur 
1.7.68	Pendere, laus est. 
1.7.69	Lux mea, Fauste, 
1.7.70	70 Spesque salusque, 
1.7.71	Litterularum 
1.7.72	Munera parua 
1.7.73	- Suscipe laetus. 
1.7.74	Sic tua summus 
1.7.75	75 Germina Christus 
1.7.76	Lucida seruet. 
1.7.77	Porrige dextram 
1.7.78	Nominis almi. 
1.7.79	Grata. Tonanti 
1.7.80	Farra piorum. 
1.8.pr	 VIII. [ENNODIVS OLVBRIO.] PRAEFATIO. Non ponit fistulam quotiens rusticum pecus agrestis pastor inspexerit. muta nemora formidolosam solitudinem pariunt, 59 ipse T 61 ariom L 62 illud Ll uulsus L1 65 aellet b, aellit BELPTV tyrambua BELV, tirannibus T, em. Sirm., corymbos coni. Schottue 66 modoratur B 68 pendere] ponere fort . laus sit uel laudem coni. Schottus 69-80 binos uersus coniungit in unum T 71 litterolarum B 72 mumera B VIII. ENNODIVS OLYBRIO addidi, om. libri; AD OLYBRTVM DE EIVS ELOQVENTIA inscr. Sirm . PRAEFACIO EPV; OLY- BRIO b 1 ponet festulam B, canit fistula ELPTVb 2 solli- tudiuem L . et ubique metus est, quando nullus in solacium deserti sonus auditur. sed si aurarum sibilis arborum comae linguae speciem mentiantur et ridente frondium motu appellet hominem iucunda concussio, putabitur ambientibus latera coetibus interesse, nec aliquam aerumnam gemit quem inter secreta sua ipsa natura s quibuslibet elementis alloquitur. iuuat tunc exulationis comitem fistulam labiis admouere et flatibus per testudinis rimosa dispersis quandam de spiritu et aura conponere rationem. tunc Palaemonem suum rudens et infabricata lingua conpellat, tunc numerat quantis seruare caulas sit opus excubiis, tunc multiplices luporum insidias quas acuit fames magistra suspirat, tunc in sermonem cadit quicquid efflauerit: huius se solari, huius nititur mulcere collegio. cui talia agenti si quis sermocinantem fidibus citharam doctus admoueat et loquacia fila inrisor urbanus adportet, in ancipiti est quid eligat nuda simplicitas, dum lyrae tactus licet errantibus digitis dulcem et qui animam frangat crepitum reddit. nefas tamen putat, si alieni tractus lepore propositi auitam discat scientiam non amare, ut, dum infrenis ambitus rusticantis doctrinae terminum non metitur, superiorum affectu et ipsa se possibilia intellegat perditurum, cum nescientem quid ualeat mapalium alumnus ipsa paternae institutionis mediocritas quasi externa contemnat. non aliter me, uir amplissime, inter maxima curiae sidera conputande, iubar facundiae, ingeniorum flamma, splendor eloquentiae, dictionum census, per nemorum inuia ad instar pastoralis fistulae quae uiliter narrantur oblectant, 2 specem B 3 appellit B iocunda EPTb 4 con∗∗∗. cusaio L, confusio E putabatur Ll latera coetitibus Y, cetibus latera T, latera E 5 erumnam BLPTY 6 aelementis B, aliis b, om . Sirm. iubat B 7 festnlam B, om. E n 9 palemonem libri ridens B, rudis b 11 famis B 12 cadet B quidquid B 14 fidebus Lx cytharam B 15 aportet d T, opportet E elegat B 16 lyra et actus BELT 17 amam V, nimam ELl reddet B 18 lepore] amore Sirm . positi B ad uitam E, amicam P (m. 2 in mg.) b 22 contempnat BELV, condemnat Pb 24 iurbar Ll 26 instar ad Tl I utiliter L, uiriliter Pb metuentem citharam tuam, laudantem plectra, quae, ut superius texui, agrestibus digitis meis urbanus aduuigis. amoue, quaeso, quam adhibes ad inuitzndum me elucubrati sermonis inlecebram. absint, quibus etiam apud peritos uteris, uincula 5 conloquii. conpesce uerborum digitos, quibus soletis renitentum animas ad desideria uestra conpellere liceat me aut silentio inscitiam tegere aut per stridentem stipulam aliis triuiale carmen adferre: uobiscum fabulari res est meriti ueteris et nonae felicitatis. quod si mei inmemor ego temptauero, adeptus -eontra uerberum propriam solis currus, iuste subeo Phaethontis exemplum. de quo quia sermo contigit et forma cautionis accessit, -quid facto opus sit subiectum carmen ostendit. 
1.8.1	Fama refert, ueterum quae nescit perdere gesta, 
1.8.2	Quae loquitur semper quicquid in orbe fuit: 
1.8.3	Germina dum Lucis Titan dispergit in axem 
1.8.4	Et ditat mundum nobilibus radiis, 
1.8.5	5 Vda uaporiferas cohibent dum lora quadrigas 
1.8.6	Et nitidum gurges mittit ubique diem: 
1.8.7	Vndantes doctis manibus Sol flexit habenas, 
1.8.8	Artificem dominum lux bene nota tulit. 
1.8.9	Sed Phaethonteo postquam dare regna precatu 
1.8.10	Non exploratis uiribus instituit, 
1.8.11	Degenerem primis rectorem motibus astrum 
1.8.12	Sensit et excussis currere coepit equis. 
1.8.13	Tunc totam sonipes lucem de naribus efflans 
1.8.14	Non tenuit legis tempora certa suae. 
1.8.15	 In flammam cessit splendor, quod luminat ussit 
1.8.16	Quodque animat terras exitium peperit. 
1.8.17	Tunc et Hyperboreas dum frangit lampade crustas, 
1.8.18	Epotis Tanais siccus abibat aquis. 
1.8.19	Crystallum fluxit, sed cursus fluminis arsit: 
1.8.20	Quod lapides soluit, nexuit Eridanum. 
1.8.21	Sic ego rhetoricum temptans transcurrere callem, 
1.8.22	Adgredior currus solis et imperium. 
1.8.23	Nescio quid uariis inpendam sideris oris, 
1.8.24	Nescio quid teneam: cuncta calor superat. 
1.8.25	 Curia te pollens teretem formauit ad unguem 
1.8.26	Et patribus iussit lumina ferre suis. 
1.8.27	Tu Phoebum reddis: fumat tibi uictima pinguis, 
1.8.28	Pro qua cessissent fulmine caelicolae. 
1.8.29	At mihi uix illud transmittunt pauperes horti 
1.8.30	Rubra quod acceptum testa refutat holus. 
1.8.31	Sum, fateor, cuius destillent uerba relatu, 
1.8.32	Quae maciem monstrent pauperis ingenii. 
1.8.33	Carmina nulla cano, nec me modulante Camenas 
1.8.34	Mansurum dabitur pollicis ore sophos. 
1.8.35	 Quicquid Apollineo loquebamur pectine, cessi 
1.8.36	Oblitus linguae, quam mihi fila dabant. 
1.8.37	Rustica per teneras errat mihi dextera cordas, 
1.8.38	Confringunt dulces barbara plectra modos. 
1.8.39	Ah quotiens uitreis Heliconis fluxit in herbis I 
1.8.40	Adridens labiis quae facit unda sitim. 
1.8.41	Ah quotiens hederis redimitus tempora duxi,. 
1.8.42	Aonium mulcens carmine concilium !. 
1.8.43	At nunc per siluas, inter spelaea ferarum,. 
1.8.44	Agrestem certus ducere militiam, 
1.8.45	45 Grandia per ualidos commendo semina sulcos, 
1.8.46	Vt germen uitae destituant loiia._ 
1.8.47	Lactea ne mentem denudent uerba solutam, 
1.8.48	Et dictis mollis dicar et ingenio:,. 
1.8.49	Non mihi per campos discurrat lingua patentes,. 
1.8.50	50 Mascula nec lituis diota feram grauibus:,. 
1.8.51	Ne mea grandisono flammentur corda coturno 
