2.83.9	Innocuis placida uernabat luce serenus, 
2.83.10	Ceu speculum noxis iniciens faciem. 
2.84.1	Eusebius Ligurum successit finibus hospes, 
2.84.2	Ignotae tractus plebis amicitia. 
2.84.3	Graius erat, socio Titan quos respicit ortu, 
2.84.4	Flammigero limphas uertice decutiens. 
2.84.5	Mitis conpositus largus pius integer audax, 
2.84.6	Crederet ut damnum non dare perpetuum. 
2.84.7	Fleuit pauperiem miserans, adrisit habenti, 
2.84.8	Gaudia cum cunctis tristitiamque gerens: 
2.84.9	Hunc index operis locuturo nuntiat orbi 
2.84.10	Fama uirum, gentes de statione trahens. 
2.85.1	Ecclesiae postquam parta est tibi sella, Geronti, 
2.85.2	Funera decessor non timuit moriens. 
2.85.3	Te reparante redit, patitur sors pallida letum, 
2.85.4	Viuit post obitum discipuli pretio. 
2.85.5	Agricolis iunctus coluisti germina uitae 
2.85.6	Nec serpens lolium pabula laeta tulit. 
2.85.7	Qui dedit in medium quem lex iubet optima uictum 
2.85.8	Emit terrenis fructibus ille polum. 
2.85.9	Errorem mentis pressisti lege laborum: 
2.85.10	Otia non passus uirtutibus ueheris. 
2.86.1	Exere quae posuit mens nomina certa, Benigne, 
2.86.2	Quem quisquis uocitat testis erit meriti. 
2.86.3	Cana fides hominem dum narrat, detegit actus, 
2.86.4	Nil loquitur casu pignoris adtonitus. 
2.86.5	Praescia uenturi non errant uota parentum, 
2.86.6	In uerum uertunt blanditias subolum. 
2.86.7	Ante patres censens sedit plaudente senatu, 
2.86.8	Praelatum sanctis extulit ille caput. 
2.86.9	Pollice sed diro ceu flos succisus aratro est: 
2.86.10	Spes decus et genius de foribus cecidit. 
2.87.1	Qui uicit trabeas solium cinctumque Gabinum, 
2.87.2	Consulibus praestans ecce Senator adest, 
2.87.3	Ingenium uelox, sermonis cura rotundi, 
2.87.4	Virtutum pretium, forma pudicitiae, 
2.87.5	Abdita librorum, mysteria clausa prophetae 
2.87.6	Qui dedit in lucem schemate quo uoluit. 
2.87.7	Orbis ad extremi missus secreta uerendis 
2.87.8	Curauit studiis quod fuerat lacerum. 
2.87.9	Tunc oriens uictum peregrino lumine fassus, 
2.87.10	Haesit ad aspectum lampadis alterius. 
2.88.1	Tu lux certa tuis, spes tu fidissima rerum, 
2.88.2	Vatis apostolici tu, Theodore, uigor, 
2.88.3	Virtutum cumulus, substantia lucida ueri, 
2.88.4	Monstrat aceruatis quem labor in studiis: 
2.88.5	Praescius accinctus fortis tranquillus amicus 
2.88.6	Conpositus simplex, tu bonus et sapiens, 
2.88.7	Fatidicus: semper tibi conscia corda futuri: 
2.88.8	Deprensum fluxit te reserante malum: 
2.88.9	Quem timuere feri calcantes culmina mundi, 
2.88.10	Dilexit spernens dura supercilii. 
2.89.1	Restat quem longo seruet rex inclitus aeuo. 
2.90.1	Imperii custos, uocali pollice cordas 
2.90.2	Per numeros animans, tibi fila loquentia carmen 
2.90.3	Verberibus plectri, doctor, seruire coegi. 
2.90.4	Cyrrha potens Phoebo, laticis pia turba sereni 
2.90.5	Tu mihi semper eris, qui pectora clausa remotis 
2.90.6	Inseris officiis et dextro numine conples. 
2.90.7	Deprecor, exactam fauturus suscipe uocem, 
2.90.8	Extortis pretium donans te iudice dictis. 
2.91.1	Visceribus lapidum permixta lege coactis 
2.91.2	Naturam faciunt artificum studia. 
2.91.3	In solidum fractis riguerunt marmora membris, 
2.91.4	Partibus in crustam colligitur genius. 
2.91.5	Vnam de uariis speciem conponere frustis 
2.91.6	Qui potuit saxum duxit in obsequium. 
2.92.1	Diuitibus pretium est Ennodi forma metallis. 
2.93.1	Parturit unda sitim, quam splendens conca ministrat. 
2.93.2	XC. 1 cf. Tibull n 5, 3 et Zingerlii Ouid. I p. 106 
2.94.1	Belliger algenti sonipes nutrite sub axe, 
2.94.2	Per Tanais medium pectora sicca ferens, 
2.94.3	Cana pruinosis mandentem gramina lustris, 
2.94.4	Virtus lege poli quem sibi percoluit, 
2.94.5	Post domitas gentes, post flumina tanta cruoris, 
2.94.6	Alter te dominus, sed manet ipse labor. 
2.94.7	Linque precor lituum, cantus passure beatos: 
2.94.8	Captiuus pacis mitteris obsequiis. 
2.94.9	Nil tibi cum bellis: commendant bucina letum: 
2.94.10	Quid iuuat expertas semper amare neces? 
2.95.1	Nomine proposito meritis certamine Victor, 
2.95.2	Despicis oppressas maculato semine terras. 
2.95.3	Tu carnis uitiis possessor corporis expers, 
2.95.4	Lubrica subiectis domuisti saecula membris, 
2.95.5	Tranquillus patiens corrector prouidus acer. 
2.95.6	Hic reddens tumulis cineres, ad celsa uocatus 
2.95.7	Spiritus aetheria congaudet lucidus arce. 
2.95.8	Busta supercilio miseratus cernit Olympi, 
2.95.9	Vnde triumphati respectans funera mundi, 
2.95.10	Cassibus exutis concedes praemia membris. 
2.96.1	Index naturae studium tibi non uenit ullum, 
2.96.2	Littera nulla colit brutae commercia linguae: 
2.96.3	Numquam discipulus, ualeas dic unde magister? 
2.97.1	Algidus in uiuo moritur dum corpore sanguis, 
2.97.2	Annorum glacies cum siccat pabula uuluae, 
2.97.3	Seminis et custos refugit cruor utilis inguen, 
2.97.4	Marcida cur iuueni sociaris, Galla, marito? 
2.97.5	Pignoris in thalamis periet fiducia iuncto. 
2.97.6	Nam subolem laxis mendacem uiuere rugis 
2.97.7	Insimulans, epulis das prolem feta cloacae. 
2.97.8	Adtulit hoc uenter, quod coniunx iungat ad ora. 
2.98.1	Nil fallit simulans: quod finxit dextera uerum est. 
2.98.2	Inmobilis stantem fugitat lepus arte molossum, 
2.98.3	Insertus rabidis ridet furor aureus ursis, 
2.98.4	Gestandus manibus saeuit leo blandior ira. 
2.98.5	Cognoscit dominam genius famulante metallo. 
2.98.6	Mitigat illa feras, dum plebem pascit egentum. 
2.99.1	Aspicis Albinum titulos post busta dedisse, 
2.99.2	Funera qui meritis uiuacibus iugulat. 
2.99.3	Inclite, cui, princeps, dum subdis iura magistri, 
2.99.4	Vere sepulturae contigit ille locus. 
2.100.1	Creticus hic sollers quidam uocitatur homullus, 
2.100.2	Naribus argutus, gressu celer, ore timendus, 
2.100.3	Inpauidus presso signans uestigia rostro: 
2.100.4	Quo ceruus capreae lepores lupus ursa uagatur, 
2.100.5	Inuenit, et tepido capitur fera prouida lecto. 
2.100.6	Luditur agnellae post proelia tanta uolatu: 
2.100.7	Molle pecus uolucrem praeuertit fraude molossum. 
2.101.1	Tot louis inlecebras, tot crimina uiua figuris 
2.101.2	Dum bene depingit, uitiosa est dextera fabri. 
2.101.3	Argenti pretium est facinus retinere uetustum, 
2.101.4	Ne purum superet, quod furtis Iuppiter egit. 
2.101.5	Nil licet aetati, scelerum monumenta resurgunt, 
2.101.6	Admonet exemplis qui culpas format auitas. 
2.102.1	Si tantas facies tunc sumpsit diuus adulter, 
2.102.2	Se primum falsis lusit imaginibus: 
2.102.3	Quid non mentito uiolasset corpore numen, 
2.102.4	Cuius forma suo gaudet adulterio ? 
2.103.1	Laesa Venus non est: naturae uincula constant: 
2.103.2	Bucula Daedalei cessat mentita laboris. 
2.103.3	Ingenio uiuens nil mugit uacca biformis, 
2.103.4	Fictaque nec uerum coitum dant ligna iuuencae. 
2.103.5	Ecce iterum tauro mulier summittitur uxor: 
2.103.6	Humanas pecudum suspirant pectora flammas. 
2.103.7	Vasta iugum ceruix rursus capit aerea colli: 
2.103.8	Qualiter adstricto sudauit marcida loro! 
2.104.1	Forma caput facies Deuteri cuncta magister, 
2.104.2	Innumeris doctor dotibus ille cluit. 
2.104.3	Excuset linguam genius perfectus ubique : 
2.104.4	Quod fari nescit, displicet inde malis. 
2.104.5	Grammaticam iactant artem nescire magistrum: 
2.104.6	Hoc melius simplex moribus instituit. 
2.104.7	Oratoris opus lapidosaque culmina Tulli 
2.104.8	Non tetigit: celsum rhetora nullas amat. 
2.104.9	Discipulis satis est uultus taoitique uerenda 
2.104.10	Caluities: Phoebae lumina plena uident. 
2.105.1	Iure colis proprium natalem, pulcher Arator. 
2.105.2	Qui si non coleres, numquid arator eras? 
2.106.1	Tot rebus fallax quid garris, pica biformis, 
2.106.2	Semiuir et tremulo qui nexas turpia lumbo? 
2.106.3	Quod tibi propositum, qui sexus constitit umquam? 
2.106.4	Quid non mentiris, uir femina, sancte profane? 
2.107.1	Lucidum tinxit maculante fuco 
2.107.2	Quisquis affectum, ferat inde linguam 
2.107.3	Iudicis Christi facibus perustam, 
2.107.4	Ore sepultus. 
2.107.5	Scindit urguens foedus omne fraude uiuax perpeti, 
2.107.6	Aegre portans quicquid ordo flagitat serenior. 
2.107.7	Linque, quaeso amice, mores plebe dignos ultima, 
2.107.8	Sanguinis callem secutus serua quod depectus es. 
2.108.1	Vincula soluit amor, quae quondam nexuit alter: 
2.108.2	Non nisi per legem cedit lex prisca sequentem. 
2.109.1	Numquam frugiferis per saecula longa thyrambis 
2.109.2	In me fluxerunt commoda Castalii. 
2.109.3	Tristia ieiunis pangentem carmina labris, 
2.109.4	Spes noua, quid stimulas, gurgitis Aonii? 
2.109.5	Sed si mutato Parcarum stamine gaudes, 
2.109.6	Exhibe cornipedem nunc, Pegasea, mihi, 
2.109.7	Qui ferat aligerum per gramina roscida corpus 
2.109.8	Nec teneras flectat uestigiis segetes, 
2.109.9	Sublimem ualidum formosum passibus aptum: 
2.109.10	Qui si contingat, mox mihi, Musa, places. 
2.109.11	Mitteris ad largum locupletem poscere parua: 
2.109.12	Ni gaudens redeas, dic mihi, Musa, uale. 
2.110.1	Pontificis castrum spes est fidissima uitae. 
2.110.2	Cui tutor sanctus, quae nocitura petant? 
2.110.3	Hic clipeus scutum est: procul hinc, Bellona, recede. 
2.110.4	Quod meritis constat, proelia nulla grauant. 
2.110.5	Conditor hic muros solidat, munimina factor. 
2.110.6	Nil metuat quisquis huc properat metuens. 
2.111.1	Dextera bellipotens uulgatis plena triumphis, 
2.111.2	Qua cecidit quicquid fugit ab obsequio, 
2.111.3	Disperso celsam solidas quae sanguine famam, 
2.111.4	Cui peperit laudem mitis et arma tenens, 
2.111.5	Postquam praelargo rubuisti scammate campi, 
2.111.6	Arua colis pingens germine purpureo. 
2.111.7	Virgultis proprio dispensas murice poma, 
2.111.8	Das plantis fructum nobilitate tua. 
2.111.9	Vilior en cespes iactat se diuite ramo, 
2.111.10	Dum ligni morsus semina clara fouet. 
2.111.11	Demessus ferro floret tibi surculus alter: 
2.111.12	Nuda maritatis dos nitet arboribus. 
2.111.13	Gramina cultorem praenoscunt, muta locuntur: 
2.111.14	Quod tetigit princeps uer habet in glacie. 
2.111.15	Gestit terra potens, monstrat cui creuerit arbor: 
2.111.16	Fetibus et genio panditur hic dominus. 
2.111.17	Peruigil Hesperidum quae seruas iugera serpens, 
2.111.18	Aurea ieiunis munera das epulis. 
2.111.19	Quis siluae subolem carpat custode ueneno? 
2.111.20	Morte nemus tutum, credite, nullus adit. 
2.111.21	Hic commune facis, pietas, quod sola parasti. 
2.111.22	Visceribus plenis nescit obire fames. 
2.112.1	Orbe pereffosso fluuidum de lumine uulnus 
2.112.2	Pestifer ostentans ora sepulta geris. 
2.112.3	Caeca per innumeros facies portatur amicos: 
2.112.4	Qui te conspiciunt iure dolent oculis. 
2.112.5	Ebria marcenti locupletas flumine menta, 
2.112.6	Circumfers crasso sordida labra fimo. 
2.112.7	Oscula nulla petas, madidam suspende mephitim: 
2.112.8	Te propter cupiam perdere quod uideo. 
2.112.9	Quis putet ei oculis flammas coalescere turpes? 
2.112.10	Nil uidet, et rectum seruat iter scelerum. 
2.113.1	Fixior annoso sonipes moderamine noster 
2.113.2	Nunc iuuenem blando sustinet obsequio. 
2.113.3	Mollia grandaeuus summittit terga sedenti: 
2.113.4	Aetas constantem gressibus esse facit. 
2.114.1	Quae capiunt mundum iunxit mens docta flagello, 
2.114.2	Exornans censu nobilitante plagas. 
2.115.1	Argenti atque auri uapulat quicumque metallis, 
2.115.2	Gaudia cum fletu miscet auara suo. I 
2.116.1	Dentibus argenti fuluum concluditur aurum: 
2.116.2	Contemnat nullus uerbera pulcra pati. 
2.117.1	Sanguine mente opibus facie uirtute pudore, 
2.117.2	Optatur qualis femina, sola fui. 
2.117.3	Hoc tantum mundi quod lex est corpore gessi, 
2.117.4	Exornans casta prole pudicitiam: 
2.117.5	Quae uictrix fortem tenui per blanda maritum, 
2.117.6	Melie meo uertens iura, Seuere, tua. 
2.117.7	Quos genui, celsa coniunctos stirpe reliqui. 
2.117.8	Quod uotum est sanctis, coniuge praemorior. 
2.117.9	Nil mihi decessit, maneo post busta superstes: 
2.117.10	Felices numquam mors nocitura petit. 
2.117.11	Et nomen dulce est, de factis Mellisa dicor. 
2.117.12	Moribus hoc fluxit iure datum propriis. 
2.118.1	In tantum prisci defluxit fama Maronis, 
2.118.2	Vt te Virgilium saecula nostra darent. 
2.119.1	Si fatuo dabitur tam sanctum nomen homullo, 
2.119.2	Gloria maiorum curret in obprobrium. 
2.120.1	Captiuo stultus congaudet stemmate uatis. 
2.120.2	Non est Virgilius, dicitur iste tamen. 
2.121.1	Externo quotiens uocitaris nomine, demens, 
2.121.2	Si tibi sunt sensus, prospice ne uenias. 
2.122.1	Cur te Virgilium mentiris, pessime, nostrum? 
2.122.2	Non potes esse Maro, sed potes esse moro. 
2.123.1	Iste callis est, supernam qui parat potentiam, 
2.123.2	Lux pudoris, esca mentis, fax medela claritas. 
2.123.3	Mundi faece qui fucantur hunc tenere nesciunt. 
2.123.4	Liber extat, hoc quicumque colla loro uinxerit. 
2.123.5	Sanguinis uenam nitentis comit iste sarculus. 
2.124.1	Hic uolucrem Rhodani torrentis respice natam 
2.124.2	Sermonum frenis subdere colla tuis. 
2.124.3	Iussa uolat uerbis et uerbis iussa quiescit, 
2.124.4	Cuius captiuum est auribus arbitrium. 
2.124.5	Vincula sentiret, ni uocis stricta lupatis 
2.124.6	Perderet auditu luxuriam generis. 
2.124.7	Cum stimulos clamor mentitur, clamor habenas, 
2.124.8	Obsequium linguae libera membra ferunt. 
2.124.9	Non opus est loris, sed nexus certa loquendi 
2.124.10	Dura catenati rostra ligat pecudis. 
2.125.1	Visceribus propriis externos fundere partus 
2.125.2	Cogitur et generis subolem lactare ferini, 
2.125.3	Iurgia naturae magno distantia calle. 
2.126.1	Edidit ignotum genetrix male conscia partum, 
2.126.2	Naturae fraudes, nobiliore dolo. 
2.127a.1	Discrimen generis iunxerunt foedera partus: 
2.127a.2	Ingenii stirpes permixta lege coacti. 
2.127b.1	Hic mulus geminum pecus est, sed corpore simplex. 
2.128.1	Astrorum populus necdum de lumine solis 
2.128.2	Perdiderat lucem, gremio sed noctis adultae 
2.128.3	Fundebat rutilos madefacto aspargine crines: 
2.128.4	Cynthia per croceas fulgebat lactea bigas, 
2.128.5	Rescindens quicquid descripserat orbita fratris: 
2.128.6	Vernabat tacitus splendor de munere noctis, 
2.128.7	Torrida frigoribus confringens tempora Cancri: 
2.128.8	Cum me curarum cupientem spernere fasces, 
2.128.9	Ruris amoenati facies depicta uocauit. 
2.128.10	Cornipedem scandi, qualem uix Cyllarus aequat, 
2.128.11	Mollibus aetherias qui uincit cursibus auras, 
2.128.12	Inmobilis currit cuius per deuia sessor, 
2.128.13	In statione uolans pedibus constanter adactis. 
2.129.1	Quam uaga constantem retinent haec tecta decorem! 
2.129.2	Mittitur a domina quicquid habent pretii. 
2.129.3	Nam rutilat fuluum Violae de luce metallum: 
2.129.4	Possessor radios spargit ubique suos. 
2.130.1	Obruit haec tumulos, uiuit post funera factis, 
2.130.2	Quae mortale nihil moribus inseruit. 
2.130.3	Euphemia tuos tellus conplectitur artus, 
2.130.4	Sed mens est niueis quam bene iuncta choris! 
2.130.5	Occidit exitium: sors tunc durissima seruit, 
2.130.6	Cum superat fatum nescia uita mali. 
2.130.7	Haec thalamis fecunda fuit, uiduata pudoris 
2.130.8	Exemplis natam fecit amare deum. 
2.131.1	Vtimur incluso per fraudes ense bacillo: 
2.131.2	Mors ligni tunicis quam bene tecta latet! 
2.131.3	Subsidium portas, quod cunctis terror haberis: 
2.131.4	Pacificum est nobis quod negat obsequium. 
2.132.1	Languescit rigidi tecum substantia ferri, 
2.132.2	Soluitur atque chalybs more fluentis aquae. 
2.132.3	Emollit gladios inbellis dextra Boeti: 
2.132.4	Ensis erat dudum, credite, nunc colus est. 
2.132.5	In thyrsum migrat quod gestas, inprobe, pilum. 
2.132.6	In Venerem constans, linque Mauortis opem. 
2.133.1	Sollicitata leui marcescunt corda uirorum 
2.133.2	Tormento: fas est ludere uirginibus. 
2.133.3	Frangunt Marmaricis elephas quod misit ab aruis, 
2.133.4	Per micas sparsum mox solidatur opus. 
2.133.5	De poena tenerae discunt cum fraude iocari: 
2.133.6	Nam ridere necis munere femineum est. 
2.133.7	Angusta norunt res mille includere capsa, 
2.133.8	Omne ebur hic, mulier, pectoris arca tui est. 
2.134.1	Riparum frenos naturae uincula surgens 
2.134.2	Forte Forte tumido gurgite transierat. 
2.134.3	In spumam fluxas cogens durescere limphas, 
2.134.4	Squamea praeualidis dorsa ferebat aquis. 
2.134.5	Ales ut in tenero fidens tunc constitit orbe, 
2.134.6	Otia dans pinnis, tuta premebat aquas. 
2.134.7	De proprio pelagus calcanti suggerit alnum, 
2.134.8	Humida cum siccam cumbula portat auem. 
2.135.1	Cum perstat grauior, bustum fortuna per iram 
2.135.2	Contulit exuuiis, Maioriane, tuis. 
2.135.3	Pyramidum indignis (ingentes) prospice moles, 
2.135.4	Vilia principibus linque sepulcra piis. 
2.136.1	Cornipedes cuncti, quos gignunt bellica rura 
2.136.2	Quosque cruentatis diluit unda toris, 
2.136.3	Algida qui Tanais domuistis dorsa profundi, 
2.136.4	Quorum praeualidas ungula calcat aquas: 
2.136.5	Ecce Padanus adest sonipes, cui iudice recto 
2.136.6	Cedant Aemonii quos fouet aura poli. 
2.136.7	Ille pruinosis qui mandit gramina lustris, 
2.136.8	Et merito et forma dispar utroque uenit. 
2.136.9	Molliter incedit membris formosus honestis, 
2.136.10	Oblectat uisum dulcis in obsequio. 
2.136.11	Nil iam Phasiacam conlaudet fabula prolem, 
2.136.12	Nec peregrina ferant nomina celsa caput. 
2.137.1	Verus honor uitem tribuit, sed munera uitis 
2.137.2	Ieiuno non dant ligna ministerio. 
2.138.1	Vt sceptrum princeps, sic gestat dextera uitem: 
2.138.2	Vtribus exornet diua corona caput. 
2.139.1	Vitifer hic siccus matrem conplector erilis, 
2.139.2	Vberibus pressis quae mihi uina negat. 
2.140.1	Heu quotiens calidis uites sine fruge labellis 
2.140.2	Inlusit, nudo nomine me refouens! 
2.141.1	Terrarum culpis uitium potator obumbras: 
2.141.2	Ebrius esse nequis uina uomens Ligurum. 
2.141.3	Dum replet madidus feruentia pectora Bacchus, 
2.141.4	Indicunt ualidam pocula nostra sitim. 
2.142.1	Dicendi palmam Victoria tollit amico. 
2.142.2	Transit ad Ambrosium: plus fauet ira deae. 
2.143.1	In ligurum terris potorem qui uocat errat: 
2.143.2	Numquid uina bibit uina bibens ligurum? 
2.144.1	Suscipe uersiculos, Ennodi proxime, nostros, 
2.144.2	Vt librum nobis reddere non desinas: 
2.144.3	Ne foedes cultum, dum reddere, Maxime, non uis, 
2.144.4	Quae pridem nobis es quoque pollicitus. 
2.145.1	Si te, Messala, studiis mihi pandere uelles, 
2.145.2	Non deerant libri, quos tibi, dulce, darem. 
2.145.3	Mens iniusta nimis quod spernat tollit amanti, 
2.145.4	Nec gratum est munus quod fugit ingenium. 
2.146.1	Artis grammaticae librum de carmine fracto 
2.146.2	Qui poscit, solidos certat habere pedes. 
2.146.3	O utinam Musis contingant munere nostro 
2.146.4	De te quandoque gaudia certa, puer! 
2.146.5	Vitant loripedem, nisi fallor, pangere uersum 
2.146.6	Vel quos in somnis respiciunt studia. 
2.147.1	Vxor Flasconis cupis dotata Falerni, 
2.147.2	Semper inexhausto pectus repleta Lyaeo, 
2.147.3	Quae Bacchum madidis colui uenerata labellis, 
2.147.4	Turgida ructato permulcens numina musto, 
2.147.5	Concludor sicci bene conscia tegmine busti: 
2.147.6	Est tamen ad superos coniunx mihi nobilis, euoe, 
2.147.7	pocula quem numquam possint transire beata. 
2.147.8	Quem si fata uirum seruant, tibi uiuimus ambo. 
2.148.1	Funus obit, uirgo quotiens in busta refertur. 
2.148.2	Vnum iter est mortis criminis obsequium. 
2.148.3	Dalmatiae meritis uicta est natura rebelli$, 
2.148.4	Degeneri caelum nobilitate tenet. 
2.148.5	Hoc satis est mundum calcasse in corpore mundi, 
2.148.6	De uitio sumptam cedere nil uitiis. 
2.148.7	Stemmatis haec lucem transcendit sole pudoris, 
2.148.8	Mens cum proposito consociata fuit. 
2.149.1	En sine nube pluit sub tectis imbre sereno 
2.149.2	Et caeli facies pura ministrat aquas. 
2.149.3	Proflua marmoribus decurrunt flumina sacris 
2.149.4	Atque iterum rorem parturit ecce lapis. 
2.149.5	Arida nam liquidos effundit pergula fontes, 
2.149.6	Et rursus natis unda superna uenit., 
2.149.7	Sancta per aetherios emanat limpha recessus, 
2.149.8	Eustorgi uatis ducta ministerio. 
2.150.pr	CL. [EXCVSATIO ENNODII DE LAVDIBVS.] Qui miratur officii terminos in amicorum me laudibus egressum recolat quam imperiosa est semper affectio nec parens propositi legibus uis amoris. et profecto si facti mei rationem quaerat, religionem uocat quod mentibatur excessum. 
2.150.1	Vt ualeant aquilae formatos prodere fetus, 
2.150.2	Vitalis tenerum frangit tepor insitus ouum. 
2.150.3	Tunc pius artatam lacerat pater inpiger aedem, 
2.150.4	pariat rursus studio quos edidit aluo. 
2.150.5	Mox generis testem Phoebum ciet arbiter idem, 
2.150.6	Inuenit internam rimatus lumine lucem. 
2.150.7	Non aliter celso pueros de stemmate cretos 
2.150.8	Doctrinae radiis opponit cura parentis. 
2.150.9	Quam bene flammarum constanter, respice, bella 
2.150.10	Excipiunt teneri, uincentes fulgora uisu. 
2.151.1	Vna domus duplici discreta iungitur aede 
2.151.2	Partiturque suum quod bene nectit opus. 
2.151.3	In geminis simplex radiat pia gloria tectis 
2.151.4	Et de diuisis consociatur honos. 
2.151.5	Ne procul aut ibidem sacros confunderet usus, 
2.151.6	Constanti numerum sors dedit ampla loco. 
