2.1.8	Funeribus iunxit funera multa suis. 
2.1.9	Occidit, heu, iuuenis, qui tersit crimina uitae 
2.1.10	Tempore culparum uiuificante deo. 
2.1.11	Aspice, primaeuos metuis qui forsitan annos, 
2.1.12	Aetas uincentem non tenuit puerum. 
2.1.13	Exemplum terris linquens, ad sidera raptus 
2.1.14	Confessis rectum quam bene monstrat iter! 
2.1.15	Bis denas hiemes, totidem transcendit aristas, 
2.1.16	Quem subito ex oculis sors inimica tulit. 
2.2.1	Numquam morte perit meritis post busta superstes, 
2.2.2	Funera sublimem non capiunt animam. 
2.2.3	Sanguis honor genius probitas constantia census 
2.2.4	Interimunt multis dotibus exitium. 
2.2.5	In commune, bonus non sentit damna sepulcri. 
2.2.6	Fila legunt Parcae quae dederant miseris: 
2.2.7	Pendula lassantur quae plebem stamina portant: 
2.2.8	Fortia contingunt licia nobilibus. 
2.2.9	Cana uenerandi renouabant saecula mores, 
2.2.10	Inque uicem templi pectora munda tulit. 
2.3.1	Consona diuersis finxisti carmina libris: 
2.3.2	Suscipiat gaudens littera quod tribuit. 
2.3.3	Nescio qui tantum non laudet, Fauste, pudorem, 
2.3.4	Cum reddis si quid lecta dedere tibi. 
2.3.5	Depositum perdit mens recti nescia semper: 
2.3.6	Ad mores redeunt haec document probos, 
2.3.7	Si tamen admittis dexter mea uerba, fatebor, 
2.3.8	Qui pollet magnis paruula iuste fugat. 
2.3.9	Laudentur tereti quos pingis carmine, uates, 
2.3.10	Mascula rhetorico schemate lingua. tonet: 
2.3.11	Ceu Paulus Christum docuit hominemque deumque, 
2.3.12	Quo praestat cunctis gaudeat eloquio. 
2.3.13	Attica per Graios ditentur dogmata sensus 
2.3.14	Et nostrum stupeat Graecia docta decus. 
2.3.15	Moralis strictis, narrentur physica certis, 
2.3.16	Historiam monstrans indicet historia, 
2.3.17	Comica per limam numerentur, fortia plausu: 
2.3.18	Conueniunt operi lucida dicta tuo. 
2.3.19	Non ualet haec alter: sed Faustum dicere summa 
2.3.20	Laudis erit semper, si bene nota loquor. 
2.4.1	Antistes summus, plaustrum, te, nobile, donat. 
2.4.2	Pandit iter magnis, omina dextra facit. 
2.5.1	Rustica, perpetuae non te sors pallida uitae 
2.5.2	Sustulit, interitum nec tibi morte dedit. 
2.5.3	Purior aetherias graderis sine carne per arces. 
2.5.4	Sic uitam castae funera nobilitant, 
2.5.5	Quod, mirum, uiduata tibi sic constitit aetas, 
2.5.6	Coniugis ad natum cum bene ductus amor. 
2.6.1	Corpore deuicto moritur quicumque superstat: 
2.6.2	Dant leti legem crimina sola homini. 
2.6.3	Nil tibi, uirgo, perit: carnem mens pura refudit, 
2.6.4	Quae numquam mundi uixit in obsequiis. 
2.6.5	Funera busta rogi scelerum stipendia cessent: 
2.6.6	De uita ad uitam transitus iste plaeet. 
2.7.1	Occisor mortis, dux uitae, planta salutis! 
2.7.2	Aspice: nam serpens ecce uenena fugat, 
2.7.3	Et quod supplicii species et mortis imago 
2.7.4	Iam fuerat miseris, est mihi certa salus. 
2.8.1	Antistes genio pollens probitate pudore 
2.8.2	Ornauit donum meritis et lumina uitae 
2.8.3	Ad pretium iungens operis haec templa locauit. 
2.8.4	Lapsa per incertos non spargit fama recessus: , 
2.8.5	Sed ueteris facti uiuit lex aucta per aeuum, 
2.8.6	Cum dexter capiat Laurenti munera Xystus. 
2.8.7	Sic manet officium, quod sanctis contigit olim. 
2.8.8	Obtulit hic templum, ueniens quod consecrat ille. 
2.9.1	Vilia tecta prius facibus cessere beatis, 
2.9.2	Si splendor per damna uenit, si culmina flammis 
2.9.3	Consurgunt habitura deum, si perdita crescunt 
2.9.4	Ignibus innocuis, si dant dispendia cultum. 
2.9.5	Qualis erit reparans crepitantibus aucta ruinis? 
2.9.6	Laurenti, tua bella gerens incendia uince. 
2.9.7	Sordida marcenti latuisset terra recessu, 
2.9.8	Si status faciem tenuissent antra uetusti. 
2.9.9	Sed postquam superi flammas misere secundas, 
2.9.10	Ad lumen cineres traxerunt ista colendum. 
2.9.11	Huc oculos conuerte pios, qui cuncta uapore 
2.9.12	Praedicis mandanda, pater, rebusque docendos 
2.9.13	Instrue, ne uerbis titubet mens nescia recti. 
2.10.1	Aedibus ad genium duo sunt concessa per aeuum, 
2.10.2	Si niteant crustis aut domini merito. 
2.10.3	Herbida pasturam simulantia saxa.uirentem 
2.10.4	Inliciant oculos nobiliore dolo: 
2.10.5	Fallat opus tamen arte, regat natura figuras, 
2.10.6	Viscera dum lapidum fingit imaginibus: 
2.10.7	Candorem roseo perfundat doctor ab ore, 
2.10.8	Depingat sparsis congrua membra notis. 
2.10.9	Aurum culmen ebur tabulas laquearia gemmas 
2.10.10	Non datur humanis plus rutilare bonis. 
2.10.11	In pretio crustis fors et sine lege iocatur. 
2.10.12	Moribus ut constes, crede, laboris erit. 
2.11.1	(Antiquum) ecce nitet templum, quod sorduit ante, 
2.11.2	Cui faciem ueterem lux noua conposuit.- 
2.11.3	Perdidit antiquum quis religione sacellum, 
2.11.4	Numinibus pulsis quod bene numen habet? 
2.11.5	Di, quibus hoc patuit, possessas linquite sedes. 
2.11.6	Quod fecit Victor, uictor ubique tenet. 
2.11.7	Addidit ad cultum merito successor et actis, 
2.11.8	Qui morum nomen hinc, Honorate, geris. 
2.11.9	Nubila uiperei qui gestat corda ueneni, 
2.11.10	Non datur ut faciat culmina pulcra deo. 
2.12.1	Accipe de cuius biberit domus arta fluentis, 
2.12.2	Atria quod superet porticibus modicis. 
2.12.3	Pontificis summi studio constructa renidet, 
2.12.4	Laurenti proprium possidet ista diem. 
2.12.5	Splendida per census consurgunt tecta ruinam, 
2.12.6	Occasum nescit quod uenit a domino. 
2.12.7	Vix caries senium comitata hoc deterit umquam, 
2.12.8	Gloria factoris quod bene condiderit. 
2.12.9	Fabula de magnis numquam tacitura reseruat, 
2.12.10	Quod uincens aenum nomen ad astra ferat 
2.13.1	Ille fuit rigidi semper seruator honesti, 
2.13.2	Terribilis culpis supplicibusque pius, 
2.13.3	Quem numquam flexit uitium, miseratio semper, 
2.13.4	Iudicium facie certus ubique dedit. 
2.13.5	Crimina corripuit uultu, conpuncta refouit, 
2.13.6	Conscia secreti detulit ora tui 
2.13.7	Hunc utero genetrix caelestem fudit in aulam, 
2.13.8	Vbera subducens tradidit uberibus. 
2.13.9	Cana uenerandum stupuerunt saeoula uatem: 
2.13.10	Moribus ante fuit quod gerit officio. 
2.14.1	Qui possessa diu felix habitacula liquit? 
2.14.2	Quae creuit domino sic uiduata domus? 
2.14.3	Aulica suscipiens moderamina raptus inemptum 
2.14.4	Quod pretio mentis quaeritur obtinuit. 
2.14.5	Nunc locus inriguo retinet quod sorbuit haustu, 
2.14.6	Prospera custodiens faucibus hausta semel. 
2.14.7	Extemplo quisquis successit mansor et heres, 
2.14.8	Ingresso dextrum contulit ista pedem. 
2.14.9	Quid praestet consors ad uitam discite sanctam, 
2.14.10	Si reddunt mundos tecta dicata uiros. 
2.15.1	Da, pater omnipotens, per saecula longa, precamur, 
2.15.2	Spes ut certa piis hospitibus ueniat: 
2.15.3	Candida ne meritis fuscentur stamina nostris, 
2.15.4	Neu metis sistat palma parata meis. 
2.15.5	Surgat qui propriae genetricis fotus in aluo 
2.15.6	Ad gustum uitae per tua dona uenit. 
2.15.7	Tu mea uel tenui perfundis corda sapore, 
2.15.8	Tu testem linguam sanguinis esse facis. 
2.15.9	Celsa tenebroso frondescunt arbuta luxu, 
2.15.10	Quae nullis strinxit falcibus agricola. 
2.16.1	Eloquium certus naturae constitit index, 
2.16.2	Perfecti fontem quaerere qui sitiat. 
2.16.3	Libertas semper studiis reseratur honestis, 
2.16.4	Infabricata latet nobilitas tenebris. 
2.16.5	Captiuum uenis seruasset terra metallum, 
2.16.6	Ni daret inuentor quod uocat in medium. 
2.16.7	Scrutator fuluum concessit pallidus aurum: 
2.16.8	Qui polit ingenuum, sic facit esse suum. 
2.16.9	Hactenus Ionium perlustrans remige pauco, 
2.16.10	Ad portum cumbam flecte, Thalia, meam. 
2.17.1	Nauita per postes suspendit munera ponti, 
2.17.2	In foribus propriis flumine parta gerens. 
2.17.3	Venator portis adponit missile ferrum, 
2.17.4	Vestibulum galea comitur armigeri. 
2.17.5	Discitur in ualuis ars uirtus nomen origo. 
2.17.6	Nos frontis signo credimur esse dei. 
2.17.7	Sic nostrum pande studium, dux littera recti, 
2.17.8	Vt domus ingenium non taceat domini. 
2.17.9	. Qui gestas Latium satiatus pectora rorem, 
2.17.10	Aspice serpentes hic Heliconis aquas. 
2.18.1	Ecce tenet uictrix pennatum dextera numen: 
2.18.2	Venit et ad reditum non habet arma uiae. 
2.18.3	Pugnacem gestans sonipes per terga minatur, 
2.18.4	Aduena cui terror ridet in arte bonus. Discat Hyperboreis famosum germen in aruis 
2.18.5	Naturae genium, cum simulacra uidet. 
2.19.1	Aspice deposita blandum feritate leonem: 
2.19.2	Ore uomit limphas pectoris obsequio. 
2.19.3	Vnda fluit rostro, dens mortis pocula mandit, 
2.19.4	Naturam perdens belua nos satiat. 
2.19.5	Effera dum uitreos effundunt guttura fontes, 
2.19.6	Dira salutiferis corda lauantur aquis. 
2.20.1	Conditor Armenius, supero qui dignus honore est, 
2.20.2	Hic peperit fontem uiuificantis aquae. 
2.20.3	Plena salutiferis gestemus uiscera limphis: 
2.20.4	Ne sitiat potans contulit unda semel. 
2.20.5	Rapta sepulturis animauit corpora pictor: 
2.20.6	Funera uiua uidens mors eat in tumulos. 
2.20.7	Illorum tamen iste locus conplectitur artus, 
2.20.8	Quos paries facie, mens tenet alma fide. 
2.21.1	Delia ceruus aper tigris leo bucula pardus. 
2.21.2	Adportant mensis fercula, docte, tuis. 
2.22.1	Diuersis dapibus confinia proxima seruat, 
2.22.2	Dum claudit uariis fercula multa uiis. 
2.22.3	Limitibus certis quod iunctus diuidit ordo, 
2.22.4	Vnus in argento quam bene uenter habet! 
2.23.1	Quis rogo per facinus crimen conpescuit umquam? 
2.23.2	Amplector sanctas, quae dant bona semina, fraudes, 
2.23.3	Augmento rumpunt dum iurgia saeua perito. 
2.23.4	Qui natum matris per culpam reddit amori, 
2.23.5	Hunc odiis constat missurum semina pacis. 
2.23.6	Ordine peruerso fallax concordia pugna est, 
2.23.7	Cum belli facies tribuat mentita quietem. 
2.24.1	Di, prohibete minas, quas partus nuntiat horrens. 
2.24.2	Quem lupa sordenti conceptum fudit asello. 
2.24.3	Coniugis ille cibus satiauit uiscera prole, 
2.24.4	Edidit et pecori subolem fera, prodiga legis. 
2.24.5	Quid faciat rumpens naturam conuena discors? 
2.24.6	Vnde sequenda petat natus, quis dicere possit, 
2.24.7	. Quem stultum genitor, furem dedit inproba mater? 
2.24.8	Nobile degenerans tenuisset culmen ab istis. 
2.24.9	Sed uitiis proprium te norunt, crede, parentes, 
2.24.10	Elinguem trepidum iactantem fraudibus aptum, 
2.24.11	Gutturis inmensi, sorbentem quicquid ubique est, 
2.24.12	Qui semel adsuetas humano sanguine fauces 
2.24.13	Pandit et ad uiles non uertit rostra iuuencos. 
2.25.1	Pasiphae, niueum linquens nec in arte iuuencum, 
2.25.2	Diffusis collo manibus petis oscula supplex, 
2.25.3	Pulcrior et certis inludis ficta puellis: 
2.25.4	Candidus argentum superat bos luce coloris: 
2.25.5	Viuit amor taurus mulier sine corpore uero. 
2.26.1	Praeparat in fletu qui fercula lauta uocatis, 
2.26.2	Annua per lacrimas celebret sollemnia magnas., 
2.27.1	Numquam stante domo pascit, mihi credite, tantos, 
2.27.2	Qui tumulos natis et mensas conplet amicis. 
2.28.1	Conuiuae miseri, luctus deposcite multos: 
2.28.2	Prandia tot uenient, funera quot fuerint. 
2.29.1	Blanditur mulier, sentit bos, membra monentur. 
2.29.2	Attulit ars formas: quis dedit his animas? 
2.30.1	Et fictus rigidam seruat, Venus inproba, mentem 
2.30.2	I Taurus, ut admotis suspendat rostra labellis. 
2.31.1	Si tibi sunt animae, pictor, quibus inseris artem, 
2.31.2	Mollior in tauro claudatur spiritus, oro, 
2.31.3	Fortia si miserae non dantur corda puellae. 
2.32.1	Consulis ad genium nomen pro stemmate iunxi: 
2.32.2	Dans lucem fastis, sum trabeis potior. 
2.32.3	Quid, palmata, tuo tantum de murice uernas? 
2.32.4	Plus fucante dedit purpura nostra tibi. 
2.33.1	Inprobe, quid fractis confundis singula uerbis? 
2.33.2	Depingit mores obruta lingua tuos. 
2.33.3	Accipis exposcis praesumis renuis ardes. 
2.33.4	Tristia blanda simul, fortia fluxa facis. 
2.33.5	Ira pauor rabies patientia tempore in uno: 
2.33.6	Tot facies gestas pectoribus uacuis. 
2.34.1	Suscipit oblatum, ueniam cui contulit Iesus. 
2.34.2	Post culpas animae sunt holocausta dei. 
2.34.3	Perge, puer, teneros superans bene conscius annos. 
2.34.4	Vectores meruit candida uita pios. 
2.35.1	Inludis Gallis, Veneti male tincta propago. 
2.35.2	Nil candoris habes: mens tibi quod genus est. 
2.35.3	Despicis insontes, maculatae uernula terrae: 
2.35.4	Sed natos Rhodani nix probitatis habet. 
2.36.1	Quod tibi naturae dederit lex germen, amice, 
2.36.2	Hoc mihi fons tradat uiuificantis aquae. 
2.37.1	Commoda de damnis mercaris, gaudia planctu, 
2.37.2	Si tibi de Christo est indubitata fides. 
2.38.1	Hoc est quod nitido membrum conpletur oliuo: 
2.38.2	Nil potius sanctas conuenit ante fores. 
2.39.1	Horrea parua licet, sed mens est largior illis. 
2.39.2	Non parcens opibus diuitias merui. 
2.40.1	Adueniant animum reserantes teste figura, 
2.40.2	Quo semper uotum proditur indicio. 
2.41.1	Nulla penum laxat mentis pressura sinistrae: 
2.41.2	Effluit extensis quod spatiis latitat. 
2.42.1	Non mihi diffusae dant prandia celsa coquinae, 
2.42.2	Nec plures uenter concutit artifices. 
2.42.3	Fercula pauca damus numerum uincentia cultu, 
2.42.4	Gloria nec mensae damna salutis habet. 
2.43.1	Sobria cella, cadis uinum quae seruat onustis, 
2.43.2	Corpora confirmat gressibus acta suis. 
2.43.3	Infundant multis irarum pocula flammas, 
2.43.4	Mitescunt nostro bellica corda mero. 
2.44.1	Respice, qui gressum sinuas per amoena uirecta, 
2.44.2	Vt discas cultis lucem praeferre diserti. 
2.44.3	Adridet germen, quod linguae pingitur ostro: 
2.44.4	. Ver habet in bruma qui flores carmine gignit: 
2.44.5	Per glaciem zephyros exalant uerba tepentes. 
2.44.6	Ebria fulgenti maduerunt murice dicta,. 
2.44.7	Omnibus in rebus sermonum purpura regnat: 
2.44.8	Oris ad imperium submittunt colla chelydri. 
2.44.9	Algida cum roseo iuuenescant sanguine corda, 
2.44.10	Primaeuos gelidis ostendit littera membris. 
2.44.11	Vertit ad obsequium naturae munera doctus, 
2.44.12	Aetates species mensuras tempora formas. 
2.45.1	Conlaudet spatiis hortorum commoda lautis 
2.45.2	Plurima cui satiant iugera culta famem. 
2.45.3	Ditior extentos superat dos larga minorum: 
2.45.4	Nobilitas uera est, quae nitet in modicis. 
2.45.5	Venit ad inclusum postponens Gratia campos, 
2.45.6	Prodidit angustis quid faciat studium. 
2.45.7	Vernat in ingressu uiridanti porticus umbra, 
2.45.8	Cui fudit genium uitifer ipse deus: 
2.45.9	Exornans magnis foliorum texta racemis 
2.45.10	Aestiuis iungit commoda frigoribus. 
2.45.11	Lilia nam laurus oleas commixta rosetis 
2.45.12	De cultu proprium fecit habere diem: 
2.45.13	Serta triumphantis frontem quae monstrat amictum, 
2.45.14	Contulit ad fetus aurea terra suos. 
2.45.15	Largus opum poscat maioris praemia uoti: 
2.45.16	Hoc satis est nobis, quod sine fraude libet. 
2.46.1	Spiritus exhausto uolitat praelubricus auro: 
2.46.2	Candida lassatum uix tangit membra metallum. 
2.46.3	Adflixit pondus pretium fornacis anhelae. 
2.47.1	Aurea per nebulas dissoluit fila magister: 
2.47.2	Cluserunt dociles flamina fulua manus. 
2.48.1	Contulit hic uentus pretiosi membra metalli: 
2.48.2	Quod finxere timent nec capiunt oculi. 
2.49.1	Est nihil, et teneo: conuincit dextera uisum. 
2.49.2	Stringitur artatis digitorum nexibus aura. 
2.50.1	Damnati fructus mittit tua tessera ligni. 
2.50.2	Haec hominem dira spoliarunt pabula primum, 
2.50.3	. Et nudis, serpens, post fraudem sorte minaris. 
2.50.4	Parce, precor, donis: casus et damna reserua. 
2.50.5	Quid nocitura putas insontis poma saluti? 
2.50.6	Ante ferax leti tunc mortem depulit arbor, 
2.50.7	Fixa triumphigeris cum ramis uita pependit. 
2.51.1	Omnia Memphitis retinentur saecula textis: 
2.51.2	Seruiuit numquam Laurentius ante Neroni, 
2.51.3	Nec timuit ualidas uicit qui corpore flammas. 
2.52.1	Vir facie, mulier gestu, sed crure quod ambo, 
2.52.2	Iurgia naturae nullo discrimine soluens, 
2.52.3	Es lepus, et tanti conculcas colla leonis. 
2.53.1	Exige mendaces, populorum uxorcula, barbas, 
2.53.2	Ne minuant quaestum mascula labra tuum. 
2.54.1	Respice portentum permixto iure creatum, 
2.54.2	Communis generis, satius sed dicitur omnis. 
2.55.1	Ludit in ancipiti constans fallacia sexu: 
2.55.2	Femineum patitur: peragit cum turpia, mas est. 
2.56.1	Mundior excocti fulgescat luce metalli 
2.56.2	Munera disponit qui dare digna deo. 
2.56.3	Ante uaporatis Laurenti uita caminis 
2.56.4	Constitit, ut blandum nobilitaret opus. 
2.56.5	Marmora picturas tabulas sublime lacunar 
2.56.6	Ipse dedit templo qui probitate nitet. 
2.56.7	Aedibus ad pretium sic mores conditor addit, 
2.56.8	Vellera ceu Serum murice tincta feras, 
2.56.9	Qualiter inclusas comit lux hospita gemmas, 
2.56.10	Nix lapidis quotiens pulcrior arte rubet. 
2.57.1	Barbaricam faciem Romanos sumere cultus 
2.57.2	Miror et inmodico distinctas corpore gentes. 
2.58.1	Romuleam tegetem nox oris nubila fuscat: 
2.58.2	Oppressit uestes tenebroso tegmine uultus. 
2.59.1	Nobilibus tollis genium, male compte, lacernis, 
2.59.2	Discordes miscens inimico foedere proles. 
2.60.1	Libera captiuum meruerunt culmina lumen, 
2.60.2	Adridet facies nubila nulla gerens. 
2.60.3	Hic nuper astrigeri dos proxima uenit Olympi, 
2.60.4	Laurenti uatis ducta ministerio, 
2.60.5	Aedibus et uitae cuius nunc una figura est, 
2.60.6	Ceu solis radiis forma color similis. 
2.60.7	Euge uetustorum reparator, perge, nouorum 
2.60.8	Conditor, et uultu. clarus et ingenio. 
2.60.9	Abiurant priscam te praesule tecta senectam, 
2.60.10	Aduena casuris porrigitur genius. 
2.61.1	Prandia lauta paras, sed linguae sordibus horres. 
2.61.2	Si deses pastor fercula concilias, 
2.61.3	Ambitiosa fames lassato prodiga censu 
2.61.4	Cornibus insultat, si taceat dominus. 
2.62.1	Visceribus miserorum et sanguine pauperis aucte, 
2.62.2	Tantorum mortes cur tibi sunt epulae? 
2.62.3	Tubera perdices grus turdus turtur echinus, 
2.62.4	Non explent uterum corpora mille tuum. 
2.62.5	Infaustus multis, tibi felix diceris uni, 
2.62.6	Heres quod misero uenter erit proprius. 
2.63.1	Artubus humanis Polyphemus uixit et atro 
2.63.2	Sanguine distentos delicias habuit. 
2.63.3	Tu reddis similem scena redeunte furorem, 
2.63.4	Cui pastum tribuunt agmina debilium. 
2.64.1	Mergeret ut diuos in mortem, pabula serpens 
2.64.2	Contulit et uitam munere dira tulit. 
2.64.3	Sic quicumque meos paradisi uere labores 
2.64.4	Demulcet, casses conuiuii patitur: 
2.64.5	Illic discedit quem pectore gessit amicus: 
2.64.6	Fit dominus cari gutturis hospitium. 
2.65.1	Nesciris uotis et cordis nube recedis 
2.65.2	Ex oculis: praesens quaereris in facie, 
2.65.3	Tuque per ambages nulli spectabilis esse 
2.65.4	Calles, mellifluis toxica dans labiis. 
2.65.5	Hoc uolo quod non uis, iurans te nolle quod optas, 
2.65.6	Concutis et uariis pectora saeua modis, 
2.65.7	Hydram uerticibus, formis superare Prometheum 
2.65.8	Doctus, ut ad priscos fabula non redeat: 
2.65.9	Bella cies, spoliis crescis, Defensor, ademptis. 
2.65.10	Ad nomen currit praeda superba tuum. 
2.66.1	Dum mea multiplices mens anxia sustinet aestus 
2.66.2	Et reddor uitrei mancipium pelagi 
2.66.3	Cumque procellosus refluentis portitor undae 
2.66.4	Africus ut captas me rotat exuuias: 
2.66.5	Pierius menti calor incidit, indiga serti 
2.66.6	Tempora mox cinxit laurus Apollinea, 
2.66.7	Tunc hederae uiridis rubuerunt fronte corymbi, 
2.66.8	Castalii mellis murmura blanda bibi. 
2.66.9	Continuo ponens marcentes pectore curas 
2.66.10	Conplector laudem carmina laetitiam. 
2.67.1	Musta cadis famuli dum condunt nostra fideles 
2.67.2	Et ludunt praelo calcibus intrepidis, 
2.67.3	Dum tingunt rosei plantas de sanguine Bacchi, 
2.67.4	Scinditur et teneras nua gerens tunicas: 
2.67.5	Otia Niliacis non passus carmina biblis 
2.67.6	Sulcaui, tumulo ne tenear moriens. 
2.67.7	Ebria lapsantis confessus uerba Thaliae, 
2.67.8	Sum uacuus culpa, si pedibus titubet. 
2.67.9	Ieiunos deceat lex artis syllaba rhythmus: 
2.67.10	Nulla Camenarum iungitur ad Bromium. 
2.68.1	Nescio cur sancto non parcas, stulte, labori, 
2.68.2	Dum morem seruas dentibus insiliens. 
2.68.3	Mandere nos pergis, sed uenter commoda nescit: 
2.68.4	Flamina nam uacuis stringis imaginibus. 
2.68.5	Escarum gurges nil ruptis murmure buccis 
2.68.6	Suscipit aut cassis motibus exuberat. 
2.68.7	Phasiacam uolucrem pisces uel sumina carpens, 
2.68.8	Vda uaporatis guttura pasce cibis: 
2.68.9	Me ieiuna iuuat sine ructu pangere dicta: 
2.68.10	Regifico luxu fercula te satient. 
2.69.1	Testibus adseritur gens census uita, Tribune, 
2.69.2	Antiquum quotiens linquimus hospitium. 
2.69.3	Tu, quem lustratis transmisit gentibus error, 
2.69.4	Nulla domus pleno nec tenet ampla die, 
2.69.5	Vis dici locuples sublimis pulcher amicus, 
2.69.6	Aestibus ignoti missus ab Oceani. 
2.69.7	Inrita dicta uolant, adsertor non uenit ullus, 
2.69.8	Nulla fides sexum detegit aut patriam. 
2.69.9	Mendicus uetulus timidus confusus anhelus, 
2.69.10	His, uerum perdens, utere nominibus. 
2.70.1	Tutus falsa loqui poteris sine teste, Tribune: 
2.70.2	Ventus habet linguam ponderibus uacui. 
2.71.1	Instabilem faciunt naturae damna Tribunum: 
2.71.2	Auolat hinc rursus, uincula ni teneant. 
2.71.3	Tolle, miser, modicam zephyro ueniente saburram: 
2.71.4	Radix nulla tuo est utilis auxilio. 
2.72.1	Eunuchus turpem poscit per conpita uictum: 
2.72.2	Semina telluri non habet unde ferat. 
2.72.3	Grandia proscissis rus seruat germina membris, 
2.72.4	Fetibus et messis multiplicata redit. 
2.72.5	Incassum sectus proscindit uomere terga, 
2.72.6	Ni findens spargat triticeam subolem. 
2.73.1	Hic uolucrum pugna est, ubi Gallo caeditur anser: 
2.73.2	Dat poenas ueteris proditionis auis. 
2.73.3	Mactatus quondam uocis capis, inprobe, quaestum: 
2.73.4	Romanis uitam qui dederit moritur. 
2.74.1	Qui ponti facies, numerum qui nouit harenae, 
2.74.2	Femina quem iurans fallere nulla potest, 
2.74.3	Astrorum plebes quae calles spectat amantum, 
2.74.4	Cynthia cui certis cornibus innotuit: 
2.74.5	Non ualet hic uultus retinere nomina mores, 
2.74.6	Quos mutat clerus tempus in exiguum. 
2.75.1	Gaudet equis recti dissuasor, prodigus aequi, 
2.75.2	Nomina qui digna studio superante caballis 
2.75.3	Subtrahit, opponens ad sancta uocabula clunem 
2.75.4	Sed procul est pecudes quod censet mentis iniquae: 
2.75.5	Propositum perstat generis, quod stemmata fundunt. 
2.76.1	Aspidas ut capiat tectis fraus hospita technis, 
2.76.2	Sub ludi specie mortis imago latet. 
2.76.3	Vmbra lacessitas producit callida pestes 
2.76.4	Et bellum blandis principiis geritur. 
2.76.5	Credite, non aliter Defensor proelia tractat, 
2.76.6	Qui accusat ridens, qui perimit placidus. 
2.77.1	Egit quod docuit meritis et honore superstes 
2.77.2	Ambrosius uates moribus ingenio, 
2.77.3	Roscida regifico cui fulsit murice lingua, 
2.77.4	Vere suo pingens germina quae uoluit. 
2.77.5	Serta redimitus gestabat lucida fronte, 
2.77.6	Distinctum gemmis ore parabat opus. 
2.77.7	Instituit populos gestu probitate pudore, 
2.77.8	Fouit respiciens perculit admonuit. 
2.77.9	Vocis ut officium postrema pericula poscunt, 
2.77.10	Sic teneras culpas qui tacet insequitur. 
2.77.11	Succinctus gladiis, clipei de pondere tutus, 
2.77.12	Pectora claudebat textilibus chalybis. 
2.77.13	Ensis habet uires uitiorum sector et hostis: 
2.77.14	Vipera non tangit squamea terga uiri. 
2.78.1	Ambrosius linquens uiduatae munia plebis 
2.78.2	Transtulit ad curam, Simpliciane, tuam. 
2.78.3	Successoris ope spoliati uiscera regni 
2.78.4	Creuerunt merito temporis alterius, 
2.78.5	Ac uelut annosam zephyris parcentibus ornum, 
2.78.6	Ne metuat bellum, longa quies solidat. 
2.78.7	Tiro tamen felix cana ad rudimenta uocatus 
2.78.8	Non flexit priscum degenerans apicem. 
2.78.9	Nil timuit gelidis anima feruente medullis. 
2.78.10	Pontificis uirtus floris habet senium, 
2.78.11	Aequora qui tecto pressit terrena patenti, 
2.78.12	Moribus et cultu sidera cum tetigit. 
2.79.1	Forma pudicitiae iuuenis sectanda Veneri 
2.79.2	Venit; nominibus nil famulata suis. 
2.79.3	Fortia marcebant uetulo sub iudice membra, 
2.79.4	Aetas praesentem perdiderat puerum. 
2.79.5	Sublimis postquam conscendit fulcra cathedrae, 
2.79.6	Cana tener populis dogmata disseruit. 
2.79.7	Aurea fluxerunt locupletis schemata linguae, 
2.79.8	Sol uitae nitidum reddidit eloquium. 
2.79.9	Aluus ut ecclesiae tumuisset semine Verbi, 
2.79.10	Non deerat pastus lactis apostolici. 
2.80.1	Marolus, extremae potator Tigridis undae, 
2.80.2	Qui iubar in madidis uiderat hospitiis, 
2.80.3	Quem labor in proprio Syriae solidauerat axe, 
2.80.4	Orditur uatem dotibus innumeris, 
2.80.5	Peruigil intentus ieiunus prouidus ardens: 
2.80.6	Quod morem tenuit sat fuit officio. 
2.80.7	Os tenerum quotiens gustus contingit honesti, 
2.80.8	Transit ad affectum quod fuit imperii. 
2.80.9	Terra potens olim patribus fundata beatis 
2.80.10	Nobilibus mundum partubus inradiat. 
2.81.1	Mens niuei lactis, species manifesta columbae, 
2.81.2	Astutia serpens, Martiniane, uale. 
2.81.3	Lubrica te dubii dum poscunt flamina uulgi, 
2.81.4	Inueniunt pauidum, ne mereare legi. 
2.81.5	Vnus erat mundo contraria iudice narrans, 
2.81.6	Qui ut caperet regnum uincere non meruit. 
2.81.7	Protinus ad magni perductus limen honoris 
2.81.8	Exul caelorum ciuibus inseritur. 
2.81.9	Post geminas sanctis construxit mundior aedes, 
2.81.10	Lumine quas clauso iussit habere diem. 
2.82.1	Suffusus minio perque optima facta rubescens 
2.82.2	Virginei uultus Glycerius sequitur. 
2.82.3	Puram sanguineo maculat dum rore figuram, 
2.82.4	Picta genas facies simpliciter placuit. 
2.82.5	Candentem crocea gestans aspargine frontem, 
2.82.6	Laeta uerecundis tinxerat ora notis. 
2.82.7	Indeptus sceptrum, tribuit quod testis imago, 
2.82.8	Purpura quem mentis prodidit imperio, 
2.82.9	Hinc abiit: populus paruo uix tempore felix, 
2.82.10	Sed rursus magni missus ad obsequium. 
2.83.1	Lazarus ut diri premeret pede culmina mundi, 
2.83.2	Vocibus adcitus trux uenit in medium, 
2.83.3	Quem frons laeta parum uitiis depinxerat hostem, 
2.83.4	Mulcantem culpas luminibus tacitis. 
2.83.5	Respiciens lapsus detersit nubila uitae: 
2.83.6	Curam saepe dedit uulneris obsequio. 
2.83.7	Non latuit tectis facinus qui gessit in antris: 
2.83.8	Absens criminibus tortor ubique fuit. 
