1.8.52	Et tumidus scriptis moribus esse pater. 
1.8.53	Qui mihi tunc portus ? famam petit undique lector.\' 
1.8.54	Sed stabilis pudor est, si taceam, proprius. 
1.8.55	55 Tu caelum teneas, me terris linque quietum, 
1.8.56	Qui solum noui, quod bene nil didici. 
1.9.pr	 VIIII. DICTIO QVAE HABITA EST IN NATALI SANCTI AC BEATISSIMI PAPAE EPIPHANI IN ANNVM XXX. SACERDOTH. PRAEFATIO. Sentio quid plerique taciti loquantur in sensibus et adposita cordis aure uocem cordis intellego. clamant enim ista silentia 43 cf. Verg. Ecl. X 52 45 cf. Verge Georg. I 223 I < i 37 dextra. L 39 a libri uitceis Ll heliconis scripsi, helicon mihi libri 40 sitem B, sittim Tl 41 a ELPTV, om. B dixi B 43 ad B spelea BLPTVb, spelunca E, speluncas P\' in mg . 50 uec lituis T in raa, corr . 51 flaAtar ET coturuo corda T1 52 tumidos B 56 dedici B vnn. INCIPIT DICTIO BELTYb NATALE BL -PAPE LT, om. E EPIFANII BET TRICENSIMVM B , PRAE.. FACIO LTV , 34* quid sibi alienae professionis homo quaerat ei themate, quid insignitus humilitatis titulis per crepantes ex more uulgi cuneos uocum plausus exepantes, quos tumescentibus fautorum bullis aura popularis exsuscitat. olim talia dicunt debuisse conponi, cum adulantibus adulescentiae floribus et pueritiae s adhuc in illo et saecularis licentiae uerna riderent, cum reboantibus efferri decuit adclamationibus, tunc cum capi potuit etiam fucatae uoluptatis specie. nune cur recitet publice quem laus nec decet publice nec delectat? hi meminerint quod ego rem nostri muneris ago, quem in sacerdotis praeconiis constat sentire quae debeam. cui quamuis nunc intempestiuis laudibus reddam modica, tamen maxima post debebo, in cuius ministerio quicquid ualeo praestat inpendi. simul etiam percepi animo quod, si reddenda est de otioso sermone ratio, non minus de otioso silentio. enut enim otiosa silentia, si laetantibus circumfusis omnigenum mentihus solus, cum dare possem, uerba subtraherem, quippe cum etiam in obsequiis caelestibus hymnos deceat adhiberi et credamus exsortem humanitatis dominum hominum meris laudibus demulceri et hoc ab his speciali quodam iure quos donauit lingua reposcere. quid antistes faciat, qui propriis orationibus egit ut possim? scriptum est enim: dominus dedit mihi linguam eruditionis, quando oporteat sermonem dicere. oportet nunc, ut censeo, et ad loquendi tempus ostium cordis aperitur. sed nunc non ego in poeticis laudibus . ora laxabo. absit a me sentina carminum, quae sicut uera non laudat, sic nec nere laudatur. nunc fauete mentibus certa 14 Cato Orig. I fr. 1 (p. 51 P.) = Cic. pro Planc. 27, 66 22 Es. 50, 4 1 qui B ex T in ras . temate Ubri 2 inBignis E 3 ettneo suo cum plausus ( £ plausus E, coplausus T) ETV tomiscentibus BV1 fCorum T 6 secularis LV renecantibus B 8 uoluntatis L reticet ET 9 delectatur E hii BP meminerent B 10 uli ETb 11 annc EP, fi LT, non BVb 12 debeo Ll 13 quidquid B !4 si] ei B 17 possem b, possim libri subtrahere B 18 ∗ymnos L exertem PL - 10 quod Pb 21 antistis B M ad 1.] alloquendi ET 25 hostium EPTI 27 faaete Pb, faaente BELTV dicturo. ia que opere si minora pro ingenii exiguitate non dixero, pro iactantia maiora non fingam. 
1.9.1	Vatibus antiquis dicendi maxima uirtus 
1.9.2	Illa fuit, doctis si scirent fallere uerbis: 
1.9.3	Laus erat in laudem mentitum pangere carmen. 
1.9.4	Tunc operi fraus apta fuit: nam more poetae 
1.9.5	.5 Seruantes quod crimen habet uetuere pudore 
1.9.6	Vera loqui, carmenque fides despexit ubique. 
1.9.7	Ars placuit, quam culpa decet: nam doctior error 
1.9.8	Extorsit certis metuenda poemata linguis. 
1.9.9	Lex docuit sine lege loqui, cum uindicat arte 
1.9.10	Quidquid iura negant fandum: retinacula morum 
1.9.11	Numina fallaci finxerunt sordida cantu : 
1.9.12	Phoebum et ter ternas dixerunt esse sorores,- 
1.9.13	Castalium laticem, uarias quoque Palladis artes: 
1.9.14	Tunc laurus tripodas cortinam tympana plectrum 
1.9.15	Narrabant: illos a ueri tramite fugit 
1.9.16	Sensus, et errantes nisus delusit imago. 
1.9.17	Nunc linguam citharae, quae cantat pollicis ore, 
1.9.18	Sperne, fides: magis, ille, ueni nunc, spiritus, oro, 
1.9.19	Cuius inexhausto reuiuiscit semper in anno 
1.9.20	Quicquid terra creat, gignit mare, parturit aether: 
1.9.21	Qui freta diffundit, solidum dat corpus in arnia, 
1.9.22	Saxa ciet iussu, metuit quem cautibus horrens 
1.9.23	Caucasus, aurito famuli cum fortia sensu 
1.9.24	Corda domat: qui cuncta uidet, quem cuncta tremescunt: 
1.9.25	Fons uia dextra lapis uitulus leo lucifer agnus 
1.9.26	Ianua spes uirtus uerbum sapientia uates 
1.9.27	Hostia uirgultum pastor mons rete columba 
1.9.28	Flamma gigans aquila sponsus patientia uermis 
1.9.29	Filius excelsus dominus deus, omnia Christus. 
1.9.30	 Hunc precor ut dictis adsit: qui pectora prisci 
1.9.31	Vatis ut ingressus Pharaonis tempore regis, 
1.9.32	Adiuuit gracili locuturum uoce prophetam. 
1.9.33	Se stupuit tunc ipse, reor, bene conscius oris, 
1.9.34	Murmuris et soliti, conplentem principis aures 
1.9.35	Pondere uoce sono sensu probitate pudore. 
1.9.36	Tu famulum, tu, sancte, mone: da soluere grates, 
1.9.37	Quas debere iuuat. sanctum conplectimur omnes 
1.9.38	Ecce diem, uoluit quo se iubar indere terris 
1.9.39	Promptius et radiis animas animare propinquis. 
1.9.40	Quo gaudet mundus, cum non sint gaudia mundi. 
1.9.41	Cernis adorantem pauidos summittere uultus 
1.9.42	Vatis in obsequium? natalis tempora sentit 
1.9.43	Festa nec amissis contemnit tristis alumnis. 
1.9.44	Iste dies cunctis uitae cunctisque salutis 
1.9.45	Causa fuit, ueteris dissoluens uincula noxae. 
1.9.46	Christus in hoc tribuit decus et tutamen in aruis 
1.9.47	Ausoniis, parili populos qui mente gubernet 
1.9.48	Et gentes pietate regat: quibus auctor Olympi 
1.9.49	Pollicitus simili regem probitate parauit: 
1.9.50	Dexter ut ipse deus solio dat iura corusco.\' 
1.9.51	. Proximus hic caelo, cui recti conscia mens est, 
1.9.52	Semper erit, quem iusta probant, quem iudice mundo 
1.9.53	Publica uota legunt: fateor, suffragia magna 
1.9.54	Contulit, ut sedis gremio frueretur inemptae. 
1.9.55	55 Libera te dominum posuit sibi turba perennem, 
1.9.56	Seruitio laudanda suo. pro quantus ubique 
1.9.57	Feruor erat! sancto Mundi plaudente tumultu 
1.9.58	Omnibus idem animus, turbis uox omnibus una. 
1.9.59	Sic tamen alterutrum certabant uincere uotis, 
1.9.60	60 Ceu sibi cum diro bellandi cominus hoste 
1.9.61	Causa foret : uulgus proprio tunc sanguine uincit, 
1.9.62	Pollicitum quotiens fuerit sufferre pericla. 
1.9.63	Caspia non aliter cum tigris feta Niphaten 
1.9.64	Circuit aut catulos rapiendi format ad usus, 
1.9.65	65 Ardet in absentes, saeuis mortalia mandit 
1.9.66	Membra animis hominumque necem petit ore cruento. 
1.9.67	Alter in hoc senium teneris miratus in annis,, 
1.9.68	Alter in antiqua iactabat stirpe parentes: 
1.9.69	Alterius contenta parum de sanguine mens est, 
1.9.70	70 Digna referre uiri uirtutum stemmata mille 
1.9.71	Commemorat: quanta tituli tunc laude superstant, \' 
1.9.72	Vincuntur quotiens, et morum gloria uictis 
1.9.73	Parturit insignem per saecula longa triumphum I 
1.9.74	Ille pudicitiam, quae pulchro in corpore uernat 
1.9.75	75 Pulchrior, et casta ridentem luce figuram 
1.9.76	Laudibus ad caelum portat: decus illa profecto 
1.9.77	Adtulit huic facies, quae multis causa pericli 
1.9.78	Saepe fuit: pulchrum satis est mansisse pudicum. 
1.9.79	Haec nisi de summo non dantur culmine Olympi. 
1.9.80	80 Sicubi contingant uel formae commoda sanctis 
1.9.81	Mentibus adcrescant, bello se uincere certant 
1.9.82	Tunc homines, funditque decus uel munera terrae 
1.9.83	Dextra animae uiuitque sibi, dum deperit illi. 
1.9.84	Haec cum multiplici populus narraret ab ore, 
1.9.85	Vna fuit cunctis sententia fixa cateruis. 
1.9.86	Turba sacerdotum uenerandaque curia saecli 
1.9.87	Elegit uoluit meruit suscepit amauit 
1.9.88	Ecce aliud dictuque nouum mirabile cunctis 
1.9.89	Transieram, quod quisque pauet, quod suspicit orbis. 
1.9.90	90 Vix primaeuus erat, tremulis cum limina lucis 
1.9.91	Calcantur plantis, cum matris ab ubere raptis 
1.9.92	Blandior a tenero sucus subducitur haustu : 
1.9.93	Callida mentitum genetrix cum forte saporem 
1.9.94	Herbarum querulis infundit dura labellis, 
1.9.95	95 Nesciat ut natus gustu cognoscere matrem, . 
1.9.96	Vnde subornatum sorbetur lacte negato 
1.9.97	Faucibus insuetis ridenda fraude uenenum. 
1.9.98	Istius illa fuit, cum signum contigit, aetas. 
1.9.99	Nam fulsisse ferunt huius cunabula magno 
1.9.100	Lumine, cum tantus micuisset splendor in illo, 
1.9.101	Quantus ia obsequium potuit tunc fundier aether, 
1.9.102	Cum iussus seruire uiro mortalia raptim 
1.9.103	Membra leuat lapsu gradiens celer ignis Olympi, 
1.9.104	Cornipedum pernix cursus imitatus equorum : 
1.9.105	Prospera non aliter puerum tunc flamma pererrans 
1.9.106	Circuit inlustrat ueneratur suspicit ambit. 
1.9.107	Tum pauidus genitor summisso lumine fatur: 
1.9.108	"Summe deum, sancti custos, qui culmine caeli 
1.9.109	Omina dextra facis, quae cernis lumine dextro, 
1.9.110	Hunc tibi de primis et adhue reptantibus annis, 
1.9.111	Sancte, pater neodum, quem necdum cassibus artis 
1.9.112	Lubrica terrenis innectunt saecula culpis. 
1.9.113	Nec faciant: sit, summe deus, tibi munus opimum". 
1.9.114	Haec ait et lacrimas quas promunt gaudia fundit. 
1.9.115	116 Crispinum petit inde libens, quem dicere digno 
1.9.116	Non datur eloquio, nec si modo surgat Auerno 
1.9.117	Qui potuit rigidas de rupibus Apennini 
1.9.118	Flumina cum starent, ad plectrum ducere siluas. 
1.9.119	Helias fuit hic mage : nam quis Helisaeum 
1.9.120	Linqueret in terris duplicato munere palmae? 
1.9.121	Nutriuit quem lacte pio, quod ab ubere Paulus 
1.9.122	Pressit, euangelicis plena est cui dextra papillis. 
1.9.123	Salue, sancte parens, semper saluete, recepti 
1.9.124	Crispini cineres, ad cuius iura redundat 
1.9.125	126 Quidquid in hoc Christi miramur dogmate dignum. 
1.9.126	Tu bene transmissum tibi censum possides, heres. 
1.9.127	Res non parua docet triplicatis iuncta talentis: 
1.9.128	Monstrat ab occidui reuocatum partibus orbis 
1.9.129	Quod supplex captum transmittit Gallia uulgus : 
1.9.130	Effera te uiso didicerunt pectora flecti, 
1.9.131	Armatum precibus superasti, maxime, regem. 
1.9.132	Sic pugnax gladios obtundit uerbere lingue, 
1.9.133	Sic ferrum expugnat uerborum lamina fortis. 
1.9.134	Nam si fanda ferunt sociant qui maxima paruis, 
1.9.135	Sic dominum expectat domitatis uilicus aruis, 
1.9.136	Cum bene mollitos incurui dente ligonis 
1.9.137	Scribit agros faciemque soli sic pectit aratris, 
1.9.138	Vt spumet plenis currens uindemia labris. 
1.9.139	Inserit externas peregrino in cespite plantas, 
1.9.140	Aduena coniunctis sociatur nexibus arbor, 
1.9.141	Truncantur stirpes, demessum falce maritat. 
1.9.142	Virgultum, tenero lignum mordetur hiatu, 
1.9.143	Germine nobilitas consurgit non sua paruo, 
1.9.144	Surculus ignoto coalescit munere diues, 
1.9.145	Dum madefacta nouo iungit plantaria libro. 
1.9.146	Paestanis pariter depingit terga rosetis, ■ 
1.9.147	Regius agresti uestitur murice campus. 
1.9.148	Lilia pro nitidae funduntur lumine calcis: 
1.9.149	Tunc pingit uiolas cythisos colocasia calthas 
1.9.150	Cinnama serpillum narcissos balsama costos. 
1.9.151	Tunc rediuiua serit quae portat germina phoenix. 
1.9.152	Hunc iubet adueniens dominus discumbere seruum, 
1.9.153	Surgit et ipse suis manibus dat fercula mensae. 
1.9.154	Sic tua ter denis, animarum cultor, in annis 
1.9.155	Halant rura rosas, interpellata nec ullis 
1.9.156	Frigoribus marcescit humus, quam uere perenni 
1.9.157	Seruat odorato meritorum cespite doctor. 
1.9.158	Arbuta siccantur quotiens tua rore negato, 
1.9.159	Infundis lacrimis, cophinum quoque congeris illic 
1.9.160	Stercoris inmundi: tunc ramis surgit opimis, 
1.9.161	Tunc fecunda deo nascendi iura superstat. 
1.9.162	Suscipe nunc dexter, uitae lux aurea nostrae, 
1.9.163	Gaudia quem faciunt modicum tibi promere carmen. 
1.9.164	Cum mea uota deus produxerit ordine coepto, 
1.9.165	Fulserit et docilis quem plantat dextera palmes, 
1.9.166	Debita post centum reddam tibi fortius annos. 
1.9.167	En statui quodcumque tibi nunc scalpere carmen 
1.9.168	Nodoso sub iure, pater, quod nexuit artis 
1.9.169	Diuersa sub sorte modis lex proxima poenae, 
1.9.170	Vsquam ne fallax nutaret syllaba. dixi. 
1.10.1	Nigrante tectam pallio 
1.10.2	Iam terra noctem suscipit, 
1.10.3	Vt uiua dulci funere 
1.10.4	Reconualescant corpora. 
1.10.5	 Mortis figura blandior 
1.10.6	Bustum soporis admouet, 
1.10.7	Anhela lucis aestibus 
1.10.8	Dum mens tepescit otio. 
1.10.9	Lux Christe uita ueritas. 
1.10.10	Ne fusca somni tempora, 
1.10.11	Tetris parata umbraculis, 
1.10.12	Nos ad tenebrae euocent. 
1.10.13	Nox nulla nos subdat sibi 
1.10.14	In noctis atrae tegmine, 
1.10.15	Sed nec caloris ebrii 
1.10.16	Mentita pingat corpora, 
1.10.17	Verum reatum nesciis 
1.10.18	Falsi ministrans criminis, 
1.10.19	Tu per quietis munera 
1.10.20	Adsiste, custos peruigil. 
1.10.21	Hostis procul sit callidus: 
1.10.22	Quod laedit, illud dormiat. 
1.10.23	Qui dente saeuo mandere 
1.10.24	Certat cubantes lectulis, 
1.10.25	 Hic membra uinctus lugeat 
1.10.26	Pulsare sese quos foues. 
1.10.27	Madente carne spiritus 
1.10.28	Non enecetur naufragus. 
1.10.29	Ornet cubile castitas, 
1.10.30	Quae prima uirtutum micat: 
1.10.31	Viuat fides in pectore, 
1.10.32	Quae luce uernat perpeti. 
1.11.1	Deus perenne gaudium, 
1.11.2	Pax Christe cordis anxii 
1.11.3	Portusque fluctuantium, 
1.11.4	Quem nec procella, turbidis 
1.11.5	6 Si uerrat ima motibus, 
1.11.6	Potest fugare a pectore. 
1.11.7	Qui mersa ponto subleuas, 
1.11.8	Qui subiugata sarcinis, 
1.11.9	Qui dux prophetae naufragi, 
1.11.10	Dum uiuit esca beluae, 
1.11.11	Dum nescit aequor quod tenet, 
1.11.12	Tutum ferino e gutture 
1.11.13	Exactor abrumpis cibum. 
1.11.14	Diro reductus remige, 
1.11.15	Custode saluus pessimo, 
1.11.16	Vates locutus te deum 
1.11.17	Tunc iussa gessit fortior. 
1.11.18	Inmunda lymphis sobrium 
1.11.19	Per busta tetris uexerat: 
1.11.20	Viuens sepulcra pertulit, 
1.11.21	Viuentis urnae prandlum. 
1.11.22	Secreta coeti prodidit 
1.11.23	Testis uerendus intimi. 
1.11.24	Sic nos precamur, rex deus, 
1.11.25	Maerore fractos ut cibum 
1.11.26	De uentre curarum rape. 
1.11.27	Viuit medullis quod necat, 
1.11.28	Turbantur alta uiscerum. 
1.11.29	In fonte carnis ardor est, 
1.11.30	Qui mergit urit adficit: 
1.11.31	Sed si serenus aspicis,- 
1.11.32	Pressura gignet gaudium. 
1.12.1	Vatis Cypriani et martyris 
1.12.2	Cor lingua sensus dignitas 
1.12.3	Mortem ferendo proferunt: 
1.12.4	Vitale bustum nex dedit: 
1.12.5	Mucrone parta lux micat. 
1.12.6	Dictis fuit praefulgidus 
1.12.7	Et ore diues unico, 
1.12.8	Torrentis unda gurgitis, 
1.12.9	Inpacta cornu spicula 
1.12.10	Sermone uincens promptulo, 
1.12.11	Opes uerendi pectoris 
1.12.12	Qui iure Christo reddidit. 
1.12.13	Nunc munus inplet pristinum: 
1.12.14	Orator orat obtinet 
1.12.15	Et dura causis temperat, 
1.12.16	Facit beatos ex reis, 
1.12.17	Peccata rumpens carmine. 
1.12.18	Non flamma carcer uinculum. 
1.12.19	Potest nocere quos iuuat. 
1.12.20	 Mactare iussus hostias 
1.12.21	Lugenda risit numina, 
1.12.22	Instante mox periculo 
1.12.23	Fugit pericla funere: 
1.12.24	Paruas loquendi schemate 
1.12.25	Moras remisit ictibus, 
1.12.26	Acciuit enses laetior, 
1.12.27	Currente leto plus celer. \'. 
1.12.28	Proconsul esse saeuior 
1.12.29	Nequiuit ille Maximus, 
1.12.30	Dum quod minatur munus est, 
1.12.31	Nec tardat ira lenior 
1.12.32	Christum uolentes uisere. 
1.13.1	Et hoc supernum munus est, 
1.13.2	Quod lingua linguis militat. 
1.13.3	Quis non tonantis praemia 
1.13.4	Per dona eiusdem proferat? 
1.13.5	 Facit loquendo qui sapit, 
1.13.6	Dignum loquatur ut deo. 
1.13.7	Infundit ecce spiritus, 
1.13.8	Et ora rursus instruit. 
1.13.9	Intrat ueterno pectora 
1.13.10	Euiscerata nubilo. 
1.13.11	In hoc apostolis die 
1.13.12	Dum uerba Verbum diuidit, 
1.13.13	Sermone mundi praepotens 
1.13.14	Et corda mundi contulit. 
1.13.15	 Summis feratur laudibus: 
1.13.16	Habet homo ora gentium, 
1.13.17	Thrax Gallus Indus unus est. 
1.13.18	Quod blanda ludit Graecia, 
1.13.19	Quod saeuit atrox barbarum 
1.13.20	Stridor Canopi murmuris, 
1.13.21	Quod lingua latrat Parthica, 
1.13.22	Pectus repleuit hospitum. 
1.13.23	Mundi ad salutem curritur 
1.13.24	Nolente mundo tot uiis, 
1.13.25	Quot sacra nunc remissio 
1.13.26	Paschalis instat gratiae, 
1.13.27	Dum mysticam septemplici 
1.13.28	Ornat coronam munere. 
1.13.29	Augmenta plenitudinis 
1.13.30	Opes ministrant diuiti. 
1.13.31	Nunc mente uoce psallite: 
1.13.32	Hoc nostra debet mens deo. 
1.14.1	Quid Stephano potentius ? 
1.14.2	Dicas Coronam: martyr est. 
1.14.3	Hoc est homo, quod praemium: 
1.14.4	Fructus laboris nomen est. 
1.14.5	 Laus haec breuis prolixa fit, 
1.14.6	Si sic uocantur inclyti. 
1.14.7	Necis minister, aspice, 
1.14.8	De morte uitam conferens, 
1.14.9	Hoc dat saluti quod negat. 
1.14.10	 Felix sub istis ictibus 
1.14.11	Fit sempiternus exitu. 
1.14.12	Cruore lucem praeparat, 
1.14.13	Caelum sepulcri munere, 
1.14.14	-Hostem ut triumphus effugat: 
1.14.15	Ceu palma sic congreditur. 
1.14.16	Hic primus intrauit uiam 
1.14.17	Nullis subactum gressibus. 
1.14.18	Secreta lustrauit poli, 
1.14.19	In ueste carnis abditus 
1.14.20	Clamauit: "ecce filius 
1.14.21	Consistit in dextra patris". 
1.14.22	Dum saxa ferrent impii, 
1.14.23	Dum mille leti machinas, 
1.14.24	Solus bonorum conscius, 
1.14.25	Orabat ex fide loquens, 
1.14.26	Ne nescientes noxios 
1.14.27	Caelestis ira perderet: 
1.14.28	Insons eat uesania. 
1.14.29	Reum furor prouexerat, 
1.14.30	Per uota currebat labor: 
1.14.31	Crucem gemebat carnifex, 
1.14.32	Crescente quem subegerat. 
1.15.1	Caelo ferunt Ambrosium 
1.15.2	Nomen honor uel actio. 
1.15.3	Nil debet hic facundiae, 
1.15.4	Dos omnis est a moribus. 
1.15.5	 Fortis iuuantem non cupit 
1.15.6	Vmbone munitus suo. 
1.15.7	In carne nil carnis regit: 
1.15.8	Regina mens in corpore 
1.15.9	Confregit omne lubricum. 
1.15.10	 Sic uixit ille non sibi, 
1.15.11	Sed totus auctori deo. 
1.15.12	Adieetus hinc apostolis 
1.15.13	Reduxit expulsam fidem, 
1.15.14	Dixit triumphos martyrum 
1.15.15	Linguae uirentis laureis. 
1.15.16	Hic ore praedam sustulit 
1.15.17	De fauce serpentis feri. 
1.15.18	Qui bella Christi militat, 
1.15.19	Nudus timetur ensibus. 
1.15.20	 Viuit sepultus et iuuat, 
1.15.21	Clauum tenens ecclesiae. 
1.15.22	Iustina uirus perdidit, 
1.15.23	Dat poena uati praemium. 
1.15.24	Sedis memento, lux, tuae, 
1.15.25	Exorna, sancte, posteros, 
1.15.26	Auctore fultos nobili, 
1.15.27	Ne dux sereni culminis 
1.15.28	In nube tectus horreat, 
1.15.29	Qui pastor est antistitum, 
1.15.30	Quod fuscat omne summouet, 
1.15.31	Gregem gubernat principum, 
1.15.32	Magister est docentium. 
1.16.1	Iam Christus ascendit polum, 
1.16.2	Necauit ante funera, 
1.16.3	Letum sepultus expulit: 
1.16.4	Mors mortis inpulsu ruit. 
1.16.5	 Cantate factum, saecula, 
1.16.6	Funus subegit tartarum, 
1.16.7	Vicit peremptus exitum: 
1.16.8	Sors inde luget pallida, 
1.16.9	Praesumpsit unde gaudium. 
1.16.10	 Escis uorator captus est: 
1.16.11	Est praeda raptor omnium. 
1.16.12	Iam rete uinctum ducitur, 
1.16.13	Iacet catena in nexibus, 
1.16.14	Serpens uenena propulit: 
1.16.15	16 Mitis terit superbiam, 
1.16.16	Agnus leonem euiscerat. 
1.16.17	Plus istud est potentiae, 
1.16.18	Quod nostra, Christe, suscipis 
1.16.19	Et ueste serui absconditus 
1.16.20	Nos ad triumphum prouehis, 
1.16.21	Quam si e coruscis sedibus 
1.16.22	Fulgore terreres reos. 
1.16.23	Deus patet per omnia, 
1.16.24	Nullo remotus tegmine: 
1.16.25	Sed ut iacentes erigat, 
1.16.26	Dignatus esse quod sumus, 
1.16.27	Redemit ipse ius suum. 
1.16.28	Ouem reuexit perditam 
1.16.29	Pastoris ad custodiam. 
1.16.30	 Leuate portas, angeli: 
1.16.31	Intrat tremendus arbiter, 
1.16.32	Maior tropaeis hostium. 
1.17.1	Quae lingua possit, quis ualeat stilus 
1.17.2	Tantae triumphos uirginis eloqui P 
1.17.3	Nono, mente molles, discite, masculi: 
1.17.4	Exempla praestat, sumite desides, 
1.17.5	Puella fortis cum superat uiros. 
1.17.6	Virtus teneri nescia semper est, 
1.17.7	Nec iura sexus fractaque mens ei, 
1.17.8	Quae corde Christum conciperet semel. 
1.17.9	Soluunt caducis pectora uinculis 
1.17.10	Quibus repostus mentibus est deus. 
1.17.11	Tormenta torsit fortia corpore: 
1.17.12	Lassante poena creuit amor crucis. 
1.17.13	Si scire posses uincere martyram, 
1.17.14	Vesane tortor, parcere disceres. 
1.17.15	16 Flammas flagellum carnifices rotas 
1.17.16	Cui crux sequenda est non metuit nimis. 
1.17.17	Hanc cum caminis igne crepantibus 
1.17.18	Iussisse fertur praecipitem dari 
1.17.19	Priscus, ueneni fonte nocentior, 
1.17.20	(Nam sic feralem tempore sordido 
1.17.21	Dixere sanctae uirginis arbitrum), 
1.17.22	Huius ministri dum cuperent nimis 
1.17.23	Fornacis escae tradere martyram, 
1.17.24	Lux tunc Olympi luce serenior 
1.17.25	Opus remouit saeua uolentium, 
1.17.26	Cum uoce monstrant qui gladium simul: 
1.17.27	"Nos hinc precamur dirige tartaro, 
1.17.28	Nam nostra sanctam non uiolat manus". 
1.17.29	Turgescit illi felle iecur calens: 
1.17.30	Mox saxa fossas uerbera bestias, 
1.17.31	Maius uenenum blanditias parat, 
1.17.32	Quibus uirago fortiter obstitit. 
1.18.1	Angusta uitae tempora, 
1.18.2	Paruis coacta terminis, 
1.18.3	Mors sancta donat crescere: 
1.18.4	Aeterna fines praeparat. 
1.18.5	5 De fruge casuum uenit 
1.18.6	. Quo surgat humanum genus: 
1.18.7	In stirpe Nazarius bona 
1.18.8	De morte lumen addidit. 
1.18.9	Nerone felix principe, 
1.18.10	Diuersa perpessus mala,. 
1.18.11	Lustrauit orbem non graui 
1.18.12	Pauore cordis algidus: 
1.18.13	Sed ut profanis inderet 
1.18.14	Quo calle conscendant polos, 
1.18.15	Verus magister actibus 
1.18.16	Exempla, non uerbis dedit. 
1.18.17	Nam ductor ille fortis est, 
1.18.18	Qui bella uiribus docet. 
1.18.19	Quem dicta militem trahunt, 
1.18.20	Si dux gerendis abstinet? 
1.18.21	Ventosa linguae hortatio 
1.18.22	Quod forma praestat non habet. 
1.18.23	Sed magna postquam semina 
1.18.24	Scribente terram sarculo. 
1.18.25	Glebis refudit optimis, 
1.18.26	Mediolanum mox petit, 
1.18.27	In qua triumpho nobili 
1.18.28	Carnis ruinam reppulit. 
1.18.29	Qui sede non digna iacens, 
1.18.30	Vatem tremendus mox monet, 
1.18.31	Vt clara rursus munera 
1.18.32	Mundo refusus adderet. 
1.19.1	Vt uirginem fetam loquar, 
1.19.2	Quid laude dignum Mariae? 
1.19.3	Det partus ornet exigat: 
1.19.4	Quod clausa porta, quod patens 
1.19.5	Exposcit, ipsa suggerat. 
1.19.6	Sint uerba ceu miraculum, 
1.19.7	Quid, mens, requiras ordinem? 
1.19.8	Natura totum perdidit: 
1.19.9	Hoc est salus, quod uincimur. 
1.19.10	 Cum sola uirgo degeret, 
1.19.11	Concepit aure filium, 
1.19.12	Stupente factum corpore: 
1.19.13	Turgescit aluus spiritu. 
1.19.14	Quod lingua iecit semen est, 
1.19.15	In carne Verbum stringitur. 
1.19.16	De matre cunctus noster est, 
1.19.17	De patre nil distans deus: 
1.19.18	Vtrisque. partus integer, 
1.19.19	Qui gignit et quae percipit. 
1.19.20	 Nil maior ille seruulis, 
1.19.21	Sed nec minor creante fit. 
1.19.22	Fons dicta clausus accipit, 
1.19.23	Fons membra clausus egerit: 
1.19.24	Nec rima cessit arctior, 
1.19.25	Et uera proles emicat. 
1.19.26	Dic, mater et uirgo, precor, 
1.19.27	Quisquamne claudit exiens? 
1.19.28	Arctantur exta fetibus, 
1.19.29	Vinclum pudoris natus est. 
1.19.30	 (Quae lau)de Christi dignior 
1.19.31	Quam sunt superna crederis, 
1.19.32	Nostri memento praepotens. 
1.20.1	Cum gesta Martini loquor, 
1.20.2	Nil laude dignum transeo: 
1.20.3	Diuisa uirtus omnibus 
1.20.4	Vnum coacta praetulit. 
1.20.5	õ Labore magno martyr est 
1.20.6	Victore carnis spiritu: 
1.20.7	Hoc est triumphis proximum, 
1.20.8	Si bella calcent intima. 
1.20.9	Perdente uires corpore 
1.20.10	Res fixa constat laureis: 
1.20.11	Sublimat hostem mentium 
1.20.12	Qui uota membrorum facit. 
1.20.13	Hic fontis ignem nesciens 
1.20.14	Calore feruebat dei: 
1.20.15	Vndis uapore iunctus est, 
1.20.16	Christo dicatus actibus. 
1.20.17	Qua ueste nudum texerat, 
1.20.18	Hac rex nitebat aetheris: 
1.20.19	Sordente panno adquiritur 
1.20.20	Quo fulget astrorum globus. 
1.20.21	Quam iusta commutatio! 
1.20.22	Astrum rependit indigens 
1.20.23	Et regna mendicus parat. 
1.20.24	Mox sacra uitae contigit, 
1.20.25	De plebe lusit daemonum, 
1.20.26	Iussit fauillis surgere: 
1.20.27	Vixere tactu funera. 
1.20.28	Flagella passus est libens, 
1.20.29	Quibus coronam nexuit. 
1.20.30	 Conpulsus ad antistitem 
1.20.31	Votum repugnans induit, 
1.20.32	Quod sancta conpleuit fides. 
1.21.1	Dionysio Christus dedit - 
1.21.2	Quot bella, tot uictorias. 
1.21.3	Exul piorum ciuis est, 
1.21.4	Vrbis supernae particeps. 
1.21.5	 Constantius uatem loco 
1.21.6	Quondam tyrannus expulit. 
1.21.7	Non cessit iste turbido, 
1.21.8	Creuit periculis fides. 
1.21.9	Hoc sancta dat professio: 
1.21.10	Te poena tradit prosperis, 
1.21.11	Optata mercaris malo. 
1.21.12	Persiste, tortor adiuuans, 
1.21.13	Lux haec negando ceditur. 
1.21.14	O quam beata aduersitas, 
1.21.15	Si sic triumphant exules! 
1.21.16	Nihil uerendo martyre 
1.21.17	Confessor ille distitit. 
1.21.18	Dispersa mors quos adficit 
1.21.19	Ad uota mortis euolant. 
1.21.20	 Nil lenta perdit coctio: 
1.21.21	Intrat latenter abdita. 
1.21.22	Vitale funus maeror est, 
1.21.23	Velox medela transitus. 
1.21.24	Risit furorem principis 
1.21.25	Fide manente cursitans: 
1.21.26	Fixus per orbem ducitur, 
1.21.27	Qua sol coruscat acrior, 
1.21.28	Negans bibendi copiam. 
1.21.29	A te, tremende, sumimus 
1.21.30	Ceu nostra quae remuneras. 
1.21.31	Tu mitte sanctum poscere, 
1.21.32	Quod ipse nobis conferas. 
2.1.1	Gente bonus, probitate nitens et nominis auctor 
2.1.2	Sic iacet angusto, dic dolor, in tumulo? 
2.1.3	Spes domus inmensae modico contecta sepulcro est, 
2.1.4	Artantur paruis culmina cespitibus. 
2.1.5	Quid decus in pueris, quid praestant limina uitae? 
2.1.6	Non expectatis mors uenit ordinibus. 
2.1.7	Quid iuuat hunc, teneris senium quod praetulit annis? 
