1	I. DONATVS CVPRIANO. Credo te retinere, sanctissime Cypriane, quae nobis fuerit apud oratorem garrulitas, unus sensus, una cogitatio, indiuidua lectio. quare non et in diuina lectione ita animis roboramur ? aut non ea semper nobis fuit cogitatio, sicut promittebas, ut simul crederemus **** 
2	II. EPISTULA CORNELII PAPAE AD CVPRIANVM. Dilectionis tuae non delectabilia et contra fidei regulam scripta suscepi, in quibus nauseas recognoui et uenena sermonum aduersus catholicam per totum orbem diffusam ecclesiam horribilibus a te superseri zizaniis non laudaui. quae peto uelociter tollas ac praedamnes. quod prius quidem te facere oportebat quam in mundo letale uirus aspersum simplicium et innocentium inficeret mentes. non ergo dignum est rebaptizare. ergo eradica et extrica, ut diximus, florulentis sermonibus atque dignis per posteriorem epistolam priora scripta, quae contra catholicam fidem serere censuerunt genimina uiperarum. non enim decet tantae urbis antistitem excellentissimumque doctorem, ut dum putas haeresis baptisma praedamnandum, uerum baptisma sermonibus maculare audeas quae doles contra apostolum scilicet repugnare dicentem: unus Dous, una fides, unum baptisma. 20 Eph. 4, 5. Epist. I. — 3 oratorem MQ, oratores Pamelius qui ex codice Cambronensi primus edidit hanc epistulam 4 lectio] dilectio coni. Balueius 6 sicut promittebamus Baluzius, om. Pamelius . Epist. II. — Epistola Cornelii papae ad Ciprianum ę 13 inficeret β , interficeret Baluzius qui hanc epistolam ex duobus libris ueteribus edidit 16 serere] seruare β et Bal . gemmina β 19 audias Bal . quae] uel que 0 
3	III. CVPRIANVS PLEBI CAETAGINI CONSISTENTI AETERNAM IN DOMINO SALVTEM. Gratias quidem agimus Deo patri et Domino Iesu Christo, qui uos adunatos atque in conuenticula restituit. propter quam rem memorauimus et scriptum beatissimorum martyrum atque confessorum uoluimus ad consilium nostrum seruare. iubet desuper maiestas atque spiritus sanctus, cuius in nobis gratia testis est salutaris. nam cum tractaret de traditoribus, iubet tam in euangelio quam in apostolo, tam, in psalmis quam in prophetis et ceteris scripturis: scrutamini. quo scrutato a nobis, inuentis ab iis qui scripturas sanctas tradiderunt non mereri eos congredi consilium nostrum, id est consilium salutare. nemo est enim qui hoc consilium congrediatur ∗∗∗ non caelestem spectet. ac propterea memorauimus ut ii qui taliter scripturas tractauerunt ad statum plebis et iudicium ab ipsis porrectum * * nec aliqua actio ab ipsis promi, sed nec etiam ad statum sacrificii neque plebis esse proximi: quibus utique iam dudum derelicta plebe nudata altaria, promota sacrificia. merito haec memorantes cum moestitia atque dolore animi profici teste ad Dominum quod debuimus statuere: qui omnes disceptationes et dissensiones et haereses et scandala ausi erant ne ulterius prouocent ad se homines seu minus fide seu scripturis leues sint et lectores, id statuimus atque statuto nostro recedi nolumus, ut si qui tradidit praepositus huic plebi mereantur antistitem administrantem altari ac corpore integro. iis uero iussimus a quibus et sacrificium offerri iubemus. merito praeceptis iis obtemperari debet nec aliud fiet quam statim euangelica uox sincera cata Ioannem loquitur. 9 Io. 5, 39. Epist. m. Incipit ad plebem Cartaginis Z . — 10 inuentis ab hiis Z, minati snmus his fort., inuentum est ab iis coni. Baiuzius qui ex codice Fuxensi bibliothecae Colbertinae (i. e. Z) primus edidit hanc epistulam 11 salutare Z, habitare Bal . 12- congrediatur coni. Bal., condreatur Z lacunam ipse indicat 14 plura interciderunt 16 quibns scripsi, qui Z 17 promota scripsi, prompta Z sacrificia] dereliquerunt addendum esse censet Bal . 18 qui] quam Z 19 dissenciones Z ausi erant scripsi, auserant Zl, hauserant Z* et Bal . 21 atque] atque statuimus atque Z 23 hiis Z ut solet III A 18 nolo, inquit, de manibus uestris sacrificia, quia non uenistis ad me cum hostia munda. qui utique hostiam mundam non offert, hostia de manibus eius non ascendit. nam iterum legimus: in principio erat uerbum et uerbum erat apud Deum et Deus erat uerbum. qui per uerbum finctionem finxerint dare res inhabitabiles apud illos seu ueras scripturas sanctas seu finctas qui dat uocem et qui dat desideria proxima, qui utique finget tradere supplebit traditionem. merito negantes uolumus interim ueniam habere confitentes patres. nam qui dicit se scripturas non habere, utique paratus fuit et torqueri, quorum exempla habemus. tertio negauerunt, et sacramentum non tradiderunt. hi autem qui nec interrogati obtulerunt interim usque ad statum consilii laici communicabunt. uerumtamen in statum consilii quod scriptura sancta promouerit secundum sententiam fixam sanctis et amicis Dei suppleri uolumus, cum iam testes et proximi aliquid iam dudum statuerant nostri antecessores. ob quam rem necesse est nos testibus consentire complecti et supplere. opto uos in Domino semper bene ualere. amen. Deo gratias. 
4	IIII. CVPRIANVS BENEDICTO ET DILECTISSIMO PARENTI TVRASIO IN DOMINO AETERNAM SALVTEM. Caritatis tuae scripta percepi, quibus animum tuum dolore commotum de filiae dormitione cognoui. non aliud principaliter admiratus sum quam christiani pectoris in te iactatam fuisse uirtutem ut animum flexeris ad dolorem. stupeo murum fidei penetratum uulneribus 1 cf. Es. 1, 13. \' 4 Io. 1, 1. - Ad plebem Cartaginifl erplicit Z . —- Incipit ad Tarasium presbyterum Z, Ad Turassium consolatoria u, om. r, Ad Turasium super morte filiae suae consolatoria h = Hieronymus tom. V p. 405 ed. Mart . — Cyprianus om. h 19 benedicto et om. Z et om. pr dilectissimo] dulcissimo r 20 tyrasio h, turassio μ in d. ae. salutem] Hieronymus h 21 in quibus h 22 dormitatione p. aliud Zh, aliter rp . 23 sum om. r μ christiani] tristis Z iactatam] ablatam h nirtutenTfuisse h 24 afflixeris Z, flecteres h et Baluzius qui ex codice Fuxensi et Bemensi epistuiam edidit (= o) stupeo... p. 275, 3 iacturam om. Z orbitatis, quem saepire debuerat spes resurrectionis et regni caelestis. numquam spes cum dolore concordat nec fides aliquando sentit quamcumque iacturam. resurgere credimus nostros, et plangimus. quid faceremus, si mori tantummodo sine resurrectione praeciperet Deus? uoluntas eius sola sufficit ad solacium, cui nullum praeponendum scimus affectum. quod dederat tulerat qui creauerat. quis certat alius plangere quod ad tempus acceperat ? commodauerat ut haberes quantocumque tempore uoluisset et cum uellet rursus auferret. nihil abstulit tuum qui recipere dignatus est proprium. creditum suum recipere decuerat creditorem, et nihil aliud decet quam creditori suo gratias agere mutuantem. sic Iob legimus quam sequamur deuotissimam uocem. Dominus, inquit, dedit, Dominus abstulit. sicut Domino placuit, ita factum est. sit nomen Domini benedictum. parum ergo non erat haec sola consolatio contra luctum quod nemo lugere debeat cum aliquid reddiderit alienum, quia fas non erat apud alium retineri quod domino suo fuerat necessarium. additur consolationis alia prouidentia, quae iaculis orbitatis occurrat. gaudere debuimus de saeculo recedentibus, si saeculi contra nos inimicitias sentiremus, et plangimus Domini beneficia qui nouit infirmitati nostrae quod praestat. periclitari uolebat adhuc qui dolet aliquem dormientem, et inter fluctus uitae praesentis uidere cupiebat 12 Iob 1, 21. 2 quancunq. r, quantamcunque h 3 nostros rfih, mortuos Zv 4 fecerimus μ perciperet Z, pcipit μ 5 eius utique h, utique eius Zx sufficeret hv, suffecerat Z praeponere h scimus] simus p, iubemus h 6 tulerat] abstulit hv quis certat alius scripsi, quid certas Zv, quis erat alius rp, quia est qui h 7 plangat h acceperas Zv commendauerat r quantocumque] quo Z 8 et] ut h rursum h auferet p . 9 dignatus est recipere proprium h dignatus... recipere om. r 10 decuit h 12 dedit et rp 13 ita om. r 14 parum] parua h sola om. h 15 quom r ut solet crediderit Z alienum quia om. Z 16 erit Z detineri Zv fuerat suo Z 17 occurrat orbitatis Zv 18 gaudere] plangere h recedentes h 19 inimicitias contra nos minime h et om. Zrp . beneficia domini Zv nouit] nobis quod praestat Zv 20 nostri r quod om. Zv praestet h, om. Z 21 pntis po, punctis r 18* miseram laborare. ad quid christianam fidelem animam putas intra carcerem mundi remorari debuisse cui totus mundus naufragium est. tantis et talibus tempestatibus uitae tot impugnationes diaboli, tot corporis bella, tot saeculi clades [tot calamitates] euasit. et lacrimas fundis, quasi nescias quid in te ipse cotidie patiaris. propter quod Dominus sic admonet apostolos suos dicens: si me dilexissetis, gauderetis, quoniam uado ad patrem. plane mortuum Lazarum fleuit, sed non tuis lacrimis. resurrectionis promissor. dolorem docere non poterat, ne fidem perfidiam faceret quam docebat. doluit Lazarum non dormientem, sed potius resurgentem, et flebat quem cogebatur propter saluandos alios [et confundendos incredulos] saeculo . reuocare. hanc uitam dans Dominus ingemiscebat, quam tu doles esse sublatam. contra lacrimas eius pugnant lacrimae tuae, et amor tuus amori eius. eius fletus non habet parem. ille nolebat reddere laboribus quem dilexerat, et tu amare te credis cui laborum uolebas adhuc restare tormenta. ceterum si putes eum mortuum Lazarum doluisse, ante non permisisset exire qui repellere poterat mortem, aut certe non fleret qui mortuum resuscitare postmodum habuerat potestatem. unde apparet sola eum causa fuisse commotum quod ad hostilem uitam carissimum suum reuocare denuo propter credituros aliquos uel confundendos incredulos urgebatur. denique sic subsecutus est dicens: 6 Io. 14, 28. 1 ad quid...l . 2 est om. h ad quid] aliquid p. christianam et v, tristitia: nam Z 2 debuisse om. Z 3 talibus ac tantis h et om. rp . zabuli r μ 4 clades saeculi Zv tot calamitates om. rph 5 quod Z μ 1 6 admonet dominus (sic om.) h me diligeretis Zv, diligeretis me h 7 quoniam] quia h lazarum fleuit mortuum h 8 non tuis 1. r, nuntius lacrimis μ , non tuas lachrymas fudit h, non suas fudit Z dolorem docere] dolere v 9 noc fide Z perfidam μ 10 et flebat om. Z 11 et c. incredulos om. ryih ad saeculum Zhv 12 dns dans Z quam tu] quantum μ 1 14 amoris rp eius] non conuenit add. hv eius fletum r, Sectum p, fletus eius Z, hic fletus h parum r, pietatem h 15 te om. Z; credebus te h restare] praestare h 16 putas 2Zhv mortuum oni. h ante] an p 17 poterat repellere p., repellere potuit h, quam pellcre poterat Z 18 suscitare h, resnscitandi Zv 19 paret μ 1 eum sola ea Zv summotum Z uitam om. Z 20 suum om. h denuo et h uel] et h 21 dns dicens Zv ergo, pater, ut credant quoniam tu me misisti. gaude ergo unde ille coactus est flere, ne uidearis dormientum felicitatibus inuidere. ab alieno mundo ad proprium transiuit, transiuit ad Dominum, et de hostili patria ad paternam patriam migrauit, migrauit ad caelum dicente apostolo: scimus, inquit, quoniam si terrena domus nostra huius corporis resoluatur, quod habitationem habemus non manu factam in caelis aeternam. caruit ergo domo quam nec nosse debuerat. caruit malis ciuibus, quorum odia sustinebat, ne adhuc peregrinaretur in terra contraria, sicut apostolus memorat dicens: quamdiu sumus in saeculo peregrinamur a Domino. non nobis ergo debet luctus incumbere, quisquis a peregrinatione redire meruit ad propriam regionem, maxime cum non inanis et uacuus redire noscatur qui christianitatis mercatus est lucrum, propter quod uenit ad mundi commercium. negotium oxplicauit, rediit et Deo debitum soluit. comparauit propter quam descenderat emptionem et ad Dominum regredi properauit, cui offerat mercem, ut comparatae mercis tam securitatem capiat quam honorem. et ego, inquies, nulla promissionum caelestium dubitatione conturbor, sed sola separatione morientis aestuans desolatus solacio pii pigneris iactor. excusatio est haec, benedicte, sine 1 Io. 11, 42. 5 II Cor. 5, 1. 10 II Cor. 5, 6. 1 ergo pater om. Z μ quoniam] quia Zhv misisti] add. hv: ait clara uoce: Lazare prodi foras. et factum est. gaudere ergo debes Zv 2 ne] ut r, ne tu saltem h dormientis Zhv 3 ad om. rah transiuit om. rph - 4 ad paternam patriam om. h alterum migrauit addidi, om. Zrphv 5 scimus...1.10 contraria om. h 6 resoluatur] reseruatur μ 8 aeternam in caelis Zv domo om. rpt careat rp, 9 ne] nec Z peregrinaret μ 10 sicuti p quamdiu... domino om. Z 11 hoc saeculo Zhv ergo nobis luctum debet h 12 incurere μ , incatere h quisquis] quisquam cum h redire] add. μ : noscatur qui christianitatis mercatus meruit ad propriam regionem, exp. m. 2 meruerit Zhv 13 rediret Z noscatur qui om. Z 14 mercatus] increatus p uenit] descendit h 15 negotium... l. 18 honorem om. h redit Z comparuit r f 17 comparatac] comparem p, 18 accipiat Zv inquietis fi promissorum v 19 morientis] dormientis h extuans Z 20 pii hv, om. rfl, spi Z pignoris Zhv ut solet haec est v benedicite r, om. Zv dubio fragilitatis humanae, quae patrocinari non potest diffidentiae. si enim desolationem ferre homines non ualerent, numquam prorsus a se sua pignera dimisissent. destitutos se a morientibus conqueruntur et uiuos filios aut propter litteras aut propter honores ant propter negotia peregrinis regionibus credunt, et gaudent totam uitam sine affectibus commorari, dummodo capiant quod cupiunt de suis pigneribus adipisci. et utad palatia pergant peregrinantur, ad studia dignitatis nauigant acquirenda uel ad causas patrimonii aliquas explicandas per labores et pericula proficiscentes omnes impellunt, nec secum uacare quos diligunt patiuntur. et ut ad palatia caeli, ad studia Christi, ad honorem uitae perpetuae, ad patrimonium possessionis aeternae cum securitate ualeant peruenire, nemo filios suos libenter a se gratulatur abscedere. propter incerta per incerta filium uel fratrem uel parentem peregrinari unusquisque compellit, et propter certa per certa suorum aliquem proficisci nullus admittit. ad comparanda peccata gaudent tam parentes a filiis quam filii a parentibus prouocante diabolo separari, ad indulgentiam percipiendam nolunt ab inuicem Deo uocante discerni, ut appareat non pro ratione nostra nos dolere quemcumque uidemur amittere, sed indicium magis ostendere diffidentiae, qui non sustinemus nostrorum profectiones ad Dominum, quorum peregrinationes in saeculo gratulamur. quia credimus mundi lucris, toleramus diuisa, nostri corporis membra. si credimus Dei promissis, post abscessionem nostrorum nihil aliud quam gratias debuerint resonare nostri pectoris 1 suae quae p. 2 desolationes h homines ferre Zh ν numquam om. Z a se] perentes a se h 4 aut propter litteras om. h 5 tota uita h μν commorari] commoueri Z 6 de suis cupiunt Zv 7 palatia] ptiam Z ucl adquirendas Z 8 ad om. Zv aliquas om. Zv per 1. e. pericula] cum labore et periculo h 9 omnes om. r μν 10 palatium Zv 11 ad] et Zh 12 a se libenter h abscendero Z 13 propter... I. 15 admittit om. h incerta per incerta] rem incertam Z 14 certa per certa] certam Z 16 separari prouocante diabolo Zv 18 pareat μ 1 pro nostra ratione nos v, probationem nostram Z quecumque r 19 in iudicium Z μ 1, iudicium μ 2 qui... p. 279, 1 gaudia om. h 20 professiones Z peregrina Z 22 sic reddimus pVsi crederemus Zv et dei promiasum Z absesione 23 gratias] in gra Z dchnerant r pectorum Z gaudia. mihi crede, semper in omnibus incredulitas moeret, et sicut non potest fides nosse quod doleat, sic diffidentia sola doloribus tenetur ancilla. nam si dormientes dicimus, dormientes utique credere debemus et non mortuos, sed requiescentes interim secundum uocem Domini fideliter loquentis: omnis, inquit, qui credit in me, licet moriatur, uiuet. si tibi medicus hoc promitteret quisquam, nullam sine dubio promissioni eius negare poteras omnino laetitiam: nunc quia Christus fabricator et resuscitator promittit, non times plangere, ut fideliorem Christo pariter et potentiorem medicum uidearis in promissionibus iudicare. sed destitutam, dicis, doleo senectutem, qui debueram meos liberos potius antecedere, ne in laboribus remanerem. quando de spiritalibus bonis quodcumque tractatur, nihil est de carnalibus omnino ante oculos reponendum. ego tibi melius profiteor euenisse, qui non carnalem sed spiritalem circa te considero felicitatem. tu te dicis de alicuius pigneris tui obitu in senectute confectum. ego contra comprobo subleuatum. senectuti tuae amputauit magis Dominus sollicitudinem quae te torquebat de uiua filia ne periret. melius utique nunc mortuam saeculo credis esse apud Deum uiuam quam uiuam saeculo doleres forsitan apud Dominum mortuam. gaude tibi quod filiam christianam mereberis sequi quam secutus in caelo gaudeas rursus amplecti. non te deseruit, sed praecessit : et 5 Io. 12, 46. 1 semper] sola h credulitatem mereri Z 2 nosse fides Zv sic et W sola] suis Z tenetur] inuenitur h 4 et om. Zv interim om. h 5 fideliter loquentis] fldelis rp., om. h omnis enim h 6 uiuit Z tibi] cui Zv hoc] homo Zv quisquam nullam] quidquam Zv 7 negare non Z ν poterit rv 8 dominus christus Zv 9 eam plangere h 10 promissione h doles] dolore Z 11 qui] quia Zv, meam qui h meos] eos μ in om. Z 12 remanerent Z q. tractaretur r, tractatur quodcumque Z 13 omnino de carnalibus hv preponendum ra, proponendum h 14 qui] quoniam Zv 15 foelicitatem r μ h, fidelitatem Zv de te dicis Z alicuius om. h pigneris om. μ 1 toi om. Zx obitum rp., debito Z 16 e contra probo h rableuatam senectutem tuam. Zv 17 magis om. Zv, dominus magis h, te om. h 18 saeculo ... uiuam om. r credis esse apud deum ph, redisse ad dominum Zv 19 quam hic h saeculo ... dominum om. h dolores μ 1, redisse Z deum p 20 quo fi filiam om. Zv merearis Z 21 et ne ... non om. h ne doleret excedentem patrem suscipere festinauit. non amisisti nutrimenta tua. si luctus horrueris et senex obtulisse pignus tuum Domino deputare poteris t, secundum uotum post Abraham, si non potes primum, ut quod ille non trepidauit offerre tu saltem uidearis de sublato gaudere. ab illo Dominus postulauit, a te tulit. ille iussioni paruit, tu uoluntati consenti. illum per illicitam legem naturae [quem Dominus] probauit sibi deuotum, te saltem per licitam condicionem mortalitatis annotet religiosum. nam si nec uoluntate nec necessitate compelleris deuotionis Domino aliquid exhibere, in qua parte christianum te poteris approbare ? erubescat incredulitas nostra nec cum gentilibus **, si Deo uult esse subiecta. communis est nobis cum illis exitus mortis et dolores illorum superamus doloribus nostris. quid ageremus si peculiare aliquid exigeretur a nobis? quid quod ad dedecus nostrum? gentiles dolores saepe contemnunt, cum non ad promissa caelestia sed ad poenas tartari rapiantur. et nos plangimus euntes ad caelum. consideret christianus talis quid deinceps mereatur qui nec imitari contendit exempla sanctorum nec contemptum habere gentilium. illi luctus desperando despiciunt, et nos sperando despicere non conamur. denique uendere liberos saepe non dubitant, ut uiuos, quod peius est, spernant. et nos nec defunctorum obitus subleuant, sublatos 1 suscipere om. Z non amisisti] misisti r μ h 2 tua nutrimenta Zv; chrieto add. h si om. Z luctum hv senex om. Zh te obtulisse p. t. Zh, tuum obtulisse pignus v domino gratuleris Z 3 deputari Zr μ h poteris] potes Z, poteris potes v habere post Zv, post μ , om . r, tuum habe post h potest (i 4 trepidauit] dubitabat h tu om. Z 6 consentias h, consensit Z, consensisti v illum h, ille Zar quem dominus om. r μ h 7 sibi probauit Zv per... religiosum om. Z illicitam fi mortalitatis] religionis v 8 aduocet roligiosum Z, annotet religiosum aduocet religiosum v nam si... l . 9 exhibere om. h si nec] siue Zv nec om. Z compelleris necessitate Z 9 dco Z te christianum Zv 10 nec om. Zv, quae nec h si om. rp.; ante si lacunae signum posui 11 domino Zv 12 peculiarie ft, peculiariter Zv 13 a nobis om. r quid quod r μ , quidquid Z, quod hv ad] ac Z nostrum] pertinet add. h, pertineret add. v 14 gentiles om. r 15 penam t. rapiuntur Z 16 merebitur deinceps h - 18 et nos ex et non p m. 2, nos et h non om. Zx 19 denique ... p. 281, 1 uolumus om. h 20 subleuat fi, amplectes Z; et nos add. c sublatos... uolumus om. ry . captiuitati et libertate donatos uolumus * *. illi seruire filios suos intrepide mortalibus tradunt et nos Deo nostros simul et suos liberos liberandos dimittere sacrilega mente cunctamur, quasi tutius apud homines iudicetur magis quam penes Deum comdemnari aliquem filiorum. pudendum nescio quid christiani apud gentiles opprobrium, quibus peiores sine dubio iudicantur quos pares habere non dicam meliores fuerat criminosum. christiani nolunt uel gratulatione suos deducere ad bona, gentiles tradere non cunctantur ad mala. postremo uel cum ipsa felicitate nostrorum morientium cogamur animum flectere, ne desideriis eorum desideria nostra incipiant repugnare. laetantur ipsi qui exeunt uenientes ad requiem. laetemur et nos cum ipsis, saltem computantes nostrorum exeuntium beatitudinem. esto religiosus uel uoto eius qui euasit, si non potes tuo, et exsulta quia placuisse cognoscis participem toi sanguinis Christo, maxime quod uel de occasione debeas tolerare Domini uoluntatem, cui non potes contradicere. et cum sit omnibus , communis hic casus, uanus dolor est, qui nec primus uidetur esse nec solus. sed dicis: nullus me de mea desolatione mentis angor exulcerat, sed pro delictis paruuli morientis humanitatis affectus impulsat. nec hoc licet commouere animum christianum, ne contra Christi imperia reluctetur. quid interest quandocumque et qualescumque filios 1 nolnmus seruire. Filios Zv intrepidanter filios suos h 2 mortali\\ r deo nostros] de nostro Zv, deo nostro h liboros] et nostros add. Zhv 3 tuti Z iudicemar Z, iudicemus hv 4 dominum Zv condemnari h, commendari Zfirv pudendum... I . 7 criminosum om. h 5 christianus est a. g. opprobrii Zv 6 parem Z meliorem Z fuerat] sumus putare Z, fuerat putare v 7 uolunt Z gratulationes u suas μ as ex os, sua h 8 cunctatur μ 9 cogamur] rogamur Z inflectere Z ne ph, non r, et Zv desidiis Z 10 repugnare] reluctari h laetantur ... I. 12 beatitudinem om. h ipsi] illi Zv 12 eieuntium] morientium add. Z esto] si Zv uoto eius] noticius Z, nouitius v qui] quae h \' 13 no euasit μ tuo et] uel Zv, tuo h participium tui Zv, tui participium h 14 uel de] uelle μ , uel r occasionem r/t 15 potest rp, debes Z cum sit... dolor est om. p1 sit om. r 16 communis om. Z uanus] unus Z 17 de om. Z consolatione Z 18 derelictis h paruulis rILh 19 nec licet commoueri h ne] nec r 20 reluctatur μ , luctetur Zv est inter Zv quandocumque] quoscumque Zv dimisisse, quos iubeamur a Domino pro causa deuotionis odisse. melius nunc saluam animam suam moriens dereliquit in pace, ne in persecutione dimittere cum suo interitu non ualeret. ipse illis auxiliatur in mundo, quorum mater habitat in caelo, et qui matri subuenit et filiis pro certo succurrit. postremo uide si debeat aliquid dolori concedi, ubi sine aliquo remedio potest animus fatigari. sapienter debet dolere qui dolet ne perdat sine causa quod dolet. nunc autem contra luctum sumenda sunt arma, ut spes nostra possit habere uictoriam. principaliter quod Dominus uoluit suscipere gratulemur. deinde quia hoc omnibus in mundo commune, additur priuatum peculiare nostrum quod ad requiem deuocamur. sequitur consummatio omnium gaudiorum, quod in resurrectione inuicem nobis Domino reformante reddemur, quod apostolus pollicetur: nolumus igitur ignorare uos, fratres, de dormientibus ut non contristemini sicut et ceteri qui non spem habent. si enim credimus quia Iesu mortuus est et resurrexit, sic et , Dominus eos qui dormierunt per Iesum adducet cum illo. haec tibi, benedicte, pro caritate communi transmisi. ceterum scio te alios consolari. tunc se orbitas non inueniet penetrabilem, si alios contra illam non cessetis armare. opto te, frater carissime, semper bene ualere et nostri meminisse. 13 I Tbees. 4, 13. 14. 1 iubemur h pro om. rh edisse r 2 safuat Zv derelinquit ph, relinquit Zv ne om. Z in persecutione] persecutionem Zv 3 dimittere om. Z ipsis h illius Z, illi v, om. h auxiliabitur h 4 matrem Zh habitat] habet Zp.h qui om. rp 5 pro certo] certe h succurret h uide] inde Z debeat] habeat v aliquid debeat h 6 aliquia dolore concidi Zv animus] aliquis Zx 9 uoluit deus h 10 deinde] denique Zv omnibus] nobis h communem r additur Z, est: additur h, aditum r, additum p . priuatim h peculiare] particulare c 11 reuocamur Zv, deducamur h consumatio Zrp 12 quod] quae Zv 18 reddemur quod] reddetur sicut Zv 14 nolo uos ignorare h 15 spem non habent Z ν 16 quia] quo Z, quod v iesu] christus h 17 dna eoa p., deus eos h, deus r, eos Zv per iesum] in iesu Zv, in christo h illo] eo Zv 18 communi] mutua. Zx te] ualere add. Zh, bene ualere add. v 19 se rp., te Zhv sij et Z 20 cessabis Zv, cosses h opto... meminisse om. h, amen Z; ualete add. p, . — Ad Turasium presbyterum explicit Z, om. ru. — 
