pr	Desiderasti, Fortunate carissime, ut quoniam pressurarum. et persecutionum pondus incumbit et in fine adque in consummatione mundi antichristi tempus infestum adpropinquare iam coepit, ad praeparandas et corroborandas fratrum mentes de diuinis scripturis hortamenta conponerem quibus milites Christi ad spiritale et caeleste certamen animarem. obtemperandum fuit desiderio tuo tam necessario, ut quantum sufficit mediocritas nostra auxilio diuinae inspirationis instructa quasi arma ac munimenta quaedam pugnaturis fratribus de praeceptis dominicis promerentur. parum est enim quod Dei plebem classico nostrae uocis erigimus, nisi credentium fidem et dicatam Deo deuotamque uirtutem diuina lectione firmemus. Quid autem potius aut maiae curae nostrae ac sollicitudini congruit quam commissum nobis diuinitus populum et exercitum in castris caelestibus constitutum aduersus diaboli tela et iacula exhortationibus adsiduis praeparare? neque enim idoneus potest esse miles ad bellum qui non exercitatus in campo prius fuerit, aut qui agonisticam coronam quaerit adipisci in stadio coronabitur, nisi usum et peritiam uirium ante meditetur. aduersarius uetus est et hostis antiquus cum quo proelium gerimus. sex milia annorum iam paene conplentur, ex quo hominem diabolus inpugnat. omnia genera temptandi et artes adque insidias INCIPIT AD FORTVNATVM (DE EXHORTATIONE MARTYRVM add. B, AMEFF add. R) WRMB, AD FORTYNATVM DE EXHORTATIONE MARTYRH V 2 desiderasti f. char. nobis ut quo R 8. I. m. ree. pressure B (persecutionum et pressurarum v) 3 consummationemJi 4 iam] nunc v 6 componere RB 7 coeleste et spiiitale v animarum R 9 instructa] inistincta R monumentaitf 15 quam] utB, quam\'ut v 17 praeparemus Wv 18 prius in campo v 21 anticus R proelium] bellum B cottidie geriiuus M* 22 poene W deiciendi usu ipso uetustatis edidicit. si inparatum inuenerit Christi militem, si rudem, si non sollicito ac toto corde uigilantem, circumuenit nescium, fallit incautum, decipit inperitum. si uero quis dominica praecepta custodiens et fortiter Christo adhaerens contra eum steterit, uincatur necesse est, quia Christus quem confitemur inuictus est. Ac ne in longum sermonem meum extenderem, frater carissime, et audientem uel legentem stili latioris copia fatigarem, conpendium feci, ut propositis titulis quos quis et nosse debeat et tenere capitula dominica subnecterem et id quod proposueram diuinae lectionis auctoritate solidarem, ut non tam tractatum meum uidear tibi misisse quam materiam tractantibus praebuisse. quae res in usum singulis proficit utilitate maiore. nam si confectam et paratam iam uestem darem, uestis esset mea qua alius uteretur et forsitan non pro habitudine staturae et corporis res alteri facta minus congruens haberetur: nunc uero de agno per quem redempti ac uiuificati sumus lanam ipsam et purpuram misi, quam cum acceperis tunicam tibi pro uoluntate conficies et plus ut in domestica tua adque in propria ueste laetaberis et ceteris quoque, ut conficere et ipsi pro arbitrio suo possint, quod misimus exhibebis, ut uetere illa nuditate contecta perferant omnes indumenta Christi caelestis gratiae sanctificatione uestiti. Nec non et illud consilium, frater carissime, utile et salubre prospexi in exhortatione tam necessaria quae martyras faciat amputandas esse uerborum nostrorum moras et tardidates adque ambages sermonis humani subtrahendas, ponenda illa sola quae Deus loquitur, quibus seruos suos ad martyrium Christus hortatur. praecepta ipsa diuina uelut arma pugnantibus suggerenda sunt. illa sint militaris tubae hortamenta, illa pugnantibus 1 christi milite B, militem christi v 2 si non] nisi non R sollicito WMSJBV, sollicitum v 4 christi uestigiis v 5 uincatur] hostis add. 3P, uindicatur W\' quia ex qua22 6 confitetur Bv 7 fre kml R 11 tractum R 14 darem] misissem V qua] quam R 15 primum et om. R res] cf. p. 13, 2 16 alteris B 18 uoluntatem R conficiens B 19 ut W 8. I. m. 2 laetaueris W 21 missimus W saepius ut ueteri ex et uetere M m. 2 praeferant fort.; cf. indicem 22 caelesti W 23 et otn. R frs kmi R 24 in] ut R tam] iam B martyrcs r 26 sola illa t . 27 christi R 28 ipsa M s. I. m. 2 29 sunt] sint Mt classica. inde aures erigantur, inde instruantur mentes, inde et animi et corporis uires ad omnem passionis tolerantiam roborentur. nos tantum qui Domino permittente primum baptisma credentibus dedimus ad aliud quoque singulos praeparemus insinuantes et docentes hoc esse baptisma in gratia maius, in potestate sublimius, in honore pretiosius, baptisma in quo angeli baptizant, baptisma in quo Deus et Christus eius exultant, baptisma post quod nemo iam peccat, baptisma quod fidei nostrae incrementa consummat, baptisma quod nos de mundo recedentes statim Deo copulat. in aquae baptismo accipiuntur peccatorum remissa, in sanguinis corona uirtutum. amplectenda res est et optanda et omnibus postulationum nostrarum precibus expetenda, ut qui serui Dei fuimus simus et amici. In exhortandis itaque ac parandis fratribus nostris et uirtutis ac fidei firmitate ad praeconium dominicae confessionis adque ad proelium persecutionis et passionis armandis primo in loco dicendum est: I. Idola deos non esse quae homo sibi faciat — neque enim quae fiunt factore suo et fabricatore maiora sunt, aut protegere et seruare quemquam possunt quae ipsa de templis suis pereunt, nisi ab homine seruentur — sed nec elementa colenda esse quae homini secundum dispositionem et praeceptum Dei seruiunt. II. Destructis idolis et elementorum ratione monstrata ostendendum Deum solum colendum esse. \' III. Tunc addendum quae comminatio Dei sit aduersus eos qui idolis sacrificant. 1 bistruantur mente. B 4 insinuantes] instruentes V 7 dns B 8 iam nemo M 10 aquae] quae R accipitur MRv t11 sanguinis] baptismo add. M* et Baluzius est om. MBB 12 expectenda BB 13 fuimus WMBBV, sumus v 14 parandis WMIBBV, praeparandis 3Pv uirtntis] ueritatis M, sed 8. l. m. 2: unitatis 15 firmitatem M ad preconium ex preconio M m. 2 ad proelium ex proelio M m. 2 16 secutionis B et om. M passionis M 8. 1. m. 2 in om. B 18 facit v 19 quae] que M 8. 1. m. 2 fabricatorem B 20 et] aut v 22 esse] esse uice deorum B et Oxon . 23 dei et praeceptum deseruiunt B 24 rationem B 26 addendum esse M 27 sacrificans R IIII. Praeterea docendum non facile ignoscere Deum idololatris. V. Et quod sic idololatriae indignetur Deus, ut praeceperit etiam eos interfici qui sacrificare et seruire idolis suaserint. VI. Subiungendum post haec quod redempti et uiuificati Christi sanguine nihil Christo praeponere debeamus, quia nec ille quicquam nobis praeposuerit et ille propter nos mala bonis praetulerit, paupertatem diuitiis, seruitutem dominationi, mortem inmortalitati, nos contra in passionibus nostris paupertati saeculari paradisi diuitias et delicias praeferamus, dominatum et regnum aeternum temporariae seruituti, immortalitatem morti, Deum et Christum diabolo et antichristo. VII. Insinuandum quoque ne erepti de faucibus diaboli et laqueis saeculi liberati, si in angustiis et pressuris esse coeperint, regredi denuo ad saeculum uelint et perdant quod euaserint. VIII. Insistendum potius esse et perseuerandum in fide et uirtute et caelestis ac spiritalis gratiae consummatione, ut ad palmam et coronam possit perueniri. VIIII. Ad hoc enim pressuras et persecutiones fieri ut probemur. X. Nec timendas esse iniurias et poenas persecutionum, quia maior est Dominus ad protegendum quam diabolus ad inpugnandum. XI. Ac ne expauescat quis et conturbetur ad pressuras et persecutiones quas patimur in isto mundo, probandum \'ante praedictum esse quod nos mundus odio habiturus esset et quod persecutiones aduersum nos excitaret, ut 1 idolatriaeB, idolatria Jd 3 quod sic] quos R idolatriae WMRB 5 suasserint W 6 subiungendum etiam V et] ac v 8 nobis quic- quam Billie B 10 dominationis B inmortalitatis Ml, inraortali B nos] non B 11 nostris W s. I. m. 2 dilicias et diuitias W 12 praeponamus V 14 antichristum B 16 de laqueis RMc si] siti2 17 ad s. denuo M 19 in] et in B 20 et W s. I. m. 2 spiritaliter R con- summationem R 22 enirn om. M probemurj prohilftnur M 24 quia) qua R\' 27 ad persccutiones W 29 quod R s. I . excitaret ut] excitaretur R ex hoc ipso quod haec fiant manifesta sit fides diuinae pollicitationis in mercedibus et praemiis postmodum secuturis, nec nouum quid accidat christians, quando ab initio mundi boni laborauerint et oppressi adque occisi sint iusti ab iniustis. XII. In nouissima parte ponendum quae spes et quae merces maneat iustos et martyras post conflictationes huius temporis et passiones. XIII. Et quod plus accepturi simus in passionis remuneratione quam quod hic sustinemus in ipsa passione. 
1	QVOD IDOLA DII NON SINT ET QVOD NEC ELEMENTA VICE DEORVM COLENDA SINT. In psalmo CXXXIIII: idola gentium argentum et aurum, opus manuum hominum. os habent et non locuntur, oculos habent et non uident, aures habent et non audiunt: neque enim est spiritus in ore eorum. 13 Ps. 134,15 sq. 1 haec W s. l. m. 2 diuina J2 2 pollicitationibusR securis Rx 4 boni om. W 5 iusti om. Wv 6 ponendum est v quae (ante merces) om. RB 7 iustis M martyres Bv, martyTibus Jf 9 XIII om. Bo sumus RB 10 ipsa om. R 11 deidola R elementa mundi M 12 sint] ostenditur add. v, habes Costerius 13 CXXXIIII] CXXXIII WB, CXIII v; cf. Ps. 113,12 14 opus WMRBV, opera v manu Ml loquentur M 16 audient M, audiunt nares habent et non odorabunt manus habent et non palpabunt non clamabunt in gutture suo neque in ore eorum B eorum] ipsorum a m. 21 similes sint illis omnes qui faciunt ea. item in Sapientia Salomonis: omnia idola nationum aestimauerunt deos, quibus neque oculorum uisus est ad uidendum neque nares ad percipiendum spiritum neque aures ad audiendum nec digiti in manibus ad tractandum, sed et pedes eorum pigri ad ambulandum. homo enim fecit illos et qui spiritum mutuatus est is finxit illos. nemo autem sibi similem homo poterit deum fingere: cum sit enim mortalis, mortuum fingit manibus iniquis. melior est autem ipse his quos colit, quoniam ipse quidem uixit, illi numquam. item in Exodo: non facies tibi idolum nec cuiusquam similitudinem. item aput Salomonem [de elementis]: neque opera adtendentes agnouerunt quis esset artifex, sed aut ignem aut spiritum aut citatum aerem aut gyrum stellarum aut nimiam aquam aut solem aut lunam deos putauerunt: quorum si propter speciem hoc aestimauerunt, sciant quanto his Dominus sit speciosior: aut si uirtutes et opera eorum mirati sunt, intellegant ab ipsis quoniam qui haec constituit fortia fortior est illis. 
2	QVOD DEVS SOLVS COLENDVS SIT. Sicut scriptum est: Dominum Deum tuum adorabis et illi soli seruies. item in Deuteronomio: non erunt tibi dii alii absque me. item illic: uidetc, uidete quoniam ego sum, et non est Deus praeter me. ego 2 Sap. 15,15 sq. 12 Ex. 20, 4. 13 Sap. 13,1 sq. 23 Dent. 6,13. 24 Ex. 20, 3. 25 Dent. 32, 39. 1 sint illis WBV, illis sint R, illis fiant Mv omnes W, hi jr, om. RBv 3 nec W osculorum Rl uisos V, usus WMRBv 4 spiritum j spem R, om. B 5 neque v 7 is om. v 9 finget M 10 ipse om. B his] iis v 11 illi autem v 13 item] iterato R de elementi. om. MR 15 sed et R 16 aut 1.] et lunam W; cf. test. III59 17 deos] rectores orbis terrae deos Cypr. I. c . 18 his] iis v dni sit R, sit dnš B 19 et] aut M minati R 20 ipeis] his R 22 solus M s. I . m. 2 23 est] in deuteronomio add. v 24 illi] ipsi MR item om. M deuteronomio] exodo v 25 item illic dns M, item in deuteronomill Oxon . quia Rv 26 alius deus R interimam) occidam M interimam et uiuere faciam, percutiam et ego sanabo, et non est qui eripiat de manibus meis. item in Apocalypsi: et uidi alium angelum uolantem medio caelo, habentem euangelium aeternum, ut adnuntiaret super terram per omnes nationes et tribus et linguas et populos, dicentem uoce magna: metuite potius Deum et date illi claritatem, quoniam uenit hora iudicii eius, et adorate eum qui fecit caelum et terram et mare et omnia quae in eis sunt. sic et Dominus in euangelio commemorationem facit primi et secundi praecepti dicens: audi Israel, Dominus Deus tuus Dominus unus est, et: diliges Dominum Deum tuum de toto corde tuo et de tota anima tua et de tota uirtute tua. hoc primum et secundum simile huic: diliges proximum tuum tamquam te. in his duobus praeceptis tota lex pendet et prophetae. et iterum: haec est autem uita aeterna ut cognoscant te solum et uerum Deum et quem misisti Iesum Christum. 
3	QVAE COMMINATIO DEI SIT ADVERSVS EOS QVI IDOLIS SACRIFICANT. In Exodo: sacrificans diis eradicabitur, nisi Domino soli. item in Deuteronomio: sacrificauerunt daemoniis et non Deo. item aput Esaiam: adorauerunt eos quos fecerunt digiti eorum, et curuatus est homo et humiliatus est uir, et non laxabo illis. et iterum: illis fudistis libamina et illis inposuistis sacrificia. super haec non indignabor? dicit 3 Apoc. 14, 6 sq. 11 Marc. 12,29. 12 Mattli. 22,37 sq. 17 Io. 17, 3. 22 Ex. 22,19. 23 Dent. 32, 17. 24 Es. 2, 8. 27 Es. 57,6. 3 in medio WlMv 5 per WMRBV, ot super v 6 et populos Ws. I. m.2 magnA et uitae potius R 7 dum M, dru R 9 et (ante mare) om. B 11 deus unus Bv 12 dcum om. Wv 13 de] ex R 15 tuum] tibi W te ipsum B 20 idola W 22 in] legitur in v diis M 8. 1. trio 2 23 item om. M demonis W\' 24 esaian R saepius ut hieremian 27 iterum dicit M 28 haec add. m. 2 in W, haec ergo v 21* Dominus. item aput Hieremiam: nolite ambulare post deos alienos ut seruiatis eis, et ne adoraueritis eos et ne incitetis me in operibus manuum uestrarum ad disperdendos uos. item in Apocalypsi: si quis adorat bestiam et imaginem eius et accipit notam in fronte sua et in manu, bibet et ipse de uino irae Deimixto in poculo irae eius et punietur igne et sulphure sub oculis sanctorum angelorum et sub oculis agni. et fumus de tormentis eorum in saecula saeculorum ascendet: nec habebunt requiem die et nocte quicumque adorant bestiam et imaginem eius. 
4	NON FACILE IGNOSCERE DEVM IDOLOLATRIS. Moyses in Exodo pro populo rogat nec impetrat: precor, ait, Domine, deliquit populus hic delictum grande, fecerunt sibi deos aureos et argenteos. et nunc si dimittis eis delictum, dimitte: sin autem, dele me de libro quem scripsisti. et dixit Dominus ad Moysen: si qui deliquit ante me, deleam eum de libro meo. item cum Hieremias pro populo deprecaretur, Dominus ad eum loquitur dicens: et tu noli orare pro populo hoc et noli postulare pro ipsis in prece et oratione, quia non exaudiam in tempore quo inuocabunt me, in tempore adflictionis suae. Ezechiel quoque hanc eandem denuntiat indignationem Dei eis qui in Deum delinquunt, et fuit, inquit, uerbum Domini ad me dicens: fili ho. minis, terra quaecumque peccauerit mihi ut delinquat delictum, extendam manum meam super eam 1 Hier. 25, 6. 4 Apoc. 14, 9 sq. 13 Ex. 32, 31 sq. 20 Hier. 11, 14. 24 Ez. 14, 12-14. 16. 1 item] et M 2 eos om. W 3 manum R 4 disperdendum M, disperdos W 5 nota R 6 et in] aut in v uino] manu M -10 ascendit R ascendet in saecula s. B et] ac RBv 11 adorat R et M s. l. m. 2 12 deum ignoscere R idolatris MB, idololatriis WR 13 moysen R imperat R 14 grande om. V 15 et argenteos om. WBv; cf. test. 11 16 eis] illis WBv sin] sine B 18 quis Bv deliquerit M me om. W 22 in] eos in 3P, item in W in quo W inuocauerunt R 24 eis] his v in] ad B dclinquont M et om. B 25 filii R 26 quicumque R 27 ectendam Wl, et extendam B et obteram ątabilimentum panis et inmittam in eam famem et auferam de ea hominem et pecora. et si fuerint tres uiri hi in medio eius Noe et Danihel et Iob, non liberabunt filios neque filias, ipsi soli salui erunt. item in Regnorum. I.: si delinquendo uir peccet aduersus uirum, orabunt pro eo Dominum: si autem in Deum peccet homo, quis orabit pro eo? 
5	QVOD SIC IDOLOLATRIAE INDIGNETVR DEVS VT PRAECEPERIT ETIAM EOS INTERFICI QVI SACRIFICARE ET SERVIRE IDOLIS SVASERINT. In Deuteronomio: quodsi rogauerit te frater tuus aut filius tuus aut filia tua aut uxor tua quae est in sinu tuo aut amicus tuus qui aequalis est animae tuae latenter dicens \'eamus et seruiamus diis aliis, diis gentium, non consenties ei et non exaudies eum et non parcet oculus tuus super eum et non celabiseum, adnuntians adnuntiabis de illo. manus tua erit super eum in primis interficere eum et manus omnis populi postremo: et lapidabunt eum, et morietur, quoniam quaesiuit auertere te a Domino Deo tuo. et iterum loquitur Dominus et dicit nec ciuitati parcendum, etiamsi uniuersa consenserit ad idololatriam: aut si audieris in una ex ciuitatibus quas Dominus Deus tuus dabit tibi inha bitare te illic dicentes (eamus et seruiamus us diis aliis quos non nostis, interficiens necabis omnes qui sunt in ciuitate caede gladii et incendes ciuitatem igni, et erit sine habitaculo in aeternum. non reaedificabitur etiam nunc, ut 5 I Sam. 2, 25. 11 Dent. 13, 6-10. 22 Deut. 13, 12-18. 2 de] ab B 3 hii BB, hi W s. I. m. 2, hi iusti V et om. Mv 4 que . filias ab his incipit S sed ipsi M 5 erunt] fiunt B in] in libro v . 1. W 8. I. m. 2 peccet uir WRv 6 orabant Bl 7 in deum om. W, ad deum R 8 idolatria. B 10 suasserint W 14 alienis v 15 diis] aliis add. Sl, exp. S* 16 prius et om. S alterum non om. B 18 imprimis W 21nec] ne22 22 uniuersamB idolatriam S, idolatria B 23 audierit S 24 te om. W 25 nosti v; add. Oxon.: quaeres sollicite et si inueneris certum esse, quod dicitur 26 ciuitate...incendes om. B 27 erint S auertatur Dominus ab indignatione irae suae. et dabit tibi misericordiam et miserebitur tui et multiplicabit te, si audieris uocem Domini Dei tui et obseruaueris praecepta eius. cuius praecepti et uigoris memor Mathathias interfecit eum qui ad aram sacrificaturus accesserat. quodsi ante aduentum Christi circa Deum colendum et idola spernenda haec praecepta seruata sunt, quanto magis post aduentum Christi seruanda sunt, quando ille ueniens non uerbis nos hortatus sit sed et factis, post omnes iniurias et contumelias passus quoque et crucifixus, ut nos pati et mori exemplo suo doceret, ut nulla sit homini excusatio pro se non patienti, cum. passus sit ille pro nobis, et cum ille passus sit pro alienis peccatis, multo magis pro peccatis suis pati unumquemque debere. et ideo comminatur in euangelio et dicit: quicumque confessus fuerit me coram hominibus, et ego confitebor eum coram patre meo qui est in caelis. qui autem me negauerit coram hominibus, et ego negabo eum coram patre meo qui est in caelis. item apostolus Paulus, si enim commorimur, inquit, et conuiuemus: si toleramus, et conregnabimus: si negamus, et ipse negabit nos. item Iohannes: qui negat filium neque patrem habet: qui confitetur filium et filium et patrem habet. unde nos ad contemptum mortis hortatur Dominus et corroborat dicens: nolite, timere eos qui occidunt corpus, animam autem non possunt 14 Matth. 10, 32 sq. 19 II Tim. 2,11 sq. 21 I Io. 2, 23. 24 Matth. 10, 28. . 3 exaudieris WRv 5 matthatias R, matthias 6M, mathias Wl interficit R accessit ex erat cessit S m. 2 6 ante W s. I. m. 2 circa d. colendum om. R 7 spernda S 8 christi] circa deum colendum add. S\', exp.Sx sint S quando] quantoU perbis SWR P, uerbis tantum r 10 docuerit R 11 patienti] pati R et Baluzius 12 ille S s. I. ftl. 2 pro... passus sit om. S 14 in euuangelio comminatur WRv dixit Sl . quicumque ex qui W m. 2 15 fuerit in me W, in me fuerit R 16 eum] in ipso W in caelis est Rv; cf. test. III16 p.130 qui autem...1.18 caelis om. S, add. in vaarg. m. rec . 17 negauerit me Sv negabo et ego S 18 eum] illum W in caelis est WRv 20 tolerabimus W et conr. om. R negauerimus v 21 negauit R 24 et om. R corroborans 81 25 et anima R occidere. magis autem metuite eum qui potest et animam et corpus occidere in gehenna. et iterum: qui amat animam suam perdet illam, et qui odit animam suam in isto saeculo in uitam aeternam conseruabit illam. 
6	QVOD REDEMPTI ET VIVIFICATI CHRISTI SANGVINE NIHIL CHRISTO PRAEPONERE DEBEAMVS. In euangelio Dominus loquitur et dicit: qui diligit patrem aut matrem super me non est me dignus, et qui diligit filium aut filiam super me non est me dignus, et qui non accipit crucem suam et sequitur me non est meus discipulus. sicut in Deuteronomio scriptum est: qui dicunt patri et matri cnon noui te\' et filios suos non agnouerunt, hi custodierunt prae cepta tua et testamentum tuum seruauerunt. item apostolus Paulus, quis nos, inquit, separabit a caritate Christi, pressura an angustia an persecutio an fames an nuditas an periculum an gladius? sicut scriptum est: quia propter te occidimur tota die, aestimati sumus ut oues uictimae. sed in his omnibus superamus pro eo qui dilexit nos. et iterum: non estis uestri: empti enim estis [pretio] magno. clarificate et portate Deum in corpore uestro. et iterum: pro omnibus mortuus est, ut et qui uiuunt iam non sibi uiuant sed illi qui pro eis mortuus est et resurrexit. 2 Io. 12, 25. 8 Matth. 10, 37. 13 Dent. 33, 9. 1Ei Rom. 8, ? sq. 21 I Cor. 6, 19 sq. 23 II Cor. 5, 15. 1 autem om. W et om. WRv 2 gehennam Rv; cf. test. I. c . 3 illam SWRV, eam v 4 uita aeterna W 5 seruabit S; cf. test. III16 p. 129 8 dixit 81 9 et qui...1. 12 discipulus om. v 12 meus discipulus] me dignus v sicut] sic et v 14 hii WR 15 tua ex sua Sm.2 16 separauit R 17 an (ante persequutio) om. R famis R 18 gladiu 81 19 toto WR 20 in om. B omnibus Ws. I. m. 2 21 superuincimus V pro eo SWRV, propter eum v qui] quod W et iterum... 1.23 uestro om. S 22 pretio om. WV clarificate WV, glorificate Rr 23 et portate W s. I. m. 2 24 est] est christus v ut et S\'l, ut WR, et 81 25 illi S, ei WRv eis S, ipsis WRv 
7	EREPTOS DE FAUCIBVS DIABOLI ET DE LAQVEIS SAECVLI LIBERATOS NON DEBERE DENVO AD SAECVLVM REVERTI NE PERDANT QVOD EVASERINT. In Exodo Iudaicus populus ad umbram nostri et imaginem praefiguratus, cum Deo tutore et uindice euasisset Pharaonis adque Aegypti id est diaboli et saeculi durissimam seruitutem, circa Deum perfidus et ingratus et aduersum Moysen mussitat respiciens solitudinis et laboris incommoda et non intellegens libertatis ac salutis beneficia diuina, et reuerti quaerit ad Aegypti hoc est ad saeculi seruitudinem, unde fuerat exutus, cum magis fidere in Deum deberet et credere, quoniam qui a diabolo et saeculo liberat populum suum protegit liberatum. quid hoc nobis, inquiunt, fecisti eiciendo nos de Aegypto? melius erat nobis seruire Aegyptiis quam obire in solitudine hac. et dixit Moyses ad populum: fidite state et cernite salutem quae a Domino est, quam nobis faciet hodie. Dominus pro uobis pugnabit et uos tacebitis. quod nos admonens in euangelio suo Dominus ne ad diabolum rursum et ad saeculum quibus renuntiauimus et unde euasimus reuertamur dicit: nemo retro ad tendens et ponens manum suam super aratrum aptus est regno Dei. et iterum: et qui in agro est non reuertatur retro. memores estote uxoris Loth. ac ne quis aliqua uel cupiditate rerum uel suorum dulcedine retardetur 12 Ex. 14, 11. 13 sq. 20 Luc. 9, 62. 22 Luc. 17, 31 sq. 2 reuerti] regredi V 3 euaserunt S* 4 exhodo S1 ita semper m. 2 iudaeicus S 5 et 88.1. m. 2 euasissent Wl 7 et aduersum S, aduer- SU6 WRv musitat WB 8 ac (pro et) laboris Rv 9 et om. Rv quaerens S aegyptum R 10 sernitudinem 81, seruitem W, seruitutem S*Rv exutus] abstractus v 11 deberet in deum v et om. R a om. 81 et S s. I . et saeculo om. V 12 suum W 8. I. m. 2 13 in eiciendo Rv, in eciendo W 14 erat S, est WRx obire SWV, mori Rv solitudine] deserto R 15 ad ex et R fidete S1, fidite et v 17 uobis Sv facit R dominus ipse v pro uos pugnabit S, pro nobis p. 12, pugn. p. u. Wv 18 admonens ex ad moysen S m. 2, admonens et docens R dominus et docens v 19 rursus JV Rv 21 superponens WRv 22 conuertatur WRv; cf. test. III11 quominus Christum sequatur, addidit et dicit: qui non renuntiat omnibus quae sunt eius, non potest discipulus meus esse. 
