8	Tibi cum rectore meo, Odouacar, occurro, qui uniuersas contra eum nationes quasi orbis concussor exciueras. tot reges tecum ad bella conuenerant, quot sustinere generalitas milites uix ualeret: deprehensum est uarias esse mentes coaceruatae multitudinis nec spem uictoriae uenire de numero. adhuc tuorum dexterae de praecedenti tabe\' titubabant nec peragebat uotiuos impetus membrorum inbecillitas: sufficit tamen unum uelle pro uiribus et indiscretum consilium de inimicis loco roboris attulit ultionem. non te castra longo munita tempore, non fluminis profunda tenuerunt: datum est hostibus tuis uallum construere, non tueri. repente aequora fugacium discursus obnubit, per quae superandam domesticam tempestatem abeuntibus indixisti: interea acies tuae aspectu consummant proelia, non labore. illic tibi fores reserauit felicitas, manifesto detegens quod qui primore loco cesserant secunda eos luctamina non manerent sed instruxit rursus in deceptione sui mens uaga conflictum , dum apud Veronam tuam apparat 1 qui MT 2 diliciarom B 3 excursus] esaries Sirm . 4 uicet B inaediam V congraessio B rediasis Bl ut uid., redisset L 5 si] sic L 7 tropois B, tropbeis MTV, tropbe∗is (i? eras.) L 10 tectū L quod B 11 depraehensum B, dephensus L coacerbatae B 13 dextrae Sirtn . titubant B b 14 uotiuos p, uotibus libri 15 indeseretum B, indecret ̃ (crec m ras.) T * 16 ultiones Tl longe B 19 obnuuet B superandum B potestatem T1 20 abeuertibus T taa bp consnmmant MT, consumarit BV, consummarit L, consuramauit p, consumauit 6; interea (= dum) a. tua a. consummaret fort . 24 apparat locum belli (an bellaadi ?) scripsi, apparatum nnbeli BLTVb, apparatum Ibeli (in belli D) DM, apparatu inbabili uel apparatum nubilo proposuit Fertig, apparatum (?) imbelli coni. Sehottus locum belli: laxis manibus pugna instruebatur inpendiis. nihil fortius aduersariis tuis ante aciem, sed cum bellicum cecinerunt classica, nihil infirmius: maxima in luctaminis promissione uirtus, et si sufficeret lingua pro dexteris:, copia summa uerborum. electus est locorum situs, non tam congressui utilis quam pauori, prouidentes ne ascriberetur casui prima et discessio perfugarum. et tamen candida reipublicae fortuna perurguebat, ne coepto desisteres. itineris tui permensus interualla conspexisti ignes hostium astrorum more rutilantes, ut si aliquando tibi fuisset nota formido, in abruptum te pendere didicisses. numquam animi tui status aut secundarum rerum tumore elatus est aut dubiis adquieuit. instabat certandi dies multis tenebras adlatura. cum primum aurora bigis in croceis ortum iubaris indicauit, cum de oceani limphis solis flamma surrexit, iam raucum bucina concinebant, iam te sui oblitus quaerebat exercitus. qui dum munimentis chalybis pectus includeres, dum ocreis armarere, dum lateri tuo uindex libertatis gladius aptaretur, sanctam matrem et uenerabilem sororem, quae ad te diligentiae causa conuenerant, dum inter spem et metum feminea sollicitudo penderet, dum de euentu adtonitae uultus tui sidere pascerentur, talibus alloquiis confirmasti : "scis, genetrix, partus tui honore uniuersis nota nationibus, quod natalis mei tempore uirum fecunda genuisti: dies est, quo filii tui sexum campus adnuntiet: telis agendum est ut auorum per me decora non pereant: sine causa parentum 1 pugnas B b 2 aciae B bellicum] belli b et Sirm . cinerunt B, concinerunt b, concinuerunt p 4 ai] quasi fort . dextris LTV cupia B 5 congressui utiles B 6 pauori prouidenti coni. Manso, pauori: prouident fort . ascruerittur B b et T, om. p, etiam Sirm., clades et fort . 7 reipublicae candida LM TV perurgebat B2TV, perungebat L 8 nec t desisteris B iteneris B 9 ignis B ostium BLb rutilantis B 10 dedicissis B 12 dies (e delet. m. 1) V, dia B 13 cruceia B* 14 limphiB LMTV 15 buccina DLMb, buocinae Sirm . concinebant T 16 chalibis V, calibis LMTp, calebis Bb 17 armarexe Tl nindix B . 19 que Bx 30 maetum B euentus DLMT1V1 22 genitrix MT 24 fili B titulis nitimur, nisi propriis adiuuemur. stat ante oculos meos genitor, de quo numquam fecit in certamine fortuna ludibrium, qui dextros sibi ipse peperit ualitudine exigente successus. hoc oportet duce contendi, qui omina incerta non timuit, sed ipse sibi secunda consciuit. uos tamen elaboratas uestes et liciorum tormenta deuehite cultiorem me acies suscipiat, quam festa consuerunt : qui me de impetu non cognouerit aestimet de nitore: inuitet cupidorum oculos honor indumenti: pretiosior species feriendum exhibeat: habeat laboris solacium cui iugulum meum, fortuna, praestiteris: inhient iacentis splendori quos non contigerit uidere pugnantem." illis dictis excepit te tergo sonipes, lituorum desideriis inquietus. sed dum indulsisti adfatibus, inimica legiones tuae premebantur instantia. dedisti inertibus fiduciam, dum moraris, et hoc credo prouisione caelicolum, ne deberetur multitudini quod uicisti. protinus aduentum tuum indicauit hostibus populus occisorum: executorem prodidit caedis enormitas. sed nec illis remedia defuere consueta. continuo alas quas tribuit formido sumpserunt, cursu praepeti interitum metu mortis eligentes. qui me ueritati nescit obsecutum, Atesis undas uideat tua nece opulentas extitisse cadaueribus, et dum tumefaceres gurgites de cruore, in parte alia sistebatur impetus fluentorum. itaque ne ensibus 1 titulis nitulis T 2 ludibrium] libidinum T1 3 dextros p; dextrum BLMTVb fort. recte successum (um ex us corr.) T 4 contendit L omina MV, ola T, omnia BLb 6 tormenta] ornamenta p in mg . cultore L1 7 conaueuerunt DT 8 praetiosior B 9 feriendO DMT, feriend LV, feriendos (o ex u corr.) B , feriendas b p solatium LV, remedium DMT 10 praestiterit B (m. rec.) b inient B, inhibent L iacentis Sirm., iacentes T, iacentes BLMVb 11 excipit B 12 litnorum p, litorum T, litorum BLMVb 13 legiones T\'p, legionis BLMT1Vb 14 caeli columnae Bb 15 multitudinis B 16 ostibus B exsecutorem LTV 17 cedis LTV in. ormitas B 19 praepiti B metfl T 20 nece scripsi, uice BLMVb, ui p, luce T opulentias T, copulatas p 21 tum faceria B, cum faceres b, tu faceres p 22 sistebautur L1 impletu L VL 18 non sufficeres, pro te et lympha militauit. salue, fluuiorum splendidissime, qui ex maiore parte sordes Italiae deluisti, mundi faecem suscipiens sine dispendio puritatis. ecce ille tectus armatis campus enituit humanorum ossuum candore nobilissimus: habemus, quotiens uetusti doloris urguemur memoria quod tueri. scenam pulcherrimam seruet terra. sublimes tamdiu maneat quod passi sunt, quamdiu deleat obliuio quod fecerunt.s o utinam uoracibus abripere aliquid bestiis non liceret perit desiderabili spectaculo quod adquisiuerint furta beluarum. 
9	Illic uellem ut aetatis inmemor, Roma, conmeares. si uenires lapsantibus tremebunda uestigiis, aeuum gaudia conmutarent. quid semper delubris inmersa concluderis? hic actum est, ut plures habeas consules, quam ante uideris candidatos. agnosce clementiam domini tui: saporem te uoluit haurire triumphorum, quam dubia elegit nescire certaminum. 
10	Ecce iterum ad deditionem sibi cognitam hostium leto debita pars cucurrit, et cum excessissent occumbentes numerum, ad seruitium tamen armis instructa radiantibus agmina conuenerunt. flexus est animus tuus pronus semper ad ueniam: credidisti quod fidem adsuescerent magisterio necessitatis, quam 1 sufficeris B limpha LMTV 2 splendidissimae B Bordie B, sortes MTl eluiatd p, dilaisti fort . 3 mundi faeoem p, mundificem BLMVb, undiflcem T dispendia B1 poritatia Bb, ueritatis DLMTV 4 armatus T1 ossium B (corr.) MT2 5 cotiens B dolores B . urgemur LTV 6 tueris B b, tueri est fort . cenam B, schemam T sublimis Bb 7 tum diu L moneat uel sublimibus t. maneat fort . 8 uoratibus Tl besteis Bl 9 desiderabilis | pictaculo Bl acquisiuert T, aequi- siuerunt DM frustra T1, frusta DM 11 uellim B, uelim 6 commeares T2p, conmearis B, commearia MT1 Vb, cu ̃ mearis L ueneree B 12 labsantibus B, lassantibus b tremibunda B comutarent L 18 immensa T 14 uideris BТ2b, uideres DL MT1 V candidatus Bb 15 aurire L 16 quem DMp dubię | liget Bb, dubia lioet p, elegit T, narrantibus elegit DM 17 adi///ditionem B cognitum L loeto LV, laeto B 19 Beruientia L conetruota T1 20 animus] amicus L 21 assuescerentur T numquam exhibuerant studio conciliante principibus. seruauit te, regum praecipue, quod abiecisti sacramenti confidentia cautionem. pependimus anxii, ne mererentur quos de hostibus tuis receperas non perire. gratias tibi, mundi arbiter deus, qui conscientias ueterno errore possessas ad ultores gladios inpulisti. puderet me recensere lenitatem originariam, nisi eam uiderem tuis laudibus obsequentem. quid dissimulo gesta persequi? libuit eos rursus tendenti inermem dexteram Odouacri regna polliceri. innotuit ilico rebus in luce deprehensis hostilium error animorum. aduocasti prouidentiam actuum tuorum comitem, et ne inpunita esset libido discurrentium, ultionis uexilla concutiens fecisti consiliorum participem in secretis populum iam probatum. neminem aduersarium agnouisse contigit, quod tecum pars mundi potior disponebat. mandata est per regiones disiunctissimas nex uotiua. quis haec praeter supernam uoluntatem praestitit, ut unius ictu temporis effunderetur Romani nominis clades longa temporum inprobitate collecta? hic quo me uertam nescio. grates referam, qui suscepi officium laudatoris, an arreptum praeconiorum tuorum iter ingrediar? consumpta res est prospero fatalique bello: succisa est Odouacris praesumptio, postquam eum contigit de fallacia non iuuari. quid Herulorum agmina fusa conmemorem ? qui ideo aduersus te deducti sunt, ut hic agnoscerent etiam 1 consiliante L 2 tė| regum B, tempore regum b praecipuae B 3 merentur L ostibus B\' 4 reciperas B _ 5 conscientias T\'p, condcientia BDLMT1 Vb aeterno Bb amore DMT possessas BT2b, possessos DLМT1V gladius B 6 lenitatem MT 8 dextram LMTY odiouacri L, odo*acri (u 8. l. m. rec.) B 9 illioo BM lueae depraehensis B 10 error] furor fort . 11 inpunit (a s. I . m. rec.) B esset (t m ras.) B 12 uiiilla B ,13 post secretis ras . 7 Ute. in L 14 contiget B, contingit L 15 nexi Bb, nox DMT 16 uoluptatem LV 17 cladis B inprobitatem B 18 gratia libri, gratias p, gradum Sirm. 19 soscipi B proeconiorum B1 20 inter L 21 odicuacris La ut uidetur contiget B 23 fusa] hic p cūmematė L 93 qui-ut L s . l. adck ideo] ideo B hio] fusa p : 18* in propriis sedibus quem timerent: egit causas longae quietis tuae furor alienus. taceo ubi tibi iniuncta est pax diuturna, Burgundio, quando sic foederibus obsecutus es, ut deputetur quod uiuis feriatus constantiae, non pauori illud quoque quis patiatur notitiae perite, quod bono felicitatis tuae concurrentia inter se uidimus tela perfidorum et inimicas acies te occupatum in aliis pia congressione cecidisse? quotiens tibi uicit qui contra te sumpserat uota pugnandi? dicat Fridericus, qui postquam fidem laesit, hostes tuos interitu comitatus est, contra illos arma concutiens, quibus fuerat errore sociatus, quando nata eat inter sceleratos de hoc quod intellegebant se unum uelle discordia. adsit diuinitas et beneficia sua in aeuum producat, qua disponente uotiua inter reos euenere litigia. nam Fridericus, postquam tibi de aduersariis tuis peregit triumphum, de se praebuit.. 
11	Trahit me ad aliam partem uenerabilium pars magna meritorum. uideo insperatum decorem urbium cineribus euenisse et sub ciuilitatis plenitudine palatina ubique tecta rutilare. uideo ante perfecta aedificia, quam me contigisset (scire) disposita. illa ipsa mater ciuitatum Roma iuuenescit marcida senectutis membra resecando. date ueniam, Lupercalis genii sacra rudimenta: plus est occasum debellare quam dedisse principia. huc accedit, quod coronam curiae innumero flore uelasti. nullum de honoribus tetigit desperatio, quem iuuerunt 1 longe LTV 2 diuturna (d in ras.) B 3 est L detala patitur B 4 uiues Bb 5 perite Tl bono* B 6 hasta F 7 occupato T1 congraessione B oecidisse T1 8 fridiricu B1LMTV 9 lesit fidem MT hostia BV1 sed corr. V m. 2 tuus BV sed corr. V m. 1 12 unum] unde T\' absit DMT1 13 interreo se uenere Bb euenire V* 14 fridiricu BLMTV 15 tribuit T 16 trahet B 17 in- spiratum Bb 19 contegisset Bb quam me contigisset T in ras. m. 2 scire addidi > 20 romo L iuueniscit LV, iaueniscet B 21 resicando B 22 debellare scripsi, rebellare L MTV, repallare Bt repellere t 23 accidit LM, accidet B, M- cedet b 24 tetiget B desperati B1 iuberunt B deprecantem bona conscientiae: nescit de effectu petitionis dubitare qui splendidis inops meritis non rogauit. aut boni sumus proposito nostro ant tuo informamur exemplo. creuerunt reipublicae opes cum priuatorum profectibus: nusquam in aula tua ambitus et opum ubique diffusio est: nemo indonatus abscedit et nullus incommoda proscriptionis ingemescit. legationibus tuis inest uigor inmortalis: mandatorum ordinem digeris, priusquam legatos aspicias, nec replicationibus tuis reperiuntur contraria nec obiectionibus facilis occurrit resolutio. excubat pro annis opinio principalis: otia nostra magni regis sollicitudo custodit, nec tamen desistis castella propagare curas tuas in longum producens. nec uiri fortis in te deest securitas nec cautela metuentis. o geminam in uno principe uirtutum plenitudinem, quae deum resignat auctorem, quia non habet inter homines a quo uideatur sumpsisse quod exhibet. 
12	Sed ecce rursus post quietem solidam ad acies uerba reuocamus: iterum ad se tuba uocat eloquium Sirmiensium ciuitas olim limes Italiae fuit, in qua seniores domini excubabant, ne coaceruata illinc finitimarum uulnera gentium in Romanum corpus excurrerent. haec postea per regentium neglectum in Gepidarum iura concessit, unde cotidiana insultatio et inconposita legationum frequentia mittebatur. urebant animum principis dolosi blandimenta conmenti et circa alios Gepidas, quorum ductor est Gunderith, intempestiua Traserici familiaritas. credebas in tua iniuria perire, quia diu licebat Italiae 1 depraecantom B 8 nro (o corr.) T 5 diffusione ̃ T 6 abscedet B ingemiscit TV, ingemiscet B 7 inest] enest B 8 legatns B nec-aontraria om. B add . in mg. inf. corr . 9 repperiuntur BV occurret B 12 nec. (i eras.) L 13 uirtutum - resignat alio atramento exarafa in T 14 dm/// (m corr.) B, dominum b actorem 2" 15 quod] quo B 17 se cuba B, excubias B (a I. m. rec.) b sermiensium BLTVb 18 limis B 19 coacerbata B b uulnere L 20 regentium V nelectum L 21 unde D, ne LV, nae Bb, ne" T, ne M (nempe in archetypo scriptum exstabat ue ̃ cottidiana B 22 ligationum B mitebatnr T* 24 gnnderit B6, gnnderich T 25 in tnam iniuriam redire p possessionem te dominante retineri, nec sufficiebat consolatio, quod eam tu non perdideras, cum inmensus esset dolor, cur illam retentator non inter dominationis tuae exordia reddidisset. minui aestimas quod non crescit imperium. postquam tamen liquido Traserici patuere conmenta, Gothorum nobilissimos Pitzia, Herduic et pubem nullis adhuc dedicatam proeliis destinasti, ut, si oblatis pactionibus adquiesceret, semel inuaso locorum potiretur arbitrio. sed usus inconstantis felicitati tuae obsecutus est: fugit sponte aliena et sine inpulsu exercitus tui deseruit quod debebat. continuo Pitzia, qui et de te euentus utiles sumpserat et consiliorum momenta. librabat, non adquisitam esse terram credidit sed refusam, nec rapinis ut lucratiua populatus est, sed dispensationibus seruauit ut propria. quibus ibi ordinationem moderantibus per foederati Mundonis adtrectationem Graecia est professa discordiam, secum Bulgares suos in tutela deducendo, quibus inter Martios conflictus castelli uice usa minitatur. tunc Mundo credens ad praesidium sufficere, si cohortes tuae quid pateretur agnoscerent, pernicibus nuntiis periculi sui fidem conmisit, qui ante defensores inire pro partibus suis conspexit certamina, quam moliri didicisset. ut tamen eminus Pitzia indomitam Bulgarum iuuentutem speculatus est, ardentes adulescentium impetus potioribus uerborum armauit incendiis: "meministis, socii, cuius ad haec loca conmeastis imperio: nemo absentes credat regis 2 tn om. DMT 3 reddisset B 5 gotorum BLV nobilissimos p,. nobilissimus libri 6 pisia T pitziah erduic V, prahaberduic DM puberem T 7 dUtinasti B, destinati L inuasa Bb 10 debeat B pizia BT, picia M 11 ntilis B deliberarat b 12 credidit sed] credidisset DMT 15 adtrictationem BLV grecia TV, gretia L 16 uulgares BLM TVb martius B 17 conflictos L calstelli L, ac stelli b, ac teli p 18 cohortis B paterentur B (s. I. m. rec.) b, pararetur coni. Manso 19 nuntius L sui om. Sirw . 20 defensores p, defensoris libri 21 ut om, Sirm . piiia B nulgarum libri 22 ardentis B aduliscentium impius B, ad ulciscendum impetum B (s. I. m. rec.) b 23 meministis meministis ........... B 24 conmeastes B1 absentis B, absenteis bp nostri oculos, pro cuius fama dimicandum eat: si caelum lancearum imber obtexeret, qui fortius telum. iaceret non lateret. ferro pectora inmergite, ut ueniat de horrore uitae spes manifesta uictoriae. credo regii testem roboris iam defunctum nec superesse qui illis quem habeamus dominum consueuerat indicare. aut forte gentem nostram dedignantur aestimare de principe P intellegant ab eo fluxisse quod gerimus, nec liceat illis quod rector noster transmisit ad originem uni tantum debere personae". haec eloquia lituis conmutauit: continuo ut adsolet ater nimbus tectis crepitantibus procellarum mugire discursu, sic se praecipitem plebs Martis inmiscuit. incerta diu conflictus lance titubauit, dum par ex utroque latere pugnandi surrexisset asperitas. concurrebant duae nationes, quibus numquam inter gladios fuga subuenerat: miratae sunt mutuo sui similes inueniri et in humano genere uel Gothos resistentem uidere uel Bulgares. interea dum anceps esset fortuna certaminis et pennatae mortes sibi aethera uindicarent, superauit nostri memoria principis, dum agerent, ut singulorum apud eum merita campus adsereret. uersa est in fugam natio punita grauius, quod euasit: tellus excita tremuit concussione cornipedum: cum ingenti lamentatione properabant, postquam uiderunt non esse se dubios de salute. caeli arbiter deus, munera conlata multiplica. illi numquam dubii de triumphis, illi quos suspexit uniuersitas perditis bellorum signis et perculsi incolumitate discedunt, terque et quater beatos esse 1 cf. Verg. Aen. XI 610 2 obtqgeret B (i. I. m. ree.) b . ieceret B, ieoerii B (A rec. 8.1) b 3 latebet B, latebit b ferrum D pectori JDM õ habebamas T, haberemus DM 6 dedigenerantnr T* 7 intelligant BLT 9 tantum (n corr.) B caeloquia B 11 discursu coni. Manso, discursum libri, decurau fort . 12 titubabit B 18 aurrexit p in mg. nationis B 16 similis BLTlV 16 Gothos scripsi, gothus (u eorr. ex ó ?) T, gotus BLV, Gothum p mdere scripsi, audere libri uulgares libri 17 pinnatae B nendicarent MT1 18 principee B 22 uider ̃ |bant L 23 dnbii Bb, dubio DLMTV (fvit in corum archetypo in dubio) 95 percussi MT incolomitate B beatu. B clamitantes quos oppetere contigisset. quid strages militum reuoluam et Sabiniani ducis abitionem turpissimam, cum a ratione diuidatur retexere exterminatis patrociniis quid euenerit indefenso? tunc ne diuidatur celebrandus saeculis Pitzia non tam militasse gloriae quam cupiditati, liquit feris aut auibus campi laborem, cum ieiunum militem opulentis detrahere cadaueribus nihil iuberet. sed haec quibus linguis sufficienter explicanda sunt? qua poterunt facundiae dote reserari? diu tu uicisti in uniuersis congressibus tuis, nunc incipiens in obsequio habere uictores. interea ad limitem suum Romana regna remearunt: dictas more ueterum praecepta Sirmiensibus: de suis per uicinitatem tuam dubitant qui hactenus nostra tenuerunt. quid castigatas Vandalorum uentis parentibus eloquar depraedationes, quibus pro annua pensione satis est amicitia tua? euagari ultra possibilitatem nesciunt duce sapientia: adfines esse meruerunt, quia oboedire non abnuunt. 
13	\' Haec de gestorum tuorum cumulis maior uoto quam eloquentia strictim digesta replicaui, melioribus intacta derelinquens. uidero quis me uincat facundia: nemo circa te transcendere ualebit affectu. habes hanc deo inspirante mansuetudinem, ut te plus credas posse diligentia quam timore. excellentia bona sunt gloriae tuae inserta monumentis, ut, cum te reges metuant, ament famuli: nam quaecumque tibi metitis 2 duces B ambitionem DMTp 3 diuidatur] deaitetur uel defendatur coni. Manso quid diuidere significaret non intellegens quod DT eueneret B 4 pixia T 6 ician∗um (i? eras.) L, ieiunumum T 7 nil MT iuberet Bb, iuaaret BDLM TV .8 facondie T, facundiae (e exp. m. rec.) B, facundia b \' doie om. b roserari deletum fere et expunctum m B, doceri b 9 congraessibus B, congressi∗∗∗bus L tuu om. Bb iocipies p 11 dictas Bp, dicta LMTV, dictat p m mg., dictus b sermiensibus Bb, sirminionsibus L 12 saam DT actenus B LV 18 uuandalorum LTVb 16 poaeebilitatem B 16 obnnnnt L 18 degesta replicaui B, degnatare placnit B (s l. m. rec.) bp 19 faoondia T1 21 indolgentia coni. Manso timere] amore T 28 famuli ament LMTV tibi T s . L m. 2 subiectorum uiribus dari imperas, credis posse denegari. o regem omni tranquillitate conpositum, qui deuotioni nostrae imputat quod. inpendimus seruituti ! 
14	Quid quod a te Alamanniae generalitas intra Italiae terminos sine detrimento Romanae possessionis inclusa est, cui euenit habere regem, postquam meruit perdidisse? facta est Latiaris custos imperii semper nostrorum populatione grassata, cui feliciter cessit fugisse patriam suam: nam sic adepta est soli nostri opulentiam. adquisistis quae nouerit ligonibus tellus adquiescere. quamuis non contigerit damna nescire, sub te uidimus euentus optimos de aduersitate generari et fieri secundorum matrem occasionem periculi. uluis liberata gratulatur terram incolens, quae hactenus dehiscentibus domiciliis solidioris schoeni emergebat beneficio. 
15	Par fuit etiam, ut eloquentiam laudis praemiis incitares, ne adoreas tuas silentio perderemus. nullarum artium cessat industria: sollers ubicumque latet inquiritur : magistratum, etiam si longe deguerit, exiget qui meretur: numquam absconditur quem prodiderit innocentia, dum, subtilis arbiter, non placaris uoce sed actibus. parentum nostrorum qui occubuerunt apud te bene acta seruantur: cuius mansuetudini tuae fides innotuerit, hereditatis iure quod auctori debueris soboli 1 uiribus d. i. n. credis T m ras. m. 2 credes B b, credit DM denegari potius quam denegare ud denegaMe B, degenerare L* 2 deuotioni (ait . i in ras.) B 3 impotat B 4 alamanniae (alt . a in e? corr.) B, Alemanniae b 7 custus B grassata b, crassata BLMTV 9 adqaisietis T1, adquisita eat iis p tellus omittondum censet Schettus 10 non) nos B dampna LM. TV 11 uidemus DLMTV optimna B 12 uluis m utilius T corr. m.2 13 treram B hactenua] flaotiboa coni. FerUg, aqua hacteous fort . domi aliis DMT 14 solidiori bp achoeni emergebat coni. Fertig, cheniem mergebat BL, chenice ̃ ∗ (a cras.) mergebat V, siceme pergebat T, scheniem mergebat bp, sic emergebat p m mg., coeai (». e. limi) emergebat coni. Schottus; graeci uocabuli ϭϰοι̃νος uestigia recte dispexit Fertig 16 perderimus B 17 latit B . 18 delituerit coni. Mamo, sed cf. Wisner Studien XI p. 246 . exigit fort. 19 suptilis B 20 placares Bb 21 mansuetudine Bb 22 actori MT debueras DLMTV soboli (pr. o corr.) B mox refundes. habemus de maiorum obsequiis fructum, et tamen de excessibus supplicia non timemus. finitur indignatio moderata cum homine, cum propter retributionem quaerat tua pietas successorem. 
16	Restant adhuc multa quae dicerem, sed inter plures actuum tuorum praecones conuenit inlibatum aliquid reseruari. debent tibi ueneranda studia quod locuntur. amauerunt praecessores tui inscitiam, quia numquam laudanda gesserunt sordebat inter aratra facundissimus et quod peritia dederat uis negabat: muto maerebant actore tribunalia nec ulla concedebatur palma dicenti. in casum negotiorum nutabat euentus, quando litteris genius non dabatur: unus ubique ingenia maeror oppresserat, quia adterebant otia eloquentium facultates: pompam seniorum edax neglegentia possidebat nec accendebatur tiro aemulatione sectanda. uide diuitias saeculi tui: tunc uix fora habuere perfectos, nunc ecclesia dirigit laudatorem. 
