1	Illi, princeps uenerabilis, in laudibus tuis perscribat professio, illum a praeconiis propositi repellat consideratio, quem a defensione tua aliquod subtraxit officium. refundat tibi generalitas rebus obligata sermonem, dum inaequalis uicissitudo conpensat laudibus quod adepta est de sudore. armis tuis libertas obnoxia, quod solum potest, hilaritatem didicit adnuntiare praeconiis. tuum est, inclyte, deuotioni pretium dare, quam intellegis uires subditorum non posse transcendere: erit dispensationis sacrae de famulis aestimare quid exigas, in quibus agnoscis totum tibi militare quod praeualent. propriis maiestas tua oblationem litterariam dignetur altaribus, quia, In nomine patria et filii et sps sci praemittit inscriptioni B Incipit panegyricuB (panygericus B1, panecyricns L, panigericns MT) dicttis clementissimo regi (rege L) theoderico (theodorico LMT) ab ennodio dl famulo (ab e. d. famnlo om . M) inscr. BLMTV; cum in codice P hoc opusculum imterciderit, ex recentioribus D = Monacensem 110 saec. XV a Mansone conlatum et M = Magliabecchianum 16, 29 a. XV hic illic adhibui; p autem editionem Variarum Cassiodori Parisinan a. 1588 significaui 4 illum DLMTV proscribat p m mg., praescribat p, rescribat fort . 5 pconis L \' 6 refundat] referat DMp 9 didicit Db, dedicet LMTV, didicet B adfictiare L 10 indite MT denotionis L, denotoram D 11 quim C cxp. et a ex ae fort, corr.) B sudditorum B 18 cognoBcis b, agnoscitis L 14 litterariam (ariam in ras.) B, litterarum DM \' ne senescat claritudo operum, aduocanda sunt linguarum exercitia. quid egeris, ne uetustas sibi uindicet, obliget catena referentum: disciplinarum enim quietem uos tribuetis, per quas uobis continget aeternitas. nihil amplius caelestis dispensator arcani Ab humanis poscit ingeniis, nisi ut intellegant quo ueniat auctore quod sapiunt. inter deo proximos agnouisse qui praestitit reddidisse est beneficium: quod descendit a superis, sola hymnorum licet mercede taxari: fabricator mundi ad potiora munera modulatis inuitatur eloquiis. dicite, si non praemii loco opifici sua lingua blandiar. iungitur quod de sacrario mundi pectoris laudatio debet principalis effluere. nec solum linguae nitorem postulat conmemoratio numinis tui bono adserenda conscientiae. in diuinis obsequiis feriato ore peragit mens serena sacrificium: actuum munitus claritate in aetherio cultu etiam mutus obsequitur. ergo et me titulus, qui obstare putabatur, inuitat: utinam mundior professio habeat concordiam cum secretis nec dissentiat splendor cordis a corpore. 
2	Salue nunc, regum maxime, in cuius dominio saporem suum ingenuitatis uigor agnouit. salue, status reipublicae: nam nefas est, speciatim a te simul conlata narrare et unius bona temporis uerborum diuisione discernere. si bella regis mei numerem, tot inuenio quot triumphos: congressui tuo nullus hostium, nisi qui laudibus adderetur, occurrit: militauit tropaeis qui restitit uoluntati: nam semper aut pietati tuae peperit t 2 uendicet DT obligec B, obligat DM cathena MT 3 referentium jDT, referentum (en corr.) B, refertitum b 4 nobis MT 5 intelligant BT 6 actore MT deo B in ras., dd DMT (sed 11 in ras. T), deoa p proximos em. Schottus, prozimus Bb, prozim V, proximum DMLT, proxime p 7 red|disse Bl qui DM 8 ymnorum BLTV 9 dicete Bb, discite DMp 10 sna scripsi, suo BLMTV, om. b blandiar Bb, blanditnr L MTV 11 affluere DM N12 nnminhis B 13 bona Bb (sed a in ras. in B) 15 culta L, cultu. (s ? eras.) B et B in ras . 17 nec] ne SN. ab opere fort . 18 saluae B dominici B m ras . 19 uigors B 20 lpeciatim] separatim Mp (in mg.) et Sirm . 21 diuisiones B 22 quod triumphuB B 23 post occurrit plus dimidia linea uacua in B tropheis LMTY, tropeis B 24 reeistit DMT subiectus gloriam aut qui praesumpsit tela uirtuti. qui te in acie conspexit, superatus est, qui in pace, nil timuit: nec promissio uenerabilis claudicauit inter prospera nec passus moram uigor in proeliis. callis tuus multo uallatus obstaculo et cotidianas uictorias uidit et profectionis detrimenta non attulit, sic inimicorum interclusus agminibus, at negaret accessum, sic tuo patefactus inpulsu, quasi hostium prouidentia nil noceret. haec si felicitati tuae adscribenda sunt, est plena dos principis, omni honore augustior, si labori. prima dextris ominibus contra naturam certamina suscipiens, ne resistendi spes relinqueretur inimicis, uarias tibi loco principe caeli leges, terrarum munimina, fluminum imperuia subdidisti. mentior, si umquam dispositis tuis inpedimentum exhibuit ardor aut frigus, si tumore gurgitum, si bibendi necessitate constrictus es, si Alpium iuga connexis poli sublimitate sociata cursibus tuis attulere tarditatem. nescierunt resistere quos deuictis locorum munitionibus inuenisti, quia securos faciunt interrupta quos protegunt et laxatis in otio animis uiuunt qui tutiora possederint. aduersus te nec campestris habitatio pares protulit nec quos amplexa sunt inuia, nisi extiterunt supplices, a depraedatione subduxerunt in possessione tua. positus sine formidine diuitias indicauit, nec rebellem inuit, si pauper innotuit: nemo indignationi tuae nisi humilitate subtractus est, eum in sociorum profecisset numero qui rogauit. non tibi I. 1 qui tenatie L 8 caudicauit B 4 nigor moram DLMTV 5 cottidiamae L professionis DMp, profeotioai coni. Manao 9 augustior DT pti pzima V 10 omnibus BfD, omibos T 11 relinquetur L 12 mnnima LV imperuia scripsi, superbia BLMTVb, superba p, superbiam coni. Manso mencior si L, si mentier b 18 edbuit. B ardoni nt frigora B, ardere ut frigera Zp i4 timore DT 15 est L conuexi Tp, connexis i et Sirm. 17 securas B ut uid. 19 possiderent Bb, possident p in textu, possiderunt p in ung . 20 nec] ve L 21 subduxerunt scripsi (fuit in archetypo subdux), subduxit libri 22 iuait p (in mg . iaaet), iubet libri 18 nemo (t in ras.) B indignationi (on in ras.) B subtractum Ls ignotas est algor Scythiae, non Meroen aut anhelum aestibus Cancrum ut alterius possessor orbis ignoras: didicisti uniuersa subigendo quae nobis uix auditu patuerunt. haec quidem maiora sunt homine: sed qui ad mundi paratur gubernacula necesse est ut uniuersis ueniat cardinibus institutus. nimis uelociter tempus maturae laudis adripui et quasi non in primordiis fluuius etiam torrentis fatiscat ingenii, sic per narrationis famem fruges perfectae aetatis inuasi. laurearum ordines quaerit qui et celeritate earum superatur et numero. citius a te, inuictissime, insignia quae reteximus impleta sunt quam dicantur. quis ferat in gestorum suorum elocutione torporem, quem in actione non pertulit? 
3	Educauit te in gremio ciuilitatis Graecia praesaga uenturi: quem ita ingressum uitae limen erudiuit, ut dum adhuc de puero haberet hilaritatem, mox eam sequeretur securitas de tutore. adhuc in cano flore degebas adulescentiae nec uirtutum messem lacteus ante experimentum culmus attulerat, adhuc blanda erat imago pubescentis nec tingens faciem lanugo uestibat: quando aeui purpura et flosculus superuenientis imperii promittebat sollicitis de gratiae conmutatione terrorem, cum ad probationem roboris et clementiae tuae ruptis uinculis furor emicuit et euisceratas diuturna quiete mentes occasionis pabulo subiugauit. pulsa est extemplo principalis urbe reuerentia et in uacuam possessionem nullo adscitus sanguine tyrannus h u 1 scytiae B, sithie DT1 merce Bb nau aestibi cancrum deleta in m. rec. quae aestum supra scripsit, aestum b anelu L 5 uniuersis] iniquos L 6 pimordis L1 7 actiam L fetescat Bb 8 faA T 9 caeleritate B, sceleritate T 10 reteximus (ex ex iz ut uid. corr.) B 12 quê (8 in raa.) T 13 grae- mio B gtia T, gretia L, gratia D 14 ingress ̃ L, ingraes B, ingens bp lum T 16 haberet] ht T eum b 16 adoli- scentiae B 17 lactens M 18 pabiscentiB B cingens fort, fingens p in mg. aestiebat b 19 flusculus B inperii B 21 ad] in Sirm. rnboris Bbp furore micait B, furorem micuit b 22 euiscerata T mentis B 23 exemplo L 24 uacua BLM tyrannas B cessit, qui aula potitus definiuit, postquam metu hostes suos debellauerat, nihil superesse quod gereret: cam animos tuos sine annorum suffragio inpulit lux naturae, ne aut causa melior te coram posito subiaceret, ant non beneficium necessitatis tempore redderes quod pacis acceperas. in ipsis congressionis tuae foribus cessit inuasor, cum profugo per te sceptra redderentur de salute dubitanti. uentilemus historias, interrogentur annales: apud quos constitit refusum exuli, quem cruore suo rex. genitus emerat, principatum? castrensis gloria turmarum participatione dispergitur nec ad unum referri potest quod uenerit conlatione multorum. singularis boni fructus est ambitionis refrenatio, illo maxime tempore, quo sine opinionis damno possis adquisita retinere. par te, inclyte domine, laus respicit donati diadematis et defensi. si te illarum rector partium non amauit, perculsus praefuit reipublicae, si dilexit, obnoxius: usus es in tuorum fide meritorum teste purpurato. 
4	Iam tunc in ius tuum se palatia ipsa contulerant: nemo credidit non te posse ad quem uoluisses transferre quod reddideras. sed parcus in exigendis praemiis, quasi sufficerent ad uicissitudinem operum tuorum, fasces accepisti, non quo tibi accederet genius de curuli, sed ut de te pretium palmata mereretur. quis hanc ciuilitatem credat inter familiares tibi uiuere plena executione uirtutis? ille annus habuit consulem, qui rempublicam non tam sollicitudine quam opinione tueretur, 1 quia nlla B metam BDLM hostee T (es in ras. corr.) bp, hostis LV, hoste (e eorr. uid.) B, hosti DM snos] uoe L 2 nil TV animiu tuus B 8 ne] nec L 5 redderi. B acciperae B congraeesionis B1 6 cessit Bb, accessit DLM TV redderentur (re ex ra? corr.) B 7 uentelemus B* 8 euuli LV 10 referi L 12 quoquo B 18 dampno L TV par te] parte ̃ Bb, parce T, per p in mg . incUte L MTV 14 respicet B diadimatis B 15 si om. L 16 ea] est DLMT fidem p 17 palatia B contulernnt L MTV 19 sed parcus om. bp proemiis BL V 90 quod DM Tp 21 accideret Bb practium B palmata M, palmatam BLTV, palmatum D, palmarum h meretur T 22 ciuilatatem L1 28 exsecutione LV *nus (a corr. uel abr. uid.) B, unus bp quo in segmentis posito quae ab hostibus sumpta fuerant arma tremuerunt. quando talis contigit sorte lectoris, qualem dedit ab ipsa mundi infantia regum examinata claritudo? nolo per casus errare dominatuum: in tuo stemmate probati sunt qui reperti. Serranum scipionibus aratra pepererunt, qui dum grandia sulcis semina conmendaret, honorum ei messis oborta est. sed minus diligo prospera, quae sumunt a desperatione principium: uix paucos contigit degenerare nobiliter, cum familiae tuae debeas actus generis nobiliter custodire. quid mihi, uetustas, obicias agrestis membra paludamentis decorate? -ego tibi, quod admirationem uincat, oppono principem meum ita ortum, ut eum non liceat inprobari, ita agere, quasi inter imperatores adhuc precetur adiungi. 
5	Sed quid faciam, cui fecunda actuum tuorum seges occurrit, ubi uniuersa eligentem superant? nescio quas aristas horreis inferam, quas relinquam. stat ante oculos meos Bulgarum ductor libertatem dextera, tua adserente prostratus, nec extinctus, ne periret monumentis, nec intactus, ne uiueret adrogantiae, in gente indomita domesticus adstipulator superfu turus roboris tui: qui si sufficiens leto uulnus excepisset, personam uiceras: quod in luce substitit, submisit originem. haec est natio, cuius 1 sigmentis BMb, figmentis DLTVp sumpti L fuerunt b 2 treuerunt L contiget B lectoris Bb, lictoris LT V, litorie D, licoris M, rectoris p 4 casus] cursus fort . domi- Datum B, dominantium p in mg . stimmate B , 5 scipioaibus B • atratra L peperererunt B graoida (aida in ras,) T 6 ei* (ut uid. i. e. eius) L meeses B 7 ad spiratione B 6ei\'(ntuid,i.e.eius*B principuum L 8 contiget Bl tuę (ę corr.) B 9 qui B 10 obitias L, subicias (u ex o uel a corr.) B agxestia p et Sirm. post decorata dimidia et tota proxima linea uacua in B 11 ornatum ut etim DMTY, ornatu ̃ (n ex & corr.) ut eum (ut eum extra uersum add.) L, ortu mutilum b, ortam nt illum p 12 improbaie Schottus 13 precetur B\' 14 feconda T1 occurret B 15 horreis aristas DMT, arestas h. B 16 uulgarum BLM TVb, uulgaris D 17 libertatem D p in mg., libertem BLMTVb asserentem L 19 superfuturos L rnboru B 20 si. L s . JL, om. DM loeto LV, laeto B 21 subtnusait L ante te fuit omne quod uoluit, in qua titulos obtinuit qui emit aduersariorum sanguine dignitatem, apud quam campus est uulgator natalium (nam cuius plus rubuerunt tela luctamine, ille putatae est sine ambage sublimior), quam ante dimicationem tuam non contigit agnouisse resistentem, quae prolixis temporibus solo bella consummauit excursu. hos non montanae strues, non fluminum obiectio, non negati egestas alimenti in artum necessitatis lege continuit, dum credunt satis. esse ad delicias equini pecoris lac potare. quia ferat aduersarium, qui pernicis iumenti beneficio currit et pascitur? quid quod et illis animalibus indicunt studiosae famis patientiam, per quae esuriem uitare didicerunt P quemadmodum fit, ut ieiunae cornipedis sessor uisceribus cibos extrahat, quos illa ne conderet, diligentia instruente prospexit? his ante mundus peruius esse credebatur: nunc illam sibi tantum orbis partem interclusam aestimant, quam tueris. esuriem multa transcendo, ne pigrioris stili uitio serus aduenias, Romanae fax curiae diu in umbram coacta tardius elucescat. 
6	 Inter uitae tirocinia et triumphorum maturitatem pectori sacro affectum nostri caelestis fauor infudit. iam diuturnae quietis dispendio per gubernantium uilitatem potens terra consenuerat: iam attulerat publicis opibus pax intemerata defectum, cum apud nos cotidianae depraedationis auctus successibus intestinus populator egeret, qui suorum prodigus incrementa aerarii non tam 1 aaluit b, uoluit potius quam ualuit B titalos Mb, titulus SDLTV optinnit L 2 sauguinem B 3 cuiu T, cui D rubuerunt (pr . u corr.) B 5 dimigationS L contiget B b 9 dilicias B po∗tare (r eras.), L 10 pernices B nimenti T curret B et] det B . . 11 studiose LTVp fames B 14 conderit B ante] epim T 15 bis or lpartem (parte in ras. syllaba bis abr.) L 16 tueres B ulta B 17 stilli B, styli b p , stellae LMTV serius p, ne serus B 18 diu inclusit Schottus umbram Sirm., umbra libri 19 tyrocinia &LV 20 dispendium L1 21 gubernantum MT 22 deffectum B .28 tl codianaa L, coMidianae B, equotidiane DM actos DMT 24 egerit populator DLTV prodigSs Ll erarii B poscebat surgere uectigalibus quam rapinis: saeuiente in ambitu pauper dominus odia effusione contraxerat, sed nec defrudatis uiribus quod minuebat opulentiae iungebatur affectui. tunc enim aulae angustia in artum res priuatas agitabat nec micare usquam scintillas famulantum extinctus tyranni fomes indulserat. metuebat parentes exercitus quem meminisse originis suae admonebat honor alienus: nam ire ad nutum suum legiones et remeare pauore algidus imperabat. suspecta enim est obedientia quae famulatur indignis, et quotiens praelatos conuenit conscientia stirpis ultimae, et illud metuunt, quod timentur. nata est felicis inter uos causa discordiae, dum perduelles animos in propinquorum tuorum necem Romana prosperitas inuitauit generata est ab inualidis causa certandi, et ne uel a negotio perituris ueniret fiducia, pars fugacium proelia concitauit. tunc a te conmonitis longe lateque uiribus innumeros diffusa per populos gens una contrahitur migrante tecum ad Ausoniam mundo: nullus praeter parentem iter adripuit: sumpta sunt plaustra uice tectorum et in domos instabiles confluxerunt omnia seruitura necessitati. tunc arma Cereris et soluentia frumentum bobus saxa trahebantur: oneratae fetibus matres inter familias tuas oblitae sexus et ponderis parandi uictus cura laborabant. tunc in campo hiems et iugi pruinarum candore uelata caesaries barbam stiriis implicuit crine possesso. nam quod diligentius indumentum matrona \'1 saeuiente in scripsi, Baeniente coni. Fertig, saeaientem libri ambitum p 2 dominus Bbp, dominum DLMTV odiosa p defrudatis B 3 minuebat] imminebat com. Sirm . affectai scripsi, affectn libri 5 extintus B 6 maetnebat L 8 legionee DMp, legionis BLTVb algidua (gid ex dig? in ras.) L 9 quotiens (quot ex coc in ras.) L praelatoe p, praelatns libri 11 timenlreni Ll feliois T\'p, felices BLMТ1Vb perdnelles Mp, perdnellis BDLTYb 12 animos p, animus libri romana p, romanam libri 18 ab om, p 14 &] an Bb, in p fngatium B 15 longae B innnmerns B1 18 et om. DM domus instabilis B 19 seuitura T1 cereis Lx 20 bubus B, bosus L onerate L, honerate MT 21 suas fort . 22 spandi T laborant Sirm. hiemps MT 28 cesaries LTV stjrriis BLV implie∗uit (i? eras.) L neuerat durante gelu ut adhaereret corpori frangebatur. pastum agminibus tuis aut indeuotae nationes aut educata lustris fera suggessit 
7	Inter haec, quae tibi cum glacie aut ardore cesserunt, unam certaminis tui lineam summotenus libet adtingere. Vlca fluuius est tutela Gepidarum, quae uice aggerum munit audaces et in iugorum morem latus prouinciae quibusdam muris amplectitur nullo ariete frustrandis. ad hunc te callis tui rigor adduxit, ubi pro legatis et gratiae postulatione obsistendi animo gens diu inuicta properauit, cum paene cohortes tuas ante inimicos famis necessitas obsideret. dic, quaeso, clementissime domine, quid praeter te spei erat residuum in populo harenae aut sideribus conparando? instantibus Gepidis amne pestilentia iter, quod declinasset fugiens, contra nudatos uagina gladios transuolasti: nullius inscii mersa caeno haesere uestigia: nullus uitae prodigus periculum ignarus incurrit. uincitur humanae mentis auctoritas praeuisione discriminis: labascit fortium conscientia, quotiens formidanda oculis ingeruntur. stetit ante indomitam iuuentutem certa de mortibus optio, cam nulla uideretur securitas de salute. quid Catonem extulistis, prisca monimenta, quod per Libycas Syrtes duxit exercitum, dum humanas neces ludibria faceret esse serpentum, uel cum sine uirtutis pretio educatum caeli uaporibus ueneni frigus expertus est? neminem contigit chelydros ante uidere quam exitium, dum per flamen prodigiosum, e corporis fabrica ut adsolent 20 cf. Lucan. Phars. VIIII 690 sq. 1 adhereret B 2 in agminibus T qducata L 4 haeq L glatiq L una bp 5 linea p ulcea T 6 gepedarum DMT manet B 7 iugoru ̃ (ù m ras.) L morem p, more libri morellatas DM prouintiae LV 9 ligatiB B 10 pene LTV 11 fames B obsederet B 13 syderibus MT 14 nudatus Bl gladius B\'L 15 ceno T 16 incurret B 17 labeecit MT 18 conscientiam Bl 19 cQrta B moribus DM 21 monumenta M et Sirm. lybi∗cas L, lybicM B V, libioas MT 24 contiget B cylidroe B (o ex n corr.) b, cylindros p, chelidros LMTV, chelindros D 25 e p, et libri fabrica∗ (m eras.) L animae, in auras euolaret. non cum uiri fortis laude perimitur qui unde ueniat nescit occasus. nec illius militis cuneis tuis fortitudo conparanda est nec par est in duce sapientia. illum ciuilis belli furor agitabat: te orbis domina ad status sui reparationem Roma poscebat. sed quid differo quod tibi euentus dexter exhibuit? cesserunt confertissimis hostium tuorum turmis quos ulterior ripa susceperat. urguebantur telis quos uorago aut inruptio non tenebat: ieiunas pectorum crates acta ualidioribus lacertis lancea transmeabat, cum inter naufragia terrena et cruoris undas inuictissimus ductor apparuit, tali muniens adstantes alloquio: "qui in hostili acie uiam desiderat me sequatur: non respiciat alterum qui dimicandi poscit exemplum. uirtus multitudinem non requirit: ad paucos uadunt bella, bellorum fructus ad plurimos. de me aestimabitur exercitus, et in his, quae gessero, gens triumphat. adtollite signa, per quae ne lateam prouidetur: nouerint quem petant aut cuius iugulis adquiescant. qui congressui meo occurrerint nobilitentur exitio". his dictis, poculum causa poposcit auspicii et laxatis in proelium habenis effusus est. ut torrens sata, ut leo armenta uastasti, nec concurrens quisquam substitit nec euadere potuit insequentem. portabare per uniuersa iam deficientibus telis adhuc ira crescente. extemplo Gepidarum. uersa condicio est: palantes uisi sunt mutata sorte uictores. nam tu, uenerabilis, qui incomitatus gustum luctaminis adripueras, uallatus milibus incedebas. caesa est multitudo aduersaria, donec paucos eriperet nox uicina, dum ad uaga horrea copiis urbium referta 1 peremitur B, pimitur L 2 aenit Sirm . milites BLVb 4 agitabat] attigebat T 6 cõfertissimis (5 in ras.) T, confortissimis L, cum fortissimis DM 7 ripas L urgnebantur B, urgebantor LTV uirago aut (et p) quos Bbp 8 terebat fort . 11 ostili L 15 triumphabit p 16 petant (a in ras.) L, paetant B iu cus L 17 occurrent B nubilitentu B 18 poposcisti coni. Manso aspicii B, auspi officii V, oautofficii L 19 auenis B est om. p et Manso 20 uastati 2x subBistit B aeuadere B 21 portaueris Bb, portabaris p 22 iepidarum L 28 ∗∗uisi (ui uel in eras.) L 24 militibus B (m. rec. s. l.) bp 25 caessa B done L 26 et nox L cupiia B ueniretur, quae non solum satisfacerent necessitati, sed subleuarent inter deliciarum. secunda fastidium. ita prosperis tuis militauit aduersitas et contra famem tuorum excursus pugnauit hostilis: uicit inediam inimica congressio, nec redisses ad ualitudinem, si certamina defuissent. haec de innumeris actibus in ordinem digesta sufficiant. transeo Sarmatas cum statione migrantes et plebem conflictuum numeratam sileo de tropaeis. 
