5.2	tunc ergo a uiro dei hoc responsum praedictus accepit: si nos una catholica fides annecteret, magis me de uitae perpetuitate debuisti consulere: sed quia de praesenti tantum salute sollicitus, quae nobis est communis, interrogas, instruendus ausculta. Gothorum nec copia. nec aduersitate turbaberis, quia cito securus eis discedentibus tu desiderata prosperitate regnabis: tantum ne humilitatis meae monita praetermittas. non te itaque pigeat pacem appetere etiam minimorum, numquam propriis uirtutibus innitaris. maledictus, inquit scriptura, qui confidit in homine et ponit carnem brachium suum et a domino recedit cor eius. disce igitur insidias cauere, non ponere: in lectulo quippe tuo pacifico fine transibis\'.
5.3	qui dum tali animatus oraculo laetus abscederet, perlato sibi, quod turba latronum aliquos captiuasset ex Rugis, uirum dei misit protinus consulendum. qui sanctis eum mandatis, ne 17 Hier. 17, 5 1 Krcen rugorum cod. Vind. 1064 flaccitheus L flacetheus N 2 cpit CGL1 TV cepit N inferiore CGL 3 infensos] infestos L 4 is] His N 5 celeste L cqlestq N 6 pricipibus G 7 postulasse] ptulisse N 8 denegatum] delegatum L 9 accipit N 10 annecteret (n prior sup. uers. a m. 2) L adnecteret M me] ime V; om. CG uite V perpetuitate libri: perpetuae (= aeternae) salute uel prosperitate Hartel 11 sollicitus quae nobis est] om. V 13 turbaberis CGNTV: turbaris L turberis M 14 desiderata prosperitate L 15 pretermittas L 21 dum MNTV (cf. Paucker Spicileg . add. lexic. lat. p. 67): cum CGL sl sibi V 22 latronum MNTV: latrocinantium barbarorum CGL uirum CGLMNTV (er. Lucif. p. 7, 15 ed. Hartel): ad uirum Sauppe ex codd. rece . 23 misit] om. M protinus] protinus adiit (adiit a m . 2 in ras. 5 litt.) M praedones sequeretur, domino reuelante praemonuit dicens: si eos secutus fueris, occideris. caue, ne amnem transeas et insidiis, quae tibi in tribus locis paratae sunt, improuida mente succumbas: nam cito nuntius fidelis adueniet, qui te de his omnibus efficiat certiorem).
5.4	tunc duo captiuorum ab ipsis hostium sedibus fugientes ea per ordinem retulerunt, quae beatissimus uir Christo sibi reuelante praedixerat. igitur frustratis insidiis aduersantum Flaccitheus incrementis auctus prosperioribus uitam rebus tranquillissimis terminauit. 
6.1	Post haec autem quidam Rugus genere per annos duodecim incredibili ossuum dolore contritus omni caruerat incolumitate membrorum, cuius cruciatus intolerabilis circumquaque uicinis factus erat ipsa diuturnitate notissimus. itaque nihil proficiente diuersitate remedii tandem uidua mater ad sanctum uirum uehiculo filium deduxit impositum et ante ianuam monasterii proiciens desperatum continuatis fletibus reddi sibi unicum filium precabatur incolumem.
6.2	sed uir dei sentiens a se magna deposci fletu commotus aiebat: \'quid opprimor opinione fallaci? cur aestimor posse quod nequeo? non est uirtutis meae praestare tam grandia: consilium tamen do tamquam misericordiam consecutus a deo. tunc mandat mulieri, ut pauperibus aliquid pro suis uiribus largiretur. illa nihil morata uestem, quam induta fuerat, se uelociter exuens egentibus diuidere properabat.
6.3	quo audito uir dei feruorem eius admirans iterum mandat, ut suis operiretur amictibus, 4 1 domino] om. V dicens] didicens G; om. M 2 insidiis] I insidias G* supr. uers . 4 nuncius V tq M 5 effitiat M 7 sibi] om. M 8 aduersantium CGLN flaccitheus (q a m. 2) L auctis V 9 uita V tranquillissimis* L 11 ossnum NTV (cf. Boenseh Itala u. Vulg. * p. 265): ossium CGLM 12 incolomitate LMNTV menbroram MN crutiatus TV 14 nichil CGLM; sic semper - profitiente M 15 filium] add. M2 supr. uers . dedaxit] dedexit Ml adduxit CG 16 ***ianuam L 17 filium] om. CG incolomem LNTV incolumen CG 18 senciens V 19 estimor CGLMN 20 uirtutis] enim uirtutis L 21 tamquam-a deo CGMNTV: om. L 23 uestem quam CGMNT V (cf. Hartel Ind. ad Gypr. p. 431): ueste qua L 24 egentibus L 25 ammirans LIMNTI dicens: \'cum filius tuus tec am domino sanante perrexerit, opere uota supplebis\'. indicto igitur paucorum dierum de more ieiunio, fusis ad deum precibus ilico sanauit infirmum atque incolumem suis gressibus ambulantem remisit ad propria. 
6.4	 qui cum postea nundinis frequentibus interesset, stupendum miraculum cunctis uidentibus exhibebat. nonnulli enim dicebant: \'ecce ille, qui fuerat totius corporis putredine tabefactus\': aliis autem, quod ipse esset, omnino negantibus grata contentio nascebatur.
6.5	ex illo igitur tempore, quo est reddita sanitas desperato, uniuersa Rugorum gens ad dei famulum frequentans coepit gratulationis obsequium reddere et opem suis postulare langoribus. de aliis etiam gentibus, ad quas tanti miraculi fama peruenerat, multi Christi militem uidere cupiebant.
6.6	qua deuotione etiam ante hoc factum quidam barbari, cum ad Italiam pergerent, promerendae benedictionis ad eum intuitu deuerterunt. 
7.1	Inter quos et Odoacar, qui postea regnauit Italiae, uilissimo tunc habitu iuuenis statura procerus aduenerat. qui dum se, ne humillimae tectum cellulae suo uertice contingeret, inclinasset, a uiro dei gloriosum se fore cognouit. cui 14-p. 23, 2 exhibet Anonymus Valesii §. 46 p. 291 ed. Gardth. 1 filius tuus T tecum] in mg . add. Mx 3 sanabit G1 4 incolomem LNV incolumen CGM remisit] ire iussit N 6 exibebat C 9 quo] quod (d ras.) G SlN sanitas reddita N 10 desperata L uniuersa rugorum] uniuersarum gothorum (a del., 0 \'add. m. 2) M 11 cpit CGLIV 12 languoribus CGLMNV 13 Christi] xpiani V 14 quidam barbari - p. 23, 2 largiturus] apud Anonymum Valesii §. 46 p. 291 sq. ed. Gardth . 15 promerende GV 16 deuerterunt CGMNTV Anon. cod. Meerm. et Palat.: deuenerunt L 17 odoacar MNTV: odouacar CG odoacer L oducar Anon. cod. Meerm. m . 1 oduacar m. 2 odoachar Anon. cod. Pal . 18 uillissimo V I ulissimo L (i add. m. 2) tunc] om. Anon . 19 se, ne] om. Anon.; se (om. ne) L humillime LN humillimum tectum Anon. cod. Pal . humillimo tecte Anon. cod. Meerm . suo] eius suo (sua Meerm.) Anon . contingeret] ne contingeret L 20 inclinasset] et inclinasset se Anon. cod. Pal . se fore] esse forte Anon. cod. Meerm . ee fore te Anon. cod. Pal . etiam ualedicenti: cuade) inquit cad Italiam, uade, uilissimis nunc pellibus coopertus, sed multis cito plurima largiturus\'. 
8.1	Feletheus quoque rex, qui et Feba, memorati filius Flaccithei, paternam secutus industriam sanctum uirum coepit pro regni sui frequentare primordiis. hunc coniux feralis et noxia, nomine Giso, semper a clementiae remediis reuocabat. haec ergo inter cetera iniquitatis suae contagia etiam rebaptizare quondam est conata catholicos, sed, ob sancti reuerentiam Seuerini non consentiente uiro, a sacrilega quantocius intentione defecit.
8.2	Romanos tamen duris condicionibus aggrauans quosdam etiam Danuuio iubebat abduci. nam cum quadam die in proximo a Fauianis uico ueniens aliquos ad se transferri Danuuio praecepisset, uilissimi scilicet ministerii seruitute damnandos, dirigens ad eam uir dei ut eos dimitteret postulab at. uerum illa facibus feminei furoris exaestuans mandata reportari iussit asperrima. \'ora\' inquit \'tibi, serue dei, in tua cellula delitescens: liceat nobis de seruis nostris ordinare quod uolumus\'.
8.3	haec igitur audiens homo dei: \'conifdo* inquit, in domino meo Iesu Christo, quia necessitate compelletur explere quod praua uoluntate despexit*. uelox itaque secuta correptio prostrauit animos arrogantis. quosdam enim aurifices barbaros pro fabricandis regalibus ornamentis clauserat arta custodia. ad hos filius memorati regis admodum paruulus, 1 ualedicendi L pr. (corr. m . 1 in mg.) uadedicenti G1 Anon. cod. Meerm . inquid V Anon. codd. Meerm. et Pal . uilis»imis (s rasa) T nilisimis V 2 cito] scito L plurimi Anon. cod. Meerm . 3 Feletheus (q a m. 2) L Feua CGL filius] om. L 4 cpit CLlMTV cepit GL eras . 5 coniunx CGL (n alteram, add. L2 supr. uers.) 6 clementiae] dementia V reuocabat MNTV: retrahebat CGL 7 ergo] autem M cetera G L 8 quondam MNTV: quosdam CGL conata] contra N 9 seuserini M sagrilega T quantotius LMTV quatotius N 10 romanis V conditionibus MNTV 11 adduci M post abduci spatium uacuum unius uersus et semis in L 12 fabianis GL fauanis N 13 praecepisset] prqcessisset L (q a m. 2) minisUrii (eras.) T ministrii V 14 dannandos (corr. m. 1) L dapnandos M 16 serue dei] om. M 19 in] I add. 02 in mg . meo] om. CGL compelle«tur T compellitur L 22 pro] (= propter cf. I. 5 et Ind. ad Viet. Vit. ed. Petsch.) om. L 23 ammodum (corr. m. 2) LT ammodum N . nomine Fredericus, eodem die, quo regina senium dei contempserat, puerili motu concitus introiuit. tunc aurifices infantis pectori gladium imposuere dicentes, quod, si quis ad eos absque iuramenti praesidio ingredi conaretur, paruulum regium primitus transfigentes semet ipsos postea trucidarent, quippe cum sibi nullam spem uitae promitterent, macerati diuturnis ergastulis.
8.4	his auditis regina crudelis et impia, uestibus dolore conscissis, talia clamitabat: \'o serue domini, Seuerine, sic, sic a deo tuo inlatae uindicantur iniuriae! hanc mei contemptus ultionem effusis precibus postulasti, ut in mea uiscera uindicares\'! itaque multiplici contritione ac miserabili lamentatione discurrens fatebatur se pro scelere contemptus, quod in seruum dei commiserat, plagae praesentis ultione percelli confestimque directis equitibus ueniam poscens et Romanos, quos eodem die tulerat, pro quibus et rogantem contempserat, retransmisit et aurifices accipientes protinus sacramentum ac dimittentes infantulum pariter et ipsi dimissi sunt.
8.5	his auditis reuerentissimus Christi seruus gratias creatori referebat inmensas, qui ob hoc interdum differt uota poscentium, ut fide, spe et caritate crescente, dum minora petitur, maiora concedat. id namque egit omnipotentia saluatoris, ut, dum liberos saeua mulier subicit seruituti, seruientes cogeretur reddere libertati. 
8.6	 quibus mirabiliter impetratis regina statim ad seruum dei properans cum marito monstrat filium, quem fatebatur illius T 2 concitis T 3 pectore LN1 imposuere Sauppe ex cod. Tegerns.: posuere CGLMNTV 4 regi*um T 6 cum sibi] cum nichil sibi (nichil del. m . 1) M uitae] om. CGL promiterent V 8 seuerine L sic sic MNTV: sic CG sicut L 9 tuo] om. N illa CGL M uindicabuntur L contemptus] obtentus L 13 dei] om. M presentis L 14 poscens MNTV: petitura CGL et libri: om. Sauppe; iunge et Romanos-et aurifices 18 reuerentissimus libri (cf. Paucker Spicilegium add. lex. lat.p. 187 sq. et Neue Lat. Formenl. 11193): reuerendissimus Sauppe ex libris quibusdam recc . xpi] Z xpi G immensas CLN 20 karitate LN minora petitur CGMNTV: miro patitur L 21 egit] om. N omni potentia T sena G LNV 24 monstrans L orationibus de mortis confinio liberatum, promittentes se nequaquam ultra eius iussionibus obuiare. 
9.1	Magna quoque famulo dei prophetiae gratia praedito in redimendis erat captiuis industria. studiosus etenim insistebat barbarorum dicione uexatos genuinae restituere libertati. interea cuidam cam coniuge liberisque redempto praecepit transuadare Danuuium, ut hominem ignotum in nundinis quaereret barbarorum, quem in tantum diuina reuelatione didicerat, ut etiam signa staturae capillorumque colorem, uultus eius ac uestis habitum indicaret et in qua parte nundinarum reperturus eum foret ostenderet, addens, ut, quicquid ei reperta diceret persona, reuersus sibi maturius intimaret. 
9.2	 profectus itaque cuncta, sicut uir dei praedixerat, miratus inuenit. is igitur ab eodem homine, quem repperisse se mirabatur, interrogatus audiuit dicentem: \'putasne possum inuenire hominem, qui me ad uirum dei, cuius ubique fama diffunditur, qua uoluerit mercede perducat? diu est enim, quod ipsos sanctos martyres, quorum reliquias fero, suppliciter interpello, ut a tali ministerio tandem aliquando soluar indignus, quod huc usque non temeraria praesumptione, sed religiosa necessitate sustinui\'.
9.3	tunc nuntius hominis dei eius se aspectibus praesentauit reliquiasque sanctorum ab eo suscipiens uiro dei detulit. qui debito sanctorum Geruasii et Protasii martyrum reliquias honore suscipiens in basilica, quam in monasterio 1 promittentes MNTV: promittens CGL 3 Magna] *agna dl V 4 remendis M industria] ex industria L studiosus. Etenim GMNTV Studiosius etenim CL 5 ditione MNTV genuine V 6 coniuge] coniunge L 7 transuadare CGMNTV (cf. Bonsch Ital. et Vulg.7 p. 202): transuadere L pr., corr. m. eadem danubium LN 8 quereret GMNV diuinu V pr . 10 habitus CGL 11 forent L (n expunxit m. 2) quidquid G 12 ei] eu N 14 reperisse CLNV 18 martires MV 19 a tali ministerio tandem] om. M 20 hue] nc (= nunc) N 21 necessatate L pr., corr. m . 1 22 presentauit L reliquiasque— detulit M: om. CGLNTV 23 martirum MV construxerat, collocauit officio sacerdotum. quo loco martyrum congregauit sanctuaria plurimorum, quae tamen praeeunte semper reuelatione promeruit, sciens aduersarium saepe subripere sub nomine sanctitatis. 
9.4	 Episcopatus quoque honorem ut susciperet postulatus praefinita responsione conclusit, sufficere sibi dicens, quod solitudine desiderata priuatus ad illam diuinitus uenisset prouinciam, ut turbis tribulantium frequentibus interesset. daturus nihilominus monachis formam sollicitius admonebat beatorum patrum uestigiis inhaerere, quibus sanctae conuersationis adquireretur instructio, adhibendamque operam, ne is, qui parentes reliquit et saeculum, pompae saecularis inleoebras retrorsum aspiciendo cuperet, quas uitauerat, et ad hoc uxoris Loth exemplum terribile proponebat.
9.5	memorabat etiam timore domini mortificanda esse incentiua libidinum nec aliter superanda corporeae delectationis asserebat incendia, nisi fuissent per dei gratiam lacrimarum fonte restincta. 
10.1	Quidam uero, nomine Maurus, basilicae monasterii fuit aedituus, quem beatus Seuerinus redemerat de manibus barbarorum. huic quadam die praecepit dicens: caue, ne hodie digrediaris alicubi: alioquin ab imminenti periculo non cauebis. hic ergo contra praeceptum tanti patris saecularis 1 collocauit libri: collocauit et sacrauit Sauppe martirum 2 plurimarum (corr. m. 1) M preunte L 3 subripere MV 2 plurimarum (corr. m.1) M preaunteL3Bubripere (forma uulg. pro subrepere; cf. Eugipp. Excerpt. p.-51, 3, Ennod. ed. Hartel Ind. p. 651) LlNTV: surripere CGL2M subrepere edd. Welseri et Boll . 7 prouintiam MTV 8 tribulantium CLXNTV: tribulancium G (bulancium in ras.) tribulantib; L* tribulations M nicbilominus CGL nichilhominus M 9 sollicitus M ammonebat VM NV 10 inberere GMNV acquireretur LlN 11 is] his MN reliquit CGLMN: relinquit TV 12 pompae] pompe GV i pompa (i add. m. 2) L illecebras CGLMN 13 aspiciendo MNTV: respiciendo CGL 14 memorabatur L 18 basilice GV fuit] om. M 19 redimerat LNV 20 quadam CGLM: quadam N quidam TV die] supr. tiers, add. T2 praecepit MNTV2: prqcedit Vpr . praecepit uir dei CGL 21 ab] om. CGL 22 cauebis MNTV: carebis CGL preceptum L cuiusdam hominis persuasu meridie ad colligenda poma in secundo a Fauianis miliario egressus mox a barbaris Danuuio transuectus est cum suo persuasore captiuus.
10.2	in illa hora uir dei, dum in cellula legeret, clauso repente codice: *Maurum* ait \'cito requirite\'. quo nusquam reperto ipse quantocius Histri fluenta praetermeans latrones properanter insequitur, quos uulgus scamaras appellabat. cuius uenerandam praesentiam non ferentes supplices quos ceperant reddidere captiuos. 
11.1	Dum adhuc Norici Ripensis oppida superiora constarent et paene nullum castellum barbarorum uitaret incursus, tam celeberrima sancti Seuerini flagrabat opinio, ut certatim eum ad se castella singula pro suis munitionibus inuitarent, credentes quod eius praesentia nihil eis eueniret aduersi. quod non sine nutu diuini muneris agebatur, ut omnes eius monitis quasi caelestibus terrerentur oraculis exemploque illius bonis operibus armarentur.
11.2	in castellum quoque, cui erat Cucullis uocabulum, deuotionibus accolarum uir sanctus aduenerat euocatus, ubi factum grande miraculum nequeo reticere: quod tamen Marciani, post presbyteri nostri, cinis eiusdem loci, stupenda relatione cognouimus. pars plebis in quodam loco nefandis sacrificiis inhaerebat. quo sacrilegio comperto uir dei multis plebem sermonibus adlocutus ieiunium triduanum per presbyteros loci persuasit indici ac per singulas domos cereos afferre praecepit, quos propria manu unusquisque parietibus 1 hominis cuiusdam N 2 fabianis G danubio L 4 in cellula CGNT: cellula (om . in) L in cella MV 5 nusquam] nSqua N quantotius T quatotius LNV hystri CGM 6 pretermeans L properantes L 7 scamaras N (cf. Ind.): se amaras MTV scameras CGL appellat CG 8 coeperant T ceperant V reddére G 9 Dum LMT: Cum CGN oum V 10 pene GM NT 11 fragrabat L oppinio L pr . 12 municionibus GM monitionibus NTV 13 eueniret CGMNTV: adueniret L 16 Cucullis] om. N 17 deuocionibus GMV 18 adnocatus GN 19 martiani V cinis CGL (sic) MTV: ciues N 21 inherebat GNV 22 allocutus CGLMN 23 presbiteros T persuasi V cerreos V cqreos L 24 afferre NTV: afferri CGL afferi M prqcqpit L manu unusquisque MNTV: manus quisque L manu (om . unusquisque) CG affixit ecclesiae.
11.3	tunc psalterio ex more decurso ad horam sacrificii presbyteros et diaconos uir dei hortatus est tota cordis alacritate secum communem dominum deprecari, quatenus ad sacrilegos discernendos lumen suae cognitionis ostenderet. itaque cum multa largissimis fletibus cum eis fixis genibus precaretur, pars maxima cereorum, quos fideles attulerant, subito est accensa diuinitus, reliqua uero eorum, qui praedictis sacrilegiis infecti fuerant uolentesque latere negauerant, inaccensa permansit.
11.4	tunc ergo qui eos posuerant diuino declarati examine, protinus exclamantes secreta pectoris satactionibus prodiderunt et suorum testimonio cereorum manifesta confessione conuicti propria sacrilegia testabantur.
11.5	o clemens potentia creatoris cereos animosque flammantis! accensus est ignis in cereis et refulsit in sensibus: uisibilis lux naturam cerae liquauit in flammas, at inuisibilis corda fatentum soluebat in lacrimas. quis credat amplius eos quos sacrilegus error inuoluerat postea claruisse bonis operibus, quam eos, quorum cerei fuerant accensi diuinitus? 
12.1	Alio rursus tempore in finibus eiusdem castelli locustae, frugum consumptrices, insederant copiosae, noxiis morsibus cuncta uastantes. tali ergo peste perculsi mox presbyteri ceterique mansores sanctum Seuerinum summis precibus adierunt dicentes: ut tantae plagae auferatur atrocitas, orationum tuarum experta suffragia postulamus, quae magno dudum 1 Qcclesiq GLIMY ur decurso V 2 presbiteros T diacones LMN ortatus LlV ortatus L1 exhortatus M 3 alacritate C GMNTV: claritate\'L comunem TV quatinus CG 4 sue MV 5 fletibus libri (cf. Eugipp. Excc. p. 967, 17): fletibus humi Sauppe 6 cereorum CL 10 daclarati V acclamantes N satactionibus (=satagentes i. e . perturbati) Hartel: satisfactionibus CLMNTV: satisfaocionibus G suis actionibus Sauppe 11 cqreorum L manifesta CGMNTV: et manifesta L 13 clementis N cqreos CGL flammantes N 14 cereis CL 15 cqrq GL re C v liquauit MNTY: liquabat CGL 16 lacrimis N 17 sacrileges (v add . m. 2) L 18 cqrei GL 20 copios CLTV: copiose GMN 21 cterique CL 22 sanctum] ad scm M precipus G pr . ad ierunt Ll atldierunt N 23 tante plage V tanta plagq M miraculo in accensis caelitus cereis multum apud dominum ualere conspeximus\'.
12.2	quos ipse religiosius allocutus: cnon legistis\' ait \'quid auctoritas diuina peccanti populo praeceperit per prophetam: conuertimini ad me in toto corde uestro, in ieiunio et in fletu, et post pauca: sanctificate, inquit, ieiunium, uocate coetum, congregate ecclesiam et cetera, quae secuntur? explete itaque dignis operibus quae docetis, ut malitiam facile praesentis temporis euadatis: nullus sane ad agrum exeat, quasi humana locustas sollicitudine uetiturus, ne diuina amplius indignatio prouocetur\'. 
12.3	 nee mora, omnibus in ecclesia congregatis unusquisque in ordine suo psallebat ex more. omnis aetas et sexus, qui etiam uoce non poterat, precem deo fletibus offerebat, elemosynae fieri non cessabant, quicquid bonorum operum praesens necessitas exigebat, sicut famulus dei praeceperat, implebatur.
12.4	omnibus igitur huiusce modi studiis occupatis quidam pauperrimus opus dei coeptum deserens ad agrum propriae segetis inuisendae causa, quae perparua inter aliorum sata iacebat, egressus est totoque anxius die locustarum nubem impendentem qua potuit exturbauit industria moxque ecclesiam communicaturus intrauit, sed segetem eius exiguam, multis uicinorum circumdatam 4 loel 2, 12. 15 sq. 1 miraculis N caelitus] diuinitus M cereis CGL aput V dominum] deum N 2 religiosus M 4 prophetam] prophetam dicens M 5 in fletu TV: fletu CGLMN 6 ctum C LV cetum M 7 ecclesiam GLXV cetera CGL Becuntur LMNT1: sequntur GT* sequuntur CV 8 docetis (scit . presbyteri) libri: docet Sauppe docet iste olim proposui 9 humanas G 11 acclesia GLMV 12 etas MV qui MNTV: quae CGL 13 uoce CGLM: uoce NTV flentib; L pr . elemosina GLT me elesine V helemosine N hele Mosinq M 14 quidquid GT pr . operum] om. M presens L preces N 15 exigebat] exhibebat M 16 huiusscemodi M paupin7 (= pauperinus) M 17 Nptum NV ceptum LM inuisendq NT: inuisende V inuisendi CG LM 18 que M iacebat] habebat M 19 totoque] totaque (?) G toto M anxios N pr . inpendentem MV impudentem G 20 cclesiam GV eccfa L 21 circumdata V frugibus, locustarum densitas deuorauit. quibus ex ea nocte ab illis finibus exterminatis imperio diuino probatum est, quanti ualeat fidelis oratio.
12.5	mane quippe sancti operis temerator atque contemptor rursus ad agrum suum male securus egrediens eum locustarum pernicie funditus inuenit abrosum et omnium circumquaque sationes integras: uehementer admirans ad castellum luctuosa uociferatione reuertitur, cumque id quod acciderat indicasset, ad huiusce modi uidendum cuncti exiere miraculum: ubi quasi ad lineam regularem contumacis hominis segetem locustarum morsus ostenderant.
12.6	tunc omnium uestigiis prouolutus intercessionibus eorum delicti sui ueniam fusa lamentatione poscebat. ob quam rem monendi occasionem homo dei reperiens docebat uniuersos, ut omnipotenti domino discerent oboedire, cuius imperiis obtemperant et locustae. pauper uero praedictus flebiliter allegabat posse se mandatis oboedire de cetero, si ulla spes sibi, qua uiueret, remansisset.
12.7	tunc ergo uir dei ceteros allocutus: \'iustum est\' inquit ut qui proprio supplicio humilitatis uobis et oboedientiae dedit exemplum liberalitate uestra anni praesentis alimenta percipiat\'. collatione itaque fidelium et correptus homo pauperrimus et ditatus didicit, quantum dispendii incredulitas inferat, quantum beneficii suis cultoribus conferat diuina largitio. 1 ex ea Hartel: ea CGL ex MNTV 2 imperi N quantum M 3 mane] manu L atque contemptor CGL (cf. p. 8, 15): om. MNTV 4 rureu MV securus (r iil ras. a m. 1; scriptum erat secutus) L 5 pernicie CMNTV: pernitie N pr . pernici G sub pernicie L abrosum OMNTV: ambrosum C abrasum L 6 ammirans L1.MNT- 7 luctuosa] lamentuosa N cunque T accederat NT1 8 huiusscemodi M 9 segete V 10 ostenderant CGLMTV (cf. Vict. Vit. ed. Petsch. p. 167): extenderant N ostendebant suspicatur Sauppe 11 eorum] om. M 12 repperiens LIMTV 13 omniptenti deo M obdire CLV obedire G 15 posse se COLT1: poft fe T* p\' se V se posse M posse N non posse se Sauppe obedire CLV obedire GM cetero GLM 16 ulla libri: nulla Sauppe spes sibi MNTV: sibi spes CGL 17 ceteros L su*plicio V (p eras.) 18 obdientiae OL V obediencia GM 20 pauprrimus Vpr. pauperimus L paupinus M 21 suis] sui (post i spatium unius litt.) L 22 largicio (largi in ras. G) GM 
13.1	Item iuxta oppidum, quod Iuuao appellatur, cum quadam die intrantes basilicam aestatis tempore sollemnitatem uespere reddituri ad accendenda luminaria ignem minime repperissent, flammam concussis ex more lapidibus elicere nequiuerunt, in tantum alterutra hac petrae. conlisione tardantes, ut tempus uespertinae sollemnitatis efflueret. at uir dei genibus humi fixis orabat attentius.
13.2	mox igitur in conspectu trium spiritalium qui aderant tunc uirorum cereus, quem manu idem sanctus Seuerinus tenebat, accensus est. quo lucente sacrificio uespertini temporis ex more suppleto gratiae deo referuntur in omnibus, quod factum licet memoratos, qui huic interfuere miraculo, celare uoluerit sicut et multa magnalia, quae per illum diuinis sunt effectibus celebrata, claritas tamen tantae uirtutis occultari non potuit, sed ad magnam fidem ceteros excellenter accendit. 
14.1	Accidit etiam eiusdem loci quandam mulierem diutino langore uexatam iacere seminecem, exequiis iam paratis, cuius proximi maesto silentio uoces funereas quodam fidei clamore presserunt et ante ostium cellulae sancti uiri corpus iam paene exanime deposuere languentis.
14.2	uidens itaque homo dei clausum aditum oppositione lectuli ait ad eos: \'quidnam 1 Item] *tem V Iuuao] falciburc iuuauo cod. Vind. 1064 appellatur MNTV: appellabatur CG apellabatur L 2 sollempnitatem LM NV 3 uesperq M reddituri] dicturi M 4 reperissent L concussis CGLI: excussis MNTV concussit L1 5 hac petrae MN: ac petrQ T ac petre V ferri ac petr (trq a m. 2 in ras. 5 litt. in L) CGL collisione CGLMN 6 uespertine M V sollSpnitatis (p del. m. 2 L) LV 8 spiritalium LMNTV: spiritualium CG adherant N cqreus CGL manu] in manu M 10 uespertinis N gratie V dei N 11 refferuntuf L memoratis Ll 12 sicut et MTV: sic et N sicut CGL i3 celebrata LM 15 cter08 GL 16 *ccidit (a om.) M 17 diutino MNTV: diuturno CGL (in ras. a m . 1 L) langore LMT: languore CGNV paratis] patis M 18 mesto CGLMN funeratas M fidl LM 19 hostium GLMNTV cellule V 20 pene GLlM NT languentis (s in ras. G) CGLM: languentes NTV 21 oppositione LiNTV: opposicione M oppisitione Ll appositione CG est, quod facere uoluistis\'? responderunt: ut oratione tua uitae reddatur exanimis. tunc ipse lacrimabundus: \'quid* inquit la paruo magna deposcitis? agnosco me prorsus indignum. utinam merear ueniam pro meis inuenire peccatis!\' et illi: \'credimus inquiunt \'quod, si oraueris, reuiuescet.
