14.3	tunc sanctus Seuerinus fusis ilico lacrimis in oratione prostratus est et muliere protinus assurgente allocutus est eos: nolite quicquam horum meis operibus applicare: hanc enim gratiam fidei uestrae feruor emeruit, et hoc fit in multis locis et gentibus, ut cognoscatur, quod unus sit deus, faciens in caelo et in terra prodigia, excitans perditos in salutem et mortuos uitae restituens. mulier uero sanitate recepta opus agrale die tertio iuxta morem prouinciae propriis coepit manibus exercere. 
15.1	Quintanis appellabatur secundarum municipium Raetiarum, super ripam Danuuii situm: huic ex alia parte paruus fluuius, cui Businca nomen est, propinquabat. is crebra inundatione Danuuii superfluentis excrescens nonnulla castelli spatia, quia in planum fundatum fuerat, occupabat. ecclesiam etiam loci eius mansores extra muros ex lignis habuere constructam, quae pendula extensione porrecta defixis in altum stipitibus sustentabatur et furculis, cui ad uicem soli tabularum 1 uite (i am . 2 in ras.) L 2 quid inquit CGL (cf. praef.): quid M NTV 3 agnoscite M 4 inuenire pro meis M inuenire] om. V 5 quod si CGMNTV: % fi p ea L* in ras . orauerint N pr . reuiuiscet COM 7 eos CGMNTV: eos dicens L 9 feruor emeruit (or a m . 2 in ras. L) CGLMNT: feruore meruit V 10 agnoscatur G in CQIO et in terra faciens GM 11 uite V 12 recepta MNTV: percepta CGL opus] op\'g M 13 cqpit CL cepit GMN 14 chunlzen quintanif cod. Vind. 1064 post appellabatur add. L2 supr. uers . locus secundarum] secundaria N fcundarum (t add. m. 2) L municipifl (fi a m. 2 in ras.) L retiarum CLNTV reciarum GM 15 danubii GL situ Lx situ (= situus) L1 16 businca (nca in ras. a m. 2) L inca M bunsica (n del. m. 2) N #is (h ras.) L his MNTV 17 danubii L castella L pr . 18 plana MNTV- piano CGL Qcclesiam LN 19 eius loci G eiusdem loci M ex] et G 20 que V qui N porecta V 21 su*stentabatur (i, ut uidetur, rasa) L ad uicem] ad inuicem N soli* L erat leuigata coniunctio, quam, quotiens ripas excessisset, aqua superfluens occupabat.
15.2	Quintanensium itaque fide sanctus Seuerinus illuc fuerat inuitatus. ubi, cam tempore siccitatis uenisset, interrogat, cur tabulata nudatis obstaculorum tegminibus apparerent. accolae responderunt, quod frequenti fluminis alluuione quicquid fuisset , superstratum continue laberetur. at ipse:. \'sternatur\' inquit super. tabulata nunc in Christi nomine pauimentum: iam uidebitis amodo inuium. caelesti iussione prohibitum\'.
15.3	pauimento itaque perfecto ipqe subter naui descendens accepta securi postes facta oratione percussit atque ad aquam fluminis uenerandae. crucis expresso signaculo dixit: (non te sinit dominus meus Iesus Christus hoc signum crucis excedere\'.
15.4	ex illo itaque tempore, cum ex more fluuius creuisset in cumulos ambissetque uiciniam, quam solebat, ita spatiis ecclesiae erat inferius, ut numquam saneti patibuli signaculum, quod impresserat homo dei, prorsus excederet. 
16.1	Accidit autem, ut castelli presbyter memorati admodum uenerabilis, Siluinus nomine, moreretur, et cum in ecclesia feretro posito noctem psallentes duxissent ex more peruigilem, iam claresceute diluculo regauit uir dei fessos presbyteros et diacones uniuersos parumper abscedere, ut post laborem uigiliarum somno se aliquantulum recrearent.
16.2	quibus egressis homo dei ostiarium, Maternum nomine, interrogat, utrum omnes, ut 3 illic M sicciMtatis L 4 tabulate L pr . 6 apparent M accole MV .\' 6 illuuione MN \'■ fuisset CGLMN: fuisse TV .7 ÏDd V strper tabulate OGMNTV: tabulatis L \' 8 flauium ammodo M 10 naui CGLNi nanim MTV postes (es ita ras. a m. 2) L\' pWilli hqc (ante hqc ecriptttnt fume uidetur acta) M oratione] oiru M II ad] om. N tienerande &MNV -14 conttilos V cumolos M, corr. m . 1K uicina M I 1&$cclesi$GLMV ed§ T inferius GOLMNTV: inferior Sauppe ex cod. D Monacensi; inferior fluuOns Rartel 16 quod - exoederet] om. L1, add. m . 2 homo dei impresserat M 18 ammodum LlMN TV 19 moreretur (ore in ras.) G acclesia GLlNV eda T 20 \'nocte N ex more duxissent M 21 presbiteros T 22 uigiUarom T 23 aliquantum N 24 hoBtiarium LMNTV VIIII. 2 3 dixerat, abscessissent. at illo respondente cunctos abisse: \'nequaquam\' ait sed latet hic quaedam\'. tunc ianitor ecclesiae saepta secundo perlustrans nullum intra ea remansisse testator. uerum Christi miles domino sibi reuelante: \'nescio quis\' ait hic delitescit*. tertio itaque diligentius perscrutans quandam inuenit uirginem consecratam locis se occultioribus abdidisse. 
16.3	 hanc ergo memoratus sic increpauit aedituus: cur istic famulo dei posito tuam credideras posse latere praesentiam\'? at illa: \'pietatis\' inquit \'amor talia me facere persuasit: uidens enim cunctos foras expelli cogitaui mecum, quod senilis Christi inuocata diuina maiestate praesentem . mortuum suscitaret*. 
16.4	 exeunte igitur memorata uirgine homo dei cum presbytero et diacono ianitoribusque duobus in oratione curuatus orauit fletu largissimo, ut opus solitae maiestatis superna uirtus ostenderet. tuno orationem complente presbytero ita cadauer uir beatus alloquitur: \'in nomine domini nostri Iesu Christi, sancte presbyter Siluine, loquere cum fratribus tuis\'. 
16.5	 at ubi oculos defunctus aperuit, uix praesentibus homo dei tacere prae gaudio persuasit. et denuo ad eum: uis) inquit (rogemus dominum, ut te adhuc seruis suis in hac uita condonare dignetur\'? at ille ait: \'per dominum te coniure., ne hic diutius tenear et frauder quiete perpetua, in qua me esse cernebam\'.
16.6	statimque reddita oratione quieuit exanimis. hoc autem factum ita sancti Seuerini adiuratione celatum est, ut ante mortem eius non potuisset agnosci: ego tamen haec quae retuli Marci 1 dixerat Qf/MNTY: dixefant L illo] 0 ex e corr. L1 2 Qcclesiq GLI V: 3 septa libri 4 piles CGLSfNT: mijites V sibi CGMNTV: OIß. L - \' -7 ergo] igitur G edituus GMN TV istic CGMNTV: iBtius, L 1 ,8 credideras MNTV; credideris CQL posse MNTV: potuiase CGL 9 pietas V 10 expelli foras M 11 preseptem LM post gusfitaret sportum uacuum duorum fere uenuum in L 18 diacone L orauit] poatulauit G 14 solite G solito M, eorr./m. 1 .\' 15 oratione C 1\'6 sanc T t \'17 ubi] add. Gl in mg . 18 defanctos N apperuit N, corr . \'m. i prae gaudio tacere M 19 rogemus CGMNT V: ut rogemus L dominum] deum M 24 adiaratione] diuratione L celatum GLM est] om- N 25 que V subdiaconi et Materni ianitoris relatione cognoui. nam presbyter et diaconus, tanti testes miraculi, ante uirum sanctum, cui iurauerant nulli se quod uiderant prodituros, obisse noscuntur. 
17.1	Talibus igitur beatus Seuerinus per Christi gratiam muneribus opulentus captiuorum etiam egenorumque tantam curam ingenita sibi pietate susceperat, ut paene omnes per uniuersa oppida uel castella pauperes ipsius industria pascerentur: quibus tam laeta sollicitudine ministrabat, ut tunc se crederet tantummodo saturari uel abundare bonis omnibus, quando uidebat egentum corpora sustentari.
17.2	et cum hebdomadarum continuatis ieiuniis minime frangeretur, tamen esurie miserorum se credebat afflictum. cuius largitionem \'tam piam in pauperes plurimi contemplantes, quamuis ex duro barbarorum imperio famis angustias sustinerent, deuotissime frugum suarum decimas pauperibus impendebant. quod mandatum licet cunctis ex lege notissimum, tamen quasi ex ore angeli praesentis audirent, grata deuotione seruabant 
17.3	Frigus quoque uir dei tantam in nuditate pauperum sentiebat, siquidem specialiter a deo perceperat, ut in frigidissima regione, mirabili abstinentia castigatus, fortis et alacer maneret.
17.4	pro decimis autem, ut diximus, dandis, quibus pauperes alerentur, Norici quoque populos missis exhortabatur epistolis. ex qua consuetudine cum ad eum nonnullam erogandarum uestium copiam direxissent, interrogauit eos qui uenerant, si ex oppido 1 subdiaconi CGL: diaconi MNTV materni CGL: martini MNTV ianitoris] genitoris N 2 sanctum uirum M 4 beatisBimus M 6 ingenita V poene TV pene GLXMN 9 saturari] salaari M habondare TV habundari M omib; V 10 egentum OOLNTV: egencium M snbstentari N cum L MNTV: cum ipse CG ebdomadaram GLMNT epdomadarum G edomadarum V 12 largiotionem (corr. m . 1) L largitiorem N largiciorem G 14 imperio] om. M angustias NTV: anguatiam CGL inopias angustias M 15 frugum] tamen frugum CG inpendebant MNV 16 notissimum] notissimum sit CG 17 praesentis] om. M - 19 spetialiter TV a deo specialiter M acce- perat M 20 maneret MNTV: permaneret CGL 22 exortabatur LIV 23 nonnullam CGLN: nonnulli M - 24 copia TV 3* quoque Tigurniae similis collatio mitteretur. respondentibus etiam inde protinus affuturos uir dei nequaquam eos uenire signauit, sed dilatam eorum oblationem praedixit barbaris offerendam. itaque non multum post ciues Tigurniae uario cum obsidentibus Gothis certamine dimicantes uix initi foederis pactione inter cetera etiam largitionem iam in unum collatam, quam mittere famulo dei distulerant, hostibus obtulerunt. 
18.1	Qiues quoque ex oppido Lauriaco crebra quondam sancti Seuerini exhortatione commoniti frugum decimas pauperibus offerre distulerant. quibus fame constrictis iam maturitate messium flanescente uicina subsidia monstrabantur. at ubi frugibus inprouisae corruptio frugibus nocitura comparuit, mox ad ipsum conuenere prostrati, poenas suae contumaciae confitentes.
18.2	miles uero Christi fesads uerbis spiritalibus alleabat dicens: \'si decimas obtulissetis pauperibus, non solum aeterna mercede frueremini, uerum etiam commodis possetis abundare praesentibus. sed quia culpam confessione propria castigatis, de domini pietate polliceor, quod rubigo praesens tam ualida penitus non nocebit: tantum fides uestra ulterius DQV uacillet, uerum ciues ad persoluendas ex illo decimas 1 (ef 4) tigurniq NT: tiguraie V tugurniQ M tiburniq CO tiburtinie (ti expunxit m. 2) L collatio] collocatio N 4 offerandam L multum MNTV: multo COL (inras. am. 1 L) uario-celtamine] om. L 5 obsidentibus Gothis CONTV: hostibus M initi L MNTV: inita CO fderi. COL* federis L\'M 6 pactionem N V cetera GL largitionemI largionS V unum] ubll V collate L collectam N ,7 dei] om. X optulerunt CLM 8 cities] u in ras. a m. 9 C lmeh laariaco cod, Yitad . 1064 9 eior- \' latione V 11 flauente M 12 inprouisa MTV: improtusq OG improuisa L inpromso N 1 conparoit V 13 conuenire L2 pquas CO penas LMN contumatie V 14 Bpiritalibus NTV: spiritnalibus CGM spiritalibus L 15 decimis N, corr. m. 2 M optulissetis LM 16 eterna V fruemini L; re add- n. 2 Sttiam] om. M 17 habundare LlMTV set Vfr. propia V 18 presens LV praaentis N 19 pquitu» CL (q a m. f4 L) - 20 illo decinpa COMNTV: illo decimas die L haec promissio reddidit promptiores. tunc, ut solebat, hortatus est indici ieiunium: quo expleto placidus imber desperata» messis amputauit incommoda. 
19.1	Batauis appellatur oppidum inter utraque flumiJia, Henum uidelicet atque Danuuium, constitutum, ubi beatus Seuerinus cellulam paucis monachis solito more fundauerat, eo quod ipse illuc saepius rogatus a ciuibus adueniret, maxime propter Alamannorum incursus assiduos, quorum rex Gibuldus summa eum reuerentia diligebat.
19.2	qui etiam quodam tempore ad eum uidendum desideranter occurrit. cui sanctus obuiam, ne aduentu suo eandem ciuitatem praegrauaret, egressus est, tantaque constantia regem est allocutus, ut tremere coram eo uehementius coeperit, secedensque suis exercitibus indicauit numquam se nee in re bellica nec aliqua formidine tanto fuisse tremore concussum.
19.3	cumque dei famulo daret optionem imperandi quae uellet, rogauit doctor piissimus, ut sibi potius praestaturus gentem suam a Romana uastatione cohiberet et captiuos, quos sui tenuerant, gratanter absolueret. tunc rex constituit, ut ex suis aliquem dirigeret ad id opus maturius exsequendum, statimque missus Amantius diaconus e uestigio regem subsequitur eiusque prae foribus excubans multis diebus non potuit nuntiari.
19.4	cui re, pro qua directus fuerat, non 1 haee] bee V, om. L redidit M prompciores G pmtiores V ymciores M hortatus N 2 ymber MN desperate V 3 incomoda M 4 atauis V Beatanis N BaMiowa Patauis cod. Vind. 1064 -5 henum NTV: hquutn M renum L rhenum GO danubium L 7 sepius M V a] ad V 10 desideranter) et desiderandtl M 11 adnentu OGMNTV: adtentu LI attenta L\' pregauaret CV 12 regem coostancia allocutus est M eo] L, o a m. 2 in ras . 13 cqperit CG ceperit LM 14 nunquam se see CGNTV: niiqui semet L se uGqua nec M 15 fuisse tremore CGMNTV: tremore fuisse L concussus N cunque T famulu V 16 impetrandi GM que V 17 prestaturus CLl 18 absoluerent LVI 19 dirigeret (ret in ras. a m. 2) L id CGMNTV: om. L 20 exequendum CGMN 21 prae MNT: pro CG LV excubantis N 22 nontiari V re pro qua BoZlaMus: pro re qua libri peracta tristissimo reuertenti apparuit quidam, effigiem sancti praeferens Seuerini, qui eum minaci compellatione perterritum sequi se iussit. cum que pauens et concitus sequeretur, peruenit ad ianuam regis statimque dux ille praeuius ex oculis mirantis euanuit. uerum regis internuntius diaconum unde esset uel quid speraret interrogat. ille rem breuiter insinuans oblatis regi receptisque remeauit epistolis.
19.5	dimissus igitur reuexit fere septuaginta captiuos, insuper promissionem regis gratam deferens, qua se spopondit, cum diligenter prouinciam peragrauerit, remissurum quantos in eadem reperturus fuisset numeros captiuorum. pro qua re sanctus Lucillus presbyter postmodum destinatus magnam miserorum copiam ex captiuitate reuocauit. 
20.1	Per id temporis, quo Romanum constabat imperium, multorum milites oppidorum pro custodia limitis publicis stipendiis alebantur. qua consuetudine desinente simul militares turmae sunt deletae, cum limite Batauino utcumque numero perdurante: ex quo perrexerant quidam ad Italiam extremum stipendium commilitonibus allaturi, quos in itinere peremptos a barbaris nullus agnouerat.
20.2	quadam ergo die, dum in sua cellula sanctus Seuerinus legeret, subito clauso codice cum magno coepit lacrimare suspirio, astantes iubens ad fluuium 3 Cunque T conciti* (= concitius) V 4 statimque] statlq; M 5 mirantib; L diaconum MNT: diacon\' (= diaoonus) V diaconem CGL 6 uel] et N 7 regi] regis IMP TV receptisque] pceptisque N 9 gram (= gratiam) N se spopondit MNT V: spopondit se CGL prouintiam NlTV 10 quantos MNTV: quantus CGL* quantas Ll reperturus MTV: repertus CGLN 11 numeros MNTV: numerus CGL poBtmodum sos lucillus presbyter CGL 12 ex MNTV: a CGL 14 Per] er V id temporis M NTV: idem tempus CGL 15 puplicis TV 17 turme V delêtae L delate V pr., corr . m. 1; delate M, quod mauult Hartelius cum] simul cum M limite] lim a m. 2 in ras. L batabino L utcumque L uno ut ctlque M 18 quidam CGMNTV: quide L 20 peremtos N barbarbaris M quada V 21 sua] om. N scs seuerinus legeret MNTV: scs legeret seuerinus CGL 22 cepit CGL1 cepit MN lacrimari C(?) L iubens MNTV: iubet CGL properanter excurrere, quem in illa hora humano firmabat oruore respergi, statimque nuntiatum est corpora praefatorum militum \'fluminis impetu ad terram fuisse delata.. 
21.1	Paulinus quidam presbyter ad. sanctum Seuerinum fama eius latius excurrente peruenerat. hic in consortio beati uiri diebus aliquot remoratus, cum redire uellet, audiuit ab eo: \'festina, uenerabilis presbyter, quia cito dilectionem tuam, populorum desideriis, ut credimus, obluctantem, dignitas episcopatus ornabit.
21.2	moxque, remqante ad patriae, sermo in eo praedicentis impletus est. nam ciues Tigurniae, quae est metropolis Norici, elegerunt praedictum uirum summi sacerdotii suscipere principatum. 
22.1	Basilicae extra muros oppidi Batauini in loco nomine Boiotro trans Henum fluuium constitutae, ubi cellulam paucis monachis ipse construxerat, martyrum reliquiae quaerebantur. ingerentibus ergo se presbyteris, ut mitterentur ad sanctuaria deferenda, haec beatus Seuerinus monita proferebat: \'quamuis cuncta mortalium opere constructa praetereant, (haec tamen aedificia prae ceteris celerrime relinquenda sunt\': et ideo pro reliquiis sanctorum nullum laborem debere suscipere, quia et ultro eis sancti Iohannis benedictio deferretur.
22.2	interea beatum 1 quem] qa (sed q tantum est a m. 1) L humano COLtMNT V: humanum L1 affirmabat M 2 cruorg (uirgulam add. to. 2) L . 5, latius MNTV: om. CGL 6 diebos CGL*MNTV: dies L1 demoratriB M 7 tuam] om. N , 8 abluctantem G 9 ornabit] ornamabit V ornauit Ll ordinabit G remeante GN eo MNTVi eum CGL 10 tigurniQ NT: tigumie V tugurniQ M tiburniQ CG tiburtiniQ L que V 11 elegerunt MNTV: coegerunt. CGL sacerdotii] sacerdotis MN 13 asilice V 14 boiotro OOli: boiothro N baiothro bio thro TV henum fluuium NTV: haêntl fluuium L rhenum (rehenum G) fluuium CG fluuium henum M constitute GV 15 martirum V reliquis V querebantur GMV querebat N, corr. m . ree. 17 hee V proferebat MTV: proferebat CGL prferebant N, n del. m. rec . 19 ediflcia GV ceteris L celerrime L et ideo CGMNTVs Video L 20 debere (sc. eos) CGMNTV: deberi L debetis Scmppe et ultro MNTV: ultro CGL . 21 iofcis (= iohannis) LM bSnedictio .(sic) V benendictio M deferretur CMTV (cf. Ind.): defferretur (prior f eras.) G deferetur LN uirum - ciues oppidi memorati suppliciter adierunt, at pergens ad Febanem, Rugerum principem, mercandi eis licentiam postularet quibus ipse: tempus\' inquit huius oppidi propinquauit, ut desertum, sicut cetera superiora castella cultore destituta, remaneat. quid ergo necesse est locis mercimonia 
22.3	 prouidere, ubi ultra non poterit apparere mreator p) respondentibus illis non se debere contemni, -sed. consueto subleuari regimine quidam presbyter haec : diabolico spiritu - repletus adiecit: \'perge, quaeso, sancte, perge uelociter, ut tuo discessu parumper a ieiuniis et uigiliis I quiescamus)., quo dicto uir dei lacrimis urguebatur\' ingentibus, quod in ridiculam uanitatem cunctis audientibus sacerdos eruperit. aperta namque scurrilitas latentium est testificatio delictorum. sanctus itaque uir cur ita fleret interrogatus a fratribus: uideo inquit plagam grauissimam nobis absentibus huic loco protinus euenturam, et Christi sacraria, quod non sine gemitu cogor exprimere, humano sanguine redundabunt in tantum, at etiam locus iste uiolandus sit\'.
22.4	nam in baptisterio loquebatar. ad antiquum itaque , et omnibus maius monasterium suum iuxta muros oppidi Fauianis, quod centum et ultra milibus aberat, Danuuii nauigatione descendit. mox igitur eo descendente Hunumundus paucis barbaris comitatus oppidum, ut sanctus praedixerat, 1 » 2 febanem MTV (cf . Ind.): ftbanum CGL\'N fabianum Ll 3 iDqa V propinquauit Iibri (cf. Lve. 1, 8; Rom. 13, 28): propinquabit suspicatur Hartel 4 cOm L 5 destifota MNTVi daetituto ca L loci G 6 folder» N \'• I 7 illis] eis M eofitempni GLM NTV 8 heo V repletus] plenus M 9 queso perge G queso NTV 8 LI V pergQ M dissce§su r" 10 dicto) audito M " 1 laprimis] a lacrinais (a àeJ. u . ,1); L nrg; w batur CQLNo in ridiculam] irridiculam N r: . aami,tem M, corr. im 1 12 erupit G - aperta—delictorum] omMitnanque C scarilitas NTV 14 aede* inqd V 16 et CQMTVi ex N ut L non sine COMTVi sine LN 19 suum] om. M \' 20 fabianis OL \'danubii L 21 descendente LMNTV: discedente CO hdnumnndtis OOLINTY: hunioniundus i1 hodeninndns M post hannmnnduB spatium uacuum 6 Hit. in L 22 comi1- Latus L Batauis inuasit ac paene cunctis mansoribus in messe detentis quadraginta uiros oppidi, qui ad custodiam remanserant, interemit. 
22.5	presbyterum quoque illum, qui tam sacrilega; contra famulum Christi in baptisterio fuerat elocutus, ad eundem locum confugientem insequentes barbari peremerunt frustra enim illuc offenso deo ueritatis inimicus accessit, ubi tam imprudenter excesserat. 
23.1	Igitur sanctissimtis Seuerinus, dam in moiiasterio Fauianis euangelium legeret, oratione suppleta consurgens scafam sibi iubet ilico praeparari et mirantibus ait: \'sit nomen: domini benedictum : \'sanctuariis beatorum martyrum BOS oportet occurrere\'. nec mora : transmeato Danuuio inueniunt hominem considentem in ripa ulteriore fluminis ac multis eos precibus postulantem, ut ad seruum dei, ad quem fama uulgante olim uenire cuperet, duceretur.
23.2	mox itaque ei Christi famulo demonstrato suppliciter sancti Iohannis Baptistae reliquias optulit multis apud se seruatas temporibus. quas dei seruus debita ueneratione suscipiens in basilicam sancti Iohannis, sicut praedixerat, ultronea benedictione collatas sacrauit officio sacerdotum. 
24.1	Ad habitatores praeterea oppidi, quod Iobiaco uocabatur, uiginti et amplius a Batauis milibus disparatum, 1 pene GLN poene V 3 presbiterum CGV sacrilegam Cl N contra] add. T1 8. 1 . 4 xpi famulum M locutus N \' 5 confugientes G pr . 6 offenso deo] offendo V 7 imprudenter LMTV: impudenter OON, 8 sanctiBsimtts CGNT: sanctisimus M Sanctus LV : ---im moBMterio N 9 fabiuis G 10 scafam, CG MNT;V: scâphā L sibi] ibi (s add . m. 2) L ilico sibi prqparari iubet M 12 occurere M \'danubio L 13 consedentem CG confidentom V ulteriore CGMNTV: , ulteriori L (ori in ras, dm.\'2) -ulteriori in ripa L multis cos OGLNTY: multos eorum Mi; 14 quem] qua V 16 baptiste CGMV optulit LMTV: obtulit CGN 17 sernata\' (s add. m. 2) T seruata N 18 in basilicam Sauppe : basilicam C&JhMT basilica NV \'\' 19 collatas Sauppe: collata CGLNTV collocata M offitio V 2Q Ad] d V * \' iobiaeo CMNTV: iouiåco L iobiano G 21 uocabatur LMN TV: uocatur OG amplios] eo amplius M batabjs L pr, disparatu N solita uir dei reuelatione commonitus Moderatum nomine, cantorem ecclesiae, destinauit praecipiens, ut habitationem loci illius omnes sine cunctatione relinquerent: mox enim perituros fore, si contemnerent imperata.
24.2	aliis ergo de tanto nuntio dubitantibus, aliis prorsus non credentibus iterum misit Quintasium quendam, cui et inlacrimans ait: perge uelocius, denuntians eis, si hac ibidem nocte manserint, sine dubitatione capientur\'. sanctum quoque Maximinum, spiritalis uitae presbyterum, instantius imperat admonere, ut saltem ipse contemptoribus derelictis properaret caelesti misericordia liberari: de quo sibi dei famulus magnam dicebat inesse maestitiam, ne forte salutiferam differendo mandatum imminenti. subiaceret exitio. 
24.3	 praedictus itaque pergens imperata suppleuit, sed presbytero et reliquis incredulitate nutantibus nuntius uiri dei presbytero retinenti se atque hospitalitatis gratiam praebere cupienti nullatenus adquieuit. qua nocte Heruli insperate protinus irruentes oppidumque uexantes plurimos duxere captiuos, presbyterum memoratum patibulo suspendentes. quo audito seruus dei grauiter doluit praemonitos non curasse. 
25.1	Deinde quidam de Norico, Maximus nomine, ad senium dei frequentare solitus cum uenisset et pro familiaritate, quam 2 Qcclesiq GMV destinabit L 3 enim] om. M 4 forent N contempnerent GLXMV tento (corr. m. 1) V 5 nuntio NTV: nuncio M praesagio CGL 6 inlacrimans MNTV: illacrimans CG #»lacrimans L (il, ut uidetur, eraswn) 7 denuncians GMV denuntians ait (ait dd. m. I) L dubitatione NT: dubitacione V dubio M dilatione CL dilacione G 8 maximinum NTV: maximianum CGL maximum M \'spiritualis CGLM uite GV 9 instancius GMV ammonere MN ammonfiri L1 admoneri CG L2 saltim N 11 mestitiam CLN mesticiam G tristiciam M 12 exitio] excidio M 13 sed presbytero MTV: om. CGL N 14 nuntiis (Y a m. 2) L uiri C&MN: uero uiri (corr. m. 1) T uiri (Tam. 2) L 15 retinendi M hopitalitatis N 16 acquieuiht LtN inspera M imperante G 17 uexantes MNTV: uastantes CGL 18 den suspentes (den add. TO. 2) M 19 praemonitos MTV: prmunitos N pmonitus L prqmonitum CG 20 Deinde] einde V meruerat, in monasterio sancti uiri diebus aliquot moraretur, eius informatur oraculis patriam suam graue repente exitium subituram. qui acceptis litteris ad sanctum Paulinum episcopum destinatis remeauit instantius.
25.2	igitur memoratua antistes litterarum tenore perstructus uniuersa diocesis suae castella scriptis propriis uehementer admonuit, ut triduano ieiunio, quod litterae uiri dei signauerant, exitio uenturae cladis occurrerent. 
25.3	quibus iussa complentibus -terminato ieiunio ecce Alamannorum copiosissima multitudo feraliter cuncta uastauit. castella uero nullum sensere periculum, quae lorica fidelis ieiunii et laudanda cordis humilitas per uirum propheticum aduersus hostium ferociam fidenter armauerat. 
26.1	Post haec leprosus quidam Mediolanensis territorii ad sanctum Seuerinum fama eius inuitante perrexerat: hunc sanitatis remedia suppliciter implorantem monachis suis indicto ieiunio commendauit: qui continuo dei gratia operante mundatus est. cumque recepta sanitate redire suaderetur ad patriam, prostrauit se pedibus sancti uiri, petens, ne ulterius ad sua redire cogeretur, cupiens scilicet, ut lepram quoque peccatorum sicut carnis effugeret uitamque in eodem loco fine laudabili, terminaret.
26.2	cuius animum religiosum uir dei uehementer admirans paucis monachis paterna iussione praecepit, ut frequentatis cum eo ieiuniis in oratione continua permanerent, 1 diebus] om. V aliquit (corr. m. 2) L 2 informatur] in forma G grauem] graae* (m rasa) T, om. V exitium CNTVi exicium GM excidium L 3 episcopum destinatis CGMNTV: episcopum ********* ordinatis ********* L 2 I sup. ras* 5 perstructus MNTV: praestructus CG prestructus L diocesis CGLMTV: a diocesis N 6 ammonuit IM&NT* 7 signauerat N uenture MV 8 complentebus (corr. m . 1) V 10 periculis N fidelis] in tng. add. M1 \' 11 cordis CGLMNT: carnis V 12 forociam G ferocium N 13 leprosus T mediolensis L 14 eius] el T *perrexerat CGLNTVt peruenerat M 15 implorante N 16 qui libri: itaque Hartel dei gratia CGNTV: dei gram L deo M 17 cunque T 18 sa uiri pedibus M 19 lepram T 20 effugeret OOMNTV: effugaret L eadem G1 22 ammirans LIMN 23 ut MTV: om. CGLN permanerent MNTV: permanere CGL ut dominus ei quae essent opportuna concederet. tantis. itaque remediis praemunitus intra duorum mensuum spatium uitae mortalis est compedibus absolutus. 
