letter1.1	DOMINO SANCTO AC MERITO VENERABILI PASCASIO DIACONO EVGIPPIVS IN DOMINO SALVTEM. Ante hoc ferme biennium, consulatu scilicet Inportuni, epistola cuiusdam laici nobilis ad quondam directa presbyterum nobis oblata est ad legendum, continens uitam Bassi monachi, qui quondam in monasterio montis, cui uocabulum est Titas, super Ariminum commoratus, post in Lucaniae regione defunctus est, uir et multis et mihi notissimus. quam epistolam cum a quibusdam describi cognoscerem, coepi mecum ipse tractare nec non et uiris religiosis edicere, tanta per beatum Seuerinum diuinis effectibus celebrata non oportere celari miracula. 1 epistola - diaconum] om . T; Incipit uita beati seuerini (seuerini add. m. 2) VI plogus in uita supra scripsit V* Incipit plogus de uita u! obitu sci seuerini L Incipit epistola egeppii pbri ad paschasium diaconum de uita et miraculis sci seuerini G Explicit uita beati bylarionis. Incipit epistola eugepii pbri ad pascasium diaconS directa de uita sci seuerini abbatis M Finit uita sci hylarionis beremitQ. Incip uita scissimi abbatis seuerini. epistola eugepii pbri ad paschasium diaconem directa N 3 sancto ac] suo G merito] om. CGL paschasio CG paskasio L 4 eugipius V eugepius CGLMNT domino] jpo CGL 5 consolatu M consulatus N importuni CGLN inporntuni M pr . 7 uobis NTV 8 quondam] quodam TV 9 titis MNTV; cf. Ind . 10 michi CGL; sic semper 11 descripta L qpi CMV cepi GL 13 celebrata MV 14 celari V vim. t. 1 
letter1.2	 Quae cum auctor epistolae praefatae rescisset, animo prompto remandauit, ut aliqua sibi per me eiusdem sancti Seuerini mitterentur indicia, quibus instructus libellum uitae eius scriberet posterorum memoriae profuturum. hac ego protinus oblatione compulsus commemoratorium nonnullis refertum indiciis ex notissima nobis et cotidiana maiorum relatione composui, non sine magno maerore animi, iniustum scilicet reputans, ut te superstite laicus la nobis hoc opus efficere rogaretur, cui et modus et color operis non sine praesumptione quadam possit iniungi, ne forsitan saeculari tantum litteratura politus tali uitam sermone conscriberet, in quo multorum plurimum laboraret inscitia et res mirabiles, quae diu quadam silentii nocte latuerant, quantum ad nos attinet ignaros liberalium litterarum, obscura disertitudine non lucerent. 
letter1.3	 sed non ultra lucernae illius igniculum te uelut sole splendente perquiram: tantum ne mihi peritiae tuae radios nube quadam excusationis obducas, imperitiam propriam uidelicet accusando. noli, obsecro, tam duris me uerberare sermonibus, dum dicis: quid tibi aquas expectare de silice? iam utique non expecto de silice plateae saecularis, sed a te, qui spiritalibus spiritalia 1 praefatae] om. LM prompto remandauit] promptiore mandauit CGL 2 sci et 3 quibus] bis, a m. 1 et 2, scriptum exhib. T 3 inditia M uite V scriberet] scriberet M ederet L 4 memoria (e add. P) TV hac] huic L ego] ergo L 6 oblacione V commemoratorum V com moratorium M 6 inditiis M cottidiana TV quotidiana L relacione V 7 merore CGLMNT timore V 8 superstite N1 rogaretur efficere CGL; ere in ras. G 9 calor M 10 quodam Tl forsita Ll forsitan L\' seculari MT litteratura] littura M 11 multorum] om. CG 12 plurimorum CG inecicia M inscientia N 13 silenti MNT V quantum] quatti V litaralium F; corr. m . 2 14 dissertitudine MNTV sed non MNTV: sed nequaquam CGL 15 lucerne T uelud G 16 periciq V 17 impericiam V propriam] om. N uidelicet propriam C accusando] accusatio Mx accusans M\' \' 18 noli] non M 19 scilice M iam] quam CG nam Sauppe utique] itaque M 20 scilice M spiritualibus CG spiritual ia C spirituali G comparans nos de firmissima petra illo quo profluis orationis melle recreabis: de quo iam nectareum suauissimae promissionis gustum dirigens praecipis, ut commemoratorium uel indicia uitae saepe dicti sancti Seuerini transmitterem: quae donec in tuae constructionis libellum transire mereantur, nequaquam animum recensentis offendant. 
letter1.4	 quisquis enim ad construendam domum architectum requirit, necessariam sollicitus materiem praeparat: quod si moles instar parietum impolitis componatur artifice tardante lapidibus, numquid aedificasse dicendus est, ubi nulla magistri structura prorsus interuenit, nulla rite subicitur fundamenti munitio? sic ego quoque pretiosam materiem ingenio uestro uilissima compositione uix praeparans num putari debeo conscripsisse quod cupio, ubi disciplinae liberalis nulla constructio, nullus grammatici culminis decor extitit? 
letter1.5	 habet plane certum fundamentum solius fidei, quo sanctum uirum mirandis constat claruisse uirtutibus, quod per manus linguae tuae nunc offero collocandum, de tui operis fastigio laudes Christo debitas redditurus. 
letter1.6	IIIa. quoque, precor, uirtutum beneficia sanitatumque remedia, quae uel in itinere uel hic apud eiusdem beatissimi patris memoriam diuina sunt peracta uirtute, digneris adnectere: quae quoniam fidelis portitor, filius uester Deogratias, optime nouit, uerbo commendauimus intimanda, sperantes nos baiuli nomen etiam de tui operis perfectione iugiter esse ducturos, 1 illo quo profluit N ilico profluis M illo pro quo fluis TV orationibus M 2 nectaris V 3 commemorium V inditia M 4 sepe GM dicta V 5 tue TV 6 quisquis] siquis CG 7 materiam OL 8 molses M instar CGMNTV: ad instar L componat CGL 9 nunquid GOT 10 magistrinulla] om. G magistri] magis L post interuenit ras. 10 fere tl litt. V 11 preciosam V materiam MN 12 composione V comparatione M praeparaus] comparans M 14 constructio] instructio suspicatur Hartelius cl. ep. Pascas. §. 5 gramatici T extitit LMNTV: existit CG 15 quo] quod L 16 constat M lingue T 17 offero] confero CGL 19 uirtutum] om. M bnfitia M 20 itinere] itire V apud] ad CGL 21 uirtute* T annectere CGLN 24 nomine CG perfectione pfectione V ducturos Sauppe: dicturos CGLMNTV 1* ut dei fidelissimus famulus tantis uirtutibus opulentus, sicut ad sanctorum gloriam suis per Christi gratiam meritis uehitur, sic ad humanam memoriam tuis litteris consecretur. 
letter1.7	 Sane patria, de qua fuerit oriundus, fortasse necessario a nobis inquiritur, ut inde, sicut moris est, texendae cuiuspiam uitae sumatur exordium, de qua licet me fatear nullum euidens habere documentum, tamen quid hinc ab ineunte aetate cognouerim non tacebo.
letter1.8	cum multi igitur sacerdotes et spiritales uiri nec non et laici nobiles atque religiosi, uel indigenae uel de longinquis ad eum regionibus confluentes, saepius haesitarent inter se quaerentes, cuius nationis esset uir, quem tantis cernerent fulgere uirtutibus, nec ullus ab eo penitus auderet inquirere, tandem Primenius quidam, presbyter Italiae, nobilis et totius auctoritatis uir, qui ad eum confugerat tempore, quo patricius Orestes inique peremptus est, interfectores eius metuens, eo quod interfecti uelut pater fuisse diceretur, — post multos itaque familiaritatis adeptae dies erupit quasi pro omnibus et ita sciscitatus est dicens: \'domine sancte, de qua prouincia deus his regionibus tale lumen donare dignatus est?\' cui uir dei faceta primum hilaritate respondit:
letter1.9	csi fugitiuum putas, para tibi pretium, quod pro me possis, cum fuero requisitus, offerre\\ his talia serio mox subiciens: \'quid prodest\' 1 uirtitibus M pr . opulentus] opimus L 2 per] p (= pro) N uebeitur M euehitur CGL 5 ut inde MNTV: unde CGL texende GV texendo N 6 qua] om. L; ea Sauppe licet] om. C GL fateor CGLM 7 tamen-tacebo MNTV: om. CGL 8 cum multi igitur MNTV: nam cum multi CGL spirituales CG 9 noftilei V 10 re#gionibus T sepius GMNV esitarent N hesitauerint C esitauerint M excitauerint L 11 querentes GN 12 fulgere] fleere M nullus G penitus LV penit\'us M ,13 inquirera N primfnius L pr . pimenius CG Italiae] om. M 15 oreste N iniquQ G peremtus N 16 uelud N 17 itaque] om. CG adepte NV 18 siscitatus G sc5 LN prouintia MT 19 deus] om. M lumen] lumen xpf M 20 hylaritate CGL 21 precium MNV 22 serio CG: senior MNTV seuerinus L subitiens M inquit \'seruo dei significatio loci uel generis sui, cam possit id tacendo facilius uitare iactantiam, utpote sinistram, qua nesciente cupit omne opus bonum Christo donante perficere, quo mereatur dextris socius fieri et supernae patriae cinis adscribi? quam si me indignum ueraciter desiderare cognoscis, quid te necesse est terrenam cognoscere, quam requiris? uerum tamen scito, quia deus, qui te sacerdotem fieri praestitit, ipse me quoque periclitantibus his hominibus interesse praecepit\'. 
letter1.10	 tali memoratus presbyter responsione conticuit nee quisquam ante uel postea beatum uirum super hac parte percontari praesumpsit. loquela tamen ipsius manifestabat hominem omnino latinum, quem constat ad quandam orientis solitudinem feruore perfectioris uitae fuisse profectum atque inde post ad Norici Ripensis oppida, Pannoniae superiori uicina, quae barbarorum crebris premebantur incursibus, diuina compulsum reuelatione uenisse, sicut ipse clauso sermone tamquam de alio aliquo referre solitus erat, nonnullas orientis urbes nominans et itineris inmensi pericula se mirabiliter transisse significans. haec igitur sola quae retuli, quotiens de beati Seuerini patria sermo ortus est, etiam ipso superstite semper audiui.
letter1.11	indicia uero mirabilis uitae eius huic epistolae coniuncto praelatis capitulis 2 cf. Matth. 6, 3 1 sui loci uel generis CGL possit MNTV: potius CGL 2 facilius] facilius possit CGL euitare CGL iactandam MN-, eorr. m. 2 M 8 omne] om. N op\' (= opus) add . M1 in mg . 4 sotius T cinis] ciues N cui\' (= cuius) V 5 adscribi MTl (d ras. in T): ascribi CGLNV quam] qua (uirgula rasa) L desiderare CGMTV: desiderante N designare L cognoscis - terrenam] om. M 6 requiris] qugris L ueruntamen GL uerflptamen M 8 me] om. V 9 quicqua (sed c in ras. a m. 2) L 10 percunctari M 12 constat] constat prius CGL quendam G1; corr. m . 2 13 ad] om. M norici L nurici M TV 14 opida L 15 premebantur L compulsu N reuelatione] uisitatione L 16 tanquam CGTV 17 immensi LN immensa CG 19 hortus G 20 semper] sepe M inditia M 21 prelatis C prqlat\' (= praelatus) N commemoratorio recensita fient, ut rogaui, libro uestri magisterii clariora. superest, ut eius orationibus tuas sociare non desinas et indulgentiam mihi poscere non desistas. 1 fiant CG rogauit M uestro G magisterio G magistri M 2 tuas sociare1 t. sotiare T tu associate N 3 et libri: ut Sauppe mihi] om. M desistat L nrcxpmrr CAPITTLA DE HIS QVAE IV COMEMORATORIO CONTINENTVR (rubric.) ID EST QVIB; VTTE (om. N) TEL GEBTORV SCI SEYERIKI PANDYNTYR INDICIA NT ExpliC prologus. Incipiunt capitula. Quomodo primum beatus seuerinus in opido quod asturis uocatur. Et cetera. Expliciunt cap. Eiplic uita et obitus beati seuerini. Incip epta paskasii diaconi ad eugepiQ prbm L Explicit epta (om . V) Incipit uita sfci (beati V* in ras.) seuerini abbatis ab eugepio pftro edita pascasio diacono directa MV; sed uerba inde ab abbatis om. V Explicit prologus. Capitula dimitte C 
1.1	Tempore, quo Attila, rex Hunnorum, defunctus est, utraque Pannonia ceteraque confinia Danuuii rebus turbabantur ambiguis ac primum inter filios eius de optinendo regno magna sunt exorta certamina, qui morbo dominationis inflati materiam sui sceleris aestimarunt patris interitum. tunc itaque sanctissimus dei famulus Seuerinus de partibus orientis adueniens in uicina Norici Ripensis et Pannoniorum paruo, quod Asturis dicitur, oppido morabatur, ubi uiuens iuxta euangelicam apostolicamque doctrinam, omni pietate et castitate praeditus, in confessione catholicae fidei uenerabile propositum sanctis operibus adimplebat. 
1.2	 dum ergo talibus exercitiis roboratus palmam supernae uocationis innocue sequeretur, quodam die ad ecclesiam processit ex more. tunc presbyteris, clero uel ciuibus requisitis coepit tota mentis humilitate praedicere, ut hostium insidias imminentes orationibus et ieiuniis ac misericordiae fructibus inhiberent. sed animi contumaces ac desideriis carnalibus inclinati praedicentis oracula infidelitatis 2 Tempore] Tenpoe V In tempore L (cf. p. 4, 14) unnorum L hu- norum M 3 ceteraque CLV ceteraa (que ras.) G danubii codd. Casin. 144. 146 4 ac primum-interitum MNTV: om. CGL codd. Gasin. 144.145.146 5 exhorta TV 6 estimarunt MN 8 uicina MNTV: uicinia CGL codd. Casin . rupensis L Pannoniarum mauuIt Sauppe; Pannoni(ae superi)oris fort . 9 ubi add. Sauppe: om. libri 10 castitate et pietate L 11 pditus N 12 exerciciis M roboraretur M 13 innocua G quadam CGLN 14 eclesiam Lpr . 15 cpit CGMV codd. Casin . cepit L 16 hostium] u a m . 2, ut uidetur, T propter hostium L ac ieiuniis et CGL codd. Casin . 17 inhiberent CGMNTV: inhrerent L 18 inclinati] inquinati C GL codd. Casin . oraculi N suae discrimine probauerunt. 
1.3	 famulus autem dei reuersus ad hospitium, quo ab ecclesiae fuerat custode susceptus, diem et horam imminentis excidii prodens: de contumaci\' ait oppido et citius perituro festinus abscedo\'. inde ad proximum, quod 
1.4	 Comagenis appellabatur, oppidum declinauit hoc barbarorum intrinsecus consistentium, qui cum Romanis foedus inierant, custodia seruabatur artissima nullique ingrediendi aut egrediendi facilis licentia praestabatur. a quibus tamen famulus dei, cum esset ignotus, nec interrogatus est nec repulsus. itaque mox ingressus ecclesiam cunctos de salute propria desperantes ieiunio et orationibus atque elemosynis hortabatur armari, proponens antiquae salutis exempla, quibus diuina protectio populum suum contra opinionem omnium mirabiliter liberasset. 
1.5	 cumque salutem omnium in ipso discriminis articulo promittenti credere dubitarent, senex, qui dudum in Asturis tanti hospitis susceptor exstiterat, uenit atque a portarum custodibus sollicita interrogatione discussus interitum sui oppidi habitu uerboque monstrauit, adiciens eadem die, qua quidam homo dei praedixerat, barbarorum uastatione deletum. quo audito solliciti responderunt: putas non ipse est, qui desperatis rebus dei nobis subsidia pollicetur?\' mox igitur in ecclesia recognito dei famulo senex pedibus eius prostratus aiebat ipsius se meritis liberatum, ne cum ceteris oppidaneis subiret excidium. 2 *ospitium (h rasa) L hospicium MV ccleBi GMV 3 prodiens L 4 citius] cito (sed o a m. 2 in ras. 3 litt.; post t dispicitur i) L 5 comagenis L: commagenis CGMNTV codd. Casin . chumberhc comagenis cod. Vind. 1064 6 iniSrant L 7 nullaque L 8 facilis] facile (sed e a m. 2 in ras. 2 litt.; scriptum erat fortasse a m. 1 facilis) L facilius Sauppe 10 qcclesiam GLMNV 11 ieiuniis CG codd. Casin . elemosinis CM TV1 helemosinis GLN helemosynis codd. Cas . elemosinas VI 12 antiq, LV exempla L 13 oppinione L omnium] om. L 14 cunque T promittendi Npr . 15 tanti] prior t in ras. T 16 extiterat CGLN V codd. Cas . 18 aditiens M quidam CGLN codd. Cas.: quidem MTV 20 putas non (= aq\' oint) libri; cf. H. Boensch Ital. et Vulg.* p . 343: putasne Sauppe disperatis TV 21 Qcclesia TV 22 eius] ei N 23 ceteris LMV opidaneis TV oppidanis CG M codd. Cas . 
2.1	His auditis habitatores oppidi memorati incredulitati ueniam postulantes monitis uiri dei sanctis operibus paruerunt ieiuniisque dediti et in ecclesia per triduum congregati errata praeterita castigabant gemitibus et lamentis. die autem tertio, cum sacrificii uespertini sollemnitas impleretur, facto subito terrae motu ita sunt barbari intrinsecus habitantes exterriti, ut portas sibi Romanos cogerent aperire uelociter.
2.2	exeuntes igitur conciti diffugerunt, aestimantes se uicinorum hostium obsidione uallatos, auctoque terrore diuinitus, noctis errore confusi, mutuis se gladiis conciderunt. tali ergo aduersariis internecione consumptis diuino plebs seruata praesidio per sanctum uirum armis didicit pugnare caelestibus. 
3.1	Eodem tempore ciuitatem nomine FauianiB saeua fames oppresserat, cuius habitatores unicum sibi remedium affore crediderunt, si ex supra dicto oppido Comagenis hominem dei religiosis precibus inuitarent. quos ille ad se uenire praenoscens a domino ut cum eis pergeret commonetur. quo cum uenisset, coepit ciuibus suadere dicens:
3.2	\'paenitentiae fructibus poteritis a tanta famis pernicie liberari. qui cum talibus proficerent institutis, beatissimus Seuerinus diuina reuelatione cognouit quandam uiduam nomine Proculam fruges plurimas occultasse. quam productam in medium arguit uehementer. \'cur\' inquit \'nobilissimis orta natalibus cupiditatis te praebes ancillam et 1 No habitores (ta add. m. 2) M habitatoribus V memorate N pr . incredulitatis L (cf. p. 10, 19) 2 sancti L 3 acclesia GT V congraegati L 4 tercio M tertia L 5 sollempnitas GMV solemnitas N 6 ferre GMNV 7 sibi portas M pr . uelociter exeuntes. Igitur MNTV 8 estimantes CGLMN 9 auctoque] actoque L noctis] om. N 11 internecione T internicione CGL internitione MN internione V 13 Eodem] odem V fabianis GL sena LMNV famis L 14 oppresserat T affore] fore LM 15 comagenis L: commagenis CGMNTV 16 reliosis V uenire] ire in ras. T 17 commonetur] ammoneretur L (re del. m . 1) 18 cepit CGV cepit LN audere V 19 pernitie NV perniti M 20 beatus L releuatione V 23 orta MN extas auaritiae mancipium, quae est docente apostolo seruitus idolorum? ecce domino famulis suis misericordia consulente tu quid de male paratis facias non habebis, nisi forte frumenta dure negata in Danuuii fluenta proiciens humanitatem piscibus exhibeas, quam hominibus denegasti. quam ob rem subueni tibi potius quam pauperibus ex his quae adhuc te aestimas Christo esuriente reseruare. quibus auditis magno mulier pauore perterrita coepit seruata libenter erogare pauperibus. 
3.3	 igitur non multo post rates plurimae de partibus Raetiarum mercibus onustae quam plurimis insperatae uidentur in litore Danuuii, quae multis diebus crassa Heni fluminis glacie fuerant colligatae: qua dei imperio mox soluta ciborum copias fame laborantibus detulerunt. tunc coeperunt omnes deum insperati remedii largitorem continuata deuotione laudare, qui se tabe diuturnae famis interire crediderant, fatentes euidentius rates extra tempus glaciali solutas frigore serui dei precibus aduenisse. 
4.1	Per id tempus inopinata subreptione praedones barbari, quaecumque extra muros hominum pecudumque reppererant, duxere captiua. tunc plures e ciuibus ad uirum dei cum lacrimis confluentes inlatae calamitatis exitium retulerunt, simul ostendentes indicia recentium rapinarum.
4.2	ille uero 1 cf. Eph. 5, 5 1 que M 2 idolorum] doto in ras. G ydolorum L idolorum seruitus M mia (= misericordia) MNTV: misericorditer CGL 3 quid] qui N malis N paratis] partis CGl fatias M 4 dure NTV: diu CGLM denegata CG 5 subuenit M 6 estimas CLMN 7 seruare CGL 8 cqpit CGMV cepit L 9 retiarum CGLN reciarum MTV 10 on\'te V hunusta M qua N insperate GLV litore T 11 danubii L crassa Heni] crassani (q in ras. a m . 1) L crassa rheni CG glatie TV glaciQ N 12 qua] quQ L solute L cyborum L copias fame] copiissime N 13 cperunt CGLMV insperate L pr.; corr . m. 1 14 continua LM qui] quq N 15 diurnq M credebant CGL 16 extra tempus] extra e tempus M glatiali TV aduenisset M 17 id TV: idem CGLMN inoppinata M surreptione (prior r in ras. a m. 2 L) CGL 18 quqcunque T pecodumque CGL precodumque N repererant supr. uers. add. Ll reperssrant M 20 illate CGL 21 inditia M Mamertinum percontatus est, tunc tribunum, qui post episcopus ordinatus est, utrum aliquos secum haberet armatos, cum quibus latrunculos sequeretur instantius. qui respondit: milites quidem habeo paucissimos, sed non audeo cum tanta hostium turba confligere. quod si tua ueneratio praecipit, quamuis auxilium nobis desit armorum, credimus tamen tua nos fieri oratione uictores\'.
4.3	dei famulus ait: \'etiam si inermes sunt tlli, milites, nunc ex hostibus armabuntur: nec enim numerus aut fortitudo humana requiritur, ubi propugnator deus per omnia comprobatur. tantum in nomine domini perge uelociter, perge fidenter: nam deo misericorditer praeeunte debilis quisque fortissimus apparebit: dominus pro uobis pugnabit et uos tacebitis. uade ergo festinus, hoc unum ante omnia seruaturus, ut ad me, quos ex barbaris ceperis, perducas incolumes\'.
4.4	exeuntes igitur in secundo miliario super riuum, qui uocatur Ticuntia, praedictos latrones inueniunt: quibus in fugam repente conuersis arma omnium sustulerunt, ceteros uinctos ad dei famulum, ut praeceperat, adduxerunt captiuos. quos absolutos uinculis, cibo potuque refectos paucis alloquitur: ite et uestris renuntiate complicibus, ne auiditate praedandi ultra huc audeant propinquare: nam et statim caelestis uindictae iudicio punientur, deo pro suis famulis dimicante, quos ita consueuit superna uirtute protegere, ut tela hostium non eis inferant uulnera, sed arma potius subministrent*.
4.5	dimissis itaque barbaris ipse de Christi miraculis gratulatur, de cuius et miseratione 1 percunctatus M 4 sed] et CO 5 prqcepit V 7 uictores] auctores N dei] et dei COL iruermes (h rasa) L inhermes M 10 perge fidenter CGMNTV: om. L 11 nam CGMNTV: ia L praheunte G 13 ad] a F 14 coeperis T cqperis MV incolomes NTV 15 ticuntia NTV: ticuncia M tyguntia CO tigantia L predictos L1 16 inueniunt] inuenerunt CGL 17 ceteros LMN uinctos] uero uinctos CGL 18 praeceperat] pdixerat L adduxere CGL 19 denuntiate CGL 20 predandi Ll hue] hunc OxN 21 et MTV: om. CGLN uindicte V iuditio M 22 deo] ds V 24 subministrent LMNT1: sumministrent CO T\'V 25 gratubatur M de cuius - promittit] om. M miseratione] miratione O VIIII. 2. 2 promittit numquam illud oppidum hostium praedas ulterius experturum: ciues tantum ab opere dei nec prospera nec aduersa retraherent. 
4.6	 Deinde beatus Seuerinus in locum remotiorem secedens, qui ad Vineas uocabatur, cellula parua contentus, ad praedictum oppidum remeare diuina reuelatione compellitur, ita ut, quamuis eum quies cellulae delectaret, dei tamen iussis obtemperans monasterium haud procul a ciuitate construeret, ubi plurimos sancto coepit informare proposito, factis magis quam uerbis instituens animas auditorum.
4.7	ipse uero ad secretum habifcaculum, quod Burcum appellabatur ab accolis, uno a Fauianis distans miliario, saepius secedebat, ut hominum declinata frequentia, quae ad eum uenire consueuerat, oratione continua deo proprius inhaereret. sed quanto solitudinem abditam incolere cupiebat, tanto crebris reuelationibus monebatur, ne praesentiam suam populis negaret afflictis.
4.8	proficiebat itaque per singulos dies eius meritum crescebatque fama uirtutum, quae longe lateque discurrens caelestis in eo gratiae signa pandebat. nesciunt enim latere quae bona sunt, cum iuxta sententiam saluatoris nec lucerna sub modio contegi nec in monte posita ciuitas possit abscondi.
4.9	inter cetera enim 20 cf. Matth. 5, 14. 15 1 numquam L illo V experturum] x et um in ras. a m. 1 T 4 in remotiore loco M secedens] recedens CL qui] quod CG 5 winberc uineas cod. Vind. 1064 fol. 64\' contentus] ctept\' V 6 ut] om. L 8 haud] haud T haut L; om. M procul] om. M 9 CQpit OGL\'MTV 10 animas] animos OG; om. L auditorum] om. .L secretiu N 11 burgum CGL apellatur (sic) M wiena fabiaois GLNTV fauianis cod. Vind. 1064 12 sepius GLNV 14 proprius Hartel (comparat. aduerb . proprie cl. Neue Lat. FormenU II 114): propius GGM propitius NTV propitio L inhereret CGNTV sollicitudinem N abditam] om. CGL 15 crebrius CG relationibus M 16 presentiam L populis] popllf M denegaret CGL qa 17 meritum eius G 18 caelestis] cqlestis (qa add . m. 2) L gratiae] gra L 20 lucerna M 21 monte] inte V ciuitas posita M caetera GL magnalia, quae illi saluator indulserat, praecipuum abstinentiae munus accipiens carnem suam plurimis subiugabat inediis, docens corpus cibis abundantioribus enutritum animae interitum protinus allaturum.
4.10	calciamento nullo penitus utebatur: ita media hieme, quae in illis regionibus saeuiore gelu torpescit, nudis pedibus ambulare contentus singulare patientiae dabat indicium, ad cuius immanitatem frigoris comprobandam testem constat esse Danuuium, ita saepe glaciali nimietate concretum, ut etiam plaustris solidum transitum subministret. 
4.11	 qui tamen talibus per dei gratiam uirtutibus sublimatus intima humilitate fatebatur dicens: ne putetis mei meriti esse quod cernitis: uestrae est potius salutis exemplum. cesset humana temeritas, elationis supercilium comprimatur. ut aliquid boni possimus, eligimur, dicente apostolo: qui elegit nos ante mundi constitutionem, ut essemus sancti etimmaculati in conspectu eius. orate immo pro me, ut non ad condemnationis cumulum, sed ad iustificationis augmentum saluatoris dona proficiant.
4.12	haec et his similia solebat proferre eum fletibus, miro erudiens homines humilitatis exemplo, cuius uirtutis fundamento munitus tanta diuini muneris claritate fulgebat, ut ipsi quoque ecclesiae hostes haeretici reuerentissimis eum officiis honorarent. 14 Eph. 1, 4 1 indulserat] intulerat N praecipuQ G praecipue C 3 habundantioribus MTV 4 illaturum N caltiamento T penitus nullo L penitus V 5 medio h/eme L seuiore GL NV torpescitf- (= torpescitur) V 6 ambulare] semper ambulare CG conteptus L pacientiq V 7 imanitate M 8 runowa danubium cod. Vind. 1064 sepe GLM glatiali TV 9 sumministret CGTV 11 meriti* (s rasa) G 12 uestre GV 14 eligimur] o eligimur (q [= quo] add. m. 2) L eligere Mt eligimur (?) M1 15 sancti] sici V inmaculati MV 16 immo] in me L 17 ad condemnatio (L* in ras.) nis cumulum sed ad (add. Ll in mg.) iustific(ationis) L2 in ras . condemnation..is G 18 dona] michi dona CGL profitiant V pr . 19 miro] mino V 20 funda mento T diuini (uini a m . 2 in ras.) T 21 qccte OLIMTV heretici GMNTV 2* 
5.1	Rugorum siquidem rex, nomine Flaccitheus, in ipsis regni sui coepit nutare primordiis, habens Gothos ex inferiori Pannonia uehementer infensos, quorum innumera multitudine terrebatur. is ergo beatissimum Seuerinum in suis periculis tamquam caeleste consulebat oraculum. ad quem, dum uehementius turbaretur, adueniens deflebat se a Gothorum principibus ad Italiam transitum postulasse, a quibus se non dubitabat, quia hoc ei denegatum fuerat, occidendum.
