39.1	A discipulorum quoque suorum oellula spiritalis doctor non longius habitabat, in orationibus uel abstinentia 1 *arcianum V 2 renoto V 3 ai*t T 4 martianum TV 6 annotantes CGLMN 7 plurimos] pluribus N 8 qua] qui M indicantibus sicut signauerant] om. M 9 approbauerunt N 10 uir MNTV: om. CGL seuerinu\' V 11 reprente L districtiore] districcione G 12 cyborum M 13 occurre N 15 pabula M 17 tibi] om. M 19 obducto] om. M loetalis TV letalis OGLIN 20 euanuit M narrasse OOMNTV: narrare L Buffitiat V 21 nam] om. CG saepius ** T egritudines GLMNTV 22 isdem L: hisdem CGMNTV 24 A] om. V spiritualis CGL 25 orationibb; (prior b rasa) V abstinentia] in abstinentia OG iugiter perseuerans: cum quibus tamen matutinas orationes et propriam noctis principio psalmodiam sollemniter adimplebat, reliqua uero orationum tempora in paruo complebat oratorio, quo manebat. in quibus saepe caelestibus firmatus oraculis multa futura per dei gratiam praedicebat, multorum etiam occulta cognoscens, ut opus erat, proferebat in medium et singulis remedia, prout poscebat modus aegritudinis, prouidebat. 
39.2	 stratus eius unum erat in oratorii pauimento cilicium, omni tempore ipso quo uestiebatur amictu, etiam dum quiesceret, utebatur. numquam ante solis occasum nisi certa soluit festiuitate ieiunium. quadragesimae uero temporibus una per hebdomadem refectione contentus aequali uultus hilaritate fulgebat. aliena quasi propria errata deflens quibus poterat praesidiis temperabat. 
40.1	Deinde post multoB agones et diuturna certamina, cum se idem beatus Seuerinus de hoc saeculo transiturum deo reuelante sensisset, memoratum Rugorum regem Febam cum uxore eius crudelissima, nomine Giso, ad se uenire commonuit. 
40.2	 quem cum salutaribus exhortatus esset affatibus, ut ita cum sibi subiectis ageret, quo se iugiter cogitaret pro statu regni sui rationem domino redditurum, aliisque uerbis intrepide monuisset, protenta manu regis pectus ostendens reginam his interrogationibus arguebat: hanc) inquit animam, Giso, an anrum argentumque plus diligis?) cumque illa maritum se diceret cunctis opibus anteferre, uir dei sapienter adiecit: 2 psalmodia L, corr. m. 2 sollempniter LlM sollenniter G 8 complebat] implebat M 4 toraculis L 6 in medium proferebat cl M 7 egritudinis GLMTV 8 cilium (ci add . m. 2) T 11 quadragesime GV 12 ebdomadem OGTV ebdomada (ã a m . 2 in ras. L) LMN contentus] contSntus (uirgulam add., n del. m. 2) L equali GL hylaritate CG 16 deo] dno N 17 regem rugorum M febam MNTV: feuam CL fquam G 18 (et 23) giso GO- LN: gisa MTV 19 salutaribus] solarib; M exortatus LxVl affaatibiis T sibi cum L 20 subiectis (prior i in ras.) T quo CGMNTV: ut L pro statu] pstrata N 22 protenta] porrecta (porrec a m. 2 in ras.) L 23 iuterrotionibus V 24 arum V Cunque TV ergo\' inquit desine innocentes opprimere, ne illorum afflictio uestram magis dissipet potestatem: etenim mansuetudinem regiam tu saepe conuellis\'.
40.3	at illa: \'cur\' inquit \'nos sic accipis, serue dei?\' cui ipse: contestor ait tuos ego humillimus iam profecturas ad deum, ut ab iniquis actibus temperantes piis insistatis operibus. huc usque regnum uestrum auctore domino prosperatum est: iam ex hoc uos uideritis\'. his monitis rex cum coniuge sufficienter instructi ualedicentes ei profecti sunt. 
40.4	Tunc sanctus non desinebat de suae migrationis uicinia suos alloqui dulcedine caritatis, quod quidem facere nec ante cessauerat. \'scitote\' inquit \'fratres, sicut filios Israel constat ereptos esse de terra Aegypti, ita cunctos populos terrae huius oportet ab iniusta barbarorum dominatione liberari. etenim omnes cum suis facultatibus de his oppidis emigrantes ad Romanam prouiaciam absque ulla sui captiuitate peruenient.
40.5	sed mementote praecepti sancti Ioseph patriarchae, cuius ego indignus et infimus uos attestatione conuenio: uisitatione uisitabit uos deus: tollite ossa mea hinc uobiscum. quod non mihi, sed uobis est profuturum. haec quippe loca nunc frequentata cultoribus in tam nastissimam solitudinem redigentur, ut hostes aestimantes auri se quippiam reperturos etiam mortuorum sepulturas effodiant'.
40.6	cuius uaticinii ueritafcem euentus rerum praesentium comprobauit. leuari uero suum corpusculum pater sanctissimus, pietatis prouidus, 17 Gen. 50, 25 4 cui] cum L pr.\' 5 deum] dominum G M 6 operibus insistatis M auctore L domino] deo L 7 uos CGMNTVi om. L 8 coniuBge L 10 karitatis N 11 sitote V filii M israhel C ilil G ereptos esse CGLNV: ereptos essa T esse ereptos if 12 egypti CGLMN qgipti V cunctos] contos V ferre III MV 13 iusta V 15 prouintiam V mementote] mtote M 16 precepti L patriarch M ego indignus et inflmus uos NTV: II uos ego indignus et infimus CGL ego indignus nos M 17 uitatione T uisitauit (eorr. m. 2) L 18 tollite OGMNTV: et tolletis L ni 21 ostes L estiin antes GGLM se auri M 22 uaticii (corr. m. 2) L 23 comprobanit] demonstrauit M 24 corpuBScfclum G argumento praecepit, ut, dum generalis populi transmigratio prouenisset, indiuisa fratrum, quos adquisierat, congregatio proficiscens optentu memoriae eius in uno societatis sanctae uinculo permaneret. 
41.1	Diem etiam, quo transiturus esset idem beatissimus Seuerinus e corpore, ante duos seu amplius annos hac significatione monstrauit. Epiphaniorum die, cum sanctus se Lucillus presbyter abbatis sui sancti Valentini, Raetiarum quondam episcopi, diem depositionis annua sollemnitate in crastinum celebraturum sollicitus intimasset, idem famulus dei ita respondit: si beatus Valentinus haec tibi celebranda sollemnia delegauit, ego quoque tibi in eodem die uigiliarum mearum studia obseruanda migraturus e corpore derelinquo.
41.2	ille his sermonibus tremefactus cum se magis, utpote homo decrepitus, enixius commendaret quasi primitus transiturus, adiecit: (hoc erit, sancte presbyter, quod audisti, nec domini constitutum humana uoluntate praeteriet). 
42.1	Praeterea Fredericus a fratre suo, Rugorum rege Feba, ex paucis, quae super ripam Danuuii remanserant, oppidis unum acceperat, Fauianis, iuxta quod sanctus Seuerinus, ut retuli, commanebat. ad quem cum idem Fredericus ex more salutaturus accederet, coepit ei Christi miles iter suum enixius indicare, sub contestatione haec proloquens: 1 populis GM 2 prouenisset] prouenit se N acquisierat Ll MN 3 obtentu GMN optSptu V 5 beatus LM 6 corpore] co M hac] om. M significationes V pr . 7 epiphaniorum LN: epyfaniorum T epyphaniorum CGMV se sanctus M 8 prsbiter TV abbati sui GIV retiarum CLNTV reciarum GM 9 sollempnitate L sollennitate G 10 dei famulus M 11 celebranda L ueneranda M sollSpnia LIM sollennia G 13 studi. (0 eras.) V obseruanda V 14 ttpute L 17 preteriet - LMN 18 fredericus MNTV: ferderuohus C GL rege TV 19 feba MNTV: feua CL fua G danfibii t. L \'20 acceperan N fabianis G 21 commanebat GGLlM NTIV: commonebat L\' Tt idem] ille M fredericus] ferdfiruchus GL federuchus C 22 cqpit OGLN cepit M noueris me\' inquit \'quantocius ad dominum profecturum et idcirco monitus praecaueto, ne me discedente aliquid horum, quae mihi commissa sunt, attaminare pertemptes et substantiam pauperum captiuorumque contingas, indignationem dei, quod absit, tali temeritate sensurus\'.
42.2	sed Fredericus insperata commonitione perculsus: \'cur\' inquit hac contestatione confundimur, cum non optemus tantis orbari praesidiis et sanctae largitioni tuae, quae omnibus nota est, conferre aliquid deceat, non auferre, quatenus solita, sicut et pater noster Flaccitheus, tua merear oratione muniri, qui experimento didicit sanctitatis tuae meritis se fuisse semper adiutum?\' et ille: qualibet inquit \'occasione cellulam meam uolueris laedere, et hie statim probabis et in futuro solues quam non opto uindictam). 
42.3	 tunc Fredericus promittens se Christi famuli monita seruaturum remeauit ad propria. doctor uero dulcissimus non cessabat suos alloqui per monita discipulos dicens: \'confido de gratia domini mei Iesu Christi, quia uobis in opere suo durantibus et meae memoriae pacata societate coniunctis, aeternae uitae bona tribuet nec praesentium solacia denegabit\'. 
43.1	Nonis itaque ianuariis coepit tenuiter lateris dolore pulsari. quo durante per triduum medio noctis tempore fratres adesse praecepit, quos de corpore suo commonens et paterna 1 quantotius LTV quStotius N 2 iccirco CGM monitis M praecaueo N 3 pertemtes C 4 indignacione M 5 temeritate] seueritate M ferddruchus CGL inspirata L DI 6 commotione (corr. m. 2) T commotione N 7 sancte GNV 8 conferri M aliquid] nos aliquid CGL deceat] doceat L* 9 auferri M quatinus CG flaccustheus (us del. m. 2) N 11 se] om. M 12 occacione G uoluerit M ledere CGL MN 14 ferderuchus CGL monita CGLMN: nonita TV \' 16 monita MNTV: momenta CGL confidoe N 17 durantibus] laborantibus M 18 pacata (a prima a m. 2 in ras. 2 litt.) L paccata M eternq GV qterna M uitae] om. M 19 tribuffit M prBentiam T pr . solatia NlTV denegauit (u ex b corr. m. 2) G 20 i:uariis T Npit CGLN cepit M 21 mediq M fratres] om. M 22 adessae V suo] om. M commouens N informatione corroborans, instanter ac mirabiliter talia prosecutus aiebat:
43.2	\'filii in Christo carissimi, scitis, quod beatus Iacob de saeculo recessurus condicione mortis instante fitios suos adesse praecipiens et prepheticae benedictionis affatibus singulos quosque rem unerans mysteriorum arcana prodidit futurorum. nos uero infirmi ac tepidi tantaeque impares pietati hanc praerogatiuam nostris usurpare uiribus non audemus, unum tamen, quod humilitati congruit, non tacebo, mittens ues ad exempla maiorum, quorum intuentes exitum conuersationis imitamini fidem. Abraham namque uocatus a domino fide oboediuit, at exiret in locum, quem accepturus erat in possessionem, et exiit nesciens, quo «enturos esset.
43.3	huiua igitur beati patriarchae imitamini fidem, imitamini sanctitatem, terrena despicite, patriam caelestem semper inquirite. confido autem in domino, quod mihi de uobis aeterna lucra prouenient. uideo enim 1109 gaudium meum feruore spiritus ampliasse, amare iustitiam, fraternae caritatis uincula diligere, castitati operam dare, humilitatis regulam custodire: haec, quantum ad hominis spectat intuitum, laudo confidenter et approbo. 
43.4	 sed orate, at quae humanis aspectibus digna sunt aeternae discretionis examine firmentur, quia non, sisut homo uidet, uidet deus. ille siquidem, sicut diuinus sermo denuntiat, omnium corda scrutatur et omnes mentium cogitationes anteuenit. assiduis ergo precibus hoc sperate, ut oculos cordis uestri deus inluminet eosque, sicut optauit 3 cf. Gen. 49, 1-33 23 Rom. 8, 27 2 aiebat] agebat TV 8 conditione LTV 4 et propheticae CGMNTV: prophetica L 5 singulos CGL: singulorum MNTV misteriorum GM ministeriorum L, corr. m. 2 archana libri 6 infimi (fi in ras. L) CGL pietate N pro 7 prarogatiuan V 10 abraham TV: habraham LN1 abraam CGM nanque C 11 obdiuit CL obediuit GMN 12 uentu| turus T 13 patriarch M fidem imitamini] C1 in ras . 15 autem] om. M eterna V 17 karitatis LN nincla CG 18 haec] hc autem M 20 eterne V 21 examine] examinatione (ion am . 2 L) CL examinacione G homo uidet MNTV: uidet homo CGL 22 diuinis Npr . 25 illuminet CGLMNT 2 V beatus Heliseus, aperiat, quo possitis agnoscare. quanta, nos circumstent adiumenta sanctorum, quanta fidelibus auxilia praeparentur. deus enim nester supplicibus appropinquat.
43.5	non desit militantibus deo iugis oratio: non pigeat agere paenitentiam, quem. non puduit facinus perpetrare: non dubitetis, luge.e peccantes, si quo modo offensa diuinitas uestrarum lacrimarum inundatione placetur, quia spiritum contribulatum suum dignatus eat uocare sacrificium. simus igitur corde, humiles, mente tranquilli, delicta omnia praecauentes ac diuinorum semper memores mandatorum, scientes non prodesse nobis humilitatem uestis, nomen monachi, uocabulum religion», speciem pietatis, si circa obseruantiam mandatorum degeneres inueniamur et reprobi.
43.6	mores igitur, fiJLii mm canssimi,, proposito suscepto consentiant: grande nefas est peccata sectari etiam hominem saecularem, quanto magis monachos, qui blandimenta saeculi quasi atrocem bestiam fugientes Christum cunctis affectibus praetulerunt, quorum incessus et habitus uirtutis creditur esse documentum? sed quid uos ultra demoror, filii carissimi, longi sermonis affatu?
43.7	superest, ut beati apostoli ultima oratione uos prosequar ita dicentis: et nunc commendo uos deo et uerbo gratiae eius, qui potens est conseruare uos et dare hereditatem in omnibus sanctificatis. ipsi gloria in saecula saeculorum. amen.\' 1 cf. IIIl Reg. 6, 17 7 cf. Ps. 50, 19 20 Act. 20, 32 1 quo LMNTV: ut OG 2 sanctorum adiumenta M 3 supplicibuB Sauppe ex codd, quibusdam recc.: simplicibus libri 4 non pigeat - perpetmre] add. m. 1 inmg. V penitentiam V 5 pudui N 6 peccantes] ntes in tis (= peccatis) coir. m . 1 in mg. L 8 scimus TV 10 memorel] om. N 12 spaiem T1 mandatorum] mandatorum dl M 13 inueniamur OGMNTV: inuenimur L 15 secularem LV 16 secnli L * 17 affectitibus V 19 demorer Jtf filii] filii mei M affatu CG-LMN: affecta TV 90 prosequa*r T dicentis (tis del., s add. m. 2) L et] e - V 22 conseruare] consolari M hereditatem (redi in ras.) L 23 secula seculonun V 24 amen MNTV: om. CGL 
43.8	 Post huiusmodi igitur aedificationis alloquium cunctos per ordinem ad osculum suum iussit accedere et sacramento communionis accepto fieri se penitus prohibet totumque corpus signo crucis extenta manu consignans, ut psallerent imperauit. quibus maeroris suffusione cunctantibus ipse psalmum protulit ad canendum: Laudate dominum in sanctis eius, omnis spiritus laudet dominum.
43.9	sexto itaque iduum ianuariarum die in hoc uersiculo nostris uix respondentibus quieuit in domino, quo sepulto credentes omni modo seniores nostri, quae de transmigratione praedixerat, sicut et multa alia praeteriri non posse locellum ligneum parauerunt, ut, cum praenuntiata populi transmigratio prouenisset, praedictoris imperata complerent. 
44.1	Fredericus uero beati Seuerini morte comperta, pauper et impius, barbara cupiditate semper immanior, uestes pauperibus deputatas et alia nonnulla credidit auferenda. cui sceleri sacrilegium copulans calicem argenteum ceteraque altaris ministeria praecepit auferri.
44.2	quae cum imposita essent sacris altaribus nec auderet directus uilicus ad tale facinus suas manus extendere, quendam militem, Auitianum nomine, compulit diripere memorata. qui quamuis inuitus praecepta perficiens, mox tamen incessabiliter uexatus omnium tremore membrorum daemonio quoque corripitur. is ergo uelociter consilio meliore correxit errata, suscepto namque professionis sanctae proposito in insulae solitudine armis caelestibus 6 Ps. 150, 1. 6 3 communiohnis M penitus] protinus M 4 externa] tenta N 5 meroris libri cunctatibus V 8 ianuarii M nostris MNTV: nobis CGL 9 «quieuit L 10 nostri] om. M 11 praeterire CGLN 12 populi prenunciata M predictoris te MV prqdictores Lx, corr. m. 2 13 impera (ta fere euanuit) M 14 ferdfiruchus CGL 17 ceteraque GLM 18 com V 19 di- 2ectus T uilicus NTV: uillicus CGLM 20 extendere manus M auicianum GM 21 deripere Ll precepta L 22 uexatus «omnium (s ras.) L tremore OGLIMNTV: tumore Li1 23 menbrorom LN his LM 24 Cscilio M melire L pr. nanque C mancipatus militiae commutauit officium.
44.3	Frederious autem immemor contestationis et praesagii sancti uiri abrasis omnibus monasterii rebus parietes tantum, quos Danuuio non potuit transferre, dimisit. sed mox in eum ultio denuntiata peruenit: nam intra mensis spatium a Frederico, fratris filio, interfectus praedam pariter amisit et uitam.
44.4	quapropter rex Odoacar, Rngis intulit bellum. quibus etiam deuictis et Frederico fugato, patre quoque Feba capto et ad Italiam cum noxia coniuge transmigrato, post audiens idem Odoacar Fredericum ad propria reuertisse statim fratrem suum misit cum multis exercitibus Onoulfum, ante quem denuo fugiens Fredericus ad Theudericum regem, qui tunc apud Nouas, ciuitatem prouinciae Moesiae, morabatur, profectus est.
44.5	Onoulfus uero praecepto fratris admonitus uniuersos iussit ad Italiam migrare Romanos. tunc omnes incolae tamquam de domo seruitutis Aegyptiae, ita de cotidiana barbarie frequentissimae depraedationis educti sancti Seuerini oracula cognouerunt. cuius praecepti non immemor uenerabilis noster presbyter tunc Lucillus, dum uniuersi per comitem Pierium compellerentur exire, praemissa cum monachis uespere psalmodia sepulturae locum imperat aperiri.
44.6	quo patefacto tantae suauitatis fragrantia omnes nos circumstantes accepit, ut prae nimio gaudio atque admiratione 1 mancipatus CGLM: mancipatum NTV ferderuchus COL autem] uero M 3 danubio L 4 tranferre M 6 quapropter] quia propter (i expunxit m. 2) L (et. 9) odouacar CO odoacer L 8 feba MNTV: feua CL fqua G et MNTV: atque C GL 10 multis] om. M 11 oDoulphum M quem COMN TV: qua L fredericus. ad L 12 teudericum NTV theodericum COLM prouinti TV 13 mesiQ LM misiq G mysiq C onoulphus M 14 fratris] patris M ammonitus L1 MNT1 15 post incolae ras. 2 litt. in L tanquam TV quasi M egyptiae CN egypciQ GM 16 cotidiana CGN: cottidiana MTV quotidiana L barbaric GMNV depredationis V 17 prqeeptis (s del. m . 1) M 18 prsbiter TV 21 fragrantia C: flagrantia LMNTV flagrancie (e in a corr.) G nos omnes M 22. circumstantes] om. M ammiratione NT1 ammiracione M iammiratione (i expvmxit m. 2) L prosterneremur in tortam. deinde humaniter aestimantes ossa funeris inueniri disiuncta — nam annus sextus depositionis eius effluxerat — integram corporis compagem repperimus. ob quod miraculum inmensas gratias retulimus omnium conditori,, quia cadauer sancti, in quo nulla aromata fuerant, nulla manna accesserat condientis, cum barba pariter et capillis usque ad illud tempus mansisset inlaesum.
44.7	linteaminibus igitur immutatis in loculo multo ante iam tempore praeparato funus includitur, carpente trahentibus equis inpositum mox euehitur cunctis nobiscum prouincialibus idem iter agentibus, qui oppidis super ripam Danuuii derelictis per diuersas Italiae regiones uarias suae peregrinationis sortiti sunt sedes. sancti itaque corpusculum ad castellum, nomine Felethem, † Mulsemensis regionis apportatum est. 
45.1	Per idem tempus multi uariis occupati langoribua et nonnulli ab spiritibus inmundis oppressi medellam diuinae gratiae sine ulla mora senserunt tunc et mutus quidam ad id castellum suorum miseratione perductus eat. qui dum in oratorio, quo sancti uiri corpusculum super carrum adhuc positum permanebat, alacer peruenisset ac sub eo clauso oris sui ostio in cordis cubiculo supplicaret, ilico lingua eius in 1 terra L humaniter OOMNTY: unanimiter L estimantea CGLMN 2 inuenire CO 3 effluxeraet V repfirimus L 4 immensas CMN 5 quo] qua N 7 mansisset MNTV: permaosisset CGL inlesum MV illteum Lx illesum GGHSN 8 fumus N 9 qquis OLl impositum COLMN uehitar M 10 canctis nobieoum] rasa M M prouintialibus V idem CLMi idem idem G eundem NTV 11 danubii L diuersa M 12 peregrinationes L corr. m. 2 sortiti-regionis] om. M 13 felethem NTV: montem feletem CL montem felentem G mulse mensis regionis (sub mulse mensis nomen regionis Italiae latere uide- tvr) NTV: multis emensis (sis in ras. G) regionibus CGL 15 multi CMNTV: multis OL langoribus occupati M languoribus C ON 16 ab OGMNTV: a L immundis COLUMN medellam TV pr. i medelam COMN medgelam (e la a m. 2) L 17 semserunt V ad id] adit N 19 oratorio LMNTV (cf. Bdnsch It. et Vulg*p. 406): oratorium CG 21 hostio NTV hostio lit mdla cubiculo cubiculo M lingua* T oratione soluta laudem dixit altissimo.
45.2	eumque renersus ad hospitium, quo suscipi consuerat, intarrogatus fuisset; ex more, nutu signoque pulsatus, et orasse et laudem se deo obtulisse clara uoce respondit. quo loquente pauefacti qui eum nouerant, ad oratorium cum clamore currentes sancto Lucillo presbytero simulque nobis, qui cum illo eramus, ignorantibus quod euenerat, indicarunt. tunc omnes exultantes in gaudio diuinae clementiae gratiarum retulimus actionem. 
46.1	Igitur illustris femina Barbaria beatum Seuerinum, quem fama uel litteris cum suo quondam iugali optime nouerat, religiosa deuotione uenerata est. quae post obitum eius audiens corpusculum sancti in Italiam cum multo labore perductum et usque ad illud tempus terrae nullatenus commendatum uenerabilem presbyterum nostrum Marcianum, sed et cunctam congregationem litteris frequentibus inuitauit.
46.2	tunc sancti Gelasii, sedis Romanae pontificis, auctoritate et Neapolitano populo exequiis reuerentibus occurrente in castello Lucullano per manus sancti Victoris episcopi in mausuleo, quod praedicta femina condidit, collocatum est. 
46.3	Qua celebritate multi langoribus diuersis afflicti, quos recensere longum est, receperunt protinus sanitatem. inter 1 soluta MNTV: resoluta CGL cunque TV 2 *ospitium (h ras.) L coosuerat TV: consueuerat CGLMN interrogatus M: interrogantis CGLNTV 3 nutu] nitu N signoque CGMNT: signoque V signoue L et orasse et CGL: et orasset NTV an orasset M optulisse LM 4 lonquente G 7 indicauerunt M 8 clementiae] gra clemeatiq (sed grq del. m . 1) N 10 quondam] quodam M 11 religiosa deuotionel deuotiosa L; religiosa in ras. G 12 italia L cum MNTV: om. GGL labore CGMNTV: honore L 14 UBrabilem V martianum TV 15 frequentibus litteris G turn M 16 neapolitane Ll neapolitanq L1 17 ezsequiis L exequis V reuerentibus CG NTY: Jreuertentibus L reuerendis M occurrentibus M lucullano CGLN: lucallane TV lucalano M 18 manu TV qictois V in] om. N mausuleo NTc mausoleo CGLM manusuleo V b 20 celeritate (corr . m. 2) L languoribus CGMNTI Lmguobus V vim. s 5 quos quaedam uenerabilis ancilla dei, Processa nomine, cinis Neapolitana, cum grauissimum aegritudinis pateretur incommodum, sancti funeris prouocata uirtutibus in itinere properanter occurrit et ingressa sub uehiculo, quo corpus uenerabile portabatur, statim caruit omnium langore membrorum. 
46.4	 [Tunc et Laudicius quidam caecus, inopinato psallentis populi clamore perculsus, sollicite suos quid esset interrogat. respondentibus, quod cuiusdam sancti Seuerini corpus transiret, compunctus ad fenestram se duci rogat, de qua poterat a sanis eminus multitudo psallentium atque uehiculum sancti corporis contemplari. cumque fenestrae nixus incumberet et oraret, protinus uidit, singillatim nominatimque demonstrans omnes notos atque uicinos. quo facto cuncti, qui audierant, gratias deo lacrimantibus gaudiis retulerunt. 
46.5	 Marinus quoque, primicerius cantorum sanctae ecclesiae Neapolitanae, cum sanitatem post immanissimum langorem recipere pro incessabili capitis dolore non posset, caput uehiculo credens apposuit et mox a dolore liberum subleuauit memorque beneficii semper in die depositionis eius occurrens uoti sacrificium deo cum gratiarum actione reddebat. 
46.6	 Verum multis plura scientibus sufficiat tria de innumeris, quae in ingressu eius gesta sunt, beneficiorum uirtutumque retulisse miracula.] Monasterium igitur eodem loco constructum ad memoriam beati hactenus perseuerat, cuius meritis multi 1 quaedam] que--dam L cinis CGMNTV*: cuius LVI 2 neapolitane Lx neapolitana L7 egritudinis GLMTV 3 in] OWl. L itinere] initinere V properanter] ppe (= prope) M 4 occurrit-qllo] om. M uehiculum G post corpus ras. i litt . in V uenerabile corpus M 5 omnium] omni M languore CGMNV1 menbrorum LN 6 Tunc et Laudicius-23 retulisse miracula] exhibent CGL, om. MNTV inoppinata L 11 nixus C L: nixius G 12 nominatimque CG: om. L 13 notos] ex natos corr. L* 15 acclesia Lx 16 languorem CG 21 sufficiat CGIL: sufficiant G* 23 eodem CGMNTY: in eodem L constructum] constitutum M 24 beati] beati uiri CGL actenus MY1 perseuerat M obsessi a daemonibus sunt curati et diuersis obstricti langoribus receperunt ac recipiunt operante dei gratia sanitatem: cui est honor et gloria in saecula saeculorum. amen. Habes, egregie Christi minister, commemoratorium, de quo opus efficias tuo magisterio fructuosum. 1 a COLT1: om. MNTJV sunt-langoribus] om. COL langTioribus N 2 dei gratia] dno grain (m del . m. 2) N sanitate N 3 amen] om. N 4 Habes—fructuosum CGNT: om. MLV egregie CG- egregi NT KXPLICAT COMMEMORATORIVM Dr QYO SOl SETERINT VITAE CONTINENTVE INDICIA. INCIPIT RESCRIPTVM sci PASCASN DiACosa T INCIPIT RESCRIPTA SCI PASCHASH DIACOHT N Explicit (om. G) Incipit epistola paschasii diaconi rescripta (rescrita G) ad eugepium presbyterum CG Explicit uita sci seuerini. Incipit prologus in libro uitae scorum patrum M Incipit uita beati pauli primi heremite V 
letter2.1	DOMINO SANCTO SEMPERQVE CARISSIMO EVGIPPIO PBESBVTERO PASCASIVS DIACONVS. Frater in Christo carissime, dum nos peritiae tuae facundia et otii felicitate perpendens amaritudines occupationesque multiplices peccatorum retractare contemnis, pudoris iacturam dilectionis contemplatione sustineo.
letter2.2	direxisti commemoratorium, cui nihil possit adicere facundia peritorum, et opus, quod ecclesiae possit uniuersitas recensere, breui reserasti compendio, dum beati Seuerini finitimas Pannoniorum prouincias incolentis uitam moresque uerius explicasti et quae per illum diuina uirtus est operata miracula diuturnis mansura temporibus tradidisti memoriae posterorum — nesciunt facta piorum praeterire cum saeculo — ut omnes praesentem habeant et secum quodam modo sentiant commorari, quibus eum relatio peruexerit lectionis. et ideo, quia tu haec quae a me narranda 
letter2.3	 poscebus elocutus es simplicius, explicasti facilius, nihil adiciendum labori uestro studio nostro credimus: siquidem aliter 1 Epistolam Pascasii om. MV 3 sancto] om. CO semperque] semper G eugepio libri 4 pascasius T: paskasius L paschasius CGN 6 perpendens NT: perpendis CGL 7 contempnis L 8 cotgplatione L 10 acclesia GL 11 prouintias T 14 tradidistis (corr. m. 1) L nesciunt CGNT: nesciunt enim L piorum Bollandus: priorum CGLNT 15 perire N 16 relatio] relaxacio G i7 a] om. C 19 credimus NT: credidi- I mus OGL alter (corr . m. 2) T audita narramus, aliter experta depromimus. facilius uirtutes magistrorum a discipulis exponuntur, quae suggeruntur crebrius conuersatione docentium. 
