1	 Domine sancte pater hagios Deus, ad te legaui animam meam, Deus meus, quis enim maior est ? tibi semper gratias et laudem referam Deus Abraham, Deus Isaac, Deus Iacob, Deus patrum nostrorum, Deus prophetarum, Deus apostolorum, Deus martyrum, qui fuisti ante mundi dispositionem, Deus uiuorum, qui uenturus es iudicare uiuos et mortuos: qui es Deus uerax, qui sedes super Cherubim et Seraphim, qui prospicis abyssos, qui uides cuncta priusquam nascantur, qui habes potestatem mortificare et iterum uiuificare, qui habes potestatem de arido uiride facere. tu omnium Deus dominator, 8 potestas om. T 4 et nunc et v, nunc T . — Oratio Cypriani explicit E, om. IT. — Oratio II. — Incipit oratio sancti Cypriani T, Incipit oratio Cypriani BNn, Incipit oratio M . — 7 agios Nn . deus om. n ad te 1. a. meam T, aeterne a te et ad te BMN, om. n, hagie et hagie a 8 est Y, te est M, te BNnv semper om. BMNno gratiam n laudes BN refero Mv, fero BNn 9 habraham Tn, abrahae BMN, abrahae et v isaac et v 10 apostolorum et deus prophetarum et v fuisti] es et fuisti BN 11 mundi add. M m. 2 in marg . dispositionem] constitutionem M qui u. es Yn, uenturus BMNv 12 et serafyn T, om. BMNn; sedem honoris tui add. v 13 qui u. Y, et u. BMNno 14 mortiflcare] occidere nv iteram] rursus nv uiuiftcare] restituere nv 15 potestatem] add. MY: occidere et resuscitare (rursum restituere M) qui habes potestatem aridum M1 uiridem BM deos] dns BNnv libera me de hoc saeculo mortali, exaudi me orantem, sicut exaudisti filios Israel de terra Aegypti, et non tibi crediderunt nec famulo tuo Moysi. \'\\ 
2	Vaa pocestis meis, Domine. eum te leuaueris confringere terram, sub qua fissura petrarum me absconsurus sum ab ante uirtutem tuam aut cui monti dicturus sum: cade super me, et cui colli dicam: tege me ab ante metum Domini mei, cum te leuaueris confringere terram ? rogo te, Domine, subueni mihi: noli secundum actum meum me iudicare: nihil enim in praeceptis tuis parui. exaudi me orantem. sicut exaudisti Ionam de uentre ceti, sic et me exaudias et eicias me de morte ad uitam. sicut Niniuitae induerunt se cinerem et cilicium et paenitentiam egerunt, exomologesin facientis ante conspectum tuum pro uniuersis peccatis meis, qui es amator paenitentiae, miserere mei. sed et Dauid dicit: Domine propter nomen tuum dele peccatum meum. et ego deprecor maiestatem tuam ut deleas uniuersa peccata mea, exaudi me orantem, sicut audisti tres pueros de camino ignis ardentis Ananiam Azariam et Misael: et misisti angelum tuum cum roribus tuis, et confusus est Nabuchodonosor 14 Ps. 50, 3. 1 de] ab Mnv jnortale Y, om. BMNnv et exaudi BMNnv 2 de t. aegypti om. M tibi om. B nequae Y, nec obedierunt BN 4 domine om. BMNnv tu te leuaberis n, ueneris BN terra NY 5 sub ...!. 8 terram om. n quam N fixura NY 6 aut cui Y, cui BMNv dicam om. BMNv 7 mei om. BMNv cum ... terram om. Y eleuaueris N, leuaberis B 8 rogo te ona. BN; te om. Mnx noli s. a. m. m. iudicare] et indulge peccatis meis BN 9 orantem] rogantem B 10 coeti Y sic et me T, sic Mnv, om. BN me] me sicut ezechias n exaudias om. BN eice BNn 11 nineuitae B, niniuae Ml, nini.. n1, nineti..b ciuitatem Y se om. BMNM cinere N 12 poenitentia N egerunt] ante dominum add. v exomologesi N facientes MIn, faciens BM\'N, faciee suas Y 14 mei om. n, mihi M domine om. n dixi dele n 15 depraecor Y, deprecans BMNnv ut deleas Y, dele BMNnv 16 et exaudi BMNnv rogantem BNn exaudisti BMn 17 ardentes T, om. BMNnv ananias azarias Yn, anania azaria N et om. BMNv misahelem BN 18 roribus tuis Y, nimbo roris BMNnv et om . n, cum M s. I. m. 2 nabogodonosor Mp nabucchodonosor rex Y, 10* praepositus regni : quoniam tu es rex regnantium et dominus dominantium, qui solus habes inmortalitatem et lucem habitas inaccessibilem, quem nemo hominum uidit nec uidere potest. exaudi me orantem, sicut exaudisti Danielum de lacu leonum: et misisti Abbacum prophetam, et adtulit ei prandium et dixit: prande prandium, quod tibi misit Deus. et Daniel dixit: non derelinquit Dominus quaerentes se. exaudi me orantem, sicut exaudisti Tobi et Sarram dum orarent in atrio domus suae: tunc obtulit pro eis Raphael angelus orationem eorum: sic et tu exaudias preces meas et mittas ad aulam sanctam tuam orationem meam, et continuo mittas angelum sanctam tuum, qui deleat uniuersa commissa mea, sicut deluisti spiritum inmundum a Sarra filia Baguel: et inlumines cor meum, sicut inluminasti oculos Tobi. exaudi me orantem. sicut exaudisti Susannam de inter manus seniorum, sic et me liberes de hoc saeculo mortali, quia tu es amator purae conscientiae. exaudi me orantem, sicut exaudisti Ezechiam regem Iudaeorum et deluisti ab eo infirmitatem carnis eius: sic et me liberes, et augeas mihi ad 5 Dan. 14, 33. 1 tu om. n et om. N 2 immortalitate N et] in M habitas n s. I . m. 2, habitat N 3 quam v uidet v . potest] poterit BN 4 danielem MfJ, danihel N lacum MNT ambacum MY, abacuc Bv 5 prandere B quod] quem Y 6 dns MNn, da te B dixit daniel BMNn υ celinquid N, relinquet BMnv 1 tobi Y, tobin *, tobiasi N, tobiam BMx 8 saram n υ tuae Y pro eis om. n, pro se N 9 orationeB Mnv, in orationem B -et tu om. BN meas dne BN 10 admittas BMNnv tuam due N orationes meas BMNnv continuo om. BN, continenter nv 11 sanctum om. BMNno uniuerea] omnes BN commissa] iniquitatee BN, delicta v meas BN 12 deluisti n, diluisti Y, deleati BMNv sarram BY, sara Mv filiam BY raguelis N et om. BMn illu- mina BN 13 tobiae BMNnv 14 de om. BMNv et om. υ liberis Y, libera N de Y, ab BMNn υ 15 mortali om. BMNnv 16 exechian n, tu et esechiam N iudeae BMNn, iudae « et om. BMN diluisti Y, deleas BN, delisti M, deleati ne 17 carnis eiue Y, carnis n, om. ΒΜΝυ a me BMNn υ liheris F, auferas infirmitatem carnis BMNno; et corporis add. BN fidem, sicut illi ad uitam annos quindecim addidisti. sic et me liberes de hoc saeculo, sicut liborasti Teclam de medio amphitheatro, liberes me ab omni infirmitate carnis meae. 
3	Te deprecor pater omnipotens, qui in fine temporum commemoratns es nostri: misisti nobis Iesum Christum filium tuum Deum et Dominum nostrum, natum de Maria uirgine de spiritu sancto, adnuntiante Gabrielo angelo, per quem nos liberasti de periculo mortis inminentis. 
4	Te deprecor filium Dei uiui, qui fecisti tam magnalia: in Cana Galilaeae de aqua uinum fecisti, propter filios Israel qui caecis oculos aperuisti, qui surdos audire fecisti, qui paralyticos ad sua membra reuocasti, qui soluisti linguas blaesorum, a daemonio uexatos sanasti, clodos currere fecisti uelut ceruos, mulierem a profluuio sanguinis liberasti, mortuos suscitasti, super aquas pedibus ambulasti, [qui Petro labenti manum tradidisti] qui mare fundasti et terminum ei posuisti, qui dixisti: hucusque uenies et te hic confringes in tua uirtute. te deprecor filium summi Dei propter uniuersa commissa 1 ad n. a. q. addedisti Y, aozisti in annos sua uitam N, auristi in (in om. nv) annos quindecim ad uitam BMnv sic et om. BMNnv me liberis Y, liberes me BN, libera me Mnx 2 hoc saeculo Y, medio saeculi huius BMNnv ampitheatro NY, amphitheatri n libera BMNv libera ... meae om. Y 3 omne BN meae om. BNn 4 precor n omnipotens Y, maiestatis M, om. BNn finem BY commemoratus] congtitutus M, misertus e 5 misisti Y, mittens BMNwo dm et dñm Y, dmn et dm BN, dum dm MtW; saluatorem add. BMNnv 6 ex maria Mv 7 grabriel MNv archangelo n liberauit B 9 te] et te BMNv depre N filius it uiuentis BNn tam Y, tanta BMNnv magnalia] mirabilia Mv in] qui in v ehanaan Y, chana Nn 10 filios om. BMNnv 11 qui surdos] snrdoe B * qui om. BN paralicos M 12 blesorum BM, aexorum Y a om. BMNv daemonium Y, daemoniis BN nexantes M 13 clodus Y currentes Mv mulieres N i] de Ms proflubium Y, fluzu BN 14 reeuscitasti n Iquam BMNn υ qui... tradidisti om. BNYn 15 terminos MN 16 inposuiati BN qui Y, et M, om. BNn dixisti... confrmges om. BNfI hucusque] usque F, huc M hic te Mv in on. N 17 uirtute tua s te otn. BNn filium om. BN summi dei Y, dei uiui Mnv, om. BN mea, qui es in caelis filius in patre et pater in filio in sempiternum, qui sedes super Cherubim et Seraphim sedes honoris tui. 
5	 Tibi adstant angeli et archangeli numerus inaestimabilis, timentes et pauentes honorem et uirtutem tuam, clamantes uoce magna dicentes: sanctus sanctus sanctus Dominus Deus Sabaoth. tu ipse nobis testamentum fecisti et pollicitus es dicens: petite et accipietis, quaerite et inuenietis, pulsate et aperietur uobis. quodcumque a patre meo petieritis in nomine meo, ego in tuo nomine peto ut accipiam. ego quaero ut inueniam, ego pulso ut aperiatur mihi. paratus sum propter nomen tuum uictimam sanguinis effundere et quodcumque tormentum sustinere. tu es adiutor meus: defende me ab aduersaria parte, angelus tuus lucis protegat me, quoniam tu dixisti: quidquid credentes petieritis per orationem, dabitur uobis. 
6	 Omnis homo mendax, tu solus Deus uerax. sicut repromisisti, potes dare Domine, reuela mihi sacramentum tuum caeleste, ut dignus II sim faciem sanctorum tuorum uidere. spiritus sanctus in me operetur 6 cf. Matth. 7, 7. 1 es] est 7 patrem M et om. BN fllio Y, te BMNnv sempiterno Mn 2 cherubyn et seraphyn Y sedem SMNnv toi om. BN 3 adstant Y, adsistunt BMNwo et om. MNv archangeli et angeli n numerus] nomen uerum BNn . inestimabile Bn, inestibile N, innumerabilis Mv 4 et pabentes Y, om. n claxnantes om. BN nocem Y et dicentes v, clamintea n 5 deus onu MNn nobiscum B 6 et polKcitna es dicens om. BMNnv quaerite et inuenietis om. NfJ, post aperietur nobis exh . n 7, quodcumque... nomine meo om. Y, in nomine meo a patre quaecumque n 8 ego in tuo nomine Y, ego a patre MNv, om. BN peto ut om. BN accipiam Y, accipiatis Mnv, accipietis BN 9 ego] ego a patre n quaero] peto ut accipiam (aecipiatis n) quaero Mnv ut a.] et aperitur n mihi] add. BMNnfJ: ego (ergo B) in tno nomine precor (peto v, om. Mn) ut tu a patre petas (nt t. a. p. petas om. BN) et (ut n, et dne BN) datu mihi 10 sanguis Y fundere BMNnv 11 tormenta Y es] es dne MNfJ adiutor] auditor Mv meus] meus et defensor BNv, meus defensor Mn defende... parte om. N aduersaria parte] inimico Mn, inimico meo BNfJ 12 quidquid Y, quod BMNnv 13 petieritis om. Y in oratione n danitur Y 14 solus dens Y, dens BMNn, ea v sicut tu BMNv 15 potes dare dne] potestate dare dne Y, potestatem habes domine dare v releba Y, om. v omne sacramentum BMNnv tuum om. Nn 16 sanctus om. BMNnv operetur] flat fortis BN uirtutem: quoniam tibi me spopondi seruire omnibus diebus uitae meae, qui passus es sub Pontio Pilato optimam confessionem, crucifixus descendisti et conculcasti aculeum mortis, qui dicxisti: ubi est aculeus mortis, ubi est mors qui regnabas. deuicta est mors, deuictus est inimicus diabolus, tu resurrexisti a mortuis et apparuisti discipulis tuis: sedisti ad dexteram patris, inde uenturus iudicare uiuos et mortuos. tu nostri dominaberis, libera me de manu quaerentis animam meam. per nomen tuum te deprecor ut optimam des uictoriam in inimicum meum: quia tu ea potens et defensor et aduocatus precum et petitionum nostrarum animarum. die et nocte interpelles pro peccatis meis, orationem meam perferas ad patrem tuum. et tu, Domine sancte pater, digneris respicere super preces meas, sicut respecxisti super munera Abel. digneris me liberare ab igne et poena perenni et ab omni tormento quod parasti iniquis, per bonum et benedictum Iesum Christum saluatorem nostrum, per quem est tibi honor uirtus gloria in saecula saeculorum. amen. 1 mrtutem om. BN, uoluntas tua in me flat Mv, uolimtas sps sc ̃ s in me fiat n tibi me Y, me tibi BN, tibi Mnv exspopondidi Y seruire om. BMNnv 2 es] est Y optima Y, bonam BMNnv confeBsione Y, confessionis B qui crucifixus Nv, crucifixus es M 3 qui dicxisti... regnabat om. Bv 4 aculeum mortis u. e. m. q. regnabus Y, more et ubi est aculeus eius N, qui regnabat ubi est aculeus mortis n, aquleus mortis M\' uicta BN 5 paruisti Mn discipulis Yn, apostolis BMNv 6 sedes Mv inde Y, qui Mv, om. BNn uenturus es Mv 7 nostri om. Mnv libera... U9 tuum om. n quaerentes anima mea Y ■ 8 te deprecor BNY, libera me ab aduersaria potestate (parte M) Mnv optima des uictoriam Y, operam des uincendi BMNn υ 9 in addidi quia Y, quoniam BMNnv potens om. n et defensor Y, assertor BMNnv 10 precum... peccatis meis om. Y animarum om. n et] ac v interpelles... digneris om. BN 12 et t. d. s. pater om. MYn dne respice BN super] ad BN, in n precibus meis Mn 13 respecxisti] respirem n super... liberare om. n muneribus Y abel] add. BN: ut orationem meam accipias ignem Ml, omigne n 14 perennem M1 et ab ... l. 15 nostrum om. Y iniquis et impiis BN 15 per quem] cui Y 16 tibi est M, tibi laus v, est Y honor uirtus gloria in] honor et gloria imperium et potestas nunc et per omnia Y . — Explicit oratio (sci add . Y) Cypriani MY, Oratio Cipriani explicit feliciter BN, om. n . — 
