5.36.3	qui autem uerbum dicturus est domini, debet stare cum Mosi et audire cum psalmista: qui statis in domo domini, in atriis domus dei nostri. et praecipitur illi, ut loquatur ad omnes ciuitates Iuda, licet \'ciuitates\' LXX non transtulerint, ne indecorum forte uideretur in atrio domus domini loqui ad urbes, quae coram non erant; sed quando ad populos et ad ciues loquitur, ipsis ciuitatibus loquitur. pulchre autem stat in atrio atque uestibulo templi domini, ut per occasionem orationis domin et adorandi eum sermones prophetae audire cogantur.
5.36.4	\'nolii, inquit, \'subtrahere uerbum; licet triste sit, licet aduersum te audientium rabies concitetur, tamen dicito, quod tibi impe ratum est, non formidans persecutiones eorum, qui aduersum te concitandi sunt, sed domini iubentis imperium!
5.36.5	\' forsitan 1 *Hier. 26 (33), 3 3 cf. Hier. 25, 1 4 Hier. 25, 1 6 *Hier. 26 (33), 1 8 cf. p. 248. 11. 300, 6 11 cf. Deat. 5, 31 12 Ps. 134, 2 14 Hier. 26 (33), 2 *Hier. 26 (33), 2 19 Hier. 26 (33), 2 23 *Hier. 26 (33), 3 1 mali] mala F 2 malitiam Vulg . 3 hoe Pa.c . superior] prior Ap.e.m2 priorej superiore Ap.c.m2 4 pr . facta ont . f ioachim MAP,La.c . ioacim F 6 ioiachim La.c.; de cet. cf. Iin. 4 7 dicens L. om. cet. v 9 rege] ut add. s. u. m3M 10 postea] postera P posteriora) postea Ma.c.m3 priora add. M ante M uerbum ante A 11 moyse MAVPv 14 tranatulerunt V indecorem Pa.c . 15 atriis A 16 populam v 18 occansionem La.c . 19 sermonis V,MAa.c . 21 tej & M 22 qae Mp.c . 23 coscitande Mp.c . iubentes La.c . imperio P si add. e forsitant La.c . LIX. Hieron. in Hierem. 21 inquit, audiant et conuertantur. uerbum ambiguum \'forsitan\' maiestati domini non potest conuenire, sed nostro loquitur affectu. ut liberum homini seruetur arbitrium, ne ex praescientia eius quasi necessitate uel facere quid uel non facere cogatur; non enim ex eo, quod deus scit futurum aliquid, idcirco futurum est, sed quia futurum est, deus nouit quasi praescius futurorum.
5.36.6	et tamen sciendum iuxta hunc eundem Hieremiam, et si mala praedixerit dominus et egerit populus paenitentiam, quod et ipse acturus sit paenitentiam super his, quae facere comminatus est; et si prospera pollicitus fuerit et egerit populus neglegenter, mutet deus sententiam et pro bonis mala inferat. tale quid et illud in euangelio est: mittam filium meum, forsitan uerebuntur eum; quod utique ex persona dei omnipotentis dicitur.
5.36.7	denique et in praesenti ait: \'si forte audiant et conuertantur unusquisque a uia sua mala, ut. cum illi conuersi fuerint, et me meae sententiae paeniteat et non faciam, quod eis facere cogito. cogito autem facere propter malitias studiorum illorum; quae si fuerint immutatae, et mea sententia commutabitur.\' legamus historiam lonae et Nineue. 
5.37.1	 26 (38), 4-6 Et dices ad eos: haec dicit dominus: si non audieritis me, ut ambuletis in lege mea, quam dedi uobis, ut audiatis sermones seruorum meorum, prophetarum, quos ego misi ad uos de nocte consurgens et dirigens et non audistis, dabo domum 1 *Hier. 26 (33), 3 8 cf. Hier. 18. 8. 10 12 *Luc. 20, 13 15 Hier. 26 (33), 3 18 *Нier. 26 (33), 3 20 cf. Ion. cap. 3. 4 1 audient V,La.c . audientes M, (es s. u. m3) A et om. M ut V connertentur МAp.c . forsitam La.c . (= lin. 13) 2 ma.gestati P 3 hominis T,Ma.r . sernet P psentia P 6 sed—est om . M deus] eni add. s. u. m3M 7 et] sed A 11 popnlos Ma.c . negligenter AVP,Ma.c . & add. P 15 conuertatur Ap.r . 16 me OD, (s. u. m2) eod. Monacensis 14425, om. cet. v meae L, om. OD 17 seatentiae] me add. (s. u. m2) Av 20 niniuae M niniue P,Ap.c.,v; cf: p. 53, 3 21 dicis P,LMa.c . 22 ut] et v 23 sermones seruorum] mones ger s. u. L . istam sicut Silo et urbem hanc dabo in maledictionem cunctis gentibus terrae .
5.37.2	In nostra est ergo positum potestate uel facere quid uel non facere, ita dumtaxat, ut, quicquid boni operis uolumus, appetimus, explemus, ad dei gratiam referamus, qui iuxta apostolum dedit nobis et uelle et perficere. sin autem sufficit semel ambulare in lege. quae nobis data est per Mosen, ut stulta heresis suspicatur, quomodo addidit: ut audiatis sermones seruorum meorum, prophetarum? qui utique post legem missi sunt et non semel, sed frequenter, nec otiose et a securo, sed semper et a sollicito.
5.37.3	\'misi,\' inquit, \'ad uos seruos meos cotidie et de nocte consurgens; quos si audire nolueritis. dabo domum istam\' — hoc est templum dei — \'sicut Silo\', ubi fuit tabernaculum. cumque templum destructum fuerit, consequenter et ciuitas erit in maledictionem cunctis gentibus terrae.
5.37.4	sicut autem exstructo templo in area Ornae et in monte \'Moria\', hoc est \'uisionis\', in quo Abraham Isaac filium optulisse narratur, cessauit religio Silom nec postea ibi sunt celebrata sacrificia, sic exstructa ecclesia et spiritalibus in ea uictimis immolatis cessauerunt legis cerimoniae et data est nrbs Iudaeorum in maledictionem cunctis gentibus terrae, de qua nos dominus liberauit dicente apostolo: Christus 5 cf. Phil. 2, 13 7 cf. Dent. 5, Î-21 hffesis] scil. Pelagianorum 3. 11 Hier. 26 (38), 5 12. 15. 21 Hier. 26 (33), 6 13 cf. Indd. 18. 31 etc. 16 cf. II Par. 3, 1 17 cf. Gen. 22. 2 22 *Gal. 3. 13 1 maledictione La.c . maladictionem P 2 ergo est positum La.c . e posita ego P ergo posituru est v 3 quicquid L ista Aa.r . 4 uolamus] aut add. s. u. m3 M appetimus] ant add. s. u. m3M 5 quia MP,Aa.r . 6 perfecere Ma.c . sufficet La.c . 7 movsen МAVP 8 addit MP 10 a om. V 11 assollicito V meos] prophetas add. v cottidie V 12 quod P 14 distractum MP 16 eitracto MA VP.La.c . 17 montem oria P filium] suum add. MAVPv filium suum Isaac v 18 selom MAV silo P LXX sec. codd. Sin., Alex., Marchal u. 6. 9 et alibi (Iudd. 18,31. I Reg. 1, 24 etc.) 19 extructa MA V,La.c . instructa P spiritualibus Ap.c.,v 20 cessarunt v leges A ceremonie La.c. caerimoniae (alt. e s. u.) M caeremoniae A caeremonia P; cf. p. 181, 23, ubi cerimoniae anteponendum uidetur 21 maledictione La.c . 22 dñs nos P liberabit M 21* redemit nos de maledictione legis. factus pro nobis mal maledictio. 
5.38.1	 26 (33),7 9a Et audierunt sacerdotes et prophetae — siue pseudoprophetae — et omnis populus Hieremiam loquentem uerba haec in domo domini. cumque conplesset Hieremias loquens omnia, quae praeceperat ei dominus, ut loqueretur ad uniuersum populum, apprehenderunt eum sacerdotes et prophetae — siue pseudoprophetae — et omnis populus dicens: morte moriatur, quia prophetauit in nomine domini dicens: sicut Silo erit domus haec et urbs ista desolabitur eo, quod non sit habitator .
5.38.2	Sacerdotes et prophetae, quos \'pseudoprophetas\' LXX manifestius transtulerunt, irascuntur Hieremiae, quod uera praedicat et subuerso templo et ciuitate deserta sit peritura religio et lucra ex religione uenientia; idcirco apprehendunt eum et consentiente sibi populo morti destinant, quare dixerit in nomine domini: sicut Silo erit domus haec et urbs desolabitur eo, quod non sit habitator. 
5.38.3	 si quando igitur propter mandata domini et fidei ueritatem uel sacerdotes nobis uel pseudoprophetae uel deceptus populus irascitur, non magnopere curemus. sed exsequamur sententiam dei nequaquam praesentia mala, sed futura bona animo cogitantes. 
5.39.1	 26 (33), 9b. 10 Et congregatus est omnis populus aduer sum Hieremiam in domum domini. et audierunt 4. 13 *Hier. 26 (3-3 , 7 9. 13 *Hier. 26 (33), 8 13 *Hier. 26 (33), 9 1 maledietionem Ma.r . 3 sacerdote V 4 siue pseadopr. s. u. L 6 cum plesset V 7 ut] et V 9 sine pseadopr. om. M 10 qaia] quare Vulg . 11 in om. v 13 quod P 14 manifestius LXX v .16 ult. relegione P,La.c . et add., sed eras. M 17 consentienti MVP,La.c . destinent P 18 quare] quia pre Ap.c.m.2 dixerat A domos] tua add. V 19 etJ ut add., sed eras. M 21 pseudopropheta P 22 exequamur MA,Pa.c. scientiam P 23 dni M bono Aa.c . 25 aduersus Pv cum Valg . 26 domo P cum Vulg . principes Iuda uerba haec et ascenderunt de domo regis in domum domini et sederunt in introitu portae domini nouae .
5.39.2	Hieremias in templo uerba domini prophetabat et dixerat: dabo domum istam sicut Silo et urbem hanc in maledictionem cunctis gentibus terrae statimque a sacerdotibus et prophetis et populo seditione commota omne uulgus aduersum prophetam congregatur in templum, ubi erat propheta et sacerdotum ac prophetarum uulgique manibus tenebatur.
5.39.3	quod cum audissent principes ciuitatis, qui in domo regia uersabantur, transierunt siue ascenderunt de domo regis in domum domini. notandumque, quod ire ad domum domini semper ascensus sit. sederuntque in introitu portae domini nouae. principum enim erat officii sedere in porta domus domini et ibi negotii et seditionis cognoscere ueritatem. \'noua\' autem porta dicitur, quia, qui sedebant in ea et iudicio praeerant, sacerdotum et pseudoprophetarum calumniae resistebant. 
5.40.1	 26 (33), 11 Et locuti sunt sacerdotes et prophetae ad principes et ad omnem populum dicentes: iudicium mortis est uiro huic, quia prophetauit aduersum ciuitate m istam, sicut audistis auribus uestris .
5.40.2	Sedentibus urbis principibus in porta templi et in porta noua, qui de regis palatio ad templum cucurrerant, ut seditio populi sedaretur, et contione populi congregata accusant sacerdotes et pseudoprophetae perieratque 4 *Hier. 26 (33), 6 11 Hier. 26 (33), 10 13 *Hier. 26 (33), 10 22 cf. Hier. 26 (33), 10 1 et s. u. L de] in VP,Ma.c.m2 domum VP.LMAa.c . 3 portae] domus add. Vulg . templo] dni add. P dni uerba Vv 4 dabo om. MVP,LAa.c.m2 5 maledictionem] dabo add. v 6 a om. V 7 aduersus v 9 tenetur Ap.r . 10 regi auersebantor (0 s . u. P transtulerunt V 13 introito Ma.c . 14 principium Ma.r . aofficium r 16 qui om. V eam M,LAa.c . praeceperant A 17 calumnia M 19 dicens P,LMAa.c . 21 adaersas a cum Vvlg . 22 templi-porta s. u. V 24 at] et V sederetur Aa.c. eoncione M contentione VP 25 pseadopropbetae] Hieremiam add . Erasmus v ppheta add. s. u. m2A : cf.p. 326,23 propheta, quantum fuit in sacerdotibus et prophetis. si accusatores ipsi habuissent iudicii potestatem. ex quo intellegimus crudeliores fuisse in prophetam per inuidiam sanctitatis, qui religioni uidebantur dediti quam qui necessitatibus publicis praeerant. 
5.41.1	 26 (33), 12-15 Et ait Hieremias ad omnes principes et ad uniuer sum populum dicens: dominus m misit m e. ut prophetarem ad domum — siue super domum — istam et ad ciuitatem — sine super ciuitatem — hanc omnia uerba, quae audistis. nunc ergo bonas facite uias uestras et st studia uestra et audite uocem domini dei uestri, et paenitebit nitebit dominum mali . quod locutus est aduersum uos — siue et quiescet domi inus a mali, quae locutus est contra uos — . 
5.41.2	 ego autem ecce in manibus uestris sum; facite mihi, ut bonum et rectum est in oculis uestris — siue ut expedit uobis — ! uer umtamen scitote et cognoscite, quod, si occideritis me, sanguinem innocentem tradetis contra uosmet ipsos et contra ciuitatem istam et habitatores eius; in ueritate enim misit me dominus a d uos, u t loquerer in auribus uestris omnia uerba haec .
5.41.3	Cum praesente populo sederent in porta principes ciuitatis et accusarent sacerdotes et prophetae Hieremiam prophetam et mortis crimen intenderent, Hieremias ad principes loquitur et ad uniuersum populum, quos sacerdotum et pseudoprophetarum factio concitauerat, prudenter 8. 9 *Hier. 26 (33), 12 13 *Hier. 26 (33), 13 16 *Hier. 26 (33), 14 22 cf. Hier. 26 (33), 9-11 2 abuiasent P iudici V 3 propheta V inuidia V 6 heremias A 8 sine s. domum s . u. m3A 9 aaper] ad V ciuitam (aU.) JP 12 nli V mali om. V 13 et] ad P quiescit YP,LMAa.c . 16 pr. ut] qaod Yulg . bonum est L 17 uos Y 18 occideretis M 19 traditis LP 20 ueritatem V 22 sederint Y 23 cinitatis principes e ciuitates Va.e . 24 intenderet La.c . intenderint Ma.c.m2 25 quod MVP,Aa.c, .28 facti F faceio P concitauerit P pariter et humiliter atque constanter.
5.41.4	prudenter, quod a domino missum esse se diceret, ut contra templum et ciuitatem loqueretur daretque consilium, quod, si uellent eius audire consilium et agere paenitentiam, dominus quoque suam sententiam commutaret. humiliter autem in eo, quod ait: ecce in manibus uestris sum; facite mihi, ut bonum et rectum est in oculis uestris! porro constanter: in ueritate misit me dominus ad uos, ut loquerer in auribus uestris omnia uerba haec.
5.41.5	aliisque sermonibus loquitur: \'si irascimmi, cur contra templum et urbem domini sim locutus, et curae nobis est salus urbis et templi, cur augetis peccata peccatis et sanguinis mei tam urbem quam habitatores eius reos facitis?
5.41.6	\' si quando igitur et nobis pro necessitatis angustiis humilitate opus est, sic eam assumamus, ne ueritatem et constantiam deseramus; aliud est enim superbe contumeliam facere iudicanti, quod signum stultitiae est, aliud sic inpendens uitare discrimen. ut de ueritate nil subtrahas. 
5.42.1	26 (33), 16 Et dixerunt principes et omnis populus ad sacerdotes et prophetas: non est uiro huic iudici-um mortis, quia in nomine domini dei nostri locutus est ad nos .
5.42.2	Populus, qui prius a sacerdotibus et pseudoprophetis fuerat supplantatus, iuogitur principibus ciuitatis et pro Hieremia loquitur, quod nequaquam reus mortis 5 *Hier. 26 (33). 14 7 Hier. 26 (33), 15 21 cf. Hier. 26 (33). 8. 9 1 atque] at Lac . prudenter om. LMFP,Aa.c . quo A,LMa.c . se add. s. u. A 2 missas F esse se LP se esse (pr. se postea add.) M esse Å eet F ut] in Pa.c . 3 si om. P eius uellent e 4 dns quoque sententiam suam (sic) s. u. A comataret A 9 irascemini Aa.e . 10 quur Mp.c . quod Aa.c.m3,v 11 qunr M 13 necessitatibus angustiS haiuiliter F 14 sammamus F 15 deseremas Pa.c . enim est P 16 indicandi Va.c . stultiae L 17 nihil MVPv detrahas Å 18 omnes LMa.c. ad V,Ap.c . et cet . 19 et] ad odd. Vulg. prophetas V.Ap.c . prophetae cet . uero P.Ma.c . 21 a 8. u. m3A ad Yas . 22 fuerant MAa.r . ciuitatibus F 23 pro] per V sit, sed in nomine domini et ex ore illius prophetarit; cito enim uulgus indoctum accepta ratione mutat sententiam. dolor autem accusantium, praecipue sacerdotum et pseudoprophetarum, non potest immutari; et ideo illis accusantibus et in accusatione perseuerantibus populus commutatur, quod spem eis dederat indulgentiae domini, si bonas facerent uias suas et audirent uocem domini dei sui, ut et dominus suam sententiam flecteret. 
5.43.1	 26 (33),17-19 Surrexeruntque uiri de senioribus terrae et dixerunt ad omnem coetum populi loquentes: Micheas de Morasthi fuit propheta in diebus Exechiae, regis Iuda, et ait ad omnem populum Iudae dicens: haec dicit dominus exercituum : Sion quasi ager arabitur et Hierusalem in aceruum lapidum erit et mons domus in excelsa siluarum . 
5.43.2	 numquid morte condemnauit eum Exechias, rex Iudae, et omnis Iuda? numquid non timuerunt dominum et deprecati sunt faciem domini et paenituit dominum mali, quod locutus erat aduersum eos? itaque nos facimus malum grande contra animas nostras .
5.43.3	Principes ciuitatis et populus intellegunt iudicii ueritatem; senes autem, quorum proprie erat nosse uetera, replicant historiam et prophetiam Micheae de Morasthi, qui prophetauit sub rege Ezechia, conparant prophetiae Hieremiae. pro qua ei mortis crimen intenditur, ostenduntque illum dixisse 25 5 cf. Hier. 26 (33), 13 21 cf. Hier. 26 (33). 16 25 cf. Hier. 26 (33), 8 1 sit om. La.c, domini om. V et om. VP prophetaret P,Aa.c . 3 accussantium A (saepius) 4 mutari V et-perseuerantibus in mg. V 6 dns MAPv ut add. 3. u. m3M bona V 7 ut eras. M, om. V et s . u. L 9 sllrrexeruntque] surrexerunt ergo Vulg . 10 cetum P 11 michaeas P (semper) cum Vulg . morasti P,La.c . morasthi Mp.c.m2 12 alt . Iuda a cum Yulg . 14 agerarabitur P 16 eam P Iuda. Vulg . 18 et deprecati-dominum om. V 19 mali om. LVP,MAa.c.m3; cf. p. 326, 12. 32% 13 fuerat s cum Ywlg . aduersus Vp.c . 20 nos L non MVP,Aa.c . faciamus MVP,LAa.c . 23 morasthi Mp.c.m2 morasti P 24 prophetia Mp.c . 25 discrimen v grauiora et tamen a iusto rege Ezechia nihil esse perpessum, sed conuersos ad paenitentiam domini in bonam partem uertisse sententiam.
5.43.4	Micheas enim dixit: Sion quasi agerarabitur et Hierusalem in aceruum lapidum erit et mons domus in excelsa siluarum: porro Hieremias: dabo. inquit, domum istam sicut Silo et urbem hanc dabo in maledictionem cunctis gentibus terrae.
5.43.5	dantque consilium putantes nequaquam futurum, quod Micheas praedixerat, quia multo tempore non sit factum propter populi paenitentiam. et hoc quoque, quod Hieremias locutus est, nequaquam fore, si iuxta consilium eius bonas faciant uias suas et studia sua et audiant uocem domini dei sui, ut dominus non inferat malum, quod eis fuerat comminatus.
5.43.6	simulque frangunt accusatorum rabiem et se miscent cum eis dicentes: itaque nos facimus malum grande contra animas nostras, non quo facere debeant, sed quia, si fecerint, nequaquam noceant accusato, sed animabus suis, quas mutatione sententiae potuerint liberare. 
5.44.1	23 (33) 20-24 Fuit quoque uir prophetans in nomine domini, Urias, filius Semei de Cariathiarim, et prophetauit aduersum ciuitatem istam et aduersum terram hanc iuxta uniuersa uerba Hieremiae. et audiuit rex Ioiacim et omnes potentes et principes eius uerba haec et quaesiuit rex interficere eum; et audiuit Urias et timuit fugitque et ingressus est Aegyptum .
5.44.2	quodque sequitur: et misit rex 3 Hier. 26 (33), 18. *Mich. 3, 12 5 Hier. 26 (33), 6 11 cf. Hier. 26 (33), 13 15 Hier. 26 (33), 19 1 ab isto V 2 eonuerso V connersus P,Mp.c. (sic) 7 dansque MVP 13 comminatur P 15 nos iterauit V non P faciamus P 18 potaerant Lp.e.m2 liberari P 20 eariatharim La.c . 21 pro aduersua v cum Vulg. alt . adaersoa Vulg . 22 terra La.e . uniuersa] omnia YtUg . 23 ioiaeim (alt. i 9 . u.; sed exp.) L ioachim cet . (= p. B30, 1) Ioacim v (semper) 26 est] in add. M quoque MAa.cm2 Ioiacim uiros in Aegyptum, Elnathan, filium Achobor, et uiros cum eo in Aegyptum, in LXX non habetur. dein iungitur: et eduxerunt Uriam de Aegypto et adduxerunt eum ad regem Ioiacim; et percussit eum gladio et proiecit cadauer eius in sepulchris uulgi ignobilis lis. uerumtamen manus Achicam, filii Saphan, erat cum Hieremia, ut non traderetur in manu populi et interficeret eum .
5.44.3	Quaeritur, cur, cum Urias, filius Semei de oppido Cariathiarim, eadem quae Hieremias propbetarit, timore perterritus fugerit Aegyptum et inde retractus occisus sit, Hieremias potuerit euadere, qui certe non fugerat, sed audacter in priore sententia perseuerans liberatus sit tam uulgi principumque iudicio quam consilio seniorum aduersum accusatores, sacerdotes et pseudoprophetas.
5.44.4	ad quod breuiter respondendum nequaquam dei sciri posse iudicium, dum eadem causa eademque sententia alius punitur et alius liberatur; nisi forte hoc respondere possimus, quod Urias in condemnationem et accusatorum et populi trucidatus sit. Hieremias autem reseruatus iudicio dei, ut reliquiis infelicis populi praedicaret et eos retraheret ad paenitudinem. quod quidem et in apostolorum Actibus legimus Iacobum apostolum 2 *Hier. 26 (33), 22 12 cf. Hier. 26 (33), 16. 17 21 cf. Act. 12, 2 1 Elnathan v cum Vulg . elnatham LMA V elnatam P 2 achabor MAPv achbor V 3 deinde A V adduxerunt V 4 ioachim MAVP,La.c . 5 proicit Ma.c . 6 ignobiles La.c . uerumtamen] igitur Vulg . manus Acbicam] manac haiam P magnus Ahicam v achiani Lp.r.Ma.c . aicham (i s. «.) A Ahicam Vulg. ’ Αχειϰάμ LXX; cf. p. 331, 18 filius P 7 safan MAP eratJ fuit Vulg . 8 manus Ap.c.,v cum Vulg . interfeceret La.c . interficerent MAVPv cum Yulg . cur om. V 9 semel V,MAp.r. cum OD semeiae cet.; cf. p. 329, 20 cariathgarim Mp c- cariathiari* V qui add. A & add. P que V,Aa.c . 10 prophetauerit V prophetaret P.Ap.c . fugeret La.c . in add. MAp.c.m3.v 11 quia P certe om. P 12 non] nunc P priori codd. (eorr. L; cf. p. 246, 9. 289, 13. 321, 3) v 13 principiumque V seniorum] se suorum V 15 scire P 17 possumus Ap.c.m3,v 18 pr . et om. v accusationem (i s. u. m2) M causatione ̄ Ap.c.m3 alt. et om. MAp.c. 19 reliquis VP . infelices Ma.c . 20 retraheret] traderet V penitudinem T plenitudinem P 21 actibus—apostolum s . u. L .: statim Herodis pertulisse sententiam et martyrio coronatum. Petrum autem et ceteros apostolos doctrinae domini reseruatos. 
5.44.5	 et animaduertenda constantia prophetalis, quod ne de Aegypto quem retractus Urias mutauerit sententiam, sed uidens sibi intentari mortem nihilominus sit locutus, quae praeceperat dominus. quodque timuit et fugit et ingressus est Aegyptum. non infidelitatis: sed prudentiae indicium est, ne frustra nos offeramus periculis. alioquin et dominum saluatorem de manibus persequentium lapsum legimus et praecipientem apostolis: cum uos persecuti fuerint in hac ciuitate, fugite ad aliam!
5.44.6	quaeritur quoque, quomodo Ioiaeim, rex Iuda, parui imperii et debilitati et iam iamque perituri, mittendi in Aegyptum habuerit potestatem et inde Uriam educere. quod facile soluitur, si consideremus eum a rege Aegypti Nechao principem constitutum. tutum et hanc prophetiam factam esse in principio regni eius.
5.44.7	quamquam autem Hieremias domini adiutorio liberatus sit, tamen et illi reputatur in mercedem, per quem prophetam suum dominus liberauit, Achicam uidelicet, filio Saphan, quod in posterioribus lecturi sumus, quando de cisterna luti Abdamelech spadonis consilio atque praesidio Hieremias de mortis periculo liberatur. 
5.45.1	 27,1 In principio regni Ioiacim, filii Iosiae. regis Iuda, factum est uerbum hoc ad Hieremiam n domino dicens . Hoc in editione LXX non habetur et 2 cf. Act. 12, 3—18 8 cf. Lur. 4, 30. luh. 8, 59 9 *Matth. 10, 23 14 cf. IV Reg. 23, 34. II Par. 36, 4 15 cf. Hier. 26 (33), 1 19 cf. Hier. 38 (45), 7-13 24 *Hier. 27 (34). 1 1 coronatum] beatum add. v 2 autem Petrum v 5 inteotarem P 6 quoque Ma.c.m2 fugiit P 7 infidelitates Pa-c . iudicium P 8 inferamus V 11 ioiachim La.c . ioachim cet . (= lin. 22. p. 332,3. 7.20) 13 ducere V educeret P educendi v 14 nechau Ma.c . 15 anc P facta V factum P 18 Aehicam (cf. p. 330, 6)] achi∗an (c eras.) LM aichcan (stc; ex acbican) A achichan V acican P Ahicam v . filio Saphan] filios aphat V fili iosafat P safa L safat M, (n s. t m3) A Sephan v; cf. p. 330, 7 19 sumus] si add. MAVP quando} quide ̄ Mp.c.mS abdamalech AP abdemelech Vv 21 liberetar VP,MAax . 23 iudae A hoc] istud Vulg . iheremiam P multi putant sequentis capituli esse principium, quod nequaquam ita est, sed iungendum superiori, ut, quicquid dictum refertur et factum, in principio regni Ioiacim factum esse credamus; unde et mittendi in Aegyptum quasi ad amicum regem habuit potestatem.
5.45.2	uidentur autem mihi LAA tituium istum hac ratione siluisse, ne secundo dicere uiderentur; iam enim in principio posuerant: in principio regis Ioiacim, filii Iosiae, regis Iuda. factum est uerbum istud a domino dicens. 
5.46.1	 27, 2—4 (34, 1-3) Haec dicit dominus ad me: fac tibi uincu-la et catenas — siue ϰλοιούς , qui Hebraice appellantur ‛mutoth’ et sermone uulgari \'boias\' uocant — ponesque eas in collo tuo et mittes ad regam Edom et ad regem Moab et ad regem filiorum Ammon et ad regem tyri et ad regem Sidonis per manum nuntiorum, qui uenerunt Hierusalem ad Sedeciam, regem Iuda. et praecipies eis, ut ad dominos suos loquantur: haec dicit dominus exercituum deus Israhel: haec dicetis ad dominos uestros .
5.46.2	Praeterita uisio in principio facta est ad prophetam regni Ioiacim, filii Iosiae, regis Iuda, haec autem sub Sedecia, qui extremus regnauit in Hierusalem et sub quo urbs capta est atque subuersa.
5.46.3	praecipiturque Hieremiae, ut catenas siue furcas ligneas, quae, ut diximus, Hebraice appellantur ‛mutoth’, inponat collo suo et mittat eas ad reges Edom, Moab, filiorum 4cf.Hier.26(83),22 cf.p.331,14 5*Hier.27(34),1 7*Hier.26 (33),1 11 *Hier. 27 (34). 2 (1) 19 cf. Hier. 26 (33), 1. 27, 1 20 Hier. 26 (33), 1. 27, 1 sec. Yulg. 22 cf. IV Reg. 25, 9.10. H Par. 36, 19 24 cf. lin. 11 1 capitulis Ma.r. 2 dietum] rectum M 4Aegyptum] et add. V ad om. P 6 soluisse P 7 posuerat Pa.c . 8 istam Ma.c. ad Ieremiam add. v 10 ninealas P 11 cathenas A Ka ΟιΟΥΕ M Ka ΟιΟΥ C P, (Kamore s. u. m3; r, h. e . require, in mg.) A KW ̄ι W Ῡ C V que Ap.c . 12 muttoh MA muttoth V ponesque] et pones Vulg . 13 mittis Ma.c . eas add. v eum Vulg . 14 filiorum—pr. regem s. u. P 15 perl in Vulg . manu Vulg . 16 (= 21) sediciam La.c. sedechiam cet. (semper) 19 dicitis P a LYa.c . 20 profetam M 21 iudę Va.c. 22 que V . 23 subuersam V ut om. VP,LMAa.c . 24 Hebraice at diximus v hebraicae AVP,La.c . muttoth A muttob V Ammon, Tyri, Sidonis per legatos, qui uenerant ad Sedeciam. et praecipiat suis dominis nuntiare, quod regi Nabuchodonosor seruire debeant et audire. quae sequens prophetae sermo prosequitur. ac ne forsitan legati et reges istarum gentium responderent: cur hoc tuo populo non praecipis?\', Sedeciae quoque regi similia loquitur et sacerdotibus ac prophetis.
5.46.4	hunc locum allegoricus semper interpres et historiae fugiens ueritatem interpretatur de caelesti Hierusalem, quod debeant habitatores eius sponte assumere corpora et descendere in ‛Babylonem’, id est \'confusionem\' mundi istius, qui in maligno positus est, et seruire regi Babylonio, hau dubium quin diabolo. quodsi * hoc facere noluerint, nequaquam eos grauia corpora portaturos. sed perituros gladio et fame et peste et nequaquam homines futuros, sed daemones.
5.46.5	hoc ille dixerit, ne defensores eius nobis calumniam faciant. ceterum nos simplicem et ueram sequamur historiam, ne quibusdam nubibus atque praestigiis inuoluamur. 
5.47.1	 27, 5 (34, 4) Ego feci terram et hominem et iumenta, quae sunt super faciem terrae, in fortitudine meamagna et in bracchio meo extento et dedi eam ei, qui placuit in oculis meis . Licet ἀνϑρωποπαϑω̄ς haec scriptura loquatur. 
