2.59.2	Uox populi respondentis inducitur et sua uitia contitentis et cohortantis se mutuo, ut ciuitates ingrediantur muratas siue unam ciuitatem Hierusalem: iam enim 2 cf. Hier. 6. 15. 8, 12 3 Hier. 8, 13 4 cf. Hier. 21, 9 8. 9 Hier. 8, 13 15. 16. 17 *Hier. 8, 14 2 si MVP,LAa.c . 4 haud AV, (ex haut) L hant (d s . t) M. (h s. u.) P; cf. p. 35, 13. 73, 16 . 88, 4. 102, 5. 105, 3 etc . chaldeis LMA 6 estati (e s . u.) M statis (s alt. s. u.) A statim P 7 ca lent P long.) l 8 cibos v fructum P 9 sumetis MV,Aa.c . 11 deripi P deuorari c state P transactib: P 12 praeterite P maiori codd. (cvrr. L; cf. p. 22, 15. 35, 2. 125. 2 ete.) v dolori VP,LMAa.c . 13 habund. VP 14 ingrediamnrj intremus MVP,Aa.c.m3 15 munitates MAa.c . 16 pro sibi M dominus] deus add. Vulg . 17 noster om. V non MP n ̄ r ex n m2 A abiecit nos] silere nos fecit Victorius v siue silere fecit ex Vulg. suppleui (ct. p. 114, 2) silere fecit] abiecit (scil. α̃πέρριψεν ) LXX (cf. p. 79,15.118. 21 etc.) nos fecit Vulg . 18 expectauimaa MVP,La.c . enim add. M 19 medellae MV,LAPa.c . 20 ind∗citur (u s. ras.) L 22 munitas v iam] & add., sed eras M LIX. Hieron. in Hierem. s ceterae captae fuerant. \'et sileamus\', inquit, \'ibi, quia dominus noster silere nos fecit — non enim habemus fiduciam deprecandi —, siue abiciamur ibi siue proiciamur instar stercoris. ipse potauit nos aquas fellis, quia dulcem in amaritudinem conuertimus deum.
2.59.3	et ut tales biberemus aquas, causa perspicua est: peccauimus enim domino et exspectauimus pacem, qui nihil boni operis feceramus putabamusque nobis tempus adesse medicinae, cum formidine atque terrore omnia conplerentur\', personarum mutatio, et maxime in prophetis, difficilem intellectum facit; quae si suis locis et causis temporibusque reddantur, plana fient, quae uidebantur obscura. 
2.60.1	 8,16 A Dan auditus est fremitus equorum eius, a uoce hinnituum pugnatorum — siue equitatus — eius commota est omnis terra; et uenerunt et deuorauerunt — siue et uenient et deuorabunt — terram et plenitudinem eius, urbem et habitatores eius .
2.60.2	Non igitur, ut supra LXX transtulerunt, dixit populus: ingrediamur ciuitates munitas, sed: ciuitatem munitam, ut significet Hierusalem. denique et nunc infert: urbem et habitatores eius. describitur autem a Dan per Phoenicem ueniens cum exercitu Nabuchodonosor, in quo loco Iordanes fluuius oritur. et quae LXX futura, Hebraicum pro ueritate rei iam facta commemorat. 1. 3. 4 *Hier. 8, 14 4 cf. Ps. 24. 8. I Petro 2, 3 5 cf. Os. 14. 1. Am. 6. 12 (13) 6 Hier. 8, 14. 15 14. 16 *Hier. 8, 16 18 *Hier. 8, 14 19 Hier. 8, 14 20 Hier. 8. 16 2 habeamus P 4 ∗∗stercoris M potabit Ma.c . aquam P aqua MAVv dulces (1 s . u.; s ex m) M 5 deum-biberemus om. M 6 expectauimus MVP 7 putamusque FP 8 tempus nobis MAVP 9 omnia-maxi in mg . m. coaeua (enim post personarum add.; et om.); eadem nerba nulla varia lectione in mg. inferiore add. alia w- M 11 qui Pa.e . uideantur P 14: innituum M eius siue equitatus v 19 sed Erasmus e siue codd . 21 discribitar P (passim) 22 exercitum L nabucod. M nabughod. (ex nabueod.) A aabogod. (ch s. g) P iordanis codd. (corr. L) fluuius Iordanis p 23 rei] se P * factam P 
2.61.1	 8, 17 (17.18) Quia ecce ego mittam uobis serpentes regulos — siue pessimos ant, ut Septuaginta transtulerunt, mortiferos —, quibus non est incantatio: et mordebunt KOS, ait dominus, insanabiliter cum dolore cordis uestri deficientis .
2.61.2	Qui sint illi, qui ueniunt a Dan pt quorum auditus est fremitus et qui terram omnem ad solitldinem redegerunt. sub alia figura idem prophetalis sermo demonstrat \'serpentes\' eos appellans \'pessimos\' siue \'mortiferos\' et, ut Aquila transtulit, \'regulos\', qui appellantur Hebraice \'sapphonim\': pro quo, quid sibi uoluerit secunda eius editio. ut \'speculatores\' diceret, non intellego. nisi forte ob uerbi similitudinem. quibus non est. ait. incantatio.
2.61.3	frustra enim ad deum preces fundunt aduersum serpentem antiquum. colubrum tortuosum, qui dei praecepta contemserint. utamur hoc loco aduersum eos, qui saluatoris eloquia contemnentes traduntur aduersariis potestatibus. 
2.62.1	 8, 18 Dolor meus super dolorem. in me cor meum maerens . Pro quo, ut supra diximus, LXX superiori sententiae, quae dicta sunt, copularunt, ut ponerent: et mordebunt uos, ait dominus, insanabiliter cum dolore cordis uestri deficientis. in Hebraico autem non tam \'dolor\' est. qui Graece dicitur ὀδύνη , quam μειδίαμα , quod nos interpretari possumus \'rictum\' oris dolore contracti et habentem risus 2 *Hier. 8, 17 4 *Hier. 8, 18 5 cf. Hier. 8. 16 6 cf. Gen. 47, 19 etc. 8. 9. 11 *Hier. 8, 17 12 Hier. 8. 17 13 cf. Apoc. 12. 9. 20, 2 14 cf. Esai. 27. 1 19 *Hier. 8, 17. 18 1 ecce] ac ̄ Pa.c. 2 peasimus La.c . 4 insanabiliter—deficientis om. Vulg . 5 deficientes La.c . deficietia cet. c ἀπορουμένης LXX (cf. lin. 21) sant Ma.c.,v 6 omnem terram V 7 redigerunt La.c.Mp.c . redierant P 8 sine om., & add. s. H. M 9 aliqua Pa.c . 10 saphonim La.c . sapponim Aa.c . aapphonin M saphpbonim c uoluerint V 13 (=15) adaersus MAVPv 14 colobrum MAa.c. tortuorsum V contemserint (sic semper fere Lp.c. uel primitus) scripsi contempserint codd . 15 eloquia MV,LAa.c . eloquium P 18 merens VP,Aa.c.m2 19 copolarunt L ponent Lp.r . et om. Y 21 deficietis MAVPv aum A dolor est] dolorem P 22 od ιΝΗ V odyNh P μειδίαμα Erasmus v MHd ι aMa LMVP MHdia λλλ (medialla e. u.) A 23 dolorem P et s. u. L 8* similitudinem. ὲμϕατιϰω̃ς autem haec ex persona dei legenda sunt plangentis euersionem Hierusalem et eius miserias non ferentis. 
2.63.1	 8, 19a Ecce uox clamoris filiae populi mei de terra longinqua ! Fletum describit et ululatum urbis Hierusalem ingressis hostibus. 
2.64.1	 8, 19 b Numquid dominus non est in Sion aut rex eius non est in ea ? Siue dominus ipse est rex aut certe dominus ad patrem, rex refertur ad filium iuxta illud, quod sub nomine Salomonis scribitur: deus, iudicium tuum regi da et iustitiam tuam filio regis. ut autem uox clamoris sit in Hierusalem et clamor ipse ueniat de terra longinqua, causa manifesta est, quod dominus non sit in ea et rex illius recesserit ab illa. 
2.65.1	 8, 19c Quare ergo me ad iracundiam concitauerunt in sculptilibus suis et in uanitatibus alienis? \'Recessit autem\', inquit, ab eis dominus, quia me, qui dominus et rex eorum eram, idolorum cultu ad iracundiam prouocarunt\'. 
2.66.1	 8, 20 Transiit messis, finita est aestas; et nos saluati non sumus . Rursum populus loquitur, qui in Hierusalem diuturna obsidione conclusus est, quod mutata sint tempora et anni circulus euolutus sit et omnis eorum spes irrita fuerit atque transierit. 
2.67.1	 8, 21 stupor contritione filiae populi mei contritus sum et contristatus, stupor obtinuit me . Respondet 10 Ps. 71, 1 (2) 1 eƆ-C Φ ar ιΚ ѠC V -KѠaC P (emphaticos s. u. A) haec om. L ex om. P diligaenda P 2 plangentes La.c . 7 in om. v 9 adfertur P 10 salamonis L 11 nt] cur v 13 lonquinqaa M 14 recessit La.c . 15 (= 18) iracundia La.c . 16 sculptillibus La.c . 17 autem om. M dominus om. P quia me qui postea add. P qui] quia Va.r . 18 eoram] illorom v prouocaaerunt V,La.c.,v 19 transit P, Vax . 21 quia.., 22 omis (is s. u. m2) A 24 contritionem P filiae s. u. L 25 contristatur V respondet scripsi respondit codd. v (if. p . 58, 9. 92, 7. 91, 14) deus, quod in adflictione Hierusalem ipse uideatur adflictus, et in humanam similitudinem stupore conteritur. 
2.68.1	 8, 22 Numquid resina non est in Galaad aut medicus non est ibi? quare igitur non est obducta cicatrix filiae populi mei ? Non solum in praesenti loco, sed et multis aliis testimoniis scripturarum inuenimus resinam Galaad pro paenitentia poni atque medicamine mirarique nunc deum, quare uulnera Hierusalem nequaquam curata sint et necdum cicatrices obduxerint cutem eo, quod non sint prophetae nec sacerdotes, quorum debeant curari medicamine. 
2.69.1	 9,1 Quis dabit capiti meo aquam et oculis meis fontem lacrimarum? et plorabo die et nocte interfectos filiae populi mei . \'Si totus\', inquit, \'uertar in fletum et nequaquam guttae sint lacrimarum. sed abundantia fluminis. tamen interfectos filiae populi mei digne flere non potero. tanta enim sunt mala. ut omnem dolorem sui uincant magnitudine\'. hoc autem tam ex prophetae quam ex domini persona intellegi potest. 
2.70.1	 9,2a Quis dabit me in solitudine diuersorium uiaforum? et derelinquam populum meum et recedam ab eis . LXX: quis det mihi in solitudine mansionem nouissimam, ut relinquam populum meum et recedam ab eis ? \'Melius\', inquit, (est habitare in extrema solitudine quam inter tanta hominum scelera commorari\'. unde et saluator in euangelio loquebatur: usquequo sustinebo uos? et in alio loco scriptum est: in tempore illo, qui 6 ci . Hier. 46 (26), 11. 51 (28). 8 21 *Hier. 9, 2 25 *Matth. 17, 16. cf. Marc. 9. 18. Luc. 9, 41 26 * Am. o, 13. cf. Thren. 3, 23. Micb. 2, 3 1 afflict∗∗tione A adflictionem P 2 humana similitudine P conteritus V eonteratur v 4 tibi M,La.r . non—cica s. u. L 6 et] in add. c 7 mirajiq.o (o s. q) F 9 obduxerunt P.Va.e . 12 alt. et; ac v cum Vulg . 13 fietum] lactum V 14 sint guttae La.c . habandantia VP 16 magnitudinem La.c . 17 propheta M 19 in diuersorio MAVP,La.c . 21 solitudinem V 23 est inquit P 25 euuangeiio La.c. (passim) 26 intelleget Ap.c . intellegit, sedebit et tacebit, quoniam tempus pessimum e s t. 
2.71.1	 9,2b.3 Quia omnes adulteri sunt, coetus praeuaricatorum, et extenderunt linguam suam quasi arcum mendacii et non ueritatis; confortati sunt in terra, quia de malo in malum egressi sunt et me non cognouerunt, dicit dominus . De malo in malum transeunt peccatores, quando idolum mutant idolo et de peccatis ad peccata transcendunt uel certe de obsidionis malo transeunt ad captiuitatem.
2.71.2	et de sanctis quidem dicitur: ibunt de uirtute in uirtutem, de peccatoribus uero: de malo in malum egressi sunt. causaque omnium miseriarum, quod non cognouerint dominum coetusque sit praeuaricantium et armantium linguam suam instar extenti arcus in blasphemiam: confortatique sunt in terra, ut mereantur audire: terra es et in terram ibis. 
2.72.1	 9, 4—6 Unusquisque se a proximo suo custodiat et in omni fratre suo non habeat fiduciam, quia omnis frater supplantatione supplantat et omnis amicus fraudulenter incedit et uir fratrem suum deridebit et ueritatem non loquentur; didicit enim lingua eorum loqui mendacium — siue docuerunt enim linguam suam loqui mendacium —. ut inique agerent, laborauerunt — siue inique egerunt et non inter- 10 Ps. 88, 8 11* Hier. 9, 3 15 Hier. 9. 3 *Geu. 3. 19 21. 24 *Hier. 9, 5 .4 et om. P 6 in] ad Vulg . 7 in] ad MAP 8 mutanti dolo P de om. M 9 de om., ab s . M. M 10 captiuitate P 12 miseroram M quia v 13 cognorunt P cognouernnt v 16 est La.c . terra La.c . 18 abeat P 19 frater] eius add. V supplantatione Ap.c.m3 supplantatis Ap.c.m2 aupplantans Vulg . sapplantat Ap.c m3 supplantabit Ap.c.m2,v cum Vulg . 20 incedet V,Ap.c.,v cum Vulg . 21 loquitur La.c . dicit V,Ma.c . docuerunt v linguam v eorum] suam v 22 loqui om . P -mendatium (da s . u.) P docuerunt—suam] didicit lingua eorum (scil. μεμάϑηϰεν ή γλω̃σσα αὐτω̃ν ) LXX docuerunt] didicit c lingua v 23 suam] eorom v iniqua VP 24 iniqua P miserunt, ut conuerterentur —. habitatio tua in medio doli; in dolo — siue usura super usuram et dolus in dolo: — rennuerunt — siue noluerunt — scire me, dicit dominus .
2.72.2	Hoc loco utendum est in tempore persecutionis et angustiae, quando aut rara aut nulla fides. quando nec fratri nec proximo credendum est et inimici eius domestici eius, quando iuxta euangelium tradet pater filium et filius patrem et diuiduntur duo in tres et tres in duo. quodque infert: docuerunt linguam suam loqui mendacium siue didicit lingua eorum loqui mendacium, ostendit consuetudinem mentiendi quodammodo in naturam uerti studioseque eos agere. ut agant iniqua. quodque sequitur: habitatio tua in medio doli. 
2.72.3	 in dolo, proprie ad prophetam sermo dirigitur, quod habitet in medio populi mentientis — siue, ut LXX transtulerunt: usura super usuram et dolus super dolum — et quod cotidie augeant scelera et nequaquam eos prioris facti paeniteat, sed nonis praeterita cumulent, haec facientes omni agant studio, ut nesciant dominum, qui haec non facienda praecepit. 
2.73.1	 9, 7 Propterea haec dicit dominus exercituum: ecce ego conflabo - siue igne examinabo - et probabo eos; quid enim aliud faciam a facie filiae populi mei ? siue quia faciam a facie malitiae filiae populi mei . Quotiescumque angustiis subiacemus, mala 2. 3 *Hler. 9. 6 6 *Mich. T. 6. *Matth. 10, 36 7 cf. Matth. 10. 21. Luc. 12, 53 8 cf. Luc. 12, 52 9 Hier. 9, 5 10 *Hier, 9. 5 13 Hier. 9, 6 15 *Hier. 9. 6 21. 23 *Hier. 9. 7 2 dolij siue add. s. «. LA alt . usura P 3 dolore P 5 fidesj est add. r .6 eiosj hominis v 8 diuidentur Ap.c.,v 9 duo] & add. P quoque MAa.c . 10 di€ Y 12 natura P ageret P 14 dirigetur MAa.c . 15 usura Erasmus v usuram codd . 16 pr . dolam V,Mp.c quod s. u. M cottidie V 17 augeat Pa.c 18 comalent P haec] aat add. s. u. Lm2 omnis MAP,LVa.c . agunt Lp,c.m2,c 19 quia P 22 facie. L filii P 23 qaid Ap.c.m2,v facie] faciem Ma.c . militiae P filii P 24 quotienscumque MVP,La.c.Ap.c.m 2 subiciemas P recepimus LMAa.c . recipimus a deo et examinamur persecutionibus, ut, quicquid in nobis adulterinae materiae est, tribulationum et miseriarum excoquatur ardoribus: argentum enim domini igne examinatum. probatum terrae. purgatum septuplum. 
2.74.1	 9, 8. 9 Sagitta uulnerans lingua eorum, dolum locuta est; in ore suo pacem cum amico suo loquitur et occulte ponit ei insidias. numquid super his non uisitabo, dicit dominus, aut in gente huiuscemodi non ulciscetur anima mea ?
2.74.2	Omnis hereticus, qui corda uulnerat audientium et nescientium scriptum: omni custodia serua cor tuum, sagittam possidet uulnerantem et in dolo loquitur, cumque ore suo pacem proximo repromittat, occulte tendit insidias. sequentibus autem uersiculis, in quibus dicit: numquid super his non uisitabo, dicit dominus, aut in gente huiuscemodi non ulciscetur anima mea? crebro in hoc propheta abutitur, ut, cum singula malorum operum enumerarit, inferat se iuste facere, quod faciat. 
2.75.1	 9, 10 Super montes assumam — siue assumite — fletum et lamentum et super speciosa — siue se mitas — deserti planctum, quoniam incensa sunt - siue defecerunt — co, quod non sit uir — siue homo — pertransiens. et non audierunt uocem possidentis - siue substantiae , a uolucre caeli usque ad pecora migrauerunt et recesserunt .
2.75.2	Superueniente 3 Ps. 11, 7 10 Prou. 4, 23 14 *Hier. 9, 9 16 cf. Hier. 5, 9. 29 19. 20. 22. 23. 24 *Hier. 9. 10 1 examinantur V 2 materia V 3 eiquoquatnr AP,La.c . exuraturv in igne V 7 ocolte V 8 gentem P huiusmodi Vulg . 9 (= 15) ulciseitnr La.c . ereticus P qai corda om. M 10 neseientera P cor add . s. u. M scriptum 8. u. L e add. s. u. m2, enl add. s. u. m3 M 11 tuum cor P possedit P 12 quumque La.c . 13 antem om. P 15 gente V 17 enumerari V enumeraret P infexat se] in se inferat V 18 facit v 20 pr . et] ac Vvlg . 23 possidentes L.Aa.c . 25 transmigrauerunt Mp.c.m2 cum Vulg . Babylonio et cuncta uastante solitudo prouinciae prophetatur. quod planctus in montibus, fletus sit in deserto siue in semitis solitudinis, quod uniuersa defecerint atque succensa sint et nullus sit, qui per terram gradiatur caesis omnibus. nihilque remanserit, quod spirare possit et uiuere. unde pro \'possidente\' LXX transtulerunt \'substantiae\', quae Hebraice dicitur \'macne\': et substantia hic non pro οὐσία , hoc est \'essentia\', accipitur, sed pro \'opibus\' atque \'diuitiis\'.
2.75.3	quodque infert: a uolucre caeli usque ad pecus recesserunt et abierunt, hoc ostendit, quod saepe diximus, iram dei uniuersa sentire et non solum aues aeris, sed et pisces aquae deficere. iuxta tropologiam fletus assumitur super montes et lamentatio super speciosa deserti, quando principes peccant ecclesiae et nihil in ea inuenitur substantiae dei nec auditur uox domini eccleesiam possidentis per sanctos et apostolicos uiros et a uolucre caeli usque ad pecora, ab his uidelicet, qui possunt in sublime ascendere, usque ad irrationales et simpliciores quosque, recesserint a conciliabulo dei. 
2.76.1	 9, 11 Et dabo Hierusalem in aceruos harenae — siue in transmigrationem — et in cubilia draconum et ciuitates Iuda dabo in desolationem eo, quod non sit habitator . Cum ecclesiastici uiri et doctores quique defecerint, tunc datur Hierusalem in transmigrationem siue in aceruos harenae. ut hereticus in ea sermo praeualeat et 5 Hier. 9, 10 6 *Hier. 9, 10 8 *Hier. 9, 10 10 cf. p. 62, 14 15 Hier. 9, 10 20 *Hier. 9, 11 1 babyllonio La.c . exercita add. Mv 4 cesis Y cessis P b ?perare PjLa.c . possit∗∗∗∗∗∗ JLA (possit bis posuit P) pro] & P 6 macnae VP magne LA 7 TCta MV, (asia s. u.) A dycia P 9 secesserunt P 11 aues] habes Ma.c . aues aeris] anersari P aquae] atq. V 14 uox] xp ̃ι add. MAVP 16 peccora P uidellicet La.c. 17 suplime P inrationabiles Pa.r . quosque] qui add. P 18 recesserunt Ap.c.m2 19 daboj oms sic m ̄ dat add. V arenae MVP 20 alt . in om. Vulg . 21 ciuitatis Aax . Iudae w desolationem (aolitudinem s. u.) A 22 quoque P,Aa.e . 23 defecerit Va.c . defecerunt P dabitur Ap.c m2 24 aceruo V arenae P efficiantur Pa.r . efficiatur cubile draconum et ciuitates illius redigantur in solitudinem nec sit in ea diuini sermonis habitatio et ille. qui dicit: inhabitabo et inambulabo in eis et ero deus eorum. 
2.77.1	 9,12―14 Quis est uir sapiens, qui intellegat hoc et ad quem uerbum oris domini fiat et annuntiet istud: quare periit terra et exusta est quasi desertum eo, quod non sit, qui pertranseat? et dixit dominus : quia dereliquerunt legem meam, quam dedi eis, et mora audierunt uocem meam et non ambulauerunt in ea et abierunt post prauitatem cordis sui et post Bahalim, quos didicerunt a patribus suis .
2.77.2	Interrogat propheta, si quem sapientium in Hierusalem ualeat repperire et eorum, ad quos fiat sermo dei et qui possint annuntiare domini uoluntatem et causas reddere, cur Iudaea redacta sit in solitudinem et omnibus interfectis nullus remanserit, qui per eam transeat. et inducit dominum respondentem causasque reddentem, quia dereliquerint legem eius, quam dederat eis, nec audierint uocem illius nec fecerint, quae praecepta sint, sed abierint post prauitatem cordis sui.
2.77.3	ergo non in nostra uoluntate, sed in domino confidendum est; prauum enim cor in hominibus et de corde nostro exeunt pessimae cogitationes. et post Bahalim, inquit, abierunt, quos didicerunt a patribus suis. Bahal idolum Sidoniorum et est 3 *II Cor. 6, 16 21 cf. Hier. 17, 9 22 *Matth. 15, 19 23 *Hier. 9, 14 1 ciuitas Lax . solitudine P 2 diuinis P 3 inambula Ma.c.m2 6 ut Ap.c.m2,v cum Vulg . 7 quae La.c . perit MV perierit Ap.c.m2 cum Vulg . pariat (a alt. in ras.) P et om. V sit Ap.r. cum Vulg . 9 derelinquerunt MAa.r . 12 quod Aa.c.m2 cum Vulg . 13 reperire Ap.r . t5 indet La.c. m2 sit] e P 18 derelinquerint V audieT P 19 eius v sunt P habierint V,La.c . abierunt P 20 cordi La.c . non om. P colaptate Pp.c . 21 confitendum c omnibus AVP,La.c.,v ominibus M 22 pessime La.c. . 24 bahal- L sydoniorum A est add. v numeri singularis, Bahalim uero pluralis numeri. ergo nec parentum nec maiorum error sequendus est, sed auctoritas scripturarum et dei docentis imperium 
2.78.1	 9, 15.16 Idcirco haec dicit dominus exercituum deus Israhel: ecce ego cibabo eos, populum istum, absinthio - siue angustiis — et potum dabo eis aquam fellis et dispergam eos in gentibus, quas non nouerunt ipsi et patres eorum, et mittam post eos gladium, donec consumantur . Potest et de uicino tempore prophetari, quando capti sunt a Chaldaeis, et proprie de hoc tempore, quando dispersi sunt in gentibus, quas non nouerant ipsi et patres eorum, et in toto orbe diuisi cibatique suut absinthio siue necessitatibus et angustiis.
2.78.2	et acceperunt potum aquam fellis, quod aut malorum significat magnitudinem et sempiteruum captiuitatis iugum, aut certe per ignorantiam legis dei pro Christo Antichristum suscepturi sunt. mittitur autem gladius post eos, ut usque ad interitum consumantur, uel certe gladius, qui eos diuidat et non patiatur in malum habere consensum, ut dispereant in eo, quod mali sunt. 
2.79.1	 9, 17 19 a Haec dicit dominus exercituum; contemplamini — siue intellegite — et uocate lamentatrices et ueniant et ad eas, quae sapientes sunt, mittite et properent — siue loquantur —, festinent et assumant super nos — siue super uos - lamentum et deducant oculi nostri — siue uestri — lacrimas et palpebrae 6 *Hier. 9, 15 21. 23 *Hier. 9, 17 24. 25 *Hier. 9, 18 1 pr . nomeris P plarales La.c. alt . namerij e add. s. u. m3 M 2 malorum MVP.Aa.c . 3 ducentis Aa.c . 5 eos om. P,Ap.r . cum Vulg . absentio La.c . absenthio P (= lin. 13) 7 dispargsm M.Aa.c . noue- rant 3IAVP 9 consummantur V,Aa.r . potens P dej di P 10 chal- deis La c. 11 nouerunt MP 14 aquam om. M au ̄ t P 15 per om. MVP,LAa.c.m2 16 deij & add. s. M . M na add. s. u. m2 a antexpm LMAa.c . 17 consumantur F 19 dispereat Aa.c.m2 20 exercituum] deus Israel add. Vulg . 21 intelligite Lp.c . 22 alt . et om. P 24 et eras. A, om. Vulg . 25 sine uestri om. M palphebrae P nostrae — siue uestrae — defluant aquis, quoniam uox lamentationis audita est de Sion siue in Sion . 
2.79.2	 Propter futuram captiuitatem et euersionem Hierusalem lamentatrices uocari iubet, quae solent in luctu uoce flebili et lacertos manibus uerberantes ad lacrimas populum prouocare; hic enim mos usque hodie permanet in Iudaea, ut mulieres sparsis crinibus nudatisque pectoribus, uoce modulata omnes ad fletum concitent. se autem iungit deus conpatientis affectu siue propheta, ut, quicquid populus sustinet, ipsum sustinere et sentire se dicat. quod autem infert: quia uox lamentationis audita est de Sion, statim sequitur, quae ista sit uox. 
2.80.1	 9, 19 b Quomodo uastati sumus et confusi uehementer? quia dereliquimus terram, quoniam deiecta sunt - siue abiecimus — tabernacula nostra . Uox ista est lamentantium Sion: quomodo uastati sumus et confusi uehementer?
2.80.2	statimque sibi ipsi respondent et causas uastationis exponunt dicentes: quia dereliquimus terram nostro uitio atque peccato et deiecta sunt tabernacula nostra, quae quasi praetereuntes quondam possidebant. dicant hoc et in persecutione quondam credentium turbae, quoniam idcirco uastatae sint atque confusae, quia dereliquerint terram domini et deseruerint tabernacula sua. 
2.81.1	 9,20.21 Audite ergo, mulieres, uerbum domini et assumat auris uestra sermonem oris eius et docete filias uestras lamentum et unaquaeque proximam suam planctum, quia ascendit mors per fenestras 1 *Hier. 9, 18 2 *Hier. 9, 19 10 *Hier. 9, 19 15 *Hier. 9, 19 16. 18. 19 Hier. 9, 19 1 sine uestrae om. M quia Vvlg . 5 lacertus La.c . 6 hinc P et La.c . & ut MP,Aa.r . 7 modolata Ma.c . 8 cou(m)patientes VPa.c . 9 ipsum eras. A 15 abicimns MP 17 ipsi sibi P causas] suae add. e 18 uastationes La.c . 19 deleta (ex delicta) M 20 possidebant—quondam om. P 21 persequationem M 22 sunt v dereliquer P 23 deaererint La.c . deseruerunt Aa.c . desuerint P 24 ergo om. Y 25 assumant Yulg . aures P,La.c., Vulg . uestrae Vulg . nostras, ingressa est domos nostras disperdere paruulos de foris, iuuenes de plateis ! In superiore capitulo dixerat: uocate lamentatrices et ueniant et ad eas, quae sapientes sunt, mittite et properent; nunc quasi praesentibus loquitur in condemnationem sacerdotum atque doctorum et uirorum omnium, ut illis cessantibus a doctrina istae audiant uerbum domini et assumant sermones oris eius doceantque filias et proximas suas planctum causasque lacrimarum, quia ascendit, inquit. mors per fenestras nostras, ingressa est domos nostras.
2.81.2	quod quamquam et spiritaliter possit intellegi eo, quod per omnes sensus ad animae interitum mors introeat peccatorum, tamen et de Babyloniorum impetu intellegi potest. quod tanta sit fortitudo et uelocitas proeliandi, ut non exspectent reserare fore. sed per fenestras et tecta conscendant, ut domos uastent Hierusalem. pereunt autem paruuli, qui foris sunt et egrediuntur de Hierusalem, et iuuenes, ad quos scribit et Iohannes. qui non ingrediuntur per artam et angustam uiam, quae ducit ad uitam. sed ambulant per plateas, de quibus scriptum est: quam lata et spatiosa uia, quae ducit ad mortem! 
2.82.1	 9, 23.24 Loquere: haec dicit dominus: et cadet morticinum hominis — siue cadauera hominum - quasi stercus super faciem regionis — siue campi — et 3 Hier. 9, 17 9 Hier. 9, 21 17 cf. I Ioh. 2. 13 18 cf. Matth. 7. 14 19 *Matth. 7, 13 22. 23 *Hier. 9. 22 .1 (= 10) domus P.La.c Ap.c., Vulg.; cf. p. 81. 8 2 fores P supenori La.c.Ap.c.,v (cj. p. 113, 12) autem add. YP 3 ueniat La.c . ad om. P,La.c . 4 nuacj non P 5 condemnatione La.c . 7 doctrina P iste V isti P sumant P sermonis La.c . sermoBem P 9 inquit om. v 11 spiritualiter Ap.c.m2 sensos Pa.c . 13 babii. P inpetn La.c . impetn M 14 pliandi V expectent MVP reserari Ap.c . sed] et add. v 15 ut] & M domus MP,La.c.Ap.c.; cf. lin. 1 (=p. 126, 12) 17 iuuenes tr. ante de; pr . et om. P iohannis P,La.c . 18 egrediantur M ducitur Ma.r . 20 latam Ma.r . uia postea add. P 21 cadit La.c . morticinium v (= p. 126, 13) 22 quasi] quia si L 23 campi et] capia P quasi faenum post tergum metentis et non est, qui colligat . Uerbum Hebraicum, quod tribus litteris scribitur \'daleth, beth, res\' — uocales enim in medio non habet —, pro consequentia et legentis arbitrio si legatur \'dabar\', \'sermonem\' significat, si \'deber\', mortem), si \'dabber\'. \'loquere\'. unde et Septuaginta et Theodotio iunxere illud praeterito capitulo, ut dicerent: disperdere paruulos de foris, iuuenes de plateis morte.
