1.1.1	 1, 1—3 Uerba Hieremiae, filii Helchiae, de sacerdotibus, qui fuerunt in Anathoth, in terra Beniamin. quod factum est uerbum domini ad eum in diebus Iosiae, filii Amon, regis Iuda, in tertio decimo anno regni eius. et factum est in diebus Iosiae, filii Iosiae. regis Iuda, usque ad consummationem undecimi anni Sedeciae, filii Iosiae, regis Iuda, usque ad transmigrationem Hierusalem in mense quinto .
1.1.2	Ceteri prophetae, ut Isaias, Osee, Iohel, fuerunt ante captiuitatem decem tribuum Israhel siue duarum tribuum Iudae et Beniamin; alii post captiuitatem, ut Danihel, Aggeus et Zacharias; Hieremias uero et Hiezechiel inminente captiuitate uaticinium texuerunt, sed alter eorum in terra Iuda, alter in Babylone.
1.1.3	Hieremias cum esset adhuc puer, prophetare coepit anno tertio decimo Iosiae, filii Amon, regis Iudae, prophetauitque in imperio eius annis 1 apollogian (ol postea add. in mg.) A apologiam VP aduersu L -us cet . 2 animaduertet V animaaduertit Ba.c . animaduertit L,P (addito id), M Aa.c . 3 blasphemari Bp.c . 6 estj explicit praefatio incipit tractatus add. litteris maiusculis V explicit add. m2 P (sequitur duorum uersuum ras.); in cet. neque subscriptio neque inscriptio 8 fili BM 9 anathod P 11 fili B,Mp.r.,Pa.c . ammon P (= 22) 12 ioiacim (alt . i p. c.) L ioacim B ioachim cet . fili M.,La.c . 13 comsummationem L consummationem—usque ad om. P 14 sedechiae (sic semper) AV fili B 15 proprophetae L 16 esaias V,APa.c . oseae A ioel M tribum Ba.c m2 18 aggaeus B zacchanas B uero] autem v ,19 iezechiel (i pr. s. u.) A captiuitatem L 20 babylone. L babflone V 22 fili B,Pa.c . iuda e- L decem et nouem et postea sub Ioiacim filio eius annis undecim et sub Sedecia, qui ultimus fuit regum Iuda. annis undecim usque ad quintum mensem, quando a Babyloniis capta est Hierusalem. Ioachaz uero et Iechoniae terni menses — quorum alter in Aegyptum, alter cum matre ductus est in Babylonem — in supradictis annis conputantur.
1.1.4	ac per hoc ab exordio prophetiae suae usque ad captiuitatem Hierusalem, in qua et ipse captus est, prophetauit annis quadraginta et uno praeter illud tempus, quando ductus est in Aegyptum. ibique prophetauit in Taphnis, ut hoc ipso uolumine continetur. pro \'uerbis Hieremiae\' Septuaginta posuerunt : uerbum dei quod factum est ad Hieremiam, hoc uidelicet sensu, quod uerba Hieremiae\' uerbum sit domini. fuit autem de genere sacerdotum, qui habitabant contra septentrionem Hierusalem in tertio miliario 5 et uiculo Anathoth. simulque admirabilis clementia domini, quod iam captiuitate uicina et Babylonio exercitu uallante Hierusalem nihilominus populum ad paenitentiam prouocat malens saluare conuersos quam perdere delinquentes. pro \'transmigratione\', quod omnes alii uoce consona transtulerunt, LXX posuere \'captiuitatem\'. post exordium autem uaticinationis Hieremiae, tricesimo quinto prophetiae eius anno, Hiezechiel in Babylone his, qui cum eo capti fuerant, exorsus est prophetare. 5 cf. IV Reg. 23, 34. 24, 15. II Par. 36, 4. 10. Hier. 24, 1 10 cf. Bier. 43 (50), 8 11 *Hier. 1, 1 20 *Hier. 1, 3 1 pr . et s . u. L ioiacim scripsi (cf. Index nominum) ioacim LB ioachim cet . filios (v S. os) B 2 sedicia L sedeciain M sedechia. P 3 babylloniis Lax . 4 iechoniae V hiechoniae (h ait. s. u.) LP hieconiae M, (e tert. s. u.) B, (h eras.) A; ef. Index nom . 5 babyllonem L 6 ac om. v hac P ab] habet P exordium pp.c . 8 prophetaait] autem add. P XLI BV, (ta uno s. u.) A 14 septemtr. T P 15 anathoh L anathot P ammirabilis V admirabiles La c . 16 cap- tiuitatem uicinam La.r . babilonio P uallente P 17 nihilo;6minus L 21 tricensimo BM,LAPa.r . prophetiae eius del. P tezechiel (i pr. s. u.) A ezechiel VP 22 babyllone La.r . babilone P 
1.2.1	 1, 4. 5 Et factum est uerbum domini ad me dicens: priusquam te formarem in utero, noui te; et antequam exires de uulua, sanctificaui te, prophetam gentibus dedi te . Non quo ante conceptionem, ut heresis suspicatur, fuerit Hieremias, sed quo praescierit eum futurum dominus, cui necdum facta iam facta sunt, secundum illud quod apostolus loquitur: qui uocauit ea quae non erant quasi ea quae essent.
1.2.2	quod autem sanctificatur in utero, iuxta illud apostoli debemus accipere: postquam autem placuit ei, qui me segregauit de utero matris meae et uocauit per gratiam suam, ut reuelaret filium suum in me, ut euangelizarem eum in gentibus. Iohannes quoque Baptista sanctificatur in utero et spiritum sanctum accipit et mouetur in uulua et per os matris loquitur. quod autem dixit;
1.2.3	prophetam gentibus dedi te, illud uult intellegi, quod in ipso postea propheta lecturi sumus, quod non solum Hierusalem, sed et multis in circuitu gentibus prophetarit. quidam hunc locum super saluatore intellegunt, qui proprie propheta gentium fuit et per apostolos uocauit omnes nationes. iste enim uere priusquam in utero uirginali formaretur et antequam exiret de uulua matris, sanctificatus in utero est et notus patri, quippe qui semper in patre et in quo semper pater. 
1.3.1	 1, 6 2 Et dixi: ah, ah, ah, domine deus, ecce nescio loqui, quia puer ego sum . LXX: et dixi, o domine deus, nescio loqui, quia iuuenis sum . Detestatur officium. quod pro aetate non potest sustinere, eadem uerecundia, qua 7 *Rom. 4, 17 9 *Gal. 1. 15-16 13 cf. Lac. 1, 41—42 15 *Hier. 1, 5 17 cf. Hier. 1. 10. 25 (32), 15 (1) 22 cf. loh. 10. 38. 14, 10—11 25 *Hier. 1, 6 3 proph. -te add. v cum Vvlg., om. codd . (et ante proph. et in ante gentibus, quamquam Vulgatae lectio est, omisi, cf. lin. 15 et Ind. loc.) 4 qaod VP haeresis B 5 quod P,Ma.r . praesciret v . 10 placui Bp.r . 13 iohannis LPa.c . sanct. spir. v 14 accepit МP,LBAa.c . 15 proph.] in add. v 17 prophetaret AVP 18 saluatorem AP,LBMa.r . 19 propriae AP,LBMa.r . 24 a a a V 27 qua] quae BMa.r . et Moses tenuis et gracilis uocis esse se dicit. sed ille quasi magnae robustaeque aetatis corripitur, huic pueritiae datur uenia, quae uerecundia et pudore decoratur. 
1.4.1	 1, 7. 8 Et dixit dominus ad me: noli dicere: puer sum, quoniam ad omnia, quae mittam te, ibis et uniuersa, quaecumque manda uero tibi, loqueris. ne timeas a facie eorum, quia tecum sum, ut eruam te, dicit dominus . \'Ne aetatem\', inquit, \'consideres — alio enim propheta loquente didicisti: cani hominis sapientia eius—, tuae sit tantum uoluntatis, ut pergas; me habebis comitem, quo cuncta adiuuante conplebis: aperi os tuum, et implebo illud.
1.4.2	nec consideres multitudinem eorum, ad quos et contra quos locuturus es, sed me qui tecum sum, ut eruam te, dicit dominus\', liberat autem dominus, non quo propheta persecutionibus et angustiis careat, quippe cum legamus eum multa perpessum, sed ut patiens omnia superet nec cedat angustiae. 
1.5.1	 1,9 Et misit dominus manum suam et tetigit os meum et dixit dominus ad me: ecce ego dedi uerba mea in ore tuo . Notandum quod hic manus mittatur dei, quae tangat os prophetae, et dicatur ei: ecce dedi uerba mea in ore tuo, in Isaia autem scriptum sit: et missus est unus ad me de seraphim et in manu habebat carbonem, quem forcipe tulerat de altari, et tetigit os meum et dixit: ecce tetigit iste labia tua et auferet iniquitates et peccata tua mundabit.
1.5.2	ibi enim, quia solidae et perfectae aetatis erat et ipse simpliciter 1 cf. Ex. 4, 10. 6, 12 9 *Sap. 4, 9 11 *Ps. 80, 11 13 Hier. 1, 8 20 Hier. 1, 9 21 *Esai. 6, 6-7 1 pr . et om. BMA moyses AVP 2 pueritia La.c . 6 quaequumque L 7 quia] ego add. v, post tecum add. Vulg . 9 dedicisti La.c . didicistia Âa.r . salomonis dictum add. P hominis] sunt add. v 12 loquuturus BM 14 persequutionibus BM 15 careat ante et tr. v quum L 18 meus Ba.c . ego om. v cum Vulg . 21 eaaia VP,Aa.c . 22 ad me unus v seraphin BMP,La.c . 24 diiit] ecce tetigit oa meum et dixit addsed exp. M 25 iniquitates] tuas add. Pe,Ap.c.m2 peccatum tuam P mundabid (b ex u) B confitetur, quod inmunda labia habeat et habitet in medio populi inmunda labia habentis, mittitur unus de seraphim, qui non manu, sed forcipe et carbone tangat os eius et iniquitates auferat et mundet peccata. hic autem ipsius dei manus mittitur, per quam cuncta operatus est, et quae in alio loco bracchium dicitur, non ut peccata auferat, quae per pueritiam multa non fecerat, sed ut loquendi gratiam tribuat.
1.5.3	porro Hiezechiel librum deuorat et intus et foris scriptum, tam sacramenta diuina quam simplicem historiam continentem. Hieremiae os tangitur et domini uerba tribuuntur, ut confidentiam accipiat praedicandi. pulchreque iuxta litteram manus mittitur, ut humanorum artuum uidens similitudinem tactum manus non reformidet. 
1.6.1	 1,10 Ecce ego constitui te hodie super gentes et super regna, ut euellas et destruas et disperdas et dissipes et aedifices et plantes . Hoc, quod nos de Hebraico addidimus \'dissipes\' siue \'deponas\', in LXX non habetur. et considerandum quod quattuor tristibus duo laeta succedant. neque enim poterant aedificari bona, nisi destructa essent mala, nec plantari optima, nisi eradicarentur pessima.
1.6.2	omnis enim plantatio, quam non plantauit caelestis pater, eradicabitur, et aedificatio, quae super petram non habet fundamentum, sed in harena exstructa est, sermone dei suffoditur atque destruitur. illam autem, quam consumet Iesus 1 cf. Esai. 6, 5 5 cf. Hier. 27 (34), 5 (4). 32 (39), 17 7 c\'. Ezech. 2, 8. 10 17 *Hier. 1. 10 20 *Matth. 15, 13 22 cf. Matth. 7, 25—26 etc. 24 cf. II Thess. 2, 8. 2 inmnnda] polluta v habentes La.c . seraphin BAP,LMa.c. 3 pr. et om. P eius om. V 4 huic Mp.c. 6 bracchium B brac- cium La.c . brachium cet . ut eras. B, ut (s . «.) ei A 7 multam Pa.r . hiezechiel BMP hiezecihel L iezechiel Y, (i pr. postea add.) A 11 & pulchre (& s. u.) M manu Ma.c . 12 artum La.c . 13 formidet V 14 ego abest a Yulg . constitue Ma.c . 16 hebraeico M, (b s. u.) L hebreico B 17 habentur L 18 quot Aa.c . 19 aedificari poterant v distructa P 20 eradicantur Pa.c . 22 super] supra u petram] terram V 23 arena P eistructa P,Lp.c . extr. eet . sermo Pa.c.m2 24 adque B (semper) illa V consummet V IesnsJ dš BA spiritu oris sui et destruet aduentu praesentiae suae, omnem scilicet sacrilegam peruersamque doctrinam, disperdet in perpetuum. 
1.6.3	porro ea quae eleuantur contra seientiam dei et in sua confidunt sapientia, quae apud deum stultitia est, dissipabit atque deponet, ut aedificentur pro his humilia, et in locum superiorum, quae destructa sunt et euulsa, exstruantur atque plantentur, quae ecclesiasticae conueniunt ueritati, et impleatur illud quod dicit apostolus: dei aedificatio, dei agricultura estis.
1.6.4	multi hunc locum super persona Christi intellegunt. \'Hieremias\' enim interpretatur (excelsus domini\', qui destruxit regna diaboli, quae sibi in excelso montis ostenderat, aduersarias perdidit potestates delens chirographum errorum in cruce. de quibus et in psalmo post historiae ueritatem τροπιϰω̃ς loquitur: quare fremuerunt gentes et populi meditati sunt inania? adstiterunt reges terrae et principes conuenerunt in unum.
1.6.5	pro his euulsis, destructis, perditis et in inferiora detractis aedificatur atque plantatur ecclesia dei. super Hieremiae autem persona nulla dubitatio est; legimus enim in consequentibus, quod in manu accipiat calicem meri plenum et propinare iubeatur cunctis in circuitu nationibus. 
1.7.1	 1, 11. 12 Et factum est uerbum domini ad me dicens: quid tu uides, Hieremia? et dixi: uirgam uigilantem ego uideo. et dixit dominus ad me: bene uidisti, quia 3 cf. II Cor. 10, 5 - 4 cf. I Cor. 3, 19 8 *I Cor. 3, 9 11 cf. Matth. 4, 8 12 cf. Cul. 2. 14 14 Ps. 2,1-2 19 ef. Hier. 25 (32), 15 (1) -1 destruit La.e . 3 ea M eleuavtur M 4 confidit Mp.c . dissipauit LPa.c . 6 loco Ap.c . eitruantor BMV exhibeantur (h s. u.; e ex u) A 7 quae et conueniunt s. v. m2 P 8 impletur P 9 agrecultura La.c . supra (corr. Cm2) personam (corr. L) codd., sed cf . lin. 18 et p. 7, 13 11 excelso post ostenderat tr. v 12 perdiderit v chyrographum La.c. cir. P cyr. AV 13 crucem V,LBa.c . istoriae (i pr. s. u.) P hystoriae V 14 uox Graeca paulum deprauata in MA, -VP (tropice s. w.) 15 adstitirunt L aatiterunt F 17 destructis] et add. p 18 adque BM (saepius) personi M 19 legemus La.c . in s. u. L 20 acipiat P calice Ma.c.m2 23 hieremias M uigilabo ego super uerbo meo, ut faciam illud . Pro \'uirga uigilante LXX \'baculum nuceum\' transtulerunt. laborandum igitur nobis est, ut breuiter Hebraeam ἐτυμολογίαν Latinus lector intellegat.
1.7.2	\'saced\' \'nux\' dicitur, \'uigilia\' autem uel \'uigil ? siue \'uigilare\' appellatur \'soced\'. unde et in posterioribus pardus uigilans hoc nomine ponitur. ab eo igitur quod dicitur \'nux\', propter uerbi similitudinem ad \'uigilis\' intellegentiam nomen adlusit. quod quidem et in Danihel iuxta Theodotionem scriptum est, ut ab arboribus schinu et prinu, ilice uidelicet et lentisco, scissio atque serratio adulteris presbyteris decernatur. alioquin et in principio Geneseos a \'uiro\', qui dicitur \'is\', appellatur mulier \'issa\', quasi quaedam uirago, eo quod de uiro sumta sit.
1.7.3	pro \'baculo nuceo\' urigam uigilantem Aquila et Symmachus, Theodotio uero \'amygdalinam\' transtulerunt. uigilat autem uirga cuncta populi peccata considerans, ut percutiat et corripiat delinquentes. unde et apostolus scribit peccantibus: quid uultis? in uirga ueniam ad uos, an in caritate et spiritu mansuetudinis? ista est uirga uel baculus, de qua et Dauid loquitur: uirga tua et baculus tuus, ipsa me consolata sunt. pulchreque posuit (consolata sunt\'; ad boc enim 2 *Hier. 1, 11 6 cf. Hier. 5, 6 9 cf. *Dan. 13, 54. 53. 61 13 *Gen. 2, 23 14 *Hier. 1. 11 17 I Cor. 4, 21 20 Ps. 22, 4 1 uerb. meo. (o ex u uel a) M aerba mea VP,Ba.c . uerbum meum v illa P 3 nobis est igitur P hebream BAV ETOemOLOGIan LBjMa.c . exhimoLoGiam (ex etoemoLoGian) -4 ΗΘΧΙ Ɔ-C ΟΑΓΙ a Y aethimologiam P etymologiam v 4 intelligat La.c . saced (a s. u.) L scced M, (e pr. ex o) BA soced V roced P 5 seced BMAp.c . roeed P et om. V 7 nuxj uox A 9 theud. B,Ma.c . ab om. V, (pro s. u. add. m2) P gcinu B.La.c . scinum P scino (o ex u) A cinu V scinu & exp. M σχίνου et πρίνου v πρίνου et σχίνου Migne 10 separatio P 11 preabiteris MA pCris Y prespiteris P alioqui Lp.c . 12 quid. dicitur P his BY, (h exp.) LMA, om. P mulier appellatur v hissa B V, (h exp.) cet . 13 sumta (sic semperfere Lp.c.) scripsi sumpta codd. uaculo B (seJnper) 14 simmachus FP 15 amigdalinam MV amigdalina P cuncti La.e. peccata popali P 18 uirgam L caritatem L 19 et om. v dominus corripit, ut emendet. et quomodo nux siue amygdalum 
1.7.4	 amarissimam habet corticem et testa durissima cingitur, ut detractis austerioribus et duris fructus dulcissimus repperiatur, sic omnis correptio et labor continentiae amara quidem uidetur ad praesens, sed fructus parit dulcissimos. unde et uetus illa sententia est: litterarum radices amarae, fructus dulces. quidam uirgam uigilantem atque nuceam intellegunt dominum, de quo dicit Isaias: exiet uirga de radice Iessae. unde et uirga Aaron, quae putabatur emortua, in resurrectione domini floruisse narratur. 
1.8.1	 1,13.14 Et factum est uerbum domini secundo ad me dicens: quid tu uides? et dixi: ollam succensam ego uideo et faciem eius a facie aquilonis. et dixit dominus ad me : ab aquilone aperientur — siue exardescent — mala super omnes habitatores terrae .
1.8.2	Quibusdam gradibus peccantibus tormenta tribuuntur, ut paulatim ueniant ad salutem: qui noluerint percutiente uirga emendari, mittuntur in ollam aeream atque succensam, de qua plenius scribit Hiezechiel, quae a facie aquilonis accenditur, Babylonium regem significans et urbem Hierusalem. pulchreque infertur: ab aquilone exardescent mala super omnes habitatores terrae — uel terrae Iudaeae uel certe uniuersae terrae—, de quibus et in Apocalypsi scriptum est: uae super omnes 1 cf. Iud. 8, 27 6 cf. Cic. frg. inc. J 18 (IV 3 p. 408 Miiller). Diom. gramm. I 310, 2 (Otto, SprichwOrter p. 195) 8 *Esai. 11, 1 9 cf. Num. 17,8 19 cf. Ezech. 24, 3—5 21 *Hier. 1, 14 23 *Apoc. 8,13 1 ds P amagd. La.c . amigd. VP 3 fructibus P reperiatur Ap.r. 5 (= 6) fructos Pa.c . 6 amare B,La.c . dulcis V 8 esaias VP,Aa.c . uirga] uera add. M iessae B,Lp.c . iesse cet . 9 ahar*ou L 13 alt . faciem Ma.r . 14 pandetur—malum Vulg . exardiscent Ma.c. (hic et lin. 21) 16 peccantibus om. P distribuuntur (dis add. m2; 1 distiguntur s. u. m2) P 17 qui] ut qui V 18 mittitur La.c . mittantur V aeneam u quo Pa.c . 19 hiezechiel Y, (i pr. s. u.) L ezecihel B iezechiel (i pr. postea add.) A ezechiel MP babilonium V 22 iudaeae L iudae cet . 23 et om. v ap∗ocalypsi (y ex i) L apocalipsi V apocalipsi* P habitatores terrae.
1.8.3	sancti enim non sunt habitatores terrae, sed aduenae atque peregrini, quorum unus dicit: aduena ego sum super terram et peregrinus sicut omnes patres mei, et alius: parui sunt et pessimi dies mei, quibus ego peregrinor in terra. unde et Petrus catholicam epistulam scribit aduenis atque peregrinis Ponti, Galatiae et Cappadociae. et iuxta mysticos intellectus Salomon loquitur: aquilo durus uentus, nomine autem dexter uocatur, ab his uidelicet, qui eius obriguere frigore et calorem fidei perdiderunt. 
1.9.1	 1, 15. 16 Quia ecce ego conuocabo omnes cognationes regnorum aquilonis, ait dominus, et uenient et ponet unusquisque solium suum in introitu portarum Hierusalem et super omnes muros eius in circuitu et super uniuersas urbes Indae. et loquar iudicia mea cum eis super omni malitia eorum, qui dereliquerunt me et libauerunt dis alienis et adorauerunt opus manuum suarum .
1.9.2	Nulli dubium multas gentes et singularum gentium reges Babylonio regi fuisse subiectas; qui obsessa Hierusalem posuerunt in circuitu, et maxime in exitibus portarum, thronum suum atque tentoria, ne quis eorum qui clausi erant posset erumpere, et non solum Hierusalem, sed omnes urbes Iudaeae simili obsidione uallatas. \'cumque\', ait, capta fuerit ciuitas, tunc loquar ad eos recta mea fuisse iudicia et recepisse singulos quod merebantur, non pro ceteris uitiis, 2 *Ps. 38, 13 4 *Gen. 47, 9 6 cf. I Petro 1, 1 8 *Prou. 27, 16 1 sancti-terrae om. V 7 pr . et] atque P cappadotiae MA mysticos A, (o ex u) BM misticos VP,La c . salamon LA 9 qui eius s. U. L obrignre Ba.c m2 11 ego o* . « conuocabo (o teri. s. u.) L 12 ueniunt La.c . ponet A ponent MVP,LBa.c.,v cum Vulg. 15 Iuda Vulg . 16 omnem malitiam Vulg . 17 dis B.Lp.r . diis cet . 18 manum B,LMa.c . 19 babvllonio La.r . subiectos Ap.c..v, sed cf. » s. «. congruentia nominum\' quo P 22 possit P sed] et add. v urbes hierusalem L 23 indaeae L iudae cet. quumque L 24 mea post iudicia tr. u recipisse P 25 quae v quibus subiacet humana condicio, sed maxime pro idololatria, per quam deserentes me adorauerunt opera manuum suarum\'. 
1.9.3	 quidam hunc locum in bonam partem accipiunt, quod uidelicet hi, qui in olla aenea excocti fuerint per cruciatus atque purgati, postea principes sint Hierusalem et, postquam misertus fuerit eorum dominus, tunc exprobret eis, quia se deserto simulacra uenerati sunt. sed haec uiolenta et praua interpretatio est; ne calumniam faciat tractator indoctus. 
1.10.1	 1, 17 a Tu ergo accinge lumbos tuos et surge et loquere ad eos omnia, quae ego praecipio tibi . Et Iob praecipitur, ut accingat lumbos suos, et apostolis, ut accinctis lumbis, quos Helias et Iohannes Baptista zonis mortificauere pelliciis, lucernas teneant in manibus suis, praedicationis uidelicet euangelicae. 
1.10.2	quicumque igitur locuturus est sermones dei, debet accingere lumbos suos sciens, quod diaboli omnis uirtus in lumbis sit et iustus dicat in psalmis: lumbi mei impleti sunt inlusionibus. cumque accinxerit lumbos, audiat illud quod scriptum est: surge, qui dormis, et eleuare, et inluminabit te Christus, ut semper uigilans et de somno consurgens loquatur, quae sibi praeceperit deus. 
1.11.1	 1, 17 b Xe timeas a facie eorum; nec enim timere te faciam uultum eorum, siue ut Septuaginta et ceteri habent interpretes: ne forte timere te faciam . Et est sensus iuxta translationem nostram: \'noli timere a facie eorum; me enim 10 cf. Hiob 38, 3. 40, 2 11 cf. Luc. 12, 35 12 cf. IV Reg. 1, 8. Matth. 3, 4 16 Ps. 37, 8 18 *Eph. 5, 14 23 *Hier. 1, 17 1 conditio M.Aa.c . idolatria codd. (corr. L) 2 quam] (J e s . a) A qua P,Ba.c., (a ex e) V odorauernnt La.c . 4 cruciatos P adque exp. M ante Martianaeus v 6 fuerit eorum L eor. fuer. cet. v exprobet MP,La.c . se (s . «.) AP deserto] do add. A 8 nec Ap c. doctus M 9 ergo] uero P 10 iob] il.li add. A 12 iohannis P,La.c . mortificauerunt P 13 euuangelicae Mp.c . 14 loquuturua BM sermones locuturns est v 17 quumque L 18 pr . et om. L in(l)luminauit BAa.c . 20 praeciperit La.c . 21 formides Valg . adiutore eos timere non poteris\'; iuxta Septuaginta: \'noli timere a facie eorum, habeto meae confidentiam iussionis; si enim non optuleris quod habes, ut timere desinas, derelinquam te et tradam timori et quodammodo uidebor timere te facere, dum relinquo formidini\'.
1.11.2	hoc autem significat, quod semper amara sit ueritas nec timenda hominum multitudo, qui increpiti correptionem non sustinent, sed insidias tendunt ei a quo corripiuntur. quodque iuxta Septuaginta sequitur: quia tecum sum, ut liberem te, dicit dominus, in Hebraico non habetur. et est sensus: \'eruam te, non in eo ut tibi nullus insidietur, sed in eo ut patiens insidias non delinquas\'. 
1.12.1	 1,18.19 Ego quippe dedi te hodie — siue ecce posui te in hac die — in ciuitatem munitam, in columnam ferream et in murum aeneum super omnem terram: regibus Indae, principibus eius et sacerdotibus et populo terrae. et bellabunt t aduersum te et non praeualebunt, quia, tecum ego sum, ait dominus, ut liberem te . Describit sermo diuinus, cur propheta timere non debeat.
1.12.2	ego, inquit, posui siue dedi t e hodie — hoc est in praesenti uita, donec uocatur hodie — quasi ciuitatem firmissimam, non ut unam domum nec turrem aut aliqua moenia, sed omnem ciuitatem, quae sita super montem latere non potest, de qua sciptum est: gloriosa dicta sunt de te, ciuitas dei, et: ego ciuitas firma, ciuitas quae oppugnatur.
1.12.3	et 6 cf. Ter. Andr. 68 (Otto, SprichwSrter p. 368). Gal. 4, 16 8 *Hier. 1, 17 18 *Hier. 1, 18 21 cf. Matth. 5, 14 23 Ps. 86, 3 24 *Esai. 27, 3 1 noli timere] nolite LBMa.c.m2 (noli metuere Bp.c.m2) 4 quodadmodo Pa.c . 5 formini La.c.m2 6 amara] amanda BAp.c. υ timendo P multitudini Mp.c.w2 multitudinem P -increpati MVP,BAp.c . 10 sensum Ma.c . 13 ciuitate La.c.m2 munitam] et add. P cum Vulg . 14 aereum Vulg . omnem om. P 15 iuda υ cum Vulg . sacerdotibusj eius add. m2 P et] omni add. s . u. m2 A 17 ego tecum Vulg. 18 quur LBM (passim) 20 (= 22) giuitatem La.c, no La.c . 21 turrim MAPp.c.,v 24 pr . et om. P ego} ergo P qaae] non add. s. v. AP expugnatur Ap.c.m2 in columnam, inquit, ferream, de qua scribit apostolus: columna et firmamentum ueritatis. unde Petrus et Iohannes, qui putabantur columnae ecclesiae, dextras dederunt. Paulo et Barnabae communionis. nec hoc sufficit, sed in murum, ait, aeneum, qui nulla uiolatur robigine nec caesus imbribus deperit, sed uetustate fit fortior.
1.12.4	eris autem talis contra reges et principes et populum, non cuiuslibet loci, sed terrae, qui terrena sapiunt et caelestia non nouerunt, qui habent imaginem choici et non caelestis, hi, inquit, bellabunt aduersum te et non praeualebunt. cur, quaeso? quae est tanta fortitudinis causa, ut nec reges nec principes nec sacerdotes nec populi aduersum unum praeualeant? sequitur: quia tecum ego sum, ait dominus, ut liberem te.
1.12.5	si quando reges Iuda, qui interpretatur \'confessio\', et principes eius et sacerdotes et populi, episcopi uidelicet et presbyteri et diaconi, et uulgus uile atque ignobile contra sanctum uirum consurgere uoluerint, habeat fidei firmitatem et timere desistat, quia domino auxiliante superabit. 
1.13.1	 2,1.2a Et factum est uerbum domini ad me dicens: uade et clama in auribus Hierusalem dicens . Hoc in LXX non habetur, sed sub asteriscis de Theodotionis editione additum est, qui uerbum Hebraicum \'carath\', pro quo nos diximus \'clama\' siue \'praedica\', interpretatus est \'lege\'. et lectionem enim et clamorem et praedicationem pro sui ambiguitate significat. aures autem Hierusalem pro auribus habitatorum eius debemus accipere. 1 Hier. 1.18 21 Tim. 8,15 3 cf. Gal. 2, 9 4 Hier. 1,18 8 cf. Phil. 3, 19 9 ef. I Cor. 15, 49 Hier. 1, 19 13 Hier. 1, 19 22 *Hier. 2. 2 1 in s . u. L, om. eet . ferream inquid P 2 columnam ̇ L 3 iohannis La.c . 4 barnebae M in s. u. L 5 rubigine BMAVPv 6 mbribus B uetuate P erit P tales La.c . 8 terrae] iis add. u 9 choiei] i terreni 8. u. A e*oyci (h eras.) P χοιϰοῡ v hi L ipsi cet . 11 tantae Pv 12 aduersum L -us cet . praeualent V 13 ego om. V ait dominus om. P 15 tert . et om. L praesbyteri B praesbiteri M 17 habeant Ma.r . 18 superauit BMa c . 21 theud. BM 22 caraht L 24 ambiguitatem L 26 ei F 
1.14.1	 2, XIV. Haec dicit dominus: recordatus sum tui miserans adulescentiam tuam et caritatem desponsionis tuae, quando secuta me es in deserto, in terra, quae non seminatur . LXX: haec dicit dominus: recordatus sum misericordiae adulescentiae tuae et dilectionis . perfectionis tuae . Plenius hoc in Hiezechiele dicitur, quando sibi Hierusalem in matrimonio dominus copulat et sub persona uxoris suis iungit amplexibus siue, ut ardentiorem monstret affectum, puellam eam et adulescentulam et desponsatam uocat; quo enim necdum potiti sumus, magis, ut potiamur, adpetimus. 
1.14.2	 \'quando\', inquit, \'secuta me es in solitudine et instar sponsaliorum et dotis legis tibi ornamenta et uerborum distribui monilia). totumque hoc non ad meritum eius refert, sed ad suam misericordiam, per quam et caritas consecuta est. hoc quoque, quod posuimus: in deserto, in terra, quae non seminatur. in LXX non habetur. 
