4.2.7	nec statim totum erit hominis, quod eueniet, sed eius gratiae, qui cuncta largitus est; ita enim libertas arbitrii reseruanda est, ut in omnibus excellat gratia largitoris iuxta illud propheticum: nisi dominus aedificauerit domum. in uanum laborauerunt. qui aedificant eam; nisi dominus custodierit ciuitatem. in uanum uigilauit, qui custodit eam. non enim uolentis neque currentis, sed miserentis est dei. 2 *Hier. 18, 3 3 *Hier. 18, 3 24 *Ps. 126, 1 27 Rom. 9, lb 1 discendissem Pa.c . 3 ambiguitatem V 4 abanima P 5 rotam P 9 sibi] siue LP,MAa.c . sic V ei M 11 lutura La.c . fuerat P,Ma.c . 12 periisse v 15 uenire YP 16 e om. MA,La.c . et om. P R repromissione ̄ . A . remissiones V 18 non s . u. M quod v 20 demittat Max. 21 paenas M sua uoluntate et add. v totum om . r 27 uigilabit Lv nigilat V uigilant P 28 sed misereatis neque currentis LMAac . 
4.3.1	 18, 11―13 Nunc ergo dic uiro Iudae et habitatori Hierusalem dicens: haec — siue sic — dicit dominus: ecce ego ego contra uos malum et cogito contra uos cogitationem; reuertatur unusquisque a uia a mala et dirigite uias uestras et studia uestra! qui dixerunt: des desperauimus — siue confortabimur -: post cogitationes enim nostras ibimus et unusquisque prauitatem — siue quod placuit cordi suo malo — faciemus. ideo haec dicit dominus: interrogate gentes: quis audiuit talia horribilia, quae fecit nimis uirgo Israhel ?
4.3.2	Implet dominus parabolam. quam et aspectu et sermonibus docuerat. et dicit: \'ecce ego fingo contra uos malum quasi figulus lutum\' — malum autem iuxta Isaiam, qui dicit: faciens pacem et creans malum, non quo per se malum sit, sed quod patientibus malum esse uideatur — et cogito contra uos cogitationem\' — id est pro merito inferre sententiam —; (mutate opera et dirigite uias uestras, ut et prosperis -poena mutetur!
4.3.3	\' \'qui/inquit, \'e contrario dixerunt: confortabimur\' — in malis uidelicet operibus siue iuxta Aquilam desperauimus us et iuita Symmachum defecimus, quod utrumque offendit deum, ut aut nequaquam se putet posse saluari aut ad placandum deum animo defecisse — et post cogitationes,\' inquit, \'nostras ibimus.\' ubi est ergo absque gratia 9::rlń:,.
4.3.4	t dei liberi arbitrii potestas et propriae indicium uoluntatis, cum grandis offensa sit dei sequi cogitationes suas et praui 2 *Hier. 18, 11 6. 8 *Hier. 18, 12 13 Hier. 18, 11 cf. Hier. 18, 6 14 Esai. 45, 7 16. 18 Hier. 18, 11 19 Hier. 18, 12 *Hier. 18, 12 20 Hier. 18, 12 21 *Hier. 18, 12 23 Hier. 18, 12 1 iuda AV cum Vulg. habitatoribus P cum Vulg . 6 (= 20) disperauimus P 7 nostras enim P 8 prauitatem1 cordis sni mali add. s. u. m2 A 9 cordis Vv cum Vulg . sni v cum Vulg . malo om. V mali v cum Vulg . facimus V 12 sermonibus et aspectu p 13 eccej ac P 14 esaiam MVP, Aa.c . 15 quod MAVPv per se] ipseF 16 facientibus V 19 paena MV e s. u. L, om. cet. v diiernnt contrario v 22 ut P saluatori Pa.r . 23 ad (d ex p) L animam P 24 dei gratia t7 25 liber P 26 grandisj magis P LIX. Hieron. in Hierem. 13 cordis facere uoluntatem? propterea infert dicens: \'interrogate gentes et omnes in circuitu nationes, quis fecerit. quis audierit idolis seruiens, quae fecit nimis uirgo Israhel.\' uirginem autem uocat eo, quod uni deo seruierit dicente propheta: notus in Iudaea deus, in Israhel magnum nomen eius. 
4.4.1	18, 14 Numquid deficiet de petra r a agri nix Libani? aut anelli possunt aquae erumpentes frigidae et defluente ? LXX: numquid deficient de petra ubera aut nix de Libano? aut declinabit aqua uiolenter sublata uento ?
4.4.2	Tale quid et illud Uerguianum sonat. ante leues ergo pascentur in aethere cerui et freta destituent nudos in litore pisces, quam nostro illius labatur pectore uultus: et in alio loco: in freta dum fluuii current, dum montibus umbrae lustrabunt, conuexa polus dum sidera pascet, semper honos nomenque tuum laudesque manebunt. 
4.4.3	 \'quomodo,\' inquit, nix de Libani summitatibus deficere non potest nec ullo. ut omnis liquescat, solis ardore superatur fluentesque de montibus riui nequaquam siccantur in fontibus, sic meum nomen, quod per se stabile est atque perpetuum, non poterit immutari; et tamen, cum cetera naturae ordinem seruent, populus meus oblitus est mei.\' sequitur enim: 
4.5.1	 18, 15 Quia oblitus est mei populus meus frustra 1. 8 Hier. 18, 13 5 Pa. 75, 2 9 *Hier. 18, 14 12 Uerg. Ecl. I 59. 60. 63 16 Uerg. Aen. I 607-609 7 numquit L (— lin . 9) *libani (b s. u.) L 8 euelli P cum Vulg . 9 LXXta P (saepius) 10 declinauit MAP 11 illum F uirgilianum MVP,Ap.c . (et hic uergiliauum in mg. Ai, v sona Ma.c . 12 antel te Ma.c . haere P 13 diatituent AP,La.c . 14 libatur A lauatar V laeuatur P :16 in freta] re in ras. LA infert. (a eras.) M flubii Ma.c. incurrent Fa.r . currunt P motibus Aa.c . 17 populus P.LMAa.c . 18 honus P nomen V 19 sumitatibus V 20 omnes V 21 siccatur Pa.c . 22 se om. M 23 potuit P immutare M 24 es Ma.e.m2 25 es MAa.c.m2 libantes et inpingentes in uiis suis, in semitis saeculi - siue sempiternis —, ut ambularent per eas in itinere non trito . Qui obliuiscitur dei et relinquit eum, qui dicit: ego sum uia, libatque dis alienis, inpingit in uiis suis - nequaquam dei, sed suis — et antiquas sempiternasque semitas derelinquit, quae omnium sanctorum sunt tritae uestigiis colentium deum. isti uero ambulauerunt in itinere non trito et relicto cultu dei idola uenerati sunt; propter quae infertur poena. Quae sequitur: 
4.6.1	 18,16 Ut fieret terra eorum in desolationem et in sibilum sempiternum; omnis, qui praeterit per eam, obstupescet et mouebit caput suum . \'Et quia dereliquerunt,\' ait, \'cultum dei et prauas idololatriae semitas sunt secuti, propterea terra eorum redacta est in solitudinem et in miraculum omnium sibilumque, ita ut, qui terram quondam et urbem florentissimam uiderint in desertum et cineres esse conlapsam, ammirentur et stupeant et animae confusionem gestu corporis indicent:\' hoc est enim mouere caput et stuporem mentis sibilo demonstrare.
4.6.2	quod plenius et rectius post aduentum domini intellegimus esse conpletum, quando nullus Iudaeorum terram quondam et urbem sanctam ingredi lege permittitur, sed cum ad planctum uenerint, mirantur et deflent uaticinia prophetarum opere completa. 
4.7.1	 18, 17 Sicut uentus urens dispergam eos co ram inimico - siue inimicis —: dorsum et non faciem 2 *Hier. 18, 15 4 Ioh. 14, 6 25 *Hier. 13, 17 1 pingentes V suis j & add. s. u. A 3 eis Pa.c . in M reliquit V 4 eumj illam v diis codd. (corr. L) v 6 dereliquit V,MAa.c . 9 infertur poena] infert eis poena Ap.c.m3 paena MV, (alt . a ex e) P 11 praeterierit V cum Vulg., (alt . er s. u.) MA praeteriit P 12 obstnpiscet La.c . obstupescit P,Aa.c . 13 di s. u. L idolatriae MAP.La.c . idolatrice V 14 sicuti Ma.c . 15 terram] urbem V quondam eras. A (= lin. 21) condam V 16 urbem] quoada add. s. u. A (= hn. 21) tioiderant P cineris (pr. i ex e) M cinere v 19 sibilum M silentio e 21 quandam Y lege s. u. L 22 pennittetur Ma.c . plantum La.c . defluent P 15* ostendam eis in die perditionis eorum . Usque hodie sententia dei permanet in Iudaeis; in toto orbe dispersi sunt coram inimico diabolo uel inimicis daemonibus et, cum diebus ac noctibus in synagogis satanae innocent nomen dei, dorsum et non faciem suam ostendit eis deus. ut intellegant eum semper recedentem et numquam ad se uenientem.
4.7.2	dies autem perditionis Iudaicae omne tempus est post passionem saluatoris usque ad consummationem saeculi, ut, postquam subintrauerit plenitudo gentium, tunc omnis Israhel saluus fiat. 
4.8.1	 18, 18 Et dixerunt: uenite et cogitemus contra Hieremiam cogitationes! non enim peribit lexa sacerdote neque consilium a sapiente nec sermo a propheta; uenite et percutiamus eum lingua et non attendamus ad uniuersos sermones eius !
4.8.2	Ista et tunc Iudaeorum contra Hieremiam siue dominum saluatorem et hodie hereticorum contra seruos eius cogitatio est, ut calumnias struant et sanctos uiros accusatione praeueniant nec cogitent, quid illi ueritatis loquantur, sed quid ipsi struant mendacii; iactant enim in sacerdotibus et in sapientibus et pseudoprophetis suis legem dei et consilium et eloquium permanere dicente scriptura: in peruersam animam non intrabit sapientia. 
4.9.1	 18,19 22 a Attencle, domine, ad me et audi nocent aduersariorum meorum! numquid redditur pro bono malum, quia foderunt foueam animae meae? recordare, quod steterim in conspectu tuo. ut loquerer 4 cf. Apoc. 2. 9. 3, 9 8 cf. Rom. 11, 25. 26 21 *Saj.. 1. 4 2 iaiaeos codd. (corr. L) 3 diabulo P 4 sinagogis P 6 ueniente Ma.c . 7 post (t s. u.) L, om. Y 8 consummationem] finem v 8 utj & Pa.t . 10 alt . et s. u. L, om. V contra] aduersus v 11 periuit Ma.c . a] ad 3fa.r . 12 alt . aj ad Ma.T . 13 pr . et om. M eum] in add . v 14 intendamus (in s . U.; d ex t) M 17 calumnia V instraaat P accussatione A accusationem F causatione P 18 cogitant Aa.c.m2 inatruant MAVP 19 alt . et] in add. Mv 20 et consilium dei v - 21 intrauit Pa.c. introiuit V 23 et audi om. V 24 numqa:t La.c . 26 loquerer-auerterem r. u. L pro eis bonum et auerterem i indignationem tuam ab eis.\' propterea da filios eorum in famem et absque eos in manus gladii; fiant uxores eorum absque liberis et uiduae et uiri earum interficiantur morte, in ue nes corum confodiantur gladio in proelio, audiatur clamor de domibus eorum !
4.9.2	In typo quidem saluatoris haec a populo Iudaeorum Hieremias uniuersa perpetitur, qui postea Babylonio ueniente uastantur; sed plenius atque perfectius conplentur in Christo. et urbe subuersa Romano gladio trucidati sunt non ob idololatriam, quae eo tempore non erat, sed ob interfectionem filii dei, quando cunctus simul populus conclamauit: tolle, tolle talem; non habemus regem nisi Caesarem!
4.9.3	et inprecatio eorum aeterna damnatione conpleta est: sanguis eius super nos et super filios nostros! foderant enim Christo foueam et dixerant: auferamus eum de terra uiuentium! qui tantae erga eos misericordiae fuit et stetit in conspectu patris, ut loqueretur pro eis bonum et auerteret indignationem illius ab eis, ut in cruce quoque diceret: pater, ignosce eis! quod enim faciunt, nesciant.
4.9.4	manifesta transcurnmus, ut in obscurioribus immoremur nequaquam deliramenta quorundam et captiuitatem caelestis Hierusalem interpretantes, sed perspicuam historiam et manifestissimam prophetiam omni uerborum et sensuum confidentia persequentes. 12 *Ioh. 19, 15 14 Matth. 27, 25 16 *Hier. 11, 19 19 ♦Luc. 23, 34 2 fame P famam v 6 praelio MVP 7 tipo V typum r heremias A 8 apniente 3. u. L 10 idolatriam YPMp.r . 11 interfectione V 12 simul om. V 13 regem non habemus v et om. V 14 sanguis i5 L 15 foderunt VP enim] in add. V 16 diierant VP 17 tanta P misericordia P et stetit] ut stans v 18 nt om . v etI ut v 19 illius] suam v 20 nesciunt s . u. m2 M transcucurrimus L,MAa.c 21 abaeorioribus P 22 quorondam Ma.c . 23 perspicuam] J p spatiosam 8. M. m3 A hystoriam P 24 et] id est Aa.c.m3 sensam APa.c . confidentia P 
4.10.1	 18,22 b. 23 Adduces enim super eos latronem r repente. quia foderunt foueam, ut caperent me, et laqueos absconderunt pedibus meis. tu autem, domine, scis omne consilium eorum aduersum me in mortem,: ne propitieris iniquitati eorum et peccatum eorum a facie tua non deleatur; fiant corruentes — siue inpingentes — in conspectu tuo, in tempore furoris tui abutere eis siue fac in eis !
4.10.2	Si de Hieremia intellegimus, repentinum latronem referamus ad Nabuchodonosor: si de saluatore. quod uerius et melius est, ad Romanum exercitum. et ne iniusta uideatur sententia dei, exponit, quid fecerint contra Christum, filium dei, et quid passi sint.
4.10.3	quod autem infert: ne propitieris iniquitati eorum et peccatum eorum a facie tua non deleatur, nequaquam priori sententiae contrarium est, in qua pro populo deprecatur patrem; sed postquam datum tempus paenitentiae praeteriit et illi in suo scelere perseuerant, non tam pro se puniuntur quam pro aliis, ne inultum peccatum ceteris noceat exemplo. 
4.10.4	 quodque infert: fiant inpingentes — siue corruentes — in conspectu tuo. illius Isaiae et Petri apostoli simile est: et non inpingetis sicut in lapidem offensionis et petram scandali: cuius et in psalmis propheta meminit: lapidem, quem reprobauerunt aedificantes, hic factus est in caput anguli; a domino factum est h o c. 
4.11.1	 19,13 a Haec dicit dominus: uade et sume 7. 8 *Hier. 18, 23 13 Hier. 18. 23 15 cf. Hier. 18, 20 19 *Hier. 18, 23 Hier. 18, 23 21 *Esai. 8, 14. cf. I Petro 2, 3 23 Ps. 117, 22. *23 1 quia om. V 4 aduersa Ma.c.m2 mortem] et add. V 6 deleantnr Par . 8 pr . eis om. P 9 nabucodonosor P,La.c . 10 quodj et add. MAVv 12 filium dei Christum n sunt P 15 prioris V 16 praeterit A 17 sua scelera V perseuerant] populi et seniores add. v 18 exemplum Ap.c . 19 quooque] quoq; qd (q; qi in ras.) A 26 esaiae VP,MAa.c . 21 inpingitis La.c . inpingentis V offensiones Ma c . 26 sume] accipe Vvlg . langunculam A lagunculam figuli testeam et de senioribus populi ac de senioribus sacerdotum et egredere ad uallem filii Ennom, quae est iuxta introitum portae fictilis — siue Charsitlt —, et praedicabis — siue clamabis uel leges — ibi uerba, quae ego loquar ad te, et dices: audite uerbum domini, reges Iudae e habitatores Hierusalem !
4.11.2	Pro \'laguncula figuli\', quae Hebraice dicitur \'bocboc\', LXX \'doliolum\' transtulerunt et pro porta fictili\' Aquila, Symmachus et Theodotio ipsum uerbum posuerunt Hebraicum \'Harsith\', pro quo LXX iuxta morem suum pro adspiratione \'heth\' litterae addiderunt \'chi\' Graecum, ut dicerent \'Charsith\' pro \'Harsith\', sicut illud est pro \'Hebron\' \'Chebron\', et pro \'Hieriho\' <Hiericho>.
4.11.3	uult autem scriptura diuina non solum auribus doceri populum, sed et oculis; magis enim, ut iam diximus, mente retinetur, quod uisu quam quod auditu ad animum peruenit. tolle. inquit. lagunculam - siue doliolum testeum — et de senioribus: populi ac sacerdotum et egredere ad uallem filii Ennom, de qua supra diximus, ubi erat delubrum Bahal et nemus ac lucus Siloae fontibus irrigatus. \'ipsa autem,\' inquit, \'uallis iuxta portam est.\' quae Hebraeo sermone \'Harsith\', hoc est \'fictilis\', appellatur.
4.11.4	\'et praedicabis — uel leges — ibi uerba. quae ego loquar tecum, ut ibi audiantur 4. 5 Hier. 19, 2 7 Hier. 19, 1 S *Hier. 19, 1 9 *Hier. 19, 2 10. 12 *Hier. 19. 2 15 cf. p. 223, 24 16 Hier. 19, *1. 2 17 *Hier. 19, 1 19 cf. p. 29. 16. 105, 16 21 *Hier. 19, 2 22 Hier. 19, 2 *Hier. 19, 2 23 *Hter. 19, 2 .1 et eras. A, om. Vult! . dej a Vulg . ac] et v cum rulg . 2 de] a Vulg. 3 ennonP,Ap.c . instaMa.c. 4 charsit MA V carsitP 5 loquor MVP,Aa.c . 6 Iuda v cum Vulg. 7 langula V 8 ebraicaeJf bodioc P LXXta _ A 9 simmaehns P 10 harsit P 11 asperatione Ma.c. beth r 12 harsith LMA charsith V halsilit P Arsith v ebron P 13 pr . hieBIBO MAP hiericho V diuina scriptura V 14 docere P,Mp.e . 15 enim om. V uisum Ma.r. 16 quam s. u. V auditur P inquit (quit s. u. M lagu- culam V 17 et eras. A 18 fili V 19 ennon MAP ubi] in qua v 20 ac ac L ∗ae M locus P siluae Ma.c. siloe VPo inrigaturP 21 hebreo AVP Hebraice. sermone om. v 22 est] au ̃ t add. P 23 ego—quae om. V ubi P quae dicturus sum: ideo autem, ut iam diximus, et \'praedicabis\' et \'clamabis\' et \'leges\' ponitur, quia uerbum Hebraicum \'carath\' tria significat. uultque, quae dicturus est, et reges luda audire et habitatores Hierusalem, id est et stirpis regiae et omnem populum, ut inexcusabiles sint. qui audire noluerint. 
4.12.1	 19,8 b-5 Haec dicit dominus exercituum deus Israhel: ecce ego inducam a fflictionem — siue mala — super locum istum, ita ut omnis, qui audierit illam - siue illa —, tinniant aures eius eo, quod dereliquerint me et alienum fecerint locum istum et libauerint in eo dis alienis, quos nescierunt ipsi et patres eorum et reges luda; et repleuerunt locum istum sanguine innocentium et aedificauerunt excelsa Bahalim ad comburendos filios suos igne in holocaustum Bahalim, quae non praecepi - siue cogitaui — nec locutus sum nec ascenderunt in cor meum . 
4.12.2	 Et hunc locum stulte quidam ad caelestem referunt Hierusalem. quod ne semper ammoneam, tantum hoc dixisse sufficiat uitandam istiusmodi explanationem. immo heresim, quae manifesta subuertit et praestigias quasdam ecclesiis Christi conatur inducere. nulli autem dubium, quin in templo dei Bahal idolum posuerint siue in delubro, quod erat in ualle filii Ennom, ubi et lucus Bahal et ara eius fuit, super quam immolauerunt et incenderunt filios suos.
4.12.3	quae dominus nec cogitauit nec locutus est nec ascenderunt in cor eius, 1 cf. p. 44, 18 Hier. 19, 2 2 *Hier. 19, 2 5 cf. Rom. 1, 20 7. 9 *Rier. 19, 3 15 Hier. 19, 5 2 uerbum] de add. P, eras. LMA hebraicu (sic) Jlp.r . hebraico P 3 triaj haec add. v uult V dicitaras Ma.r . 4 stirpes P stirpem v regiam v 5 ut om . r inexcussabiles P 9 deliquerint Ma.c.m2 dereliqaerit P 10 fecerit Pa.c . libauerunt P cum Vulg . 11 diis AVP.La.r.Mp.c. cum Vulg. 12 alt . et eras. A 13 innocentum v cum Yulg . 14 igni (ex ignem) M cum Vulg . 18 nec MP,LAa.r . admoneamus c hoc tantum v 19 uitandum LMAa.c . uitanda V explanatioaem] esse add . v 20 praeatrigias LMAa.r . quaedam V 21 xp ̃ο P coaantur P qui Ma.e. . in s. u. L 23 fili P pr . et om. M locua P 25 pr. nec] ne V corde L . non quo deus futura nescierit, sed quo indigna sua notitia ignorare se dicat iuxta illud euangelicum: recedite a m e, operariiiniquitatis, nesciouos! nouit enim dominus eos, qui sui sunt, et qui ignorat, ignorabitur. uel certe ἀνϑρωποπαϑω̃ς et haec de deo accipienda sicut et alia. 
4.12.4	 omnis autem bereticus derelinquit deum et alienum facit locum habitatione dei, quem sua fraude polluerit, et libat dis alienis, quos nec ipse nouerat nec patres eius, apostoli uidelicet et apostolici uiri; reges autem luda, hoc est hereticorum patriarchae, implent locum quondam dei sanguine deceptorum et innocentium — nisi enim stultus et simplex fuerit, non cito subuertitur — et aedificant excelsa Bahalim, dum de sublimibus disputare se dicunt, et comburunt filios suos idolo, quos in heresi genuerint. quae omnia dominus ignorare se dicit nec umquam ascendisse in cogitationem suam. 
4.13.1	 19,6 Propterea ecce dies ueniunt, dicit dominus, etnonuocu.br:trcrlocusi.steamplius To feth et uallis et non uocabitur locus iste amplius Tofeth et uallis filii Ennom. sed uallis occisionis . LXX: idcirco ecce dies ueniunt, dicit dominus, et non uocabitur locus iste amplius ruina et πολάνδριον filii Ennom, sed πολο άνδριον occisionis .
4.13.2	Quae sit uailis filii 2 *Luc. 13, 27. cf. Matth. 7, 23 3 *II Tim. 2, 19 4 *I Cor. 14. 38 19 *Hier. 19, 6 2 1 Pr . quod AVP.Ma.r. alt . quod V..Ap.c.,v digna suam notitiam P 2 sed V iuita L ut (a eras .) M . (est post at add. s. u. m2) A ut VP euu ̇ angelicum L discedite v 4 pr . que Pa.c. 5 a ΝΘ p ιτωΠ a Θω C (antritapatos in mg.) M, (antropopatos s. u.) A aNOp Π W Π aOWC V aNE p μ a Θ WC P haec om. M hoc Va.c . aliam L 7 habitationis P quam P g diis AVP.La.r., (pr . i uel e s. u. eras.) M,v 10 patrisrcae La.c . 13 de s. u. M conburent FP 14 heresim V genuerunt r s ignorare se dicit dominus v 18 amplios locus iste Vulg- tofeth V (et alibi semper fereL uel primitus uel p.c.) thofeth cet. Topheth v cum Vulg. semper) ualles La.c . 21 L ΠΟΔΥ aNAp ιΟΝ (poliandrum s. u.) M, (poliandrion s. u.) A Π Ѡ Δ Ua Nap ι ѠC V ΠΟ aya- Nap ιΟΝ P (idem P lin. 22) 22 sed om. P ITOLYa ΝΔ piON (poliandrum s. u.) ΜΠΟ L ΙΔΝΔΡΙΟΝ (poliandrion s.u.) A Δ ua ΝΔ p ι ѠN l fili M Ennom, quae Hebraice dicitur \'gehennom.\' unde et \'gehennam\' appellatam putant, supra diximus. miror autem, quid sibi uoluerint LXX pro \'Tofeth\' διάπτωσ v , hoc est \'ruinam\', ponere et pro \'ualle\' πολυά v διο v , quod significat \'uirorum multitudinem,\' nisi forte ex eo, quod ibi populus corruerit et caesa sit hominum multitudo uel spiritaliter in errore idololatriae uel iuxta litteram a Babylonio exercitu, quod in consequentibus manifestius legitur. 
4.14.1	 19, 7 9 Et dissipabo consilium Iudae et Hierusalem in loco isto ei subuertam eos gladio in conspectu inimicorum I suorum et in manu quaerentium animas eorum et dabo cadauera eorum escam uolatilibus caeli et bestiis terrae et ponam ciuitatem hanc in stuporem et in sibilum; omnis, qui praeterit per eam, obstupescet et sibilabit super uniuersa plaga eius . 
4.14.2	 et cibabo eos carnibus filiorum suorum et carnibus filiarum suarum et unusquisque carnem amici sui comedet in obsidione et in angustia, in qua concludent eos inimici eorum et, qui quaerunt animas eorum .
4.14.3	Quamquam haec et in Babylonia captiuitate accidisse populo nouerimus, tamen plenius referuntur ad tempora saluatoris, quando obsessi sunt 2 cf. p. 106, 2. 20 3. 4 *Hier. 19, 6 7 cf. Hier. 19, 7-9 1 ennon Aa.c . enom M quod V hebreicae M pr . gehennon Ap.c . geennom v 2 pntam A 3 thofeth codd. (pr . h exp. D a ι a ΠΤΟ CIN P, (aiaptosim s . u.) M Δι aNTOCIN (diantosin s. u ) A ΔιΔΠΘ ѠCIN V 4_ ΠΟ a Υ a ΝΔ p ι (poliandri s . u.) M ΠΟ a ΥΝΑΡΙΟΝ (poliandrion s. u.) A IIO AUaNap ι ѠN V ΠΟΑ yANapION P significatur P multitudine Pp.r . 5 cesa M excesa V ceşsa P 6 spiritualiter Ap.c . idolatriae codd. (corr. L) 7 exercitum L 9 Inda Vulg . 10 censpectuj omnium add. P 11 suorum s. u. M req (= require) add. s . U. m3 A et—pr . eorum in mg. M querentium V 12 escas VP 13 besteis Aa.c . 14 sibilium Ma.r . praeteriet P,La.e . praeterierit V cum Vulg.. (alt. ri s. u. m2) MA 15 obstupeacit Pa.c. sibilauit Pa.c . uniuersas plagas M 21 et s. u. L babyloniea Pp.c . tam V 22 obbressi (ob s. u. m. rec.; r ex a) M sd; (virgula s. M. paene cuanuit) L a Uespasiano et Tito et ciuitas eorum Hadriani temporibus in aeternos cineres conlapsa est, ut, qui optulerant filios suos idolis, ipsi eos postea famis necessitate conpulsi in ciborum usum uerterent carnesque omnium darentur uolatilibus caeli et bestiis terrae, ut, qui dei muneribus abusi fuerant in impietatem et propria uiscera idolis immolarant, uentres suos sepulchra facerent liberorum. 
4.15.1	 19, 10. 11 a XV Et conteres lagunculam in oculis uirorum, qui ibunt — uel egredientur — tecum, et dices ad eos: haec dicit dominus exercituum: sic conteram populum istum et ciuitatem hanc, sicut conteritur uas figuli, quod non potest ultra instaurari .
4.15.2	Perspicue non de Babylonia, sed de Romana dicitur captiuitate: post Babylonios quippe et urbs instaurata et populus reductus in Iudaeam et abundantiae pristinae restitutus est. post captiuitatem autem, quae sub Uespasiano et Tito et postea accidit sub Hadriano, usque ad consummationem saeculi ruinae Hierusalem permansurae sunt, quamquam sibi Iudaei auream atque gemmatam Hierusalem restituendam putent rursumque uictimas et sacrificia et coniugia sanctorum et regnum in terris domini saluatoris.
4.15.3	quae licet non sequamur, tamen damnare non possumus, quia multi ecclesiasticorum uirorum et martyres ista dixerunt, ut unusquisque in suo sensu abundet et 9 *Hier. 19,10 22 cf. Iren. c. heres. V 35, 2. Tert. adn. Marc. III 24. Lact. Inst. VII 24. 26. lust. Mart. Dial. cum Trypb. 80. Hieron. in Ezech. 36. 1-15 p. 422. in Esai. XVIII praef. p. 767—768 23 Rom. 14. 5 1 ciuitates V eorum] de add. AVP,LMa.c . adriani MAVP 2 aeterno cinere P 3 eoa om. V posteaj potest ea V 5 qui di L qui dñi Yv qui diu M quid in P, (d eras.; t uod s . uid m3) A abosu P fuerat Pa.c . in s. u. P 6 immolarent YP sepnlcrha P 7 fecerunt V 8 conterens P,Aa.c . languculam Fx 11 hane] istam Vulg . conteretur Ma.c . 13 romani P 14 pr . et om. Y urbis MP.Aa.r . instaurate Mp.c . staurata V populis (o s . i) M reductos Mp.c. 15 habundantiae YP 16 uaspasiano Va.c . aeceditM 17 adriano MA YP comsnmmationem L consnmationem P 20 sacrificium P 21 quaereseruentur (p. 236,1) eras. m2 (1) L sequamns P 22 nirorum s. u. V 23 iste P ista direrunt] statuerunt Mp.c . ut] et v habundet YP 
4.15.4	 I domini cuncta iudicio reseruentur. quomodo autem uas fictile et testeum, si fractum fuerit, in antiquam speciem non potest reformari, sic et populus Iudaeorum et Hierusalem subuersa statum pristinum non habebunt. denique cassum nomen est ipsius hodie ciuitatis et ab Aelio Hadriano Aelia dicitur et cum habitatione pristina pristinum quoque nomen amisit ad decutiendam superbiam habitatorum eius.
4.15.5	sanctae autem crucis et resurrectionis uocabula non urbem significant, sed locum, nec diuitiarum quondam magnitudinem, per quam periit populus Iudaeorum, sed gloriam sanctitatis, quam nostra paupercula possidet Bethleem non habens aurum et gemmas, sed panem, qui in ea natus est. 
4.16.1	 19,11b 13a Et in Tofeth sepelientur — uel sepelient — eo, quod non sit alius locus ad sepeliendum. sic faciam loco huic, ait dominus, et habitatoribus eius, ut ponam ciuitatem istam sicut Tofeth —siue ut ruinam —. et erunt domus Hierusalem et domus regum Iuda sicut locus Tofeth siue ruinae . quod autem in LXX infertur: omnes domus regum Iuda sient locus Tofeth, in Hebraico non habetur. Et sequitur: 
